"title","number","date","keywords","link"
"Die Europäer aus den neun Schengen-Staaten müssen weiter auf Reisen ohne Kontrollen warten: Wann geht der Spuk zu Ende? |","1994.6.6366","1994-02-04","DIE ZEIT, Die Europäer aus den neun Schengen-Staaten müssen weiter auf Reisen ohne Kontrollen warten, Airport, Bernd Schmidbauer, Bundeskriminalamt, Drogenhandel, Kanzleramt, Dänemark, Europa, Niederlande, Brüssel, Athen, Barcelona, Bonn, Paris, Straßburg, Wiesbaden","http://www.zeit.de/1994/06/wann-geht-der-spuk-zu-ende"
"Das Ende der langen Einsamkeit |","1994.6.6367","1994-02-04","DIE ZEIT, ,  Jitzchak Rabin, Schimon Peres, David Ben Gurion, Israel, Vereinte Nationen, Beziehung, DDR, Diplomat, China, Jerusalem, Kenia, Libanon, Libyen, Marokko, Spanien, Syrien, Ägypten, Europa","http://www.zeit.de/1994/06/das-ende-der-langen-einsamkeit"
"Japans Reformer mußten sich mit den bisherigen Machthabern, den Liberaldemokraten, arrangieren: Ein Neubeginn mit Altlasten |","1994.6.6368","1994-02-04","DIE ZEIT, Japans Reformer mußten sich mit den bisherigen Machthabern, den Liberaldemokraten, arrangieren, Bill Clinton, Ichiro Ozawa, Allianz, Japan, Opposition, Regierungschef, tTokyo, Wahlrecht, MIT, Washington D.C","http://www.zeit.de/1994/06/ein-neubeginn-mit-altlasten"
"Nato und EU haben die Länder Ostmitteleuropas bisher enttäuscht. Der Westen muß sich endlich öffnen: Warten auf ein Ja aus Brüssel |","1994.6.6369","1994-02-04","DIE ZEIT, Nato und EU haben die Länder Ostmitteleuropas bisher enttäuscht. Der Westen muß sich endlich öffnen, Brüssel, Nato, Europäische Gemeinschaft, Timothy Garton Ash, Europäische Union, DDR, Freihandel, Freihandelszone, Protektionismus, Textilie, Jugoslawien, Portugal, Russland, Spanien, Türkei, Westeuropa, Europa","http://www.zeit.de/1994/06/warten-auf-ein-ja-aus-bruessel"
"Algeriens Armee kürt einen Ex-General zum Staatspräsidenten: Ein neuer Anfang? |","1994.6.6370","1994-02-04","DIE ZEIT, Algeriens Armee kürt einen Ex-General zum Staatspräsidenten, Algerien, Militär, Phoenix, Asche, Ausnahmezustand, Gewalt, Korruption, Nachfolge, Parlamentswahl, Verteidigungsminister, Ölpreis, Bürgerkrieg, Flüchtling, Aachen, Paris","http://www.zeit.de/1994/06/ein-neuer-anfang"
"Zeitspiegel |","1994.6.6371","1994-02-04","DIE ZEIT, , Edouard Balladur, Arbeitslosigkeit, Bund der Steuerzahler, Ehrenamt, Geburtenrate, Jubiläum, Mond, Premierminister, Tageszeitung, Sarajevo, Sachsen-Anhalt","http://www.zeit.de/1994/06/zeitspiegel"
"Parteitag mit Mangosuthu Buthelezi: Der Zulu-Führer ruft zum Boykott der ersten freien Wahl in Südafrika auf: Der Häuptling will sein Fürstentum |","1994.6.6372","1994-02-04","DIE ZEIT, Parteitag mit Mangosuthu Buthelezi: Der Zulu-Führer ruft zum Boykott der ersten freien Wahl in Südafrika auf, Wahl, Südafrika, ANC, Nelson Mandela, Allianz, Osmose, MIT, Parteitag, Bonn, Pretoria","http://www.zeit.de/1994/06/der-haeuptling-will-sein-fuerstentum"
"Eigentor |","1994.6.6373","1994-02-04","DIE ZEIT, , Adolf Hitler, Werner Hackmann, Eltern, Hauptstadt, Horst Schmidt, Olympiastadion, Ostern, Zeitung, Eigentor, England","http://www.zeit.de/1994/06/eigentor"
"Worte der Woche |","1994.6.6374","1994-02-04","DIE ZEIT, , George W.  Bush, Helmut Kohl, Bill Clinton, Günter Grass, Willy Brandt, Günter Verheugen, Kurt Biedenkopf, Alkohol, André Kostolany, Barbara Bush, Bundespräsident, Helmut Zilk, Inflation, Jörg Tauss, Nikotin, Texas, Wien","http://www.zeit.de/1994/06/worte-der-woche"
"Der indische Premier Narasimha Rao besucht Bonn – und sucht Hilfe für den Wandel in seinem Land: Ein Manipulator als Modernisierer |","1994.6.6375","1994-02-04","DIE ZEIT, Der indische Premier Narasimha Rao besucht Bonn – und sucht Hilfe für den Wandel in seinem Land, Bonn, Sucht, Indien, Klaus Kinkel, China, Manmohan Singh, Reform, Satellitenfernsehen, Premierminister, Vietnam, Asien, Delhi, Kaschmir","http://www.zeit.de/1994/06/ein-manipulator-als-modernisierer"
"Silvio Berlusconi, italienischer Medienzar, geht in die Politik, um einen Sieg der Linken zu verhindern: Der Cavaliere ist beliebter als Jesus |","1994.6.6376","1994-02-04","DIE ZEIT, Silvio Berlusconi, italienischer Medienzar, geht in die Politik, um einen Sieg der Linken zu verhindern, Silvio Berlusconi, Bettino Craxi, Italien, Jesus, Thomas Morus, Mailand","http://www.zeit.de/1994/06/der-cavaliere-ist-beliebter-als-jesus"
"Abpfiff |","1994.6.6377","1994-02-04","DIE ZEIT, , Recht, Gesundheit, Olympiastadion, Rechtsstaat, Schlägerei, Berlin","http://www.zeit.de/1994/06/abpfiff"
"Die Grenzen der offenen Gesellschaft beschwor vorige Woche Karl-Otto Hondrich. Seine Thesen nennt der Politologe Dieter Oberndörfer politische Brandstiftung: Abschied vom völkischen Wahn |","1994.6.6378","1994-02-04","DIE ZEIT, Die Grenzen der offenen Gesellschaft beschwor vorige Woche Karl-Otto Hondrich. Seine Thesen nennt der Politologe Dieter Oberndörfer politische Brandstiftung, Ausländer, Brandstiftung, Ausländerfeindlichkeit, Einbürgerung, Einwanderung, Grundgesetz, Karl Otto Hondrich, Nationalismus, Republik, Bundesrepublik Deutschland, Polen, Politikwissenschaft, Schweiz, Balkan, Bayern, Europa, Osteuropa, Schleswig-Holstein, Südosteuropa, Weimar","http://www.zeit.de/1994/06/abschied-vom-voelkischen-wahn"
"Zu Beginn des Superwahljahres wirkt die CDU müde und lustlos. Was ist los mit der Union? Welche Art Wahlkampf droht dem Bürger? Ein ZEIT-Gespräch mit dem Fraktionsvorsitzenden Wolfgang Schäuble: „Das nächste Spiel ist das schwerste“ |","1994.6.6379","1994-02-04","DIE ZEIT, Zu Beginn des Superwahljahres wirkt die CDU müde und lustlos. Was ist los mit der Union? Welche Art Wahlkampf droht dem Bürger? Ein ZEIT-Gespräch mit dem Fraktionsvorsitzenden Wolfgang Schäuble, Herbert Wehner, Wolfgang Schäuble, CDU, Helmut Kohl, SPD, Willy Brandt, Wahlkampf, John Foster Dulles, Aufklärung, Bundestagswahl, Markus Wolf, Regierungswechsel, Wolfgang Schäuble, Sonntagsfrage, Stasi, Superwahljahr, Untersuchungsausschuss, MIT, Baden-Württemberg, Kiel, Niedersachsen, Südostasien, Weimar","http://www.zeit.de/1994/06/das-naechste-spiel-ist-das-schwerste"
"Arbeitsvermittlung: Private Agenturen schaffen keine neuen Stellen – sie können aber die Arbeitsämter ergänzen: Service für Aufsteiger |","1994.6.6380","1994-02-04","DIE ZEIT, Arbeitsvermittlung: Private Agenturen schaffen keine neuen Stellen – sie können aber die Arbeitsämter ergänzen, Service, Aufsteiger, Bundesanstalt für Arbeit, Großbritannien, Agentur, Arbeitnehmer, Bundestag, Fachkräftemangel, Irland, Schweiz, Dänemark, Niederlande, Schweden, Spanien","http://www.zeit.de/1994/06/service-fuer-aufsteiger"
"Bonner Kulisse |","1994.6.6381","1994-02-04","DIE ZEIT, , Bundesregierung, Theo Waigel, Bundesbank, Rudolf Scharping, SPD, Oskar Lafontaine, Bundeshaushalt, DDR, Existenzminimum, Solidaritätszuschlag, Vermögensteuer, Weißbuch, Ökosteuer, Bonn, Brüssel","http://www.zeit.de/1994/06/bonner-kulisse"
"Jetzt oder nie |","1994.6.6382","1994-02-04","DIE ZEIT, , Jacques Delors, Andreas Papandreou, Französisch, Karolos Papoulias, Minister, Präsidentschaft, Regierungswechsel, Oder, Athen, Brüssel, Europa, Berkeley, Cambridge","http://www.zeit.de/1994/06/jetzt-oder-nie"
"Boden gefunden |","1994.6.6383","1994-02-04","DIE ZEIT, , BMW, Dax, Rover, Aktienindex, Autohersteller, Bayer AG, Börse, Dividende, Vogel, USA","http://www.zeit.de/1994/06/boden-gefunden"
"Schirinowskij: Der Rechtsextremist nutzt mit seinen wirtschaftspolitischen Parolen die Schwächen der Reformer aus: Blitzkrieg für Rußland |","1994.6.6384","1994-02-04","DIE ZEIT, Schirinowskij: Der Rechtsextremist nutzt mit seinen wirtschaftspolitischen Parolen die Schwächen der Reformer aus, Russland, Alexander Schochin, Jegor Gajdar, DDR, Dollar, Jeffrey Sachs, KGB, Rubel, Ukraine, MIT, Sowjetunion","http://www.zeit.de/1994/06/blitzkrieg-fuer-russland"
"Zeitungen: Der britische „Independent“ ist am Ende – neue Eigentümer sollen das Elite-Blatt retten: Selbstmord in Raten |","1994.6.6385","1994-02-04","DIE ZEIT, Zeitungen: Der britische „Independent“ ist am Ende – neue Eigentümer sollen das Elite-Blatt retten, Selbstmord, David Montgomery, Rupert Murdoch, Independent, Kartellamt, Robert Maxwell, Australien, Irland, Italien, Spanien","http://www.zeit.de/1994/06/selbstmord-in-raten"
"Die Regeln für den Handel sind überholt: Alte Zöpfe |","1994.6.6386","1994-02-04","DIE ZEIT, Die Regeln für den Handel sind überholt, Alte, Günter Rexrodt, Handel, Ladenschluss, Sportartikel, Warenhaus","http://www.zeit.de/1994/06/alte-zoepfe"
"Metalltarife: Die Taktik der Kontrahenten: Patt und Poker |","1994.6.6387","1994-02-04","DIE ZEIT, Metalltarife: Die Taktik der Kontrahenten, IG Metall, Poker, Walter Riester, Arbeitgeber, Arbeitgeberverband, Arbeitskampf, Arbeitszeit, Elektroindustrie, Streik, Tarifrunde, Unternehmen, Warnstreik","http://www.zeit.de/1994/06/patt-und-poker"
"Wenn der Geldstrom aus Amerika versiegt, droht den deutschen Börsen ein Kurseinbruch: Fluchtpunkt Dividende |","1994.6.6388","1994-02-04","DIE ZEIT, Wenn der Geldstrom aus Amerika versiegt, droht den deutschen Börsen ein Kurseinbruch, USA, Dividende, Dax, Deutsche Bank, Deutsche Bundesbank, Morgan Stanley, Aktie, Aktienfonds, Aktienindex, Börse, Maschinenbau, Rendite, Staatsanleihe, US-Dollar, Wechselkurs, WestLB, Hongkong, Malaysia, Thailand, Asien, Europa, Singapur","http://www.zeit.de/1994/06/fluchtpunkt-dividende"
"Exportkontrolle: Legal |","1994.6.6389","1994-02-04","DIE ZEIT, Exportkontrolle, Bundesregierung, Wirtschaftsministerium, Binnenmarkt, Export, Landgericht, Massenvernichtungswaffe, Natur, Prozess, Richter, Irak, Tod, Bonn","http://www.zeit.de/1994/06/legal"
"Ruhrkonzerne: Thyssen und Krupp-Hoesch wollen 15 000 Arbeitsplätze streichen: An den Stahl gekettet |","1994.6.6390","1994-02-04","DIE ZEIT, Ruhrkonzerne: Thyssen und Krupp-Hoesch wollen 15 000 Arbeitsplätze streichen, Dieter Spethmann, Ekkehard Schulz, Personalabbau, Stahlindustrie, Unternehmen, Ruhr","http://www.zeit.de/1994/06/an-den-stahl-gekettet"
"Finanzpolitik: Genial |","1994.6.6391","1994-02-04","DIE ZEIT, Finanzpolitik, CDU, Finanzpolitik, Helmut Kohl, Bundeskanzler, Parlament, Präsident, Unternehmen","http://www.zeit.de/1994/06/genial"
"Von wegen Freizeitpark – vier Millionen suchen in Deutschland einen Job: Die Arbeit geht nie aus |","1994.6.6392","1994-02-04","DIE ZEIT, Von wegen Freizeitpark – vier Millionen suchen in Deutschland einen Job, Arbeit, Günter Rexrodt, Theo Waigel, Bundesbank, Bundesregierung, Karl Marx, Karl Schiller, DDR, Erbe, Freizeitpark, Geldpolitik, Kurt Schmücker, Rezession, Wirtschaftsminister, Sowjetunion, Osteuropa","http://www.zeit.de/1994/06/die-arbeit-geht-nie-aus"
