"title","number","date","keywords","link"
"Zaire: Das geplünderte Land |","1991.41.2915","1991-10-04","DIE ZEIT, Zaire","http://www.zeit.de/1991/41/das-gepluenderte-land"
"Was will die EG werden: Nur eine westeuropäische Erfolgsgemeinschaft oder eine Solidargemeinschaft, die sich nach Osten öffnet?: Auf dem Tandem aus dem Tritt |","1991.41.2916","1991-10-04","DIE ZEIT, Was will die EG werden: Nur eine westeuropäische Erfolgsgemeinschaft oder eine Solidargemeinschaft, die sich nach Osten öffnet?, Saddam Hussein, Frankreich, Auswärtiges Amt, Nordafrika, England, Europa, Jugoslawien, Niederlande, Oder, Sowjetunion, USA, Afrika, Maastricht, Rhein, Saar","http://www.zeit.de/1991/41/auf-dem-tandem-aus-dem-tritt"
"Pssst! |","1991.41.2917","1991-10-04","DIE ZEIT, , Bundesnachrichtendienst, Energie, Führerschein, Stasi, Verfassungsschutz","http://www.zeit.de/1991/41/pssst"
"Brüssel ohne Konzept: Fluchtort Europa |","1991.41.2918","1991-10-04","DIE ZEIT, Brüssel ohne Konzept, Brüssel, Europa, Martin Bangemann, Jacques Delors, Abschiebung, Asylrecht, Binnenmarkt, Bleiberecht, Einwanderung, Währungsunion, Frankreich, Italien, Portugal, Spanien, Bonn, Dublin, Maastricht","http://www.zeit.de/1991/41/fluchtort-europa"
"Nachlese: UN-Inspektionen im Irak: Katz und Maus |","1991.41.2919","1991-10-04","DIE ZEIT, Nachlese: UN-Inspektionen im Irak, Irak, Recht, Arbeit, Hauptstadt, Information, Vereinte Nationen, Bagdad","http://www.zeit.de/1991/41/katz-und-maus"
"Die CIA steckt in einer tiefen Krise. Amerikas Rivale hat abgedankt, die Sowjetunion zerfällt. Wozu dient nun eine Armee von Spionen? Eine Anhörung im amerikanischen Senat wirft diese Frage jetzt öffentlich auf: Der Mann, der nichts mehr wußte |","1991.41.2920","1991-10-04","DIE ZEIT, Die CIA steckt in einer tiefen Krise. Amerikas Rivale hat abgedankt, die Sowjetunion zerfällt. Wozu dient nun eine Armee von Spionen? Eine Anhörung im amerikanischen Senat wirft diese Frage jetzt öffentlich auf, Sowjetunion, Ronald Reagan, Saddam Hussein, CIA, Helmut Schmidt, Zbigniew Brzezinski, Geheimdienst, Johannes Paul II., USA, Wirtschaftsspionage, Irak, Iran, Washington D.C., New York","http://www.zeit.de/1991/41/der-mann-der-nichts-mehr-wusste"
"Worte der Woche |","1991.41.2921","1991-10-04","DIE ZEIT, , George W.  Bush, Michail Gorbatschow, Hans-Jochen Vogel, CDU, FDP, SPD, Boris Jelzin, Bundeskanzleramt, Burkhard Hirsch, François Mitterrand, Asylrecht, DDR, Jugoslawien, Bonn","http://www.zeit.de/1991/41/worte-der-woche"
"Vor einem Jahr vereinigten sich die beiden deutschen Staaten. Doch immer noch trennen Welten die neu zusammengeführten Landsleute.: Zur Lage der Nation |","1991.41.2922","1991-10-04","DIE ZEIT, Vor einem Jahr vereinigten sich die beiden deutschen Staaten. Doch immer noch trennen Welten die neu zusammengeführten Landsleute., Kurt Schumacher, Christian Meier, Helmut Schmidt, SPD, Polen, Ralf Dahrendorf, Wolfgang Thierse, DDR, Diktatur, Extremismus, Frankreich, Solidarität, Niederlande, Russland, Sowjetunion, Ungarn, Europa, Auschwitz, Bremen, Heidelberg, Leipzig","http://www.zeit.de/1991/41/zur-lage-der-nation"
"Bonner Bühne: Pathos nicht mehr gefragt |","1991.41.2923","1991-10-04","DIE ZEIT, Bonner Bühne, Bühne, Heidemarie Wieczorek-Zeul, Rita Süssmuth, Abtreibung, Debatte, Echo, Hauptstadt, Johannes Gross, Konjunktur, PDS, Parlament, Schwangerschaftsabbruch, Test, Berlin, Bonn, Rhein","http://www.zeit.de/1991/41/pathos-nicht-mehr-gefragt"
"Weltbühne: Wie alt ist die Demokratie? |","1991.41.2924","1991-10-04","DIE ZEIT, Weltbühne, Aristoteles, Ostblock, Staatsverschuldung, Griechenland, Jugoslawien, Athen, Europa","http://www.zeit.de/1991/41/wie-alt-ist-die-demokratie"
"Nach der deutschen Einheit kam der Bonner Außenminister zweimal ins Stolpern: im Golfkrieg und in der Jugoslawienkrise. Doch jetzt gibt ihm die amerikanische Abrüstungsinitiative wieder recht.: Vom Werden und Wollen |","1991.41.2925","1991-10-04","DIE ZEIT, Nach der deutschen Einheit kam der Bonner Außenminister zweimal ins Stolpern: im Golfkrieg und in der Jugoslawienkrise. Doch jetzt gibt ihm die amerikanische Abrüstungsinitiative wieder recht., Hans-Dietrich Genscher, Außenminister, James Baker, Vereinte Nationen, Abrüstung, DDR, Eduard Schewardnadse, Jugoslawien, Kroatien, Ottawa, Slowenien, USA, Verfassungsänderung, Golfkrieg, Israel, Sowjetunion, Bonn, New York, Washington D.C., Amman, Europa, Magdeburg, Moskau","http://www.zeit.de/1991/41/vom-werden-und-wollen"
"Rückblick: Klaus Barbie gestorben: Der Schlächter von Lyon |","1991.41.2926","1991-10-04","DIE ZEIT, Rückblick: Klaus Barbie gestorben, Klaus Barbie, Alte, Geheimdienst, Opfer, Prozess, Strafe, Tod, Bolivien, Frankreich, Lyon","http://www.zeit.de/1991/41/der-schlaechter-von-lyon"
"Bürgerschaftswahl an der Weser: Rechtsruck nach links |","1991.41.2927","1991-10-04","DIE ZEIT, Bürgerschaftswahl an der Weser, CDU, FDP, Grüne, Helmut Kohl, SPD, SPD-Fraktion, DVU, Gerhard Frey, Klaus Wedemeier, Bürgerschaftswahl, Bundesrat, Volksparteien, Bremen, Bonn, Brandenburg, Rheinland-Pfalz","http://www.zeit.de/1991/41/rechtsruck-nach-links"
"Zeitspiegel |","1991.41.2928","1991-10-04","DIE ZEIT, , Michael Naumann, John Major, Literatur, Finanzminister, Kabinett, Lothar de Maizière, Premierminister, Republik, Roman, Rowohlt Verlag, Verlag, Wasser, Whirlpool, Wirtschaftsminister, Großbritannien, London","http://www.zeit.de/1991/41/zeitspiegel"
"Die beiden deutschen Staaten wurden zusammengefügt, doch die Menschen sind einander eher fremd geworden. ZEIT-Redakteur Christoph Dieckmann, selber aus der DDR in die Einheit gekommen, läßt in einem Gruppenbild das erste Jahr Revue passieren.: „Warum schaust du hinterher?“ |","1991.41.2929","1991-10-04","DIE ZEIT, Die beiden deutschen Staaten wurden zusammengefügt, doch die Menschen sind einander eher fremd geworden. ZEIT-Redakteur Christoph Dieckmann, selber aus der DDR in die Einheit gekommen, läßt in einem Gruppenbild das erste Jahr Revue passieren., DDR, Bundesliga, Erich Mielke, Fußball, Dynamo Dresden, Hamburger SV, SV Werder Bremen, Ägypten, Berlin, Dresden, Hamburg, Bremen, Leipzig, München, Rostock","http://www.zeit.de/1991/41/warum-schaust-du-hinterher"
"Neuer Generalinspekteur: Himmelfahrtskommando im Frieden |","1991.41.2930","1991-10-04","DIE ZEIT, Neuer Generalinspekteur, Klaus Naumann, Frieden, Wolf Biermann, Bundesregierung, Jörg Schönbohm, Soldat, USA, Europa, Kaukasus, München","http://www.zeit.de/1991/41/himmelfahrtskommando-im-frieden"
"KOLUMNE: Wirtschaften in richtiger Verfassung |","1991.41.2931","1991-10-04","DIE ZEIT, KOLUMNE, Verfassung, Klaus von Dohnanyi, Bundesrat, Bundestag, Europäische Gemeinschaft, Grundgesetz, Grundrecht, Lateinamerika, Umweltschutz, Volksentscheid, Vollbeschäftigung, Schweiz, Europa, Osteuropa","http://www.zeit.de/1991/41/wirtschaften-in-richtiger-verfassung"
"Der Thron des Diktators von Zaire wackelt: Der Staatsdieb im Armenhaus |","1991.41.2932","1991-10-04","DIE ZEIT, Der Thron des Diktators von Zaire wackelt, François Mitterrand, Frankreich, Mobutu Sese Seko, Weltbank, Angola, Kinshasa, Brüssel, Washington D.C","http://www.zeit.de/1991/41/der-staatsdieb-im-armenhaus"
"Arbeiterproteste in Bukarest: Die Rache für falsche Versprechen |","1991.41.2933","1991-10-04","DIE ZEIT, Arbeiterproteste in Bukarest, Ion Iliescu, Bukarest, Europäische Gemeinschaft, Rumänien, Securitate, Weltbank","http://www.zeit.de/1991/41/die-rache-fuer-falsche-versprechen"
"Übersiedler aus Honeckers Tagen: Die Seele bleibt noch lange drüben |","1991.41.2934","1991-10-04","DIE ZEIT, Übersiedler aus Honeckers Tagen, Seele, DDR, Ostdeutschland, Berlin, Bonn, Chemnitz, Hamburg, Leipzig, München, Ost-Berlin","http://www.zeit.de/1991/41/die-seele-bleibt-noch-lange-drueben"
"Parteiengespräch im Kanzleramt: Hilflos vor dem Fremdenhaß |","1991.41.2935","1991-10-04","DIE ZEIT, Parteiengespräch im Kanzleramt, SPD, Björn Engholm, Heiner Geißler, Kanzleramt, Richard Freiherr von Weizsäcker, Burkhard Hirsch, Asylrecht, Ausländerpolitik, Einbürgerung, Ostdeutschland, Werner Schulz, Dänemark, Frankreich, Bonn, Brandenburg, Bremen, Saarlouis","http://www.zeit.de/1991/41/hilflos-vor-dem-fremdenhass"
"Zaire: Das geplünderte Land |","1991.41.2936","1991-10-04","DIE ZEIT, Zaire","http://www.zeit.de/1991/41/das-gepluenderte-land"
"Energiepolitik: Verlockendes Netz |","1991.41.2937","1991-10-04","DIE ZEIT, Energiepolitik, Energiepolitik, Fernwärme, Kraftwerk, Stromversorgung, Dortmund, Elbe, Ruhr, Saarbrücken","http://www.zeit.de/1991/41/verlockendes-netz"
"Bonner Kulisse |","1991.41.2938","1991-10-04","DIE ZEIT, , Theo Waigel, Jürgen Möllemann, Bundesregierung, Helmut Kohl, Finanzministerium, Otto Schily, Binnenschifffahrt, Dieter Vogel, Finanzminister, Luftfahrt, Mineralölsteuer","http://www.zeit.de/1991/41/bonner-kulisse"
"Autoseller: Der Trend hält an |","1991.41.2939","1991-10-04","DIE ZEIT, Autoseller, Audi, Opel, VW, PKW, Polo, Rüsselsheim, Wolfsburg","http://www.zeit.de/1991/41/der-trend-haelt-an"
"Rudolf Engen: Deutsche Chancen |","1991.41.2940","1991-10-04","DIE ZEIT, Rudolf Engen, EMMA, Arbeitslosigkeit, Atomkraftwerk, Chemie, DDR, Finanzminister, Föderalismus, Geschichte, Hauptstadt, Lehrer, Stern, Territorium, Wald, Japan, USA, Berlin, Saar, Bonn, Saarland","http://www.zeit.de/1991/41/deutsche-chancen"
"Dirk Kurbjuweit:: Ein mehr als dünnes Ergebnis |","1991.41.2941","1991-10-04","DIE ZEIT, Dirk Kurbjuweit:, Norbert Blüm, FDP, CDU, Otto Graf Lambsdorff, Gehalt, Krankenkasse, Pflegeversicherung, Sozialversicherung, Vorsorge","http://www.zeit.de/1991/41/ein-mehr-als-duennes-ergebnis"
"Wird es jetzt zum Volkssport, auf die fernöstlichen Konkurrenten einzudreschen? Der Vorstandsvorsitzende von Daimler-Benz plädiert für Rücksichtnahme statt Ressentiments.: Sündenbock Japan |","1991.41.2942","1991-10-04","DIE ZEIT, Wird es jetzt zum Volkssport, auf die fernöstlichen Konkurrenten einzudreschen? Der Vorstandsvorsitzende von Daimler-Benz plädiert für Rücksichtnahme statt Ressentiments., Japan, SPD, Edzard Reuter, Mercedes-Benz, OECD, Peugeot, Toyota, Automobilindustrie, Europäische Gemeinschaft, Lexus, Ostasien, Europa, Frankreich, Großbritannien","http://www.zeit.de/1991/41/suendenbock-japan"
"Brasilien: Karneval des Chaos |","1991.41.2943","1991-10-04","DIE ZEIT, Brasilien, Brasilien, Karneval, Militär, Fernando Collor de Mello, Lateinamerika, Privatisierung, Argentinien, Belgien, Chaos, Indien, USA, Europa, Rio de Janeiro, Südamerika","http://www.zeit.de/1991/41/karneval-des-chaos"
"Ostpolitik: Diskreter Wandel |","1991.41.2944","1991-10-04","DIE ZEIT, Ostpolitik, Helmut Kohl, Michail Gorbatschow, Bundeskanzler, Finanzpolitik, Internationaler Währungsfonds, Kunst, Ministerpräsident, Ostpolitik, Republik, Selbstbestimmung, Wirtschaftshilfe, Währungspolitik, Sowjetunion, Bonn","http://www.zeit.de/1991/41/diskreter-wandel"
"Jemen: Union der Habenichtse |","1991.41.2945","1991-10-04","DIE ZEIT, Jemen, Saddam Hussein, Finanzministerium, Jemen, BP, Freihandelszone, Hongkong, Niederlande, Südjemen, Afrika, Bahrain, Bayern, Nordjemen","http://www.zeit.de/1991/41/union-der-habenichtse"
"ZEIT/Südprojekt-Prognose: Die Mark gibt nach |","1991.41.2946","1991-10-04","DIE ZEIT, ZEIT/Südprojekt-Prognose, Aktie, Aktienmarkt, Alte, Bank, D-Mark, Devisenmarkt, Dollar, Geld, tTokyo, Unwetter","http://www.zeit.de/1991/41/die-mark-gibt-nach"
"Am 3. Oktober 1990 vereinigten sich die beiden deutschen Staaten – eine Bilanz: Das Land der zwei Geschwindigkeiten |","1991.41.2947","1991-10-04","DIE ZEIT, Am 3. Oktober 1990 vereinigten sich die beiden deutschen Staaten – eine Bilanz, Bundesregierung, Theo Waigel, SPD, Ulrich Beck, Wolfgang Thierse, Arbeitnehmer, Arbeitslosenversicherung, DDR, Einkommen, Grundstück, Ostdeutschland, Tariflohn, Treuhandanstalt, Japan, Berlin, Europa, Rheinland-Pfalz","http://www.zeit.de/1991/41/das-land-der-zwei-geschwindigkeiten"
"Telearbeit: Gift oder Medizin? |","1991.41.2948","1991-10-04","DIE ZEIT, Telearbeit, Jörg Tauss, Siemens AG, DAG, Hans Werner Richter, Belgien, Niederlande, Oder, Telearbeit, Stuttgart, Hamburg","http://www.zeit.de/1991/41/gift-oder-medizin"
"Lebensmittelindustrie: Mit Gummitrabis gegen Westbärchen |","1991.41.2949","1991-10-04","DIE ZEIT, Lebensmittelindustrie, Ronald Reagan, CMA, DDR, Lebensmittelindustrie, Währungsunion, MIT, Magdeburg, Bayern, Köln","http://www.zeit.de/1991/41/mit-gummitrabis-gegen-westbaerchen"
"Konkurrenz der Städte: Neidisch auf Berlin |","1991.41.2950","1991-10-04","DIE ZEIT, Konkurrenz der Städte, Berlin, Franz Josef Strauß, Roland Berger, SPD, Eberhard von Kuenheim, Siemens AG, IHK, CSU-Fraktion, Helmut Becker, Landesregierung, Ruhrgebiet, München, Isar","http://www.zeit.de/1991/41/neidisch-auf-berlin"
"Markt-Report: Mangel an Phantasie |","1991.41.2951","1991-10-04","DIE ZEIT, Markt-Report, Dax, Aktienindex, Aktienmarkt, Anleihe, Dividende, Pirelli, Privatisierung, Rendite, Verlust, Bank, England","http://www.zeit.de/1991/41/mangel-an-phantasie"
"AEG Olympia: Countdown in Wilhelmshaven |","1991.41.2952","1991-10-04","DIE ZEIT, AEG Olympia, Edzard Reuter, Olympia, AEG, Siemens AG, Frankfurter Flughafen, Wilhelmshaven, Berlin, Oregon, Ostfriesland, Portland","http://www.zeit.de/1991/41/countdown-in-wilhelmshaven"
"In loser Folge portraitiert unser Reporter bedeutende Wirtschaftsblätter in aller Welt: Scheinbar 24 Stunden Sonne |","1991.41.2953","1991-10-04","DIE ZEIT, In loser Folge portraitiert unser Reporter bedeutende Wirtschaftsblätter in aller Welt, Sonne, Italien, Zeitung, London, Mailand, Rom, Brüssel, Europa, New York, Sizilien, Turin, Verona","http://www.zeit.de/1991/41/scheinbar-24-stunden-sonne"
"Sri Lanka: Ein Modell wird zerstört |","1991.41.2954","1991-10-04","DIE ZEIT, Sri Lanka, Sri Lanka, Weltbank, Indien, Pakistan, Colombo, Delhi, Ganges","http://www.zeit.de/1991/41/ein-modell-wird-zerstoert"
