"title","number","date","keywords","link"
"Ungarn: Mit den Masken der Clowns","2011.46.52821","2011-11-16","Politik, Ungarn, Ungarn, Demonstration, Protest, Viktor Orbán, Ungarn, Clown, Diktatur, Feuerwehr, Madonna, Solidarno??, Verfassungsgericht, MIT, Polen, Sowjetunion, Danzig, Osteuropa","http://www.zeit.de/2011/46/Ungarn-Orban"
"Nahost-Konflikt: Wohnst du noch, oder kämpfst du schon?","2011.46.52822","2011-11-16","Politik, Nahost-Konflikt, Israel, Immobilie, Nahost, Jerusalem, Benjamin Netanjahu, Barack Obama, Israel, Nahost-Konflikt, Unesco, Palästinenser, Blackberry, Hauptstadt, Islam, Jerusalem, Kanada, Kibbuz, Klagemauer, Minarett, Nachbarschaft, Oder, Tunesien, USA, Ägypten, Ostjerusalem, Europa","http://www.zeit.de/2011/46/Ostjerusalem"
"Europa: Wir haben die Wahl","2011.46.52823","2011-11-13","Politik, Europa, Europa, Europapolitik, Eu, Europa, Wahl, Angela Merkel, Nicolas Sarkozy, Europäische Union, Jürgen Habermas, Giorgos Papandreou, Jean-Claude Juncker, Finanzmarkt, José Manuel Durão Barroso, Rettungspaket, Sparpaket, Griechenland, Brüssel","http://www.zeit.de/2011/46/01-Europa-Demokratie"
"Muammar Gadhafi: Die Grüne Internationale","2011.46.52824","2011-11-13","Politik, Muammar Gadhafi, Al-gadhafi-muammar, Diktatur, Libyen, Deutsche_Politiker, Bruno Kreisky, Grüne, Otto Schily, Muammar al-Gaddafi, Die Linke, Reise, Anders Behring Breivik, Friedensbewegung, Johannes Paul II., Libyen, Muammar al-Gaddafi, Norwegen, Sowjetunion, USA, Wüste, Ökologie, Tripolis, Wien, Sizilien","http://www.zeit.de/2011/46/Gadhafi-Gruenes-Buch"
"Anti-Euro-Partei: CDU – und raus bist du!","2011.46.52825","2011-11-11","Politik, Anti-Euro-Partei, Cdu, Partei, Euro, CDU, Wolfgang Bosbach, CSU, Hubert Aiwanger, Friedrich Merz, Henkel, Bundestagswahl, Bundeswehrreform, Familienpolitik, Landtag, Mindestlohn, Europa, Bayern, Leipzig","http://www.zeit.de/2011/46/Neue-Partei"
"Joschka Fischer: »Vergesst diese EU«","2011.46.52826","2011-11-11","Politik, Joschka Fischer, Deutsche_Politiker, Europa, Eu, Gruene, Angela Merkel, Europäische Union, Joschka Fischer, Griechenland, Euro, Euro-Zone, Europaparlament, Volksabstimmung, Dänemark, Europa, Italien, USA, Balkan, Brüssel, Cannes, London, Louisiana","http://www.zeit.de/2011/46/Interview-Fischer"
"Eurokrise: Merkels Wille geschehe","2011.46.52827","2011-11-11","Politik, Eurokrise, Euro, Finanzkrise, Merkel-angela, Angela Merkel, Peer Steinbrück, Europäische Zentralbank, Betreuungsgeld, Bundestag, Euro-Krise, Euro-Zone, G-20-Gipfel, Griechenland, Italien, Notenbank, Euro-Krise, Europa, Frankreich, Portugal, Schweiz, Spanien, Cannes, Berlin","http://www.zeit.de/2011/46/Merkel-Eurokrise"
"Israel-Politik: An den Grenzen der Freundschaft","2011.46.52828","2011-11-11","Politik, Israel-Politik, Internationale_Beziehungen, Israel, Iran, Nahost, Konflikt, Angela Merkel, Bundesregierung, Freundschaft, Unesco, Hamas, Steffen Seibert, Iran, Israel, Schimon Peres, Vereinte Nationen, Euro-Krise, Palästinenser, Sanktion, Siedlungsbau, Solidarität, Syrien, Kanada, Palästina, Türkei, USA, Berlin, Jerusalem","http://www.zeit.de/2011/46/Israel"
"Regierungswechsel: Das etwas bessere Griechenland","2011.46.52829","2011-11-10","Politik, Regierungswechsel, Griechenland, Regierungswechsel, Opposition, Giorgos Papandreou, Griechenland, Regierungswechsel, John Kerry, Allianz, Kostas Karamanlis, Ministerpräsident, Pasok, Populismus, Rettungspaket, Sparpaket, Zeichnung, Athen","http://www.zeit.de/2011/46/Griechenland"
"Nach Berlusconi: Ohne ihn","2011.46.52830","2011-11-10","Politik, Nach Berlusconi, Italien, Berlusconi-silvio, Regierungswechsel, Silvio Berlusconi, Carlo Azeglio Ciampi, Europäische Zentralbank, Mario Draghi, Apulien, Kommunistische Partei, Mario Monti, Silvio Berlusconi, Italien, Mosambik, Rom","http://www.zeit.de/2011/46/Italien-Berlusconi"
"Politik und Lyrik Nr. 36: PRADA MARFA TEXAS ZWEI","2011.46.52831","2011-11-28","Politik, Politik und Lyrik Nr. 36, Lyrik, Politik, Prada, Gedicht, Katastrophe, Wüste","http://www.zeit.de/2011/46/Lyrik"
"Protest: Kämpfen statt campen","2011.46.52832","2011-11-12","Politik, Protest, Aegypten, Occupy, Protest, Hosni Mubarak, Bankenregulierung, Blogger, Jugendbewegung, Ägypten, USA, Demokratie, Finanzmarkt, Folter, Frühling, Griechenland, Israel, Protest, Spanien, USA, Verhaftung, Berlin, Kairo, London, Madrid, New York, Rom, Washington D.C","http://www.zeit.de/2011/46/P-Occupy-Aegypten"
"FDP-Parteitag: Unschlagbar verschlagen","2011.46.52833","2011-11-12","Politik, FDP-Parteitag, Bruederle-rainer, Fdp, Partei, Deutsche_Politiker, Guido Westerwelle, Philipp Rösler, Rainer Brüderle, FDP, FDP-Fraktion, Daniel Bahr, Karl-Theodor zu Guttenberg, Gesundheitsministerium, Hermann Otto Solms, Christian Lindner, Sahra Wagenknecht, Europa, Baden-Württemberg, Rheinland-Pfalz, Rostock","http://www.zeit.de/2011/46/FDP-Bruederle"
"Piratenpartei: 99 Fragen an den Piraten Andreas Baum","2011.46.52834","2011-11-09","Politik, Piratenpartei, Piratenpartei, Deutschland, Politiker, Partei, Barack Obama, FDP, Grüne, Telekom, CSU, Hans-Christian Ströbele, Peter Altmaier, Josef Ackermann, Computer, H&amp;M, Johnny Depp, Tempelhof, Urheberrecht, Berlin, Libyen","http://www.zeit.de/2011/46/Piratenpartei-Baum"
"Berlusconi: Basta ist nicht genug","2011.46.52835","2011-11-09","Politik, Berlusconi, Italien, Berlusconi-silvio, Praesident, Regierungswechsel, Silvio Berlusconi, Europäische Union, Albtraum, Bestechung, Bilanzfälschung, Giorgio Napolitano, Italien, Mario Monti, Moderator, Müll, Strafverfolgung, Europa","http://www.zeit.de/2011/46/01-Italien-Berlusconi"
"Occupy-Bewegung: Guy? Schon vorbei","2011.46.52836","2011-11-14","Wirtschaft, Occupy-Bewegung, Occupy, Protest, Alan Moore, Margaret Thatcher, Amazon, Comic, Hollywood, Kunststoff, Scientology, Söldner, Time Warner, Australien, Kanada, Occupy-Bewegung, USA, Asien, Bergisch Gladbach, New York","http://www.zeit.de/2011/46/Occupy-Fawkes"
"Systemkritik: Kapitalismus in der Reichtumsfalle","2011.46.52837","2011-11-14","Wirtschaft, Systemkritik, Kapitalismus, Reichtum, Wirtschaft, Wachstum, John Maynard Keynes, Kapitalismus, Bankenrettung, Bruttoinlandsprodukt, Enkel, Euro, Finanzkrise, Lehman Brothers, Reichtum, Staatsverschuldung, Statistisches Bundesamt, Botsuana, Indien, USA, Asien, Nordamerika, Osteuropa","http://www.zeit.de/2011/46/Kapitalismus"
"Schuldenkrise: Warum sollten sie?","2011.46.52838","2011-11-13","Wirtschaft, Schuldenkrise, Euro, Eurozone, Finanzkrise, Finanzpolitik, China, Europäische Union, Nicolas Sarkozy, China, Deng Xiaoping, WTO, EFSF, G 20, G-20-Gipfel, Staatsbesuch, Twitter, Volksabstimmung, Yuan, Europa, Frankreich, USA, Athen, Cannes","http://www.zeit.de/2011/46/China-Eurokrise"
"Staatsanleihen: Fehlen nur noch 1.000 Milliarden","2011.46.52839","2011-11-12","Wirtschaft, Staatsanleihen, Finanzkrise, Finanzpolitik, Staatsfinanzen, Euro, Eurozone, Kapitalmarkt, Bundesbank, Bundesregierung, Nicolas Sarkozy, Europäische Zentralbank, Anleihe, EFSF, Euro, Euro-Bond, Fonds, Frankreich, G-20-Gipfel, Internationaler Währungsfonds, Italien, Kapitalflucht, Pandora, Rettungsschirm, Schwellenland, Staatsanleihe, Währungsunion, Belgien, Luxemburg, Portugal, Berlin, Cannes, Washington D.C","http://www.zeit.de/2011/46/Griechenland-Euro"
"Erderwärmung: Die wahre Krise","2011.46.52840","2011-11-10","Wirtschaft, Erderwärmung, Klimawandel, Klimaschutz, Klima, Energie, Energiepolitik, Erderwärmung, Euro-Krise, Fabrik, Finanzkrise, Gebäude, Klimaschutz, Kohlendioxid, Meeresspiegel, Staatsanleihe, Tornado, Bangkok, Bremen, Cancún, Durban, Genua, Hamburg, Niedersachsen, Nizza","http://www.zeit.de/2011/46/Energie-Klimawandel"
"Schweizer Banker: New Yorker Verlockungen","2011.46.52841","2011-11-10","Wirtschaft, Schweizer Banker, Schweiz, Wall-street, Bank, UBS, Credit Suisse, Investmentbanking, James Bond, Schweiz, Swiss, Verwaltungsrat, Boston, Chicago, London, New York, Sizilien","http://www.zeit.de/2011/46/CH-Wallstreet"
"Geldanlage: Von allem ein bisschen","2011.46.52842","2011-11-16","Wirtschaft, Geldanlage, Kapitalanlage, Geld, Fonds, Aktie, Dax, Europäische Zentralbank, Aktie, Anleihe, Bundesanleihe, Edelmetall, Euro-Krise, Euro-Zone, Gold, Griechenland, Inflation, Rendite, Rettungsschirm, Rohstoff, Silber, Staatsanleihe, Brasilien, Indonesien, Taiwan, USA, Europa, Singapur","http://www.zeit.de/2011/46/F-Geldanlage"
"Kampfjet Rafale: Die Mutter aller Aufträge","2011.46.52843","2011-11-12","Wirtschaft, Kampfjet Rafale, Flugzeug, Militaerflugzeug, Frankreich, Luftwaffe, Unternehmen, Nicolas Sarkozy, Dilma Rousseff, Boeing, Verteidigungsministerium, Brasilien, Figaro, Frankreich, Indien, Luftwaffe, Australien, Israel, Niederlande, Spanien, USA, Vereinigte Arabische Emirate, Bangalore, Singapur","http://www.zeit.de/2011/46/Rafale-Kampfjet"
"Entwicklungspolitik: Alles nur Murks?","2011.46.52844","2012-01-17","Wirtschaft, Entwicklungspolitik, Entwicklungspolitik, Entwicklungshilfe, Niebel-dirk, Dirk Niebel, Erhard Eppler, Heidemarie Wieczorek-Zeul, Walter Scheel, Egon Bahr, Carl-Dieter Spranger, Helmut Schmidt, Willy Brandt, DDR, Entwicklungspolitik, Weltbank, Madagaskar, Norwegen, Afrika, Südamerika","http://www.zeit.de/2011/46/Entwicklungspolitik"
"Wirtschaftskultur: Sie nahmen sich, was möglich war","2011.46.52845","2011-11-10","Wirtschaft, Wirtschaftskultur, Wirtschaft, Euro, Europa, Finanzkrise, Euro, Finanzmarkt, Griechenland, Immobilienkredit, Niall Ferguson, Notenbank, Übersee, Irland, Italien, USA, Europa, Athen, Dublin, Maastricht","http://www.zeit.de/2011/46/Rezension-Lewis"
"Arbeitsbedingungen: Arbeiten, um zu leben","2011.46.52846","2011-11-17","Wirtschaft, Arbeitsbedingungen, Arbeit, Arbeitsbedingungen, Arbeitnehmer, Unternehmen, Kapitalismus, Karl Marx, Ford, Henry Ford, Friedrich Engels, Agent, Fabrik, Japan, Mazda, Ostdeutschland, USA, China, England, Hamburg, Hiroshima","http://www.zeit.de/2011/46/Historie-Arbeitnehmer"
"Sozialismus: Lernen von den Versagern","2011.46.52847","2011-11-16","Wirtschaft, Sozialismus, Sozialismus, Kapitalismus, Erich Honecker, Karl Marx, Albert Camus, Rudolf Bahro, Friedrich Engels, Bundestag, DDR, Kapitalismus, Nordkorea, Russland, Moskau, Ost-Berlin","http://www.zeit.de/2011/46/Sozialismus"
"Schweizer Banken: Der Untergang des Herrn Kall","2011.46.52848","2011-11-14","Wirtschaft, Schweizer Banken, Schweiz, Bank, Steuervergehen, Julius Bär, UBS, Credit Suisse, Schweiz, Frauenhandel, Geld, USA, Vermögen, Steuerhinterziehung, USA, New York, Basel, Miami, Zürich","http://www.zeit.de/2011/46/CH-Banker-Kall"
"Hartmut Mehdorn: Strafzettel kriege ich nur morgens","2011.46.52849","2011-11-14","Wirtschaft, Hartmut Mehdorn, Luftverkehr, Verkehr, Management, Unternehmen, Hartmut Mehdorn, Air Berlin, Gerhard Schröder, Joachim Hunold, Telekom, Josef Ackermann, Bahn, Bundestag, Börsengang, Deutsche Post, Lehman Brothers, Verwaltungsrat, USA, Unternehmen, Berlin, Bielefeld, Buxtehude","http://www.zeit.de/2011/46/P-Mehdorn"
"Utopien: Bessere Welten","2011.46.52850","2011-11-11","Wirtschaft, Utopien, Kapitalismus, Francis Bacon, Philosophie, Atlantis, Christentum, Eigentum, Kapitalismus, Konsumgenossenschaft, Muhammad Yunus","http://www.zeit.de/2011/46/Utopien"
"Koalitionspolitik: Alter ist keine Leistung","2011.46.52851","2011-11-11","Wirtschaft, Koalitionspolitik, Pflege, Pflegeversicherung, Gesundheitspolitik, Vorsorge, Daniel Bahr, FDP, CDU, Philipp Rösler, CSU, Jürgen Rüttgers, Wolfgang Kubicki, Dirk Niebel, Hans-Olaf Henkel, Rainer Brüderle, Betreuungsgeld, Christian Lindner, Euro, Euro-Krise, Griechenland, Pflege, Pflegeversicherung, Europa, Nordrhein-Westfalen, Thüringen","http://www.zeit.de/2011/46/Interview-Bahr"
"Übernahmeplan: Man kennt sich","2011.46.52852","2011-11-09","Wirtschaft, Übernahmeplan, Warenhaus, Handel, Unternehmen, Investition, Nicolas Berggruen, Karstadt, Kaufhof, Wendelin Wiedeking, Eckhard Cordes, Ferrari, Alfred Gusenbauer, Geldanlage, Ver.di, Kartellrecht, Euro, Österreich, München, Wien","http://www.zeit.de/2011/46/Metro-Kaufhof"
"Wirtschaftskrise: Zweimal Niedergang","2011.46.52853","2011-11-14","Wirtschaft, Wirtschaftskrise, Europa, Usa, Finanzkrise, Wirtschaft, Wirtschaftskrise, Finanzen, USA, BIP, Demokratie, Erzeuger, Europapolitik, Selbstmord, Wahlrecht, Irland, Sowjetunion, Spanien, Europa, Berlin","http://www.zeit.de/2011/46/P-Zeitgeist"
