"title","number","date","keywords","link"
"Berufsparlament: Gewurstel aus Prinzip","2012.42.54276","2012-10-11","Politik, Berufsparlament, Schweiz","http://www.zeit.de/2012/42/Schweiz-Berufsparlament-Milizsystem"
"Fragen Sie Dr. Notter!: Pro und Kontra Berufsparlament","2012.42.54277","2012-10-11","Politik, Fragen Sie Dr. Notter!, Schweiz","http://www.zeit.de/2012/42/CH-Notter"
"Europa: Hurra, wir planen noch!","2012.42.54278","2012-10-10","Politik, Europa, Europa, Europapolitik, Europaeische-union, Euro-krise, Finanzkrise","http://www.zeit.de/2012/42/Zukunft-Europa"
"Winfried Kretschmann: Weniger Gorleben!","2012.42.54279","2012-10-10","Politik, Winfried Kretschmann, Atommuellendlager, Atommuell, Atomindustrie","http://www.zeit.de/2012/42/Kretschmann-Endlager-Gorleben"
"Merkel in Athen: Kreuz mit Haken","2012.42.54280","2012-10-11","Politik, Merkel in Athen, Angela-merkel, Griechenland, Euro, Euro-krise","http://www.zeit.de/2012/42/01-Griechenland-Merkel-Kreuz-mit-Haken"
"Peer Steinbrück: Tugendterror","2012.42.54281","2012-10-11","Politik, Peer Steinbrück, Peer-steinbrueck","http://www.zeit.de/2012/42/01-Peer-Steinbrueck"
"US-Wahlkampf: Auftritt: Der wahre Romney","2012.42.54282","2012-10-11","Politik, US-Wahlkampf, Mitt-romney, Us-wahlkampf, Wahlkampf","http://www.zeit.de/2012/42/Obama-Wahlkampf"
"Schuldenkrise: Besuch der kalten Dame","2012.42.54283","2012-10-11","Politik, Schuldenkrise, Angela-merkel","http://www.zeit.de/2012/42/Merkel-Athen-Besuch"
"Saudisches Königshaus: Wowi und der Prinz","2012.42.54284","2012-10-11","Politik, Saudisches Königshaus, Klaus-wowereit, Berlin, Saudi-arabien","http://www.zeit.de/2012/42/Ortstermin-Saudis-Berlin"
"Macht: Kahl ist cool","2012.42.54285","2012-10-11","Politik, Macht","http://www.zeit.de/2012/42/Haare-Glatze-Macht"
"Politikstil: Fehler? Frei!","2012.42.54286","2012-10-11","Politik, Politikstil","http://www.zeit.de/2012/42/Politiker-Fehler-Gestaendnis"
"FDP: Treffen sich zwei","2012.42.54287","2012-10-10","Politik, FDP, Fdp, Guido-westerwelle, Wolfgang-kubicki","http://www.zeit.de/2012/42/FDP-Mallorca"
"China: Gefährliche Frauen","2012.42.54288","2012-10-10","Politik, China, China","http://www.zeit.de/2012/42/China-Politstar-Bo-Xilai"
"Vier Jahre Obama: Die coole Macht","2012.42.54289","2012-10-19","Politik, Vier Jahre Obama, Barack-obama, Us-wahlkampf, Us-wahl, Usa","http://www.zeit.de/2012/42/Obama-Bilanz"
"US-Präsident: Setzen, sechs!","2012.42.54290","2012-10-20","Politik, US-Präsident, Barack-obama, Demokraten-%28usa%29, Usa, Wahlkampf, Us-wahlkampf","http://www.zeit.de/2012/42/Obama-Professor"
"Politiker-Vorträge: Der Macht-Effekt","2012.42.54291","2012-10-21","Politik, Politiker-Vorträge, Peer-steinbrueck","http://www.zeit.de/2012/42/Redner-Vermittler"
"Putin: Durch den Weichzeichner geguckt","2012.42.54292","2012-10-21","Politik, Putin, Russland, Diplomatische-beziehungen","http://www.zeit.de/2012/42/Bundesregierung-Russland-Partnerschaft"
"Scarlett Johansson: Mein schönster Schmuck","2012.42.54293","2012-10-21","Politik, Scarlett Johansson, Scarlett-johansson, Barack-obama, Us-wahlkampf, Us-wahl","http://www.zeit.de/2012/42/USA-Wahl-Obama-Scarlett-Johansson"
"Rechtsextremismus: Union der Sprachlosen","2012.42.54294","2012-10-11","Politik, Rechtsextremismus, Rechtsextremismus, Npd, Hans-peter-friedrich, Ostdeutschland, CDU, CSU, Rechtsextremismus, Ausländerfeindlichkeit, Christine Lieberknecht, DDR, Lorenz Caffier, Mike Mohring, Tagesspiegel, Thüringen, Sachsen","http://www.zeit.de/2012/42/Rechtsextremismus-Innenminister-Friedrich"
"Energiewende: Die Stunde der Konterrevolutionäre","2012.42.54295","2012-10-11","Wirtschaft, Energiewende, Energie, Energiewirtschaft, Energiewende, Energiekosten, Erneuerbare-energien","http://www.zeit.de/2012/42/Erneuerbare-Energien-Kosten-Energiewende"
"Luftfahrt: Rousseau ist schuld","2012.42.54296","2012-10-11","Wirtschaft, Luftfahrt, Eads, Luftfahrt, Raumfahrt, Raumfahrtindustrie, Fusion","http://www.zeit.de/2012/42/EADS-BAE-Luftfahrt"
"Geld und Leben: Unterdrückung?","2012.42.54297","2012-10-11","Wirtschaft, Geld und Leben","http://www.zeit.de/2012/42/Geld-Leben-Kolumne-Sparer-Kreditnehmer"
"Nationale Sicherheit: Handys als Waffen","2012.42.54298","2012-10-11","Wirtschaft, Nationale Sicherheit, Usa, China, Telekommunikation, Sicherheitspolitik","http://www.zeit.de/2012/42/USA-China-Huawei-ZTE-Telekommunikation"
"Quengelzone: »Superkleber«","2012.42.54299","2012-10-11","Wirtschaft, Quengelzone","http://www.zeit.de/2012/42/Quengelzone-Superkleber"
"Designer Mark Rolston: Tschüs, Handy! Hallo, Lampe!","2012.42.54300","2012-10-18","Wirtschaft, Designer Mark Rolston, Design, Computer, Apple, Augmented-reality","http://www.zeit.de/2012/42/Designer-Mark-Rolston-Computer-Zukunft"
"Baden-Württemberg: Ein ganz normales Geschäft","2012.42.54301","2012-10-19","Wirtschaft, Baden-Württemberg, Stefan-mappus, Enbw, Baden-wuerttemberg, Energiewirtschaft, Unternehmen","http://www.zeit.de/2012/42/Energiekonzern-EnBW-Baden-Wuerttemberg"
"US-Wirtschaft: Der Boss und der Präsident","2012.42.54302","2012-10-20","Wirtschaft, US-Wirtschaft, Us-wirtschaft, General-electric, Barack-obama, Us-wahlkampf, Arbeitsmarkt, Arbeitslosigkeit","http://www.zeit.de/2012/42/USA-Wahl-Arbeitslosigkeit-Jeffrey-Immelt"
"Mobilfunk: Der ewige Schuldendienst","2012.42.54303","2012-10-21","Wirtschaft, Mobilfunk, Telekom, Mobilfunk, Fusion, Unternehmen","http://www.zeit.de/2012/42/Telekom-Fusion-T-Mobile-Metro-PCS"
"Hunger: Die falschen Gegner","2012.42.54304","2012-10-21","Wirtschaft, Hunger, Jean-ziegler, Hungersnot, Sachbuch, Buch, Literatur","http://www.zeit.de/2012/42/Jean-Ziegler-Wir-lassen-sie-verhungern-Rezension"
"Dirk Vogelsang: Beim Kuchen sieht er rot","2012.42.54305","2012-10-22","Wirtschaft, Dirk Vogelsang, Rechtsanwalt, Lufthansa, Luftverkehr, Luftfahrt","http://www.zeit.de/2012/42/Anwalt-Dirk-Vogelsang-Lufthansa-Luftfahrtindustrie"
"Gemeinschaftspraxen: Zieht zusammen!","2012.42.54306","2012-10-22","Wirtschaft, Gemeinschaftspraxen, Gesundheitswesen, Mediziner, Arzt","http://www.zeit.de/2012/42/Aertzehaus-Versorgungszentrum"
"ESM-Chef: Die Märkte haben versagt","2012.42.54307","2012-10-11","Wirtschaft, ESM-Chef, Esm, Rettungsschirm, Euro-zone, Euro-krise, Europäische Zentralbank, Internationaler Währungsfonds, Finanzmarkt, Griechenland, Irland, Notenbank, Spanien, Geld, Kredit, Liquidität, Märkte, Portugal, Staatsdefizit, Verfassungsgericht, Währungsunion, Asien, Madrid","http://www.zeit.de/2012/42/Klaus-Regling-Euro-Rettung-ESM"
"Korruption: Südliche Geschäfte","2012.42.54308","2012-10-11","Wirtschaft, Korruption, Korruption, Kaernten, Oesterreich, Fussball-em, Joerg-haider, Jörg Haider, Italien, Staatsanwaltschaft, Werbung, Klagenfurt, Kärnten, Mailand, Wien, Neapel, Rom","http://www.zeit.de/2012/42/Kaernten-Korruption-Haider-Fussball-EM"
"Preisentwicklung: Tobt schon die Inflation?","2012.42.54309","2012-10-18","Wirtschaft, Preisentwicklung, Inflation, Wirtschaftskrise, Euro-krise","http://www.zeit.de/2012/42/Inflation-Deutschland-Debatte"
