"title","number","date","keywords","link"
"Flutkatastrophe in Pakistan: In einem Boot mit den Taliban","2010.37.50924","2010-09-13","Politik, Flutkatastrophe in Pakistan, Taliban, Pakistan, Flutkatastrophe, Pakistan, Taliban, Gesundheitsministerium, Flutkatastrophe, Afghanistan, Flut, MIT, USA, Swat-Tal","http://www.zeit.de/2010/37/DOS-Pakistan"
"Türkei: Zentrale an Provinz: Vorwärts!","2010.37.50925","2010-09-11","Politik, Türkei, Tuerkei, Verfassung, Demokratie, Recep Tayyip Erdogan, Europäische Union, Türkei, AKP, Abdullah Gül, Ankara, Istanbul, Brüssel, Gaza","http://www.zeit.de/2010/37/Tuerkei-Verfassungsreferendum"
"Gedenktag 9/11: Die Welle","2010.37.50926","2011-07-21","Politik, Gedenktag 9/11, Usa, Islam, Moschee, Terrorismus, Barack Obama, George W.  Bush, Newt Gingrich, USA, World Trade Center, Geert Wilders, Hautfarbe, Islam, Koran, Muslim, Religion, Repräsentantenhaus, Republikaner (USA), Bangladesch, Europa, Irak, New York, Berkeley, Kalifornien, Manhattan, Washington D.C","http://www.zeit.de/2010/37/Moschee-Ground-Zero"
"Nahostkonflikt: Ein kleiner Friede ist der beste Frieden","2010.37.50927","2010-09-10","Politik, Nahostkonflikt, Nahost, Israel, Palaestina, Frieden, Frieden, Barack Obama, Europäische Union, Hamas, Hillary Clinton, UN, Ehud Barak, Apartheid, Fatah, Hoffnung, Israel, Palästinenser, Siedlungsbau, Russland, Sowjetunion, USA, Camp David, Gaza, Jerusalem, Washington D.C., Westeuropa, Westjordanland","http://www.zeit.de/2010/37/P-Oped-Stein"
"Mitbestimmung: Politiker, hört die Signale!","2010.37.50928","2010-09-10","Politik, Mitbestimmung, Deutschland, Demokratie, Mitbestimmung, CDU, CSU, Grüne, Mitbestimmung, Medien, Demokratie, Fitnessstudio, Kinderbetreuung, Kindertagesstätte, Neukölln, Stuttgart","http://www.zeit.de/2010/37/01-Politik-Mitbestimmung"
"Ungarn: Und morgen ein König","2010.37.50929","2010-09-09","Politik, Ungarn, Ungarn, Regierungschef, Viktor Orbán, Ungarn, Ministerium, Péter Esterházy, Revolution, Tafel, Verfassungsrecht, Rumänien, Serbien, Slowakei, Europa","http://www.zeit.de/2010/37/Ungarn-Premierminister-Orban"
"Mahnmal: Unter dem Giftmüll","2010.37.50930","2010-09-09","Politik, Mahnmal, Bund-der-vertriebenen, Bernd Neumann, Aufklärung, Ausstellung, Gedenkstätte, Giftmüll, Holocaust, Integration, Nationalismus, Vertreibung, Polen, Slowakei, Tschechische Republik, Berlin","http://www.zeit.de/2010/37/P-Meinungsleiter-Vertriebenenstiftung"
"Günther Beckstein: »Ich habe mir keinerlei Gefühl geleistet«","2010.37.50931","2010-09-09","Politik, Günther Beckstein, Politiker, Beckstein-guenther, Bayern, Ministerpraesident, Günther Beckstein, Finanzkrise, Ministerpräsident, Wahlkampf, Tibet, Bayern, Nürnberg, Siegen","http://www.zeit.de/2010/37/Rettung-Guenther-Beckstein"
"Terrroranschläge USA: 11. September","2010.37.50932","2010-09-09","Politik, Terrroranschläge USA, Usa, Terrorismus, Selbstmordattentaeter, Flugzeug, Barack Obama, USA, Anschlag, Islam, Jahrestag, Minderheit, Moschee, Religionsfreiheit, Virus, Afghanistan, Frankreich, Irak, USA, Atlantik, Europa, New York, Washington D.C","http://www.zeit.de/2010/37/01-Elfter-September"
"Norwegen: Der gute Riese","2010.37.50933","2010-09-14","Politik, Norwegen, Norwegen, Mineraloelindustrie, Erdoel, Boeing, Atommüll, Entsorgung, Fonds, Gold, Investmentfonds, Kinderarbeit, Norwegen, Philip Morris, Saurier, Vorsorge, Wal-Mart, USA, Oslo","http://www.zeit.de/2010/37/Erdoel-Norwegen"
"Parteien: Ganz schön weich","2010.37.50934","2010-09-12","Politik, Parteien, Cdu, Merkel-angela, Angela Merkel, Thilo Sarrazin, Wolfgang Bosbach, CDU, Edmund Stoiber, Helmut Kohl, Roland Koch, Stefan Mappus, Ursula von der Leyen, Wolfgang Schäuble, Grüne, Norbert Röttgen, Hermann Gröhe, Atomkraft, Niederlande, Tansania, Stuttgart, Europa, Rheinland-Pfalz, Norbert Röttgen","http://www.zeit.de/2010/37/CDU-Modernisierung"
"Energie: Salzige Träume","2010.37.50935","2010-09-13","Wirtschaft, Energie, Rohstoff, Bolivien, Suedamerika, Energie, Bolivien, Mitsubishi, Akku, Chile, Elektroauto, Evo Morales, Afghanistan, Japan, Saudi Arabien, La Paz","http://www.zeit.de/2010/37/Lithium-Bolivien"
"Harry Brouwer: Smart und markig","2010.37.50936","2010-09-11","Wirtschaft, Harry Brouwer, Unternehmer, Unternehmen, Handel, Unilever, Cinemaxx, Edeka, Lidl, Niederlande, Smart, Elbe, Europa, HafenCity, Rotterdam","http://www.zeit.de/2010/37/P-Brouwer"
"Peter Y. Solmssen: Rückkehr nach drei Generationen","2010.37.50937","2010-09-10","Wirtschaft, Peter Y. Solmssen, Unternehmen, Siemens, Generation, Siemens AG, General Electric, Josef Ackermann, Eisenbahnbau, SEC, Börsenaufsicht, Vorstand, Berlin, Bayern, München, Philadelphia","http://www.zeit.de/2010/37/Siemens-Vorstand-Solmssen"
"Schwarz-gelbe Koalition: Noch'n Geschenk","2010.37.50938","2010-09-10","Wirtschaft, Schwarz-gelbe Koalition, Krankenversicherung, Versicherung, Krankenkasse, Schwarz-gelbe-koalition, Merkel-angela, Angela Merkel, Tony Blair, FDP, Guido Westerwelle, Margaret Thatcher, Arzneimittel, Bundeskanzler, Krankenversicherung, Stromkonzern, Großbritannien","http://www.zeit.de/2010/37/Regierung-Klientelismus"
"Thilo Sarrazin: Fremdeln im Vorstand","2010.37.50939","2010-09-10","Wirtschaft, Thilo Sarrazin, Bank, Bundesbank, Management, Thilo Sarrazin, Christian Wulff, Axel Weber, Europäische Zentralbank, Klaus Wowereit, Vorstand, Finanzministerium, Bundespräsidialamt, Fremdenfeindlichkeit, Kanzleramt, Notenbank, Weltbank, USA, Denver, Frankfurt am Main","http://www.zeit.de/2010/37/Bundesbank-Weber-Sarrazin"
"Energiepolitik: Atom bleibt, Öko kommt vielleicht","2010.37.50940","2011-07-26","Wirtschaft, Energiepolitik, Energie, Energiepolitik, Kernenergie, Alternative_energie, Regierung, Angela Merkel, Rainer Brüderle, RWE, E.on, Energiepolitik, Norbert Röttgen, EnBW, Humboldt-Universität, Kanzleramt, Kernenergie, Kernkraftwerk, Sonnenenergie, Vattenfall, Wirtschaftsminister, Brüssel","http://www.zeit.de/2010/37/Atomenergie-Oekostrom"
"Stromkonzerne: Gut vernetzt","2010.37.50941","2010-09-08","Wirtschaft, Stromkonzerne, Energie, Energiewirtschaft, Energiepolitik, Unternehmen, Grossunternehmen, RWE, CDU, E.on, SPD, EnBW, Bundeskanzleramt, Hannelore Kraft, Norbert Röttgen, Vattenfall, Wolfgang Clement, Atomkraft, Aufsichtsrat, Bundesumweltministerium, Bundesverband der Deutschen Industrie, Energiepolitik, Energiewirtschaft, Erzeuger, Stromkonzern, Strompreis","http://www.zeit.de/2010/37/Stromkonzerne"
"Wirtschaft für Kinder: Warum gibt es bei uns Armut?","2010.37.50942","2010-09-13","Wirtschaft, Wirtschaft für Kinder, Armut, Deutschland, Kind, Musik, Arbeit, Armut, Auto, Computer, Eltern, Erwachsene, Essen, Fabrik, Familie, Geld, Kindergarten, Schule, Urlaub, IPod, China, Ostsee","http://www.zeit.de/2010/37/Kinderzeit-Armut"
"Hartz IV: Die Armen haben wenig zu verlieren","2010.37.50943","2010-09-10","Wirtschaft, Hartz IV, Armut, Hartz-iv, Familie, Arbeitslosigkeit, Ursula von der Leyen, Bundesregierung, Hartz IV, Jobcenter, Statistik, Ulrich Schneider, Verfassungsgericht, Nürnberg","http://www.zeit.de/2010/37/Interview-Schneider"
"Schwarzbuch Landwirtschaft: Reiche Ernte in der Steueroase","2010.37.50944","2010-09-14","Wirtschaft, Schwarzbuch Landwirtschaft, Agrarwirtschaft, Agrarpolitik, Oesterreich, Finanzministerium, Einkommensteuer, Grundstück, Josef Pröll, Österreich","http://www.zeit.de/2010/37/A-Landwirtschaft"
"Singapur: Nicht so von Wahlen abgelenkt","2010.37.50945","2010-09-10","Wirtschaft, Singapur, Suedostasien, Wirtschaft, Demokratie, Deng Xiaoping, China, Privatinsolvenz, Singapur, Europa, Jakarta, London, New York, Tokio","http://www.zeit.de/2010/37/Singapur-Wirtschaft"
"Rohstoffpreise: Verspekuliert","2010.37.50946","2010-09-09","Wirtschaft, Rohstoffpreise, Rohstoff, Finanzmarkt, Boersenspekulation, Angela Merkel, Ilse Aigner, Nicolas Sarkozy, Vereinte Nationen, Christine Lagarde, Dürre, Entwicklungshilfe, Frankreich, Klimawandel, Michel Barnier, Russland, Sonnenenergie, Weltbank, Brasilien, Elfenbeinküste, Kolumbien, Mosambik, Pakistan, Afrika, Asien","http://www.zeit.de/2010/37/Regulierung-Rohstoffpreise"
"Bankenregulierung: Showdown in Basel","2010.37.50947","2010-09-08","Wirtschaft, Bankenregulierung, Bank, Finanzmarkt, Finanzpolitik, Finanzkrise, Bundesbank, Europäische Union, Wolfgang Schäuble, Axel Weber, BaFin, G-20-Gipfel, Jochen Sanio, Kredit, Japan, Spanien, USA, Basel, Europa","http://www.zeit.de/2010/37/F-Bankenregulierung"
