"title","number","date","keywords","link"
"Pakt mit dem Teufel |","1991.19.2249","1991-05-03","DIE ZEIT, , Saddam Hussein, Bundesregierung, PKK, Alliierte, Autonomie, Berg, Bundesaußenminister, Dschalal Talabani, Flüchtling, Hauptstadt, Opposition, Soldat, Streitkräfte, Vereinte Nationen, MIT, Regierung, Bagdad, Kurdistan","http://www.zeit.de/1991/19/pakt-mit-dem-teufel"
"Vor der Wahl zum Frankfurter Oberbürgermeister: Die nächste Kurve auf der Achterbahn |","1991.19.2250","1991-05-03","DIE ZEIT, Vor der Wahl zum Frankfurter Oberbürgermeister, Volker Hauff, Wahl, FDP, SPD, Oberbürgermeister, CDU, Grüne, Innenministerium, Bundestag, Vorstandswahl, Bonn, Hamburg, Rheinland-Pfalz","http://www.zeit.de/1991/19/die-naechste-kurve-auf-der-achterbahn"
"Schwierige Einheit an der Spree: Durchmischen, was zusammen gehört |","1991.19.2251","1991-05-03","DIE ZEIT, Schwierige Einheit an der Spree, Eberhard Diepgen, Spree, Christine Bergmann, DDR, Ditmar Staffelt, Feuerwehr, PDS, Werner Schulz, Sowjetunion, Bayern, Brandenburg, Dortmund, Ostberlin","http://www.zeit.de/1991/19/durchmischen-was-zusammen-gehoert"
"Nachlese: Reform der Bayern-SPD: Ein Gesamtkunstwerk? |","1991.19.2252","1991-05-03","DIE ZEIT, Nachlese: Reform der Bayern-SPD, SPD, Renate Schmidt, Demokratie, Franken, Märchen, Reform, Widerstand","http://www.zeit.de/1991/19/ein-gesamtkunstwerk"
"Mit Wasserpistolen und Trillerpfeifen: Ein neuer Start im Rückwärtsgang |","1991.19.2253","1991-05-03","DIE ZEIT, Mit Wasserpistolen und Trillerpfeifen, Grüne, Antje Vollmer, Ludger Volmer, Werner Schulz, Bundesversammlung, DDR, Jutta Ditfurth, Parteitag, Wolfgang Ullmann, MIT, Neumünster, Brandenburg, Sachsen, Wiesbaden","http://www.zeit.de/1991/19/ein-neuer-start-im-rueckwaertsgang"
"Weltbühne: „Modell Südtirol“ |","1991.19.2254","1991-05-03","DIE ZEIT, Weltbühne, Friedensnobelpreis, Italien, Justiz, Luis Durnwalder, Volksparteien, Jugoslawien, Kroatien, Litauen, Bozen, Balkan, Baltikum, Europa, Osteuropa, Rom, Südtirol, Tirol","http://www.zeit.de/1991/19/modell-suedtirol"
"Ein Ausweg für die Sowjetunion?: Gemeinsam gegen die Krise |","1991.19.2255","1991-05-03","DIE ZEIT, Ein Ausweg für die Sowjetunion?, Michail Gorbatschow, Boris Jelzin, Allianz, Sowjetunion, Streik, Verfassung, Armenien, Georgien, Moldawien, Russland, Ukraine, Moskau, Osteuropa","http://www.zeit.de/1991/19/gemeinsam-gegen-die-krise"
"Worte der Woche |","1991.19.2256","1991-05-03","DIE ZEIT, , Helmut Kohl, Grüne, CDU, CSU, FDP, Michail Gorbatschow, Saddam Hussein, Wolfgang Schäuble, Björn Engholm, Heiner Geißler, Armenier, Bundestagspräsident, Bundesversammlung, Dschalal Talabani, Gerhard Zwerenz, Golfkrieg, Jutta Ditfurth, Koalitionsverhandlung, Lech Wa??sa, Max Streibl, Siedlungspolitik, Susanne Albrecht, Tarik Asis, Irak, Kurdistan, Kuwait","http://www.zeit.de/1991/19/worte-der-woche"
"Bonner Bühne: Schlummernder Sprengsatz |","1991.19.2257","1991-05-03","DIE ZEIT, Bonner Bühne, Bühne, ARD, CDU, Konrad Weiß, ZDF, Gregor Gysi, Uwe Barschel, Berichterstattung, Bundestag, DDR, Medienpolitik, PDS, Revolution, Rupert Scholz, Sprengsatz, Stilkritik, Bonn","http://www.zeit.de/1991/19/schlummernder-sprengsatz"
"Welche Rolle war dem obersten Devisenjongleur der SED nach dem Ende des Honecker-Regimes zugedacht? Egon Krenz hatte Großes mit ihm vor. Doch die Kräfte um Hans Modrow versuchten, ihn als Blitzableiter für den Volkszorn zu benutzen. Aus den Koffern des Alexander Schalck-Golodkowski – Teil III und Schluß.: Vom Retter zum Sündenbock |","1991.19.2258","1991-05-03","DIE ZEIT, Welche Rolle war dem obersten Devisenjongleur der SED nach dem Ende des Honecker-Regimes zugedacht? Egon Krenz hatte Großes mit ihm vor. Doch die Kräfte um Hans Modrow versuchten, ihn als Blitzableiter für den Volkszorn zu benutzen. Aus den Koffern des Alexander Schalck-Golodkowski – Teil III und Schluß., Hans Modrow, Alexander Schalck-Golodkowski, Egon Krenz, SED, Günter Mittag, Günter Schabowski, Markus Wolf, DDR, Stasi, Bundesrepublik Deutschland, MIT, Bonn, Moskau","http://www.zeit.de/1991/19/vom-retter-zum-suendenbock"
"Wolfgang Ebert: Tatort Wahlzelle |","1991.19.2259","1991-05-03","DIE ZEIT, Wolfgang Ebert, CDU, FDP, SPD, CSU, Tatort, Drohung, Ermittlung, Landespolitik, Liebe, Verbrechen, Wahlkampf, Wolfgang Ebert, Mainz, Rheinland-Pfalz","http://www.zeit.de/1991/19/tatort-wahlzelle"
"Zeitspiegel |","1991.19.2260","1991-05-03","DIE ZEIT, , Artensterben, Krankenversicherung, Australien, Costa Rica, Polen, Europa, Heidelberg","http://www.zeit.de/1991/19/zeitspiegel"
"Die Weltorganisation nach dem Golfkrieg: Die Gunst der Stunde nutzen |","1991.19.2261","1991-05-03","DIE ZEIT, Die Weltorganisation nach dem Golfkrieg, George W.  Bush, Saddam Hussein, Sicherheitsrat, UN-Sicherheitsrat, Eduard Schewardnadse, Javier Pérez de Cuéllar, Vereinte Nationen, Bronis?aw Geremek, Golfkrieg, Irak, Japan, USA, Kuwait, New York","http://www.zeit.de/1991/19/die-gunst-der-stunde-nutzen"
"KOLUMNE: Was die anderen von den Deutschen erwarten |","1991.19.2262","1991-05-03","DIE ZEIT, KOLUMNE, Hans-Dietrich Genscher, Helmut Kohl, James Baker, Antje Vollmer, Außenminister, Außenpolitik, Bundestag, Bundeswehr, Bundeswehreinsatz, DDR, Europäische Gemeinschaft, Frankreich, Golfkrieg, Großbritannien, Horst Teltschik, Währungspolitik, Bundesrepublik Deutschland, Israel, Sowjetunion, Berlin, Bonn, Europa, Moskau","http://www.zeit.de/1991/19/was-die-anderen-von-den-deutschen-erwarten"
"Autoseller: Rekorde im März |","1991.19.2263","1991-05-03","DIE ZEIT, Autoseller, Bundesländer, Auto, Statistik","http://www.zeit.de/1991/19/rekorde-im-maerz"
"Die Vereinigten Staaten drängten die Deutschen, die Zinsen zu senken. Mehr Inflation wäre die Folge.: Erfolgreich gewehrt |","1991.19.2264","1991-05-03","DIE ZEIT, Die Vereinigten Staaten drängten die Deutschen, die Zinsen zu senken. Mehr Inflation wäre die Folge., George W.  Bush, Bundesregierung, Inflation, Internationaler Währungsfonds, Entwicklungsland, Geldpolitik, Golfkrieg, Konsum, Privathaushalt, Rezession, Sparquote, Weltbank, Japan, Zinsen, Bonn, Osteuropa, Washington D.C","http://www.zeit.de/1991/19/erfolgreich-gewehrt"
"ZEIT/Südprojekt-Prognose: Feuerwerk der Phantasie |","1991.19.2265","1991-05-03","DIE ZEIT, ZEIT/Südprojekt-Prognose, Dax, Dresdner Bank, Ford, Chrysler, Aktie, DDR, Konjunktur, Ostdeutschland, Rezession, Sowjetunion, Sparquote, Feuerwerk, USA","http://www.zeit.de/1991/19/feuerwerk-der-phantasie"
"Multikulturell |","1991.19.2266","1991-05-03","DIE ZEIT, , Armut, Bildung, Droge, Gewalt, Hautfarbe, Jugendliche, Schüler, Student, Mexiko, Puerto Rico, USA, Los Angeles, Mississippi, New York","http://www.zeit.de/1991/19/multikulturell"
"Zum 1. Mai: Arbeit – was ist das? |","1991.19.2267","1991-05-03","DIE ZEIT, Zum 1. Mai, Arbeit, Norbert Blüm, Johann Wolfgang von Goethe, Karl Marx, Edzard Reuter, Hannah Arendt, Preussag, Ralf Dahrendorf, Reinhard Mohn","http://www.zeit.de/1991/19/arbeit-was-ist-das"
"Bonner Kulisse |","1991.19.2268","1991-05-03","DIE ZEIT, , Michael Glos, Theo Waigel, Bundesregierung, Wolfgang Roth, Bundeskabinett, Finanzministerium, Rita Süssmuth, Bundesanleihe, Bundeshaushalt, Bundesschatzbrief, Bundestag, Bundestagspräsident, Vermögensteuer, Berlin","http://www.zeit.de/1991/19/bonner-kulisse"
"Atomindustrie: Nichts als Hoffnung |","1991.19.2269","1991-05-03","DIE ZEIT, Atomindustrie, Klaus Töpfer, Siemens AG, Sowjetunion, Atomindustrie, Bulgarien, Bundesverband der Deutschen Industrie, DDR, Hoffnung, Kernkraftwerk, Ungarn, Greifswald, Osteuropa, Stendal, Tschernobyl, Wien","http://www.zeit.de/1991/19/nichts-als-hoffnung"
"Markt-Report: Vergebliche Anläufe |","1991.19.2270","1991-05-03","DIE ZEIT, Markt-Report, Dax, Dresdner Bank, Aktie, Aktienindex, Aktienmarkt, Dollar, Finanzminister, Geld, Handel, Hoffnung, Unternehmen","http://www.zeit.de/1991/19/vergebliche-anlaeufe"
"Wilfried Herz:: Mehr geben – aber mit Verstand |","1991.19.2271","1991-05-03","DIE ZEIT, Wilfried Herz:, Theo Waigel, Helmut Kohl, Horst Köhler, Bundesregierung, Willy Brandt, Entwicklungsland, Golfkrieg, Lateinamerika, Vereinte Nationen, MIT, Sowjetunion, Asien, Bonn, London","http://www.zeit.de/1991/19/mehr-geben-aber-mit-verstand"
"Folgenschweres Doppelleben |","1991.19.2272","1991-05-03","DIE ZEIT, , Henkel, Carl Zeiss, Philip Morris, DDR, Rotkäppchen, München, Bielefeld, Dresden, Düsseldorf, Ostberlin, Thüringen, Wiesbaden","http://www.zeit.de/1991/19/folgenschweres-doppelleben"
"Preiswert, sicher und rentabel |","1991.19.2273","1991-05-03","DIE ZEIT, , Theo Waigel, Bundesbank, Anleihe, Bundesanleihe, Staatsanleihe, Bundesrepublik Deutschland","http://www.zeit.de/1991/19/preiswert-sicher-und-rentabel"
"Eine ZEIT-Serie.: Johnny kann nicht lesen |","1991.19.2274","1991-05-03","DIE ZEIT, Eine ZEIT-Serie., George W.  Bush, USA, Abschlusszeugnis, Bandenkriminalität, Drogenbesitz, Golfkrieg, Harvard University, Lehrer, Minnesota, Schule, Irak, Japan, Lesen, Mississippi, Kentucky, Ohio, Washington D.C","http://www.zeit.de/1991/19/johnny-kann-nicht-lesen"
"Ostdeutschland: Krause, der Temposünder |","1991.19.2275","1991-05-03","DIE ZEIT, Ostdeutschland, Günther Krause, Ostdeutschland, DDR, Bonn, Berlin, Bielefeld, Ostfriesland","http://www.zeit.de/1991/19/krause-der-temposuender"
"Wirtschaftspolitik: „Da tickt eine Zeitbombe“ |","1991.19.2276","1991-05-03","DIE ZEIT, Wirtschaftspolitik, Wirtschaftspolitik, Herbert Henzler, Bundesregierung, Theo Waigel, DDR, Industrie, Langzeitarbeitslosigkeit, Ostdeutschland, Produktivität, Japan, Kanada, USA, Berlin, Bonn, Dresden, Leipzig, Osteuropa, Rostock, Südostasien","http://www.zeit.de/1991/19/da-tickt-eine-zeitbombe"
