"title","number","date","keywords","link"
"Moskaus Weg zur Marktwirtschaft – ein Tagebuch: Ein Ritt über dünnes Eis |","1992.3.3358","1992-01-10","DIE ZEIT, Moskaus Weg zur Marktwirtschaft – ein Tagebuch, Innenministerium, Moskau, Tagebuch, Feiertag, Rubel, Russland, Sowjetunion, Moskau, Jekaterinburg, Kolkata","http://www.zeit.de/1992/03/ein-ritt-ueber-duennes-eis"
"KOLUMNE: Prioritäten setzen |","1992.3.3359","1992-01-10","DIE ZEIT, KOLUMNE, Medien, Atomwaffe, Horst Teltschik, Mohammed, Ostdeutschland, Waffenstillstand, Algerien, Bulgarien, El Salvador, Jugoslawien, Kambodscha, Pakistan, Polen, Rumänien, Türkei, Ungarn, Afrika, Asien, Kirgisistan","http://www.zeit.de/1992/03/prioritaeten-setzen"
"Rückblick: Bürgerkrieg in Somalia: Diadochenkampf |","1992.3.3360","1992-01-10","DIE ZEIT, Rückblick: Bürgerkrieg in Somalia, Bürgerkrieg, Somalia, Asche, Chef, Diplomat, Estland, Gebäude, Hauptstadt, Hilfsorganisation, Hoffnung, Krankenhaus, Siad Barre, Vereinte Nationen, Kroatien, USA, Europa, Mogadischu","http://www.zeit.de/1992/03/diadochenkampf"
"Worte der Woche |","1992.3.3361","1992-01-10","DIE ZEIT, , Jürgen Möllemann, Hans-Dietrich Genscher, Otto Schily, Bundesaußenminister, Bundeswirtschaftsminister, Bärbel Bohley, Chaos, Europäische Gemeinschaft, Günter Schabowski, Javier Pérez de Cuéllar, Nuklearwaffe, Rainer Eppelmann, Vereinte Nationen, Vizepräsident, Wolfgang Berghofer, Europa","http://www.zeit.de/1992/03/worte-der-woche"
"Kandidat für die Lambsdorff-Nachfolge: Ein Profi ohne kalte Schnauze |","1992.3.3362","1992-01-10","DIE ZEIT, Kandidat für die Lambsdorff-Nachfolge, Hans-Dietrich Genscher, Klaus Kinkel, FDP, CSU, RAF, Alice Schwarzer, Bundesnachrichtendienst, Jürgen Möllemann, Thomas Dehler, Irmgard Schwaetzer, Kinderpornografie, Pflegeversicherung, Rote-Armee-Fraktion, Staatssekretär, Ulrich Wickert, Stuttgart, Bonn","http://www.zeit.de/1992/03/ein-profi-ohne-kalte-schnauze"
"Die Gauck-Behörde öffnet ihr Archiv: Blick in den Abgrund des Verrats |","1992.3.3363","1992-01-10","DIE ZEIT, Die Gauck-Behörde öffnet ihr Archiv, Ibrahim Böhme, Archiv, Günter Schabowski, Wolf Biermann, Bärbel Bohley, Christian Wernicke, DDR, Stasi, Berlin, Leipzig, Ost-Berlin","http://www.zeit.de/1992/03/blick-in-den-abgrund-des-verrats"
"Die Vereinten Nationen als Makler: Ein Sieg ohne Gewinner |","1992.3.3364","1992-01-10","DIE ZEIT, Die Vereinten Nationen als Makler, Javier Pérez de Cuéllar, Vereinte Nationen, El Salvador, Fidel Castro, Horst Bieber, Katholische Kirche, Guerilla, Konflikt, Waffenstillstand, Angola, Jugoslawien, Kambodscha, Kolumbien, Kuba, Nicaragua, Sowjetunion, Venezuela, Europa, Mexiko-Stadt, Mittelamerika, Washington D.C","http://www.zeit.de/1992/03/ein-sieg-ohne-gewinner"
"Skandalöse Disziplinarmaßnahme in der Bundeswehr: Die verlorene Ehre des Major Prieß |","1992.3.3365","1992-01-10","DIE ZEIT, Skandalöse Disziplinarmaßnahme in der Bundeswehr, Gerhard Stoltenberg, Bundeswehr, CDU, CSU, Gericht, Soldat, Volksverhetzung, Koblenz, Köln, Westeuropa","http://www.zeit.de/1992/03/die-verlorene-ehre-des-major-priess"
"Bonner Bühne: Jahresfischfrühstück |","1992.3.3366","1992-01-10","DIE ZEIT, Bonner Bühne, Hans-Dietrich Genscher, Klaus Kinkel, Bühne, Thomas Dehler, FDP, Auswärtiges Amt, Außenpolitik, Botschaft, Frühstück, Jahresrückblick, Justizminister, Postmoderne, Jugoslawien, Russland, Sowjetunion, USA, Bonn, Washington D.C","http://www.zeit.de/1992/03/jahresfischfruehstueck"
"Weltbühne: Hendl statt Bundesadler? |","1992.3.3367","1992-01-10","DIE ZEIT, Weltbühne, Robert Jungk, ÖVP, Franz Vranitzky, Heinz Fischer, Kommunismus, Republik, Staatssymbol, Österreich, Waterloo","http://www.zeit.de/1992/03/hendl-statt-bundesadler"
"Nachlese: George Bush in Seoul: Frieden in Korea? |","1992.3.3368","1992-01-10","DIE ZEIT, Nachlese: George Bush in Seoul, George W.  Bush, Frieden, Roh Tae Woo, Reise, Seoul, DDR, Gespräch, Hauptstadt, Südkorea, USA, Asien, Osteuropa, Pjöngjang, Wien","http://www.zeit.de/1992/03/frieden-in-korea"
"Vermittlung auf dem Balkan: Friedensstifter in Schwierigkeiten |","1992.3.3369","1992-01-10","DIE ZEIT, Vermittlung auf dem Balkan, Cyrus Vance, Balkan, Jimmy Carter, Michail Gorbatschow, Vereinte Nationen, Detroit, Europäische Gemeinschaft, Jugoslawien, Panama, Serbien, USA, Camp David, Paris, Santo Domingo, Teheran, Washington D.C., West Virginia","http://www.zeit.de/1992/03/friedensstifter-in-schwierigkeiten"
"Heinz-Günter Kemmer:: Der schädliche Überfluß |","1992.3.3370","1992-01-10","DIE ZEIT, Heinz-Günter Kemmer:, Saddam Hussein, Benzin, Benzinverbrauch, Irak, Mineralölsteuer, Shell AG, Swing, Tempolimit, Iran, Saudi Arabien, Sowjetunion, Venezuela, Kuwait","http://www.zeit.de/1992/03/der-schaedliche-ueberfluss"
"Einkommensverteilung: Was uns reich macht |","1992.3.3371","1992-01-10","DIE ZEIT, Einkommensverteilung, Meinhard Miegel, Mentalität, Region, Europa, Fulda, Osteuropa, Paderborn, Pirmasens, Schweinfurt, Siegen, Traunstein, Uelzen, Vechta","http://www.zeit.de/1992/03/was-uns-reich-macht"
"Transrapid: Verlockend |","1992.3.3372","1992-01-10","DIE ZEIT, Transrapid, Günther Krause, DDR, Gehalt, Geld, Verkehr, Verkehrsminister, Werftindustrie, Widerstand, Transrapid, Berlin, Hamburg, Spree","http://www.zeit.de/1992/03/verlockend"
"Börsenspiel: Durch Stehvermögen an die Spitze |","1992.3.3373","1992-01-10","DIE ZEIT, Börsenspiel, Schweiz, USA, Zürich","http://www.zeit.de/1992/03/durch-stehvermoegen-an-die-spitze"
"Bonner Kulisse |","1992.3.3374","1992-01-10","DIE ZEIT, , Theo Waigel, Carl-Dieter Spranger, Friedrich Zimmermann, CDU, Franz Josef Strauß, Innenministerium, Alfred Dregger, Sowjetunion, Paris, Peking","http://www.zeit.de/1992/03/bonner-kulisse"
"Markt-Report: Banger Blick nach Westen |","1992.3.3375","1992-01-10","DIE ZEIT, Markt-Report, Bundesbank, Dax, Aktie, Aktienindex, Aktienmarkt, Anleihe, Bundesanleihe, Börse, Fonds, Versicherung, Wunder","http://www.zeit.de/1992/03/banger-blick-nach-westen"
"Atommülldeponie: Gorleben – und kein Ende |","1992.3.3376","1992-01-10","DIE ZEIT, Atommülldeponie, Gerhard Schröder, Grüne, Gorleben, Monika Griefahn, Müll, Territorium, Umweltminister, Hannover, Niedersachsen","http://www.zeit.de/1992/03/gorleben-ein-kein-ende"
"Sachsen: Die Kraft der alten Stärke |","1992.3.3377","1992-01-10","DIE ZEIT, Sachsen, Sachsen, Audi, IG Metall, Siemens AG, Chemnitz, USA, Zwickau","http://www.zeit.de/1992/03/die-kraft-der-alten-staerke"
"Waffenexporte: Peinlich |","1992.3.3378","1992-01-10","DIE ZEIT, Waffenexporte, Hans-Dietrich Genscher, Außenminister, Bundesrat, Bundestag, Export, Golfkrieg, Opposition, Regierung, Richter, Staatsanwaltschaft, Zoll","http://www.zeit.de/1992/03/peinlich"
"Landwirtschaft: Europa ist der größte Sünder |","1992.3.3379","1992-01-10","DIE ZEIT, Landwirtschaft, George W.  Bush, Europa, Landwirtschaft, OECD, Australien, Dollar, Europäische Gemeinschaft, USA, Finnland, Japan, Neuseeland, Norwegen, Schweden, Schweiz, Österreich, Washington D.C., Brüssel, Nordamerika, Paris","http://www.zeit.de/1992/03/europa-ist-der-groesste-suender"
