"title","number","date","keywords","link"
"Revolution im O-Ton |","1991.36.2759","1991-08-30","DIE ZEIT, , Boris Jelzin, Revolution, BBC, Michail Gorbatschow, Sowjetunion, Berichterstattung, Putsch, Radio, Sender, Russland, Zypern, München, Kiew, Krim, Moskau, Schwarzes Meer, Washington D.C","http://www.zeit.de/1991/36/revolution-im-o-ton"
"Furcht vor dem Chaos |","1991.36.2760","1991-08-30","DIE ZEIT, , George W.  Bush, Boris Jelzin, Dick Cheney, Chaos, Hungersnot, Nuklearwaffe, Präsident, USA, Wirtschaftshilfe, Russland, Sowjetunion, Ukraine, Weißrussland, Washington D.C., Europa, Moskau","http://www.zeit.de/1991/36/furch-vor-dem-chaos"
"Schlechte Arbeitsbedingungen, bürokratische Hemmnisse, hochmotivierte Studenten: Hans Apel, der frühere Bundesminister, berichtet über seine Erfahrungen an der Universität Rostock: Lehren aus der Fremde |","1991.36.2761","1991-08-30","DIE ZEIT, Schlechte Arbeitsbedingungen, bürokratische Hemmnisse, hochmotivierte Studenten: Hans Apel, der frühere Bundesminister, berichtet über seine Erfahrungen an der Universität Rostock, Universität, Rostock, Hans Apel, Bundestag, Europäische Gemeinschaft, Finanzpolitik, Gemeindefinanzen, Student, Universität Rostock, Bundesrepublik Deutschland, Tschechoslowakei, Bonn, Hamburg, Sibirien, Warnemünde","http://www.zeit.de/1991/36/lehren-aus-der-fremde"
"KOLUMNE: Rechte Radikale im Osten |","1991.36.2762","1991-08-30","DIE ZEIT, KOLUMNE, Richard Schröder, FDJ, SPD-Fraktion, Ausländerfeindlichkeit, DDR, Gastarbeiter, Ideologie, Judenverfolgung, Jugendarbeitslosigkeit, Nationalsozialismus, Rechtsradikalismus, Stasi, Volkskammer, Israel, Mosambik, Sowjetunion, USA, Vietnam","http://www.zeit.de/1991/36/rechte-radikale-im-ost"
"Deutsche Lieder |","1991.36.2763","1991-08-30","DIE ZEIT, , Helmut Kohl, Heinrich Hoffmann, Briefwechsel, Bundestag, Jahrestag, Nationalhymne, Richard Freiherr von Weizsäcker, Bundesrepublik Deutschland, Berlin, Erfurt, Helgoland, Rhein","http://www.zeit.de/1991/36/deutsche-lieder"
"Der Kreis schließt sich |","1991.36.2764","1991-08-30","DIE ZEIT, , Michail Gorbatschow, Boris Jelzin, Putsch, Leningrad, Russland, Saale, St. Petersburg, Tallinn","http://www.zeit.de/1991/36/der-kreis-schliesst-sich"
"„Herr, vergib ihnen nicht!“ |","1991.36.2765","1991-08-30","DIE ZEIT, , Vytautas Landsbergis, George W.  Bush, Hans-Dietrich Genscher, Estland, Hitler-Stalin-Pakt, Kommunistische Partei, Litauen, Putsch, Wladimir Iljitsch Lenin, Dänemark, Lettland, Norwegen, Vilnius, Bonn, Moskau, Oslo","http://www.zeit.de/1991/36/herr-vergib-ihnen-nicht"
"Affäre Schalck-Golodkowski: Das Kanzleramt als Kontaktbüro |","1991.36.2766","1991-08-30","DIE ZEIT, Affäre Schalck-Golodkowski, Lothar de Maizière, Alexander Schalck-Golodkowski, Kanzleramt, Wolfgang Schäuble, Bundesnachrichtendienst, Uwe Barschel, DDR, Geheimdienst, Untersuchungsausschuss, Sowjetunion, Pullach, Berlin, Bonn","http://www.zeit.de/1991/36/das-kanzleramt-als-kontaktbuero"
"Jugoslawien ohne Schlichter: Offenen Auges in den Abgrund |","1991.36.2767","1991-08-30","DIE ZEIT, Jugoslawien ohne Schlichter, Jugoslawien, Franjo Tudjman, Josip Broz Tito, Slobodan Miloševic, Kroatien, Serbien, Ibrahim Rugova, Minderheit, Zagreb, Belgrad","http://www.zeit.de/1991/36/offenen-auges-in-den-abgrund"
"Worte der Woche |","1991.36.2768","1991-08-30","DIE ZEIT, , Michail Gorbatschow, George W.  Bush, Margaret Thatcher, Boris Jelzin, Volker Rühe, Alexander Jakowlew, Bischof, Brian Mulroney, Bundesverkehrsminister, Diözese, Premierminister, Präsident, Putsch, Sowjetunion, Vytautas Landsbergis, Wirtschaftshilfe, Kroatien, Leningrad, Peking","http://www.zeit.de/1991/36/worte-der-woche"
"Weltbühne: Mittler mit Mut |","1991.36.2769","1991-08-30","DIE ZEIT, Weltbühne, John Major, George W.  Bush, Margaret Thatcher, Boris Jelzin, Außenminister, Golfkrieg, Neil Kinnock, Regierungschef, MIT, Sowjetunion, Bonn, London, Moskau, Paris, Toskana, Washington D.C","http://www.zeit.de/1991/36/mittler-mit-mut"
"Stimmen zur ZEIT |","1991.36.2770","1991-08-30","DIE ZEIT, , George W.  Bush, Helmut Kohl, Michail Gorbatschow, Wolf Biermann, Erbe, Fluss, Freimut Duve, Putsch, Redakteur, Stern, Tageszeitung, Virus, Krim, Moskau","http://www.zeit.de/1991/36/stimmen-zur-zeit"
"Zum Tode von Oswald von Nell-Breuning: Über Orden und Kirche hinaus |","1991.36.2771","1991-08-30","DIE ZEIT, Zum Tode von Oswald von Nell-Breuning, Kirche, CDU, Helmut Schmidt, Norbert Blüm, SPD, Katholische Kirche, Bildung, Eigentum, Gleichstellung, Humboldt-Universität, Johannes Paul II., Kirchensteuer, Papst, Reichsbahn, Rentenversicherung, Japan, USA, Berlin, Westeuropa","http://www.zeit.de/1991/36/ueber-orden-und-kirche-hinaus"
"Rückblick: Krieg in der Westsahara: Die Macht des Monarchen |","1991.36.2772","1991-08-30","DIE ZEIT, Rückblick: Krieg in der Westsahara, Krieg, Blauhelm, Javier Pérez de Cuéllar, Rundfunk, Territorium, Vereinte Nationen, Verwaltung, Volksabstimmung, Waffenstillstand, Wüste, Algerien, Marokko, Spanien, Wasser, Westsahara, Brunnen, Rabat, Sahara","http://www.zeit.de/1991/36/die-macht-des-monarchen"
"Björn Engholms hundert Tage als Vorsitzender der SPD sind vorüber. Schon werden die ersten Fragen nach der Macht und Kraft des neuen Hoffnungsträgers der Sozialdemokraten gestellt: Die Sache mit der Faust |","1991.36.2773","1991-08-30","DIE ZEIT, Björn Engholms hundert Tage als Vorsitzender der SPD sind vorüber. Schon werden die ersten Fragen nach der Macht und Kraft des neuen Hoffnungsträgers der Sozialdemokraten gestellt, Gerhard Schröder, Oskar Lafontaine, Björn Engholm, Hans-Jochen Vogel, SPD, Ingrid Matthäus-Maier, Uwe Barschel, Bundesrat, Bundestagsfraktion, Mehrwertsteuer, Politbarometer, MIT, Russland, Schweden, Bonn, Schleswig-Holstein, Europa, Kiel, Saarland","http://www.zeit.de/1991/36/die-sache-mit-der-faust"
"Vom Kämpfer zum Staatsmann |","1991.36.2774","1991-08-30","DIE ZEIT, , Michail Gorbatschow, Boris Jelzin, Plenum, Putsch, Russland, Europa, Moskau, Straßburg, Ural","http://www.zeit.de/1991/36/vom-kaempfer-zum-staatsmann"
"Kurzportrait: Cornelia Schmalz-Jacobsen: Die Sprache finden |","1991.36.2775","1991-08-30","DIE ZEIT, Kurzportrait: Cornelia Schmalz-Jacobsen, Sprache, Bundesregierung, Cornelia Schmalz-Jacobsen, Dax, FDP, Familie, Klischee, Liselotte Funcke, Nachfolge, Parteitag, Halle an der Saale","http://www.zeit.de/1991/36/die-sprache-finden"
"Zum Tode von Oswald von Nell-Breuning: Ein großer Kämpfer der leisen Töne |","1991.36.2776","1991-08-30","DIE ZEIT, Zum Tode von Oswald von Nell-Breuning, Helmut Schmidt, Askese, Gedächtnis, Paul VI., Sokrates, Vatikan, Italien, Rom","http://www.zeit.de/1991/36/ein-grosser-kaempfer-der-leisen-toene"
"Herrhausen gab Kontra |","1991.36.2777","1991-08-30","DIE ZEIT, , Edzard Reuter, Alfred Herrhausen, Hans Otto Eglau, Boeing, MBB, Otto Graf Lambsdorff, Aufsichtsrat, Fusion, Helmut Haussmann, Kartellamt, Bonn, München, Ottobrunn","http://www.zeit.de/1991/36/herrhausen-gab-kontra"
"Reichsbahn: Abfahrt |","1991.36.2778","1991-08-30","DIE ZEIT, Reichsbahn, Recht, Bahn, Fusion, Produktivität, Reichsbahn","http://www.zeit.de/1991/36/abfahrt"
"Geschäfte per Dekret |","1991.36.2779","1991-08-30","DIE ZEIT, , Helmut Kohl, François Mitterrand, Philips, Grundig AG, Industrie, Thomson, Brüssel, Europa, Berlin","http://www.zeit.de/1991/36/geschaefte-per-dekret"
"Wieder ein Rekord |","1991.36.2780","1991-08-30","DIE ZEIT, , Rekord, VW, Opel, Audi, Auto, Bestseller, Golf, Herbst, Polo","http://www.zeit.de/1991/36/wieder-ein-rekord"
"Rudolf Engen: Jobs für Pöhl |","1991.36.2781","1991-08-30","DIE ZEIT, Rudolf Engen, Karl Otto Pöhl, Bundesbank, SPD, EMMA, Wirtschaftspolitik, Angeln, Bertelsmann AG, Briefmarke, Cowboy, Familie, Gehalt, Golf, Europa","http://www.zeit.de/1991/36/jobs-fuer-poehl"
"Mark-Report: Jeder Crash ist anders |","1991.36.2782","1991-08-30","DIE ZEIT, Mark-Report, Dresdner Bank, Aktie, Dividende, Hoffnung, Kapitalmarkt, Konjunktur, Konjunkturentwicklung, Putsch, Rendite, Strom, Wunder, Irak, Sowjetunion, Kuwait, Moskau","http://www.zeit.de/1991/36/jeder-crash-ist-anders"
"Benzinpreise: Eigentor |","1991.36.2783","1991-08-30","DIE ZEIT, Benzinpreise, Benzin, Benzinpreis, Diesel, Eigentor, Putsch, Wirtschaftsordnung, Benzinpreis, Sowjetunion, Moskau, Rotterdam","http://www.zeit.de/1991/36/eigentor"
"Salomon-Skandal: Kartell der Schuldenmakler |","1991.36.2784","1991-08-30","DIE ZEIT, Salomon-Skandal, Finanzministerium, Morgan Stanley, Anleihe, tTokyo, Warren Buffett, Weltbank, New York, Wisconsin","http://www.zeit.de/1991/36/kartell-der-schuldenmakler"
"Krise in der Sowjetunion: Einst Rüstungszar und jetzt Reformer |","1991.36.2785","1991-08-30","DIE ZEIT, Krise in der Sowjetunion, Michail Gorbatschow, Sowjetunion, Boris Jelzin, Börse, Grigori Jawlinski, Juri Andropow, KGB, Privatisierung, Putsch, Statistisches Bundesamt","http://www.zeit.de/1991/36/einst-ruestungszar-und-jetzt-reformer"
"Wilfried Herz:: Verdrängte Wahrheiten |","1991.36.2786","1991-08-30","DIE ZEIT, Wilfried Herz:, Theo Waigel, Bundesregierung, Bundesanstalt für Arbeit, Bundeskabinett, Jürgen Möllemann, Auswärtiges Amt, Bundestag, DDR, Finanzminister, Finanzpolitik, Jochen Steffen, Körperschaftsteuer, Pflegeversicherung, Volkswirtschaft, Sowjetunion, Berlin, Jakarta","http://www.zeit.de/1991/36/verdraengte-wahrheiten"
"Bank und Börse: Tanz auf dünnem Eis |","1991.36.2787","1991-08-30","DIE ZEIT, Bank und Börse, Bank, Börse, Bundesbank, Tanzen, Theo Waigel, Berliner Bank, Dresdner Bank, Aktie, Aktienmarkt, Japan, Jugoslawien, Sowjetunion, Kuwait, Moskau","http://www.zeit.de/1991/36/tanz-auf-duennem-eis"
