"title","number","date","keywords","link"
NA,"1995.48.10291","1995-11-24","Politik, , Helmut Schmidt, Oskar Lafontaine, SPD, Willy Brandt, CDU, Hans-Jochen Vogel, Wolfgang Schäuble, Rudolf Scharping, Theo Sommer, Christa Müller, Die Linke, Klischee, Presserecht, Republik, Europa, Mannheim","http://www.zeit.de/1995/48/Der_richtige_Mann_zur_rechten_Zeit"
NA,"1995.48.10292","1995-11-24","Politik, , Bosnien, UN-Sicherheitsrat, Bosnien und Herzegowina, Blauhelm, Jugoslawien, Kroatien, Serbien, Serbien und Montenegro, Slowenien, Balkan, Sarajevo, Srebrenica, Südosteuropa","http://www.zeit.de/1995/48/Der_Erfolg_der_Realpolitik"
NA,"1995.48.10293","1995-11-24","Politik, , Fernsehen, Herz, Hut","http://www.zeit.de/1995/48/Hoheit"
NA,"1995.48.10294","1995-11-24","Politik, , Johannes Rau, Rudolf Scharping, Oskar Lafontaine, Georg Leber, Hans-Jochen Vogel, SPD, Alte, Enkel, Hans-Jürgen Wischnewski, Putsch, Schmerz, Mannheim, Bonn, Düsseldorf","http://www.zeit.de/1995/48/Die_Alten_weinten"
NA,"1995.48.10295","1995-11-24","Politik, , Oskar Lafontaine, SPD, CDU, Stephan Hilsberg, Thomas Krüger, Sozialpolitik, Harald Ringstorff, Junge Union, Linkspartei, Manfred Püchel, PDS, Mecklenburg-Vorpommern, Berlin, Niederrhein, Sachsen","http://www.zeit.de/1995/48/Hoffnungen_auf_eine_linke_Mehrheit"
NA,"1995.48.10296","1995-11-24","Politik, , Recht, Fiat, Bundesgerichtshof, DDR, Justiz, Karriere, Mord, Richter, Tod","http://www.zeit.de/1995/48/Gebeugtes_Recht"
NA,"1995.48.10297","1995-11-24","Politik, , Boris Jelzin, Richard Holbrooke, Flughafen, Jubiläum, Nachrichtensendung, Verfassung, Vietcong, Bosnien und Herzegowina, Bulgarien, Russland, USA, Vietnam, Donau","http://www.zeit.de/1995/48/Zeitspiegel"
NA,"1995.48.10298","1995-11-24","Politik, , Oskar Lafontaine, CDU, Grüne, Helmut Kohl, SPD, Rudolf Scharping, Bundestagswahl, Die Linke, Drohung, Mannheimer, PDS, Parteitag, Resolution, Großbritannien, Bonn, Mannheim","http://www.zeit.de/1995/48/Von_Tony_Blair_noch_weit_entfernt"
NA,"1995.48.10299","1995-11-24","Politik, , Natur, MIT, Filmfestival, Tierschutz, Freiburg, Festival, Saale","http://www.zeit.de/1995/48/Filmisches_Menetekel_Unser_Mitarbeiter_in_Deutschlands_Oeko-Hauptstadt_moechte"
NA,"1995.48.10300","1995-11-24","Politik, , Aleksander Kwasniewski, Lech Wa??sa, Arbeitslose, Jugendliche, Kommunismus, Polen, Verwaltung, Wahl, Debatte, Demokratie, Parlament","http://www.zeit.de/1995/48/Angst_vor_Machtmissbrauch"
NA,"1995.48.10301","1995-11-24","Politik, , Europäische Union, Otto Graf Lambsdorff, Telekommunikation, WTO, Arbeitslosigkeit, Auslandsinvestition, Europäische Währungsunion, Finanzmarkt, Globalisierung, Innovation, Mobilität, Pflegeversicherung, Rationalisierung, Rendite, Steuer, Unternehmensbesteuerung, Bonn","http://www.zeit.de/1995/48/Die_goldenen_vierzig_Jahre_sind_vorbei"
NA,"1995.48.10302","1995-11-24","Politik, , Schmerz, Ausstellung, Gebäude, Gedenkstätte, Gefängnis, Geheimdienst, Körper, Opfer, Schicksal, Stasi, Widerstand, Dresden, Potsdam","http://www.zeit.de/1995/48/Schmerz_und_Leid"
NA,"1995.48.10303","1995-11-24","Politik, , Regierung, Sozialismus, Jawaharlal Nehru, Deutsche Bank, Indien, Siemens AG, ASEAN, Benetton, China, Motorola, Pakistan, Sowjetunion, Bangladesch, Niederlande, Russland, USA, Asien, Bangalore, Kentucky","http://www.zeit.de/1995/48/Der_Abschied_vom_Spinnrad_Die_indische_Version_des"
NA,"1995.48.10304","1995-11-24","Politik, , Chauvinismus, Literatur, Diktatur, Kino, Kirche, Minderheit, Parlament, Ratifizierung, Sprache, Ungarn, Bonn, Bratislava, New York, Wien","http://www.zeit.de/1995/48/Chauvinismus_per_Gesetz"
NA,"1995.48.10305","1995-11-24","Politik, , Oskar Lafontaine, Franz Josef Strauß, SPD, Willy Brandt, Johannes Rau, Grüne, Joschka Fischer, Gregor Gysi, Aufrüstung, Integration, Mannheimer, PDS, Postmoderne","http://www.zeit.de/1995/48/Grosse_Rolle"
NA,"1995.48.10306","1995-11-24","Politik, , Herbert Wehner, SPD, Willy Brandt, Franz Josef Strauß, Gerhard Schröder, Joschka Fischer, Fritz Erler, Martin Luther, Vereinte Nationen, Bundestagsfraktion, Jusos, Opposition, Parteiprogramm, Solidarität, Bonn, Hannover, München, Saarbrücken","http://www.zeit.de/1995/48/Eine_ungehaltene_Rede_an_die_SPD"
NA,"1995.48.10307","1995-11-24","Politik, , Sarajewo, Bill Clinton, Recht, Bosnien und Herzegowina, Fest, Krieg, Marlboro, Requiem, Streitkräfte, Territorium, Volkszählung, Bosnien und Herzegowina, Sarajevo","http://www.zeit.de/1995/48/Requiem_fuer_Bosnien"
NA,"1995.48.10308","1995-11-24","Politik, , Frieden, Bosnien und Herzegowina, Bosnien und Herzegowina, Friedenstruppe, Krieg, Waffenruhe, Weltsicherheitsrat, USA, Jugoslawien, Kroatien, Serbien, Sarajevo, Europa, Washington D.C., Zagreb","http://www.zeit.de/1995/48/Noch_steht_alles_auf_Papier"
NA,"1995.48.10309","1995-11-24","Politik, , Jassir Arafat, Lea Rabin, Schimon Peres, Hamas, PLO, West Bank, Arbeitsbeschaffungsmaßnahme, Attentat, Gazastreifen, Mord, Palästinenser, Volksparteien, Israel, Sudan, USA, Europa, Gaza, Gaza-Stadt, Kairo, Paris","http://www.zeit.de/1995/48/Den_Frieden_im_Alltag_erkaempfen"
NA,"1995.48.10310","1995-11-24","Politik, , Marion Gräfin Dönhoff, Ralf Dahrendorf, Aldous Huxley, CO2, Friedrich-Ebert-Stiftung, George Orwell, Hans-Ludwig Zachert, Korruption, Norm, Rechtsstaat, Wolfgang Schaupensteiner, Berlin, Frankfurt am Main","http://www.zeit.de/1995/48/Gier_nach_Beute"
NA,"1995.48.10311","1995-11-24","Politik, , Polen, Aleksander Kwasniewski, Bill Clinton, Lech Walesa, Pierre Cardin, Polen, Wirtschaftskriminalität, Warschau","http://www.zeit.de/1995/48/Moses_der_polnischen_Linken"
NA,"1995.48.10312","1995-11-24","Politik, , Vhb_Prozess, Hans Filbinger, Alliierte, Jutta Limbach, Prozess, Richter, Schule, Schüler, Unterricht, Nürnberg","http://www.zeit.de/1995/48/Schon_ziemlich_lange_her"
NA,"1995.48.10313","1995-11-24","Politik, , Nato, SPD, Alltag, Außenpolitik, Bundesverfassungsgericht, Bundeswehr, Bundeswehrsoldat, Frieden, Golfkrieg, Gründung, Soldat, Test, Verteidigungsminister, Völkermord, Bosnien und Herzegowina, Jugoslawien, Balkan, Adria, Mannheim, Sarajevo","http://www.zeit.de/1995/48/Schritte_in_die_Gefahr"
NA,"1995.48.10314","1995-11-24","Politik, , Musik, Ass, Kino, Single, Wiedervereinigung","http://www.zeit.de/1995/48/Yeah_yeah_"
NA,"1995.48.10315","1995-11-24","Politik, , Jacques Delors, Claude Lévi-Strauss, DG Bank, Islam, Japan, Kulturpolitik, Weltbank, Wolf Lepenies, China, Europa, Frankreich, Indien, Jugoslawien, Malaysia, Taiwan, Ägypten, Asien, Berlin","http://www.zeit.de/1995/48/Das_Ende_der_Ueberheblichkeit"
NA,"1995.48.10316","1995-11-24","Politik, , Preis, Jassir Arafat, Frieden, Jizchak Rabin, Widerstand, Baden-Baden, Bonn, Hamburg, Stuttgart","http://www.zeit.de/1995/48/Deutschen_Medienpreis_'95"
NA,"1995.48.10317","1995-11-24","Politik, , Gregor Gysi, Oskar Lafontaine, SPD, Grüne, Oskar Lafontaine, PDS, Gespräch, Wahl, Ostberlin, Thüringen","http://www.zeit.de/1995/48/In_der_Bredouille"
NA,"1995.48.10318","1995-11-24","Politik, , Oskar Lafontaine, Slobodan Miloševic , Bill Clinton, Ken Saro-Wiwa, SPD, Lech Walesa, Rudolf Scharping, Shell AG, Aleksander Kwasniewski, Alija Izetbegovic, Bischofskonferenz, Frieden, Präsident, Schmerz, Tanzen, USA, Bosnien und Herzegowina, China, Kroatien, Nigeria, Serbien","http://www.zeit.de/1995/48/Worte_de_Woche"
NA,"1995.48.10319","1995-11-24","Politik, , Bevölkerung, Militär, Algerien, Bürgerkrieg, Demokratisierung, Reform, Wahl","http://www.zeit.de/1995/48/Die_Zukunft_vertagt"
NA,"1995.48.10320","1995-11-24","Politik, , Willy Brandt, Egon Bahr, Oskar Lafontaine, SPD, CDU, Erich Honecker, SED, Willi Stoph, DDR, Gespräch, Berlin, Bonn, Erfurt, Kassel, Ost-Berlin","http://www.zeit.de/1995/48/Wie_der_Osten_es_sah"
NA,"1995.48.10321","1995-11-24","Politik, , CDU, Edmund Stoiber, FDP, Oskar Lafontaine, Michael Glos, Oskar Lafontaine, SPD, Lech Walesa, Alexander Kwasniewski, Drama, Johannes Gerster, Justizminister, Parteitag, Präsident, Sommer, Wahl, Polen, Mannheim, Saarland","http://www.zeit.de/1995/48/Basis_Nicht_gefragt"
NA,"1995.48.10322","1995-11-24","Politik, , Gespräch, Schriftsteller, Tagesspiegel, Berlin, West-Berlin","http://www.zeit.de/1995/48/Abschottung"
NA,"1995.48.10323","1995-11-24","Politik, , Bewerbung, Club of Rome, Forschung, Großunternehmen, ICE, Industrie, Physik, Technologie, Umweltschaden, Umweltschutz","http://www.zeit.de/1995/48/Gibt_es_hier_fuer_Physiker_nichts_zu_tun"
NA,"1995.48.10324","1995-11-24","Politik, , Willy Brandt, Erich Honecker, SPD, Willi Stoph, Egon Bahr, Walter Ulbricht, Bundeskanzler, Bundestag, Bundestagswahl, Denkmal, Friedensnobelpreis, Gespräch, Misstrauensvotum, Vertrag, Viermächteabkommen, Sowjetunion, Berlin, Erfurt, Kassel, Ost-Berlin","http://www.zeit.de/1995/48/Daten_der_Deutschlandpolitik"
NA,"1995.48.10325","1995-11-24","Politik, , Bill Clinton, USA, Frieden, Harry S. Truman, Kasachstan, Präsident, Richard Holbrooke, Thomas Jefferson, Haiti, Iran, Kanada, Türkei, Ukraine, Europa, Balkan, Washington D.C","http://www.zeit.de/1995/48/Die_Weltmacht_zwingt_zum_Friedensschwur"
NA,"1995.48.10326","1995-11-24","Politik, , Soldat, Bill Clinton, CDU, Nato, Wolfgang Schäuble, Bosnien und Herzegowina, Frieden, Logistik, Newt Gingrich, Präsident, Präsidentschaft, Repräsentantenhaus, Republikaner (USA), Soldat, USA, Balkan, Ohio, Washington D.C","http://www.zeit.de/1995/48/Clintons_zweite_Front"
NA,"1995.48.10327","1995-11-24","Politik, , China, Sony, Dorf, Mao Zedong, USA, Hongkong, Niederlande, Peking","http://www.zeit.de/1995/48/Der_Traum_vom_Reichtum"
NA,"1995.48.10328","1899-12-31","Dossier","http://www.zeit.de/1995/48/Club_MC¸d_ohne_Animateur"
NA,"1995.48.10329","1995-11-24","Dossier, , Europa, Frankreich, Marokko, Spanien, Droge, Gibraltar, Haschisch, Nordafrika, Barcelona, Drogen, Rabat, Brüssel, Madrid, Tanger","http://www.zeit.de/1995/48/Der_grosse_Graben_Ueber_die_Strasse_von_Gibraltar"
NA,"1995.48.10330","1995-11-24","Dossier, , Brüssel, Europäische Union, Mittelmeer, Agrarprodukt, Auslandsinvestition, Demokratisierung, Freihandelszone, Nordafrika, Region, Zoll, Israel, Jordanien, Libyen, Malta, Marokko, Russland, Tunesien, Türkei, USA, Zypern, Ägypten, Barcelona, Cannes, Europa, Madrid, Osteuropa, Paris","http://www.zeit.de/1995/48/Schwenk_zum_Mittelmeer"
NA,"1995.48.10331","1995-11-24","Wirtschaft, , Bundesregierung, Europäische Währungsunion, Finanzpolitik, Geldpolitik, Opposition, Otto, Stabilitätspakt, Umfrage, Unternehmen, Volkswirtschaft, Echo, Europa","http://www.zeit.de/1995/48/Sonntagsreden_ohne_Echo"
NA,"1995.48.10332","1995-11-24","Wirtschaft, , Bundesanstalt für Arbeit, Siemens AG, Bundesverband der Deutschen Industrie, Maschinenbau, Outsourcing, Stellenabbau, USA, Osteuropa, Südostasien","http://www.zeit.de/1995/48/Nach_dem_Kehraus"
NA,"1995.48.10333","1995-11-24","Wirtschaft, , Dow Jones, Aktie, Wahl, Wirtschaftskrise, Krieg, Mexiko, Kuwait, Washington D.C","http://www.zeit.de/1995/48/Irrtum"
NA,"1995.48.10334","1995-11-24","Wirtschaft, , AT&amp;T, Aldi, General Electric, Großhandel, Tageszeitung, Unternehmen, Wal-Mart","http://www.zeit.de/1995/48/Rezepte_fuer_Sieger"
NA,"1995.48.10335","1995-11-24","Wirtschaft, , Norbert Blüm, Martin Luther, Bischof, Evangelische Kirche, Geld, Glaube, Protestantismus, Seele, Sozialversicherung, Steuer, Ökosteuer, Geschichte, Oder","http://www.zeit.de/1995/48/Rache"
NA,"1995.48.10336","1995-11-24","Wirtschaft, , Alain Juppé, Jacques Barrot, Jacques Chirac, Gesundheitswesen, Kulturrevolution, Sozialversicherung, Steuer, Wohnungsbau, Frankreich, Waterloo","http://www.zeit.de/1995/48/Der_Blitzableiter"
NA,"1995.48.10337","1995-11-24","Wirtschaft, , Helmut Kohl, Bundesregierung, Günter Rexrodt, Heinrich Weiss, Horst Teltschik, Mark Wössner, Siemens AG, China, WTO, Unternehmen, Vietnam, Indien, Asien, Singapur","http://www.zeit.de/1995/48/Lektionen_in_Sachen_Marktwirtschaft"
NA,"1995.48.10338","1995-11-24","Wirtschaft, , Commerzbank, Dax, Dow Jones, Absatz, Aktie, Aktienfonds, Aktienindex, Börse, Hoffnung, Investmentgesellschaft, Merck, Venezuela","http://www.zeit.de/1995/48/Anleger_gesucht"
NA,"1995.48.10339","1995-11-24","Wirtschaft, , Manager, Hilmar Kopper, Börse, Adam Opel AG, Betriebsklima, Vorruhestand, Italien, Darmstadt, London, Rom","http://www.zeit.de/1995/48/Opel_Absolution_vom_Staatsanwalt_ENI_Koloss_fuer_die"
NA,"1995.48.10340","1995-11-24","Wirtschaft, , Handel, Solidaritätszuschlag, Einzelhandel","http://www.zeit.de/1995/48/Stures_Feilschen"
NA,"1995.48.10341","1995-11-24","Wirtschaft, , Oskar Lafontaine, Bundesbank, Rudolf Scharping, Bundestag, DDR, Wechselkurs, Währung, Europa, Mannheim","http://www.zeit.de/1995/48/Wendig_modern_und_vage"
NA,"1995.48.10342","1995-11-24","Wirtschaft, , Dünger, Jochen Borchert, Angela Merkel, CDU, Bundesrat, Deutscher Bundestag, Schweden, Österreich, Umweltschutz, Bayern","http://www.zeit.de/1995/48/Zuviel_des_Guten"
NA,"1995.48.10343","1995-11-24","Wirtschaft, , Jacques Chirac, Jean-Marie Le Pen, Alain Juppé, Concorde, Frankreich, Robin Hood, Großbritannien, USA, Bordeaux, Paris","http://www.zeit.de/1995/48/Der_Kampf_der_Kleinbuerger"
NA,"1995.48.10344","1995-11-24","Wirtschaft, , Brasilien, Siemens AG, Bundesverband der Deutschen Industrie, Direktinvestition, Lateinamerika, Ostasien, Bundesrepublik Deutschland, São Paulo, Asien, Brüssel, Buenos Aires, Europa, Fernost, Lima, Mexiko-Stadt","http://www.zeit.de/1995/48/Aufbruch_nach_Brasilien"
NA,"1995.48.10345","1995-11-24","Wirtschaft, , Birgit Breuel, Hans Tietmeyer, Henkel, Ernst-Wolfgang Böckenförde, Jürgen Weber, Karl Lehmann, Ostdeutschland, Ulrich Wickert, Köln","http://www.zeit.de/1995/48/Es_gibt_noch_Helden"
NA,"1995.48.10346","1995-11-24","Wirtschaft, , Jürgen Schrempp, DDR, Dasa, Fokker, Gewinn, Manfred Bischoff, Umsatz, Verlust, Vorstand, Dresden, Stuttgart","http://www.zeit.de/1995/48/Strikt_auf_Sparkurs"
NA,"1995.48.10347","1995-11-24","Wirtschaft, , Norbert Blüm, Arbeitgeber, Arbeitslosenversicherung, Arbeitsminister, Berufsausbildung, Einkommen, Erwerbsunfähigkeit, Haushalt, Ifo-Institut, Ladenschluss, Ostdeutschland, Privathaushalt, Rente","http://www.zeit.de/1995/48/Sicherheit_fuer_alle"
NA,"1995.48.10348","1995-11-24","Wirtschaft, , FDP, Günter Rexrodt, Wirtschaftsministerium, Ausbildung, Baufinanzierung, Debeka, Finanzdienstleister, Ostdeutschland, Verbraucherschutz, Berlin, Europa, Fürstenfeldbruck, Niedersachsen","http://www.zeit.de/1995/48/Druecker_unter_Druck"
NA,"1995.48.10349","1995-11-24","Wirtschaft, , Coca-Cola, Fernsehen, Hollywood, Produktion, Wunder, Frankreich, Brüssel, Europa, Paris","http://www.zeit.de/1995/48/Flop"
NA,"1995.48.10350","1995-11-24","Wirtschaft, , Ausbildung, Bafög, Bildung, Geschichte, Lehrer, Student","http://www.zeit.de/1995/48/Wende"
NA,"1995.48.10351","1995-11-24","Wirtschaft, , FDP, Bundesanstalt für Arbeit, IG Metall, Arzneimittel, Bevölkerungsentwicklung, Dasa, Gesundheitsreform, Krankenhaus, Krankenkasse, Krankenversicherung, Kur, Mediziner, USA, Hamburg","http://www.zeit.de/1995/48/Von_allen_Seiten_Widerstand"
NA,"1995.48.10352","1995-11-24","Wirtschaft, , Norbert Blüm, Barbara Stolterfoht, DGB, SPD, Statistisches Bundesamt, Arbeitgeber, Arbeitsminister, Einzelhandel, Gastronomie, Ladenschluss, Rente, Schwarzarbeit, Sozialversicherung, Hessen","http://www.zeit.de/1995/48/Alternative_Schwarzarbeit"
NA,"1995.48.10353","1995-11-24","Wirtschaft, , Hans Mayer, John Maynard Keynes, Wien, Österreich, Glasgow, Wien, Basel","http://www.zeit.de/1995/48/Der_Pluralist"
NA,"1995.48.10354","1995-11-24","Wirtschaft, , Bundesregierung, Einkommen, Geld, Staatsquote, Steuer, Wiedervereinigung, Wirtschaftswachstum","http://www.zeit.de/1995/48/Die_Staatsquote"
NA,"1995.48.10355","1995-11-24","Wirtschaft, , Airbus, Boeing, McDonnell Douglas, Airline, Allianz, Dasa, Dollar, Fusion, General Electric, John Leahy, Pentagon, Spanien, Seattle, Toulouse, Washington D.C","http://www.zeit.de/1995/48/Ein_Riese_will_aufruesten"
NA,"1995.48.10356","1995-11-24","Wirtschaft, , Entwicklungsland, Forum, Freihandelszone, Hauptstadt, Konflikt, Regierungschef, Region, USA, China, Indonesien, Japan, Kanada, Neuseeland, Regierung, Manila, Osaka, Seattle","http://www.zeit.de/1995/48/Durchbruch_fuer_die_Pazifikregion"
NA,"1995.48.10357","1995-11-24","Wirtschaft, , Konrad Schily, CDU, Johannes Rau, Privathochschulen, Walther Leisler Kiep, Ausbildung, Franchising, Gebühr, Präsident, Student, Volkswagen AG, WestLB, Nordrhein-Westfalen","http://www.zeit.de/1995/48/Die_Kunst_des_Bettelns"
NA,"1995.48.10358","1995-11-24","Wirtschaft, , Verbraucher, Ausländer, AGB, Bundesgerichtshof, Bundesgerichtshof, Sparkasse, Universität Bremen, England, Frankreich, Großbritannien, Berlin","http://www.zeit.de/1995/48/Ohne_Durchblick"
NA,"1995.48.10359","1995-11-24","Wirtschaft, , Bonner Finanzministerium, Volker Rühe, Drohung, Finanzminister, Rüstung, Verteidigungsminister","http://www.zeit.de/1995/48/Bonner_Kulisse"
NA,"1995.48.10360","1995-11-24","Wirtschaft, , Bill Gates, Microsoft, Adam Smith, Cebit, Computer, Computernetz, Online-Dienst, USA, Atlanta, Hamburg, Hannover","http://www.zeit.de/1995/48/Visionen_eines_Milliardaers"
NA,"1995.48.10361","1995-11-24","Wirtschaft, , Angela Merkel, Gerhard Schröder, Thomas Goppel, Atommüll, Endlager, Niedersachsen, Bonn, Sachsen-Anhalt, Bayern, Gorleben, Sachsen","http://www.zeit.de/1995/48/Schwarzer_Peter"
NA,"1995.48.10362","1995-11-24","Wirtschaft, , Theo Waigel, DSL, Immobilienbesitz, Vermarktung, Treuhandanstalt, Bonn, Baden-Württemberg","http://www.zeit.de/1995/48/Land_im_Ausverkauf"
NA,"1995.48.10363","1995-11-24","Wirtschaft, , Zuwanderung, Europäische Union, Wirtschaftsministerium, Arbeitslosigkeit, Arbeitsmarkt, Osteuropa","http://www.zeit.de/1995/48/Wohlstand_durch_Fremde"
NA,"1995.48.10364","1995-11-24","Wirtschaft, , Gerhard Schröder, Wolfgang Mayrhuber, Roland Berger, DDR, Dasa, Sozialplan, Wirtschaftsministerium, Europa, Niedersachsen, Südostasien","http://www.zeit.de/1995/48/Start_auf_holpriger_Piste"
NA,"1995.48.10365","1995-11-24","Wirtschaft, , EMMA, Bundestag, Autofahrer, Bravo, Kommunikation, USA","http://www.zeit.de/1995/48/Knopf_im_Ohr"
