"title","number","date","keywords","link"
"Union: Christlich-demokratische Verunsicherung","2004.52.33442","2004-12-16","Politik, Union, Partei, Religion, Sozialstaat, Arbeit, Terrorismus, Staatsorgane, Staat, Rassismus, Parlament, Opposition, Islam, Partei, Religion, Sozialstaat, Arbeit und Sozialstaat, Terrorismus, Staatsorgane, Staat, Rassismus, Parlament, Opposition, Angela Merkel, Friedrich Merz, CDU, J√ºrgen R√ºttgers, SPD, Wolfgang Sch√§uble, Annette Schavan, CSU, Georg Milbradt, Gr√ºne, Guido Westerwelle, Nicolas Sarkozy, Autoaggression, Christoph B√∂hr, Gesundheitspr√§mie, Glaube, Neoliberalismus, Parteitag, Patriotismus, Religion, Bayern, Mecklenburg-Vorpommern, Nordrhein-Westfalen, Rheinland-Pfalz, Sachsen","http://www.zeit.de/2004/52/Opposition"
"Terrorismus: Ein Gehirn in zwei K√∂pfen","2004.52.33443","2004-12-16","Politik, Terrorismus, Verfassungsschutz, Verfassung, Verbrechensbekaempfung, Terrorismus, Staat, Polizei, Kriminalitaet, Innere_sicherheit, Innenpolitik, Kontra, Gehirn, Terrorismus, Otto Schily, Anschlag, Beh√∂rde, Bundesinnenministerium, Geheimdienst, Grundst√ºck, Information, Innenminister, Polizei, Student, Berlin, Madrid, New York, Verfassungsschutz, Verfassung, Verbrechensbek√§mpfung, Terrorismus, Staat, Polizei, Kriminalit√§t, Innere Sicherheit, Innenpolitik","http://www.zeit.de/2004/52/Terrorzentrum"
"gro√übritannien: Wenn es Regeln hagelt","2004.52.33444","2004-12-16","Politik, gro√übritannien, Kriminalitaet, Auslaenderpolitik, Auslaender, Regierung, Recht, Populismus, Linke, Einwanderungspolitik, Asylpolitik, Gro√übritannien, Tony Blair, John Maynard Keynes, David Blunkett, Fettleibigkeit, John Reid, Schule, USA, Europa, London, Kriminalit√§t, Ausl√§nderpolitik, Ausl√§nder, Regierung, Recht, Populismus, Linke, Einwanderungspolitik","http://www.zeit.de/2004/52/BlairsInnenpolitik"
"rechtsradikale: Glatze mit Scheitel","2004.52.33445","2004-12-16","Politik, rechtsradikale, NPD, Steffen Hupka, Udo Voigt, DVU, Landtag, Bundeswehr, MIT, Bayern, Dresden, M√ºnchen, Sachsen, Vorpommern","http://www.zeit.de/2004/52/voigt_kurz"
"Niemand will wirklich verzichten","2004.52.33446","2004-12-16","Politik, , F√∂deralismus, Bundesregierung, Edmund Stoiber, Bundesrat, Bundestag, Reform, Vermittlungsausschuss","http://www.zeit.de/2004/52/Niemand_will_wirklich_verzichten"
"kommentar: So schnell vergeht der Ruhm der Welt‚Ä¶","2004.52.33447","2004-11-11","Politik, kommentar, Angela Merkel, Laurenz Meyer, Bundestagspr√§sident, Einkommen, Euro, Papst, Parlament, Ritus, Umfrage, Geld, Oder","http://www.zeit.de/2004/52/laurenzm"
"Iran: Atome der Macht","2004.52.33448","2004-12-16","Politik, Iran, Atomwaffe, Staat, Bevoelkerung, Internationale_Beziehungen, Gesellschaft_und_soziales_Leben, Gesellschaft, Aussenpolitik, Krieg, Golfkrieg, Iran, Saddam Hussein, Mohammed Chatami, Ali Akbar Salehi, Kernbrennstoff, US-Au√üenpolitik, USA, Afghanistan, Irak, Israel, Russland, Teheran, Europa, Br√ºssel, Osteuropa, Washington D.C., Atomwaffe, Staat, Bev√∂lkerung, Internationale Beziehungen, Gesellschaft und soziales Leben, Gesellschaft, Au√üenpolitik, Krieg","http://www.zeit.de/2004/52/Iran_Atom"
"Hilfe unerw√ºnscht","2004.52.33449","2004-12-16","Politik, , Muslim, Nicolas Sarkozy, Dominique de Villepin, Innenministerium, Frankreich, Islam, Moschee, Theo van Gogh, Algerien, Paris","http://www.zeit.de/2004/52/Hilfe_unerwuenscht"
"WORTE DER WOCHE","2004.52.33450","2004-12-16","Politik, , CDU, CSU, Europ√§ische Union, Gerhard Schr√∂der, NPD, Wladimir Putin, Donald Rumsfeld, Amnestie, Diskriminierung, Fahrzeug, Finanzminister, Landtag, Pr√§sidentschaftskandidat, Terrorismus, Verteidigungsminister, Viktor Juschtschenko, Russland, Sowjetunion, T√ºrkei, Ukraine, Bayern, Sachsen-Anhalt","http://www.zeit.de/2004/52/WORTE_DER_WOCHE"
"Altersdiskriminierung: Mit 70 hat man noch Tr√§ume","2004.52.33451","2004-12-16","Politik, Altersdiskriminierung, Wirtschaft_und_Konjunktur, Wirtschaft, Werbung_und_Marketing, Werbung, Sozialverhalten, Gesellschaft_und_soziales_Leben, Gesellschaft, Generation, Familie_und_Partnerschaft, Diskriminierung, Arbeitsmarkt, Alte, Altersversorgung, Antidiskriminierungsgesetz, Bewerbung, Diskriminierung, Einkommen, Krankenversicherung, Mobbing, Pr√§vention, Sozialstaat, Universit√§t Bremen, Weiterbildung, MIT, Wirtschaft und Konjunktur, Wirtschaft, Werbung und Marketing, Werbung, Sozialverhalten, Gesellschaft und soziales Leben, Gesellschaft, Generation, Familie und Partnerschaft, Diskriminierung","http://www.zeit.de/2004/52/01___leit_1_52_2f04"
"Wettbewerb der Sch√§bigkeit","2004.52.33452","2004-12-16","Politik, , Strafvollzug, Recht, Bundesrat, Bundestag, Entlassung, Gef√§ngnis, Justizsenator, Resozialisierung, R√§uber, Sanktion, Strafe, Straftat, Russland, Arizona","http://www.zeit.de/2004/52/Wettbewerb_der_Schaebigkeit"
"kommentar: Germanischer Charakter","2004.52.33453","2004-11-11","Politik, kommentar, Charakter, George W.  Bush, Margaret Thatcher, Medien, Drogenhandel, Einwanderung, Missbrauch, Mittelschicht, Personalausweis, Sozialstaat, Terrorismus, Unterhaus, Wohlfahrtsstaat, Debatte, Demokratie, Gro√übritannien, USA, Verlust, Wahlkampf","http://www.zeit.de/2004/52/gbidcard"
"Uno: Mit Kampfeslust und tausend Tricks","2004.52.33454","2004-12-16","Politik, Uno, Mitglieder, Diskussionen, Reform, Internationale_Beziehungen, Aussenpolitik, Diplomatie, Krieg, Dienstreise, Verhandlung, Vhb_Weltwirtschaft, Kofi Annan, Bundesregierung, George W.  Bush, Gunter Pleuger, Sicherheitsrat, UN-Sicherheitsrat, Vereinte Nationen, China, Frankreich, Diplomat, Gro√übritannien, Irak, Irak-Krieg, Japan, Kanzleramt, UN, MIT, New York, Berlin, Peking, Mitglieder, Diskussionen, Reform, Internationale Beziehungen, Au√üenpolitik, Diplomatie, Krieg, Dienstreise, Verhandlung","http://www.zeit.de/2004/52/UN-Reformdebatte"
"Haus ohne H√ºter","2004.52.33455","2004-12-16","Politik, , Marianne Birthler, Otto Schily, Christina Weiss, SPD, Bundesbeauftragter f√ºr Stasi-Unterlagen, Beh√∂rde, B√ºndnisgr√ºne, DDR, Gedenkst√§tte, Kultusministerium, Stasi, Volkskammer, Werner Schulz, Berlin, Leipzig","http://www.zeit.de/2004/52/Haus_ohne_Hueter"
"EU-Beitritt: Pack den Tiger in die EU","2004.52.33456","2004-12-16","Politik, EU-Beitritt, Staat, Religion, Islam, Demokratie, Religion, Internationale_Beziehungen, Europapolitik, Aussenpolitik, Reform, Kultur, CDU, CSU, Europ√§ische Union, EU-Beitritt, T√ºrkei, Agrarmarkt, Diaspora, Ankara, Europa, Irak, Iran, Portugal, Ukraine, Br√ºssel, Siegen, Teheran, Westeuropa, Staat, Religion, Islam, Demokratie, Religion, Internationale Beziehungen, Europapolitik, Au√üenpolitik, Reform","http://www.zeit.de/2004/52/01___leit_2_52_2f04"
"EU-Beitritt: Auf dem Gipfel der Verzagten","2004.52.33457","2004-12-16","Politik, EU-Beitritt, Staat, Religion, Islam, Demokratie, Religion, Verhandlung, Reform, Kultur, Internationale_Beziehungen, Europapolitik, Staat, Religion, Islam, Demokratie, Religion, Verhandlung, Reform, Kultur, Internationale Beziehungen, Europ√§ische Union, Joschka Fischer, Nicolas Sarkozy, T√ºrkei, Angela Merkel, Binnenmarkt, Estland, Michel Barnier, Partnerschaft, Frankreich, Polen, Schweden, Slowenien, Ungarn, Zypern, √ñsterreich, Ankara, Br√ºssel, Helsinki","http://www.zeit.de/2004/52/Partnerschaft"
"Integration: Raus aus der Glaubensfalle!","2004.52.33458","2004-12-16","Politik, Integration, Religion, Staat, Bevoelkerung, Islam, Christentum, Werte, Religion, Gesellschaft_und_soziales_Leben, Gesellschaft, Demokratie, S√§kularisierung, Religion, Staat, Bev√∂lkerung, Islam, Christentum, Werte, Religion, Gesellschaft und soziales Leben, Gesellschaft, Demokratie, Ayaan Hirsi Ali, Antwerpen, Gewalt, Islam, Koran, Migration, Mill√Æ G√∂r√ºs, Minderheit, Religion, Religionsfreiheit, Scharia, Niederlande, Marokko, Niederlande, Pakistan, √Ñgypten, Amsterdam, Europa, Beslan, Istanbul, Madrid, Westeuropa","http://www.zeit.de/2004/52/Integration"
"Patriotismus - Argwohn - Ausgezeichnet","2004.52.33459","2004-12-16","Politik, , Geert Wilders, Peter Costello, Award, Ayaan Hirsi Ali, Geburt, Islam, Mord, Patriotismus, Studiengang, Theo van Gogh, Umfrage, Urknall, Australien, Canberra, Schwaben","http://www.zeit.de/2004/52/Patriotismus_-_Argwohn_-_Ausgezeichnet"
"Vorsicht, Spannung!","2004.52.33460","2004-12-16","Politik, , Nomos, Arbeitgeber, Arbeitsvertrag, Aufsichtsrat, Bundestagspr√§sident, Datenschutz, Di√§t, Einkommen, Einkommensteuer, Kapitalgesellschaft, Laurenz Meyer, Rechtsanwalt, Strom, VEW, Verm√∂gen","http://www.zeit.de/2004/52/Vorsicht_Spannung_"
"Russland: Die Unzertrennlichen","2004.52.33461","2004-12-16","Politik, Russland, Terrorismus, Innere_sicherheit, Innenpolitik, Verh√§ltnis, Wirtschaft_und_Konjunktur, Wirtschaft, Vhb_Zeitgeschichte, Tschetschenien, Russe, Portrait, Vhb_Erdgas, Terrorismus, Innere Sicherheit, Innenpolitik, Verh√§ltnis, Wirtschaft und Konjunktur, Wirtschaft, Zeitgeschichte, Tschetschenien, Russe, Portrait, Gerhard Schr√∂der, Joschka Fischer, Wladimir Putin, Europ√§ische Union, Polen, Freundschaft, St. Petersburg, Russland, Ukraine, Europa, Kiew, Moskau, Rum√§nien, Tschetschenien, T√ºrkei, Beslan, Br√ºssel, New York, Washington D.C","http://www.zeit.de/2004/52/RussischerB_8ar"
"Das ist schon beleidigend","2004.52.33462","2004-12-16","Politik, , Gianfranco Fini, Europ√§ische Union, Joschka Fischer, Martin Schulz, SPD, Italien, Kofi Annan, Sicherheitsrat, Au√üenminister, Beziehung, Fl√ºchtling, Muammar al-Gaddafi, Nordafrika, Bestechung, Freundschaft, Gazastreifen, Irak-Krieg, Israel, Libyen, Russland, T√ºrkei, Berlin, Br√ºssel, Europa","http://www.zeit.de/2004/52/_Das_ist_schon_beleidigend_"
"Alle Jahre wieder","2004.52.33463","2004-12-16","Politik, , Gerhard Schr√∂der, Oskar Lafontaine, SPD, Angela Merkel, BASF, Bertelsmann AG, EnBW, Berichterstattung, Erfindung, Innovation, Kanzleramt, Patriotismus, Praktikum, Strom","http://www.zeit.de/2004/52/Alle_Jahre_wieder"
"Ein Veteran","2004.52.33464","2004-12-16","Politik, , Augusto Pinochet, Fidel Castro, Gericht, Krieg, Kulturrevolution, Terrorismus, Veteran, Vietcong, Argentinien, Chile, China, Uruguay, Moskau","http://www.zeit.de/2004/52/Ein_Veteran"
"Popeye vorn","2004.52.33465","2004-12-16","Politik, , Traian Basescu, Europ√§ische Union, Adrian Nastase, F√§lschung, Stichwahl, Ministerpr√§sident, Rum√§nien, Verwaltung, Bukarest, Europa","http://www.zeit.de/2004/52/Popeye_vorn"
"Wei√üw√§scher","2004.52.33466","2004-12-16","Politik, , Silvio Berlusconi, Bestechung, EU-Gipfel, Justiz, Prozess, Richter, Italien","http://www.zeit.de/2004/52/Weisswaescher"
"Grossbritannien: Herber Verlust","2004.52.33467","2004-11-11","Politik, Grossbritannien, Kriminalitaet, Auslaenderpolitik, Auslaender, Regierung, Recht, Populismus, Linke, Einwanderungspolitik, Asylpolitik, Kriminalit√§t, Ausl√§nderpolitik, Ausl√§nder, Regierung, Recht, Populismus, Linke, Einwanderungspolitik, Tony Blair, David Blunkett, Charles Clarke, Ruth Kelly, Gordon Brown, Innenministerium, Innenminister, Jack Straw, John Prescott, Kabinett, Patricia Hewitt, Gro√übritannien","http://www.zeit.de/2004/52/blunkett"
"afrika: Rolle r√ºckw√§rts","2004.52.33468","2004-11-11","Politik, afrika, Horst K√∂hler, Ausw√§rtiges Amt, Armut, Benin, Bundespr√§sident, Gewalt, Kerstin M√ºller, Korruption, Krieg, Liebe, Waffenstillstand, Eritrea, Sierra Leone, Afrika, √Ñthiopien, Dschibuti","http://www.zeit.de/2004/52/Koehler"
"Slums auch bald in Deutschland?: Wer arm ist, muss wieder schlecht wohnen","2004.52.33469","2004-12-16","Dossier, Slums auch bald in Deutschland?, Bevoelkerung, Auslaender, Staedtebau, Sozialstruktur, Sozialpolitik, Lebensstandard, Architektur, Armut, Arbeitsmarkt, Arbeitslosigkeit, Arbeit, Bundesregierung, Hartz IV, Heizung, Humboldt-Universit√§t, Lebensstil, Miete, Wohnungsbau, Frankreich, Gro√übritannien, Wohnen, Berlin, Bev√∂lkerung, Ausl√§nder, St√§dtebau, Sozialstruktur, Sozialpolitik, Lebensstandard, Bauen und Wohnen, Armut, Arbeitsmarkt, Arbeitslosigkeit","http://www.zeit.de/2004/52/slum_beitext"
"Ich habe noch Hoffnung","2004.52.33470","2004-12-16","Dossier, , Interview, Armut, Entwicklungsland, Globalisierung, Hoffnung, Vereinte Nationen, China, Dienstleistung, Dorf, Indien, Kredit, Simbabwe, Stadt, Stadtplanung, S√ºdafrika, Taiwan, Wasserversorgung, Asien, Bangalore, Europa, Nairobi","http://www.zeit.de/2004/52/_Ich_habe_noch_Hoffnung_"
"slums: Die Fledermausmenschen von Manila","2004.52.33471","2004-12-16","Dossier, slums, Zavala, Ravno, Erfahrungsbericht, Dubrovnik, Buchtitel, Wetter, Naturkatastrophe, Forschung, Natur, Zavala, Ravno, Erfahrungsbericht, Dubrovnik, Buchtitel, Wetter, Naturkatastrophe, Natur und Technik, Vereinte Nationen, Br√ºcke, Eigenheim, Fluss, Gloria Macapagal Arroyo, Peso, Philippinen, Wasser, Manila, Afrika, Asien, Jakarta, Lateinamerika, Westeuropa","http://www.zeit.de/2004/52/Slum-Haupttext"
"Oracle: Zufrieden","2004.52.33472","2004-12-16","Wirtschaft, , Macher, Larry Ellison, Aktie, Dollar, Sommer, √úbernahme, USA, Unternehmen, Europa, San Jos√","http://www.zeit.de/2004/52/Oracle_Zufrieden"
"argument: Wenn Stillstand zur Qual wird","2004.52.33473","2004-12-16","Wirtschaft, argument, Arbeit, Dienst, Reform, Streik, Gewerkschaft, Verwaltung, Staat, Karriere, Einkommen, Beruf, CSU, Edmund Stoiber, Franz M√ºntefering, Hans Peter Bull, Peter Heesen, SPD, Frank Bsirske, Otto Schily, Ver.di, Altersversorgung, Arbeitszeit, Bundesrat, Bundestag, Grundgesetz, Landesregierung, Reform, Rentenreform, Arbeit und Sozialstaat, Dienst, Reform, Streik, Gewerkschaft, Verwaltung, Staat, Karriere, Einkommen","http://www.zeit.de/2004/52/Argument_52"
"Reformen: Konfus","2004.52.33474","2004-12-16","Wirtschaft, , Macher, Bev√∂lkerung, Hartz IV, Medien, Arbeitgeber, Aufsichtsrat, Ein-Euro-Job, Gewerkschaft, Hewlett-Packard, Kopfpauschale, Mitbestimmung, Opposition, Regierung, Tageszeitung","http://www.zeit.de/2004/52/Reformen_Konfus"
"duales system: Her mit dem M√ºll","2004.52.33475","2004-12-16","Wirtschaft, duales system, Betriebswirtschaft, Management, Kapitalanlage, Geld_und_Boerse, Fonds, Kapitalbeteiligung, Geldanlage, Wirtschaft_und_Konjunktur, Wirtschaft, Produktion, Gr√ºne, M√ºll, Aufsichtsrat, MTU, B√∂rse, B√∂rsengang, Euro, Gro√übritannien, MIT, Rationalisierung, Umsatz, Vorstand, Betriebswirtschaft, Management, Kapitalanlage, Geld und B√∂rse, Fonds, Kapitalbeteiligung, Geldanlage, Wirtschaft und Konjunktur, Wirtschaft","http://www.zeit.de/2004/52/Interv__Gorenflos"
"Das Lohngef√§lle liegt bei eins zu sechs","2004.52.33476","2004-12-16","Wirtschaft, , Eberhard Sinner, Bundesregierung, Europ√§ische Union, Kapitalgesellschaft, Steuerbelastung, Tschechische Republik, Unternehmen, Bayern, Br√ºssel, Berlin, Europa","http://www.zeit.de/2004/52/_Das_Lohngefaelle_liegt_bei_eins_zu_sechs"
"banken: Die Geier sind da","2004.52.33477","2004-12-16","Wirtschaft, banken, Kredit, Finanzwirtschaft, Kreditderivate, Wirtschaft_und_Konjunktur, Wirtschaft, Konjunktur, Unternehmenskrise, Krise, Konkurs, Geld_und_Boerse, Hans Eichel, Lone Star, Eigenkapital, Euro, Kredit, Banken, Indonesien, Taiwan, Thailand, Basel, Kredit, Finanzwirtschaft, Kreditderivate, Wirtschaft und Konjunktur, Wirtschaft, Konjunktur, Unternehmenskrise, Krise, Konkurs","http://www.zeit.de/2004/52/G-Geierfonds"
"Werner Seiferts gro√üer Traum","2004.52.33478","2004-12-16","Wirtschaft, , B√∂rse, Werner Seifert, Traum, Fusion, Kapitalmarkt, Oper, Rechtsanwalt, London, Atlantik, Themse","http://www.zeit.de/2004/52/Werner_Seiferts_grosser_Traum"
"Auf Knopfdruck","2004.52.33479","2004-12-16","Wirtschaft, , Film, Euro, Handel, Internet, McDonald's, Personal, Privatfernsehen, ProSieben, Sender, Show, TV-Sender, Video, Werbung, Studie, USA","http://www.zeit.de/2004/52/Auf_Knopfdruck"
"Von einer Hand in die andere","2004.52.33480","2004-12-16","Wirtschaft, , Blackstone Group, Dornier, Euro, Firmengr√ºndung, Fusion, Insolvenz, JP Morgan, MTU, Rodenstock, √úbernahme","http://www.zeit.de/2004/52/Von_einer_Hand_in_die_andere"
"eu: Jeder will das gr√∂√üte St√ºck","2004.52.33481","2004-12-16","Wirtschaft, eu, Staatsfinanzen, Verteilung, Subvention, Osteuropa, Osterweiterung, Internationale_Beziehungen, Europapolitik, Aussenpolitik, Staatsfinanzen, Verteilung, Subvention, Osteuropa, Osterweiterung, Internationale Beziehungen, Europapolitik, Europ√§ische Union, Gerhard Schr√∂der, Hans Eichel, Helmut Kohl, EU-Kommission, Michel Barnier, Agrarpolitik, BIP, EU-Haushalt, Euro, Frankreich, Irland, Niall Ferguson, √ñsterreich, Br√ºssel, Europa, Gro√übritannien, London, Bayern, Lissabon, Rotterdam","http://www.zeit.de/2004/52/EU-Gelder"
"EU-Stabilit√§tspakt: Ende gut‚Ä¶","2004.52.33482","2004-12-16","Wirtschaft, EU-Stabilit√§tspakt, Staatsfinanzen, Staatsverschuldung, Stabilit√§tspakt, Haushaltspolitik, Bundeshaushalt, Finanzpolitik, Kontroverse, Haushaltsdefizit, Wirtschaft_und_Konjunktur, Staatsfinanzen, Staatsverschuldung, Stabilit√§tspakt, Haushaltspolitik, Bundeshaushalt, Finanzpolitik, Kontroverse, Haushaltsdefizit, EU-Kommission, Hans Eichel, Jean-Claude Juncker, Recht, Betrug, Debatte, Euro, Finanzminister, Finanzpolitik, Joaqu√≠n Almunia, Regierung, Stabilit√§tspakt, Strafe, Griechenland, Italien, Br√ºssel, Europa","http://www.zeit.de/2004/52/Defizitverfahren"
"was bewegt...: ...Klaus Ernst?","2004.52.33483","2004-12-16","Wirtschaft, was bewegt..., Arbeit, Reform, Gewerkschaft, Sozialstaat, Sozialpolitik, Karriere, Beruf, Portrait, Konflikt, Steuerpolitik, Staatsorgane, Arbeit und Sozialstaat, Reform, Gewerkschaft, Sozialstaat, Sozialpolitik, Karriere, Beruf, Portrait, Konflikt, Steuerpolitik, Gerhard Schr√∂der, SPD, Willy Brandt, IG Metall, Hartz IV, Bundestag, Riester-Rente, Schweinfurt, Berlin, M√ºnchen, Nordrhein-Westfalen, Stuttgart","http://www.zeit.de/2004/52/P-Ernst"
"Verlockendes Dosenpfand","2004.52.33484","2004-12-16","Wirtschaft, , Gr√ºne, EuGH, Dosenpfand, Europ√§ischer Gerichtshof, Verpackung, Euro, Umsatz, Unternehmen","http://www.zeit.de/2004/52/Verlockendes_Dosenpfand"
"Der Kaufrausch, eine Illusion","2004.52.33485","2004-12-16","Wirtschaft, , Statistisches Bundesamt, Alltag, Arbeitsmarkt, Ausnahmezustand, Euro, Export, Feiertag, Fest, Handel, Haushalt, Statistik, Steuerreform, Strom, U-Bahn, Umsatz, Wirtschaftswachstum","http://www.zeit.de/2004/52/Der_Kaufrausch_eine_Illusion"
"Flei√ük√§rtchen mag ich nicht","2004.52.33486","2004-12-16","Wirtschaft, , Energiepolitik, Alternative_energie, Umweltpolitik, Umwelt, Emissionshandel, Klimapolitik, Strom, Energiewirtschaft, Forschung, Natur, Klimaschutz, Energiepolitik, Energie und Rohstoff, Umweltpolitik, Umwelt, Emissionshandel, Klimapolitik, Strom, Energiewirtschaft, Natur und Technik, Natur, J√ºrgen Trittin, Helmut Kohl, OECD, ADAC, Wirtschaftsministerium, Atomkraftwerk, CO2, China, Emissionshandel, Energieeffizienz, Klimakonferenz, Klimaschutz, Kohlekraftwerk, Kraftwerk, Kyoto-Protokoll, USA, Umweltminister, √ñkosteuer, USA, Indien, Schweden, Buenos Aires, Nordrhein-Westfalen, Schleswig-Holstein","http://www.zeit.de/2004/52/Trittin-Interview"
"Machtlose Opec","2004.52.33487","2004-12-16","Wirtschaft, , Opec, Dollar, Winter","http://www.zeit.de/2004/52/Machtlose_Opec"
"Desinformation","2004.52.33488","2004-12-16","Wirtschaft, , Bundesregierung, Hartz IV, Statistisches Bundesamt, Armut, Bekleidung, Familie, Ministerium, Studie, √ñffentlichkeit","http://www.zeit.de/2004/52/Desinformation"
"Autos: Beliebt","2004.52.33489","2004-12-16","Wirtschaft, , Macher, Bernd Gottschalk, Auto, Autoh√§ndler, Hoffnung, Pr√§sident, D√§nemark, Frankreich, Griechenland, Spanien, Westeuropa","http://www.zeit.de/2004/52/Autos_Beliebt"
"ungarn: Der lange Weg zum Geld","2004.52.33490","2004-12-16","Wirtschaft, ungarn, Ungarn, Euro, Br√ºssel, Europa, Kroatien, Budapest, Balkan","http://www.zeit.de/2004/52/Ungarn"
"Der befreite Zuschauer","2004.52.33491","2004-12-16","Wirtschaft, , Videorekorder, Julia Roberts, Robert Redford, Tagesschau, USA, Athen, Atlanta, Montana, M√ºnchen","http://www.zeit.de/2004/52/Der_befreite_Zuschauer"
"Die Rechnung des Herrn P.","2004.52.33492","2004-12-16","Wirtschaft, , Essen, Euro, Fahrrad, Kindergeld, Nahverkehr, Schule","http://www.zeit.de/2004/52/Die_Rechnung_des_Herrn_P_"
"Silverstone: Gef√∂rdert","2004.52.33493","2004-12-16","Wirtschaft, , Macher, Bernie Ecclestone, Chef, Bank, Geld, Hotel, Region, Silverstone, Ascot, Mekka","http://www.zeit.de/2004/52/Silverstone_Gefoerdert"
"Gut, dass Rauchen teurer wird","2004.52.33494","2004-12-16","Wirtschaft, , Tabaksteuer, Euro, Konsum, Krankenkasse, Nichtraucher, Steuer, Sucht, Volkswirtschaft, Osteuropa","http://www.zeit.de/2004/52/Gut_dass_Rauchen_teurer_wird"
"hartz IV: Wie aus mehr weniger wird","2004.52.33495","2004-12-16","Wirtschaft, hartz IV, Arbeit, Sozialstaat, Sozialhilfe, Arbeitslosenversicherung, Zusammenlegung, Reform, Arbeitslosenhilfe, Arbeitsmarkt, Arbeitslosigkeit, Recht, Kontra, Arbeit und Sozialstaat, Sozialstaat, Sozialhilfe, Arbeitslosenversicherung, Zusammenlegung, Reform, Arbeitslosenhilfe, Arbeitsmarkt, Arbeitslosigkeit, Recht, Bundesregierung, Hartz IV, Statistisches Bundesamt, Bekleidung, Euro, Existenzminimum","http://www.zeit.de/2004/52/ALG_II"
"60 SEKUNDEN F√úR den Lotto-Wahn","2004.52.33496","2004-12-16","Wirtschaft, , Dax, Aktie, B√∂rse, Euro, Lotto, Reichtum, Traum, Geschichte, Unternehmen","http://www.zeit.de/2004/52/60_SEKUNDEN_FUeR_den_Lotto-Wahn"
"Toll Collect: Die endlose Geschichte ‚Äì letzter Akt?","2004.52.33497","2004-11-11","Wirtschaft, Toll Collect, Verkehrspolitik, Transport_und_Verkehr, Lastkraftwagen, Autobahngeb√ºhr, Technik, Forschung, Schadensersatz, Recht, Transport, Gueterverkehr, K√ºndigung, Verkehrspolitik, Transport und Verkehr, Lastkraftwagen, Autobahngeb√ºhr, Technik, Natur und Technik, Schadensersatz, Recht, Transport, G√ºterverkehr, Bundesregierung, Manfred Stolpe, DaimlerChrysler, Deutsche Telekom, Hartz IV, Autobahn, Fahrzeug, Folter, Geb√ºhr, Industriegeschichte, Kinderkrankheit, Kommunikation, Maut, Verkehrsminister, Technik, Vertrag","http://www.zeit.de/2004/52/TollCollect"
