"title","number","date","keywords","link"
"Feindliche Truppen","1998.27.18052","1998-06-25","Länderspiegel, , Zeitung, Ruhrgebiet, WAZ-Gruppe, Zeitung, Betriebsrat, Bürgerinitiative, Großbritannien, Heimat, Ostern","http://www.zeit.de/1998/27/Feindliche_Truppen"
"Vor 50 Jahren: Eiserner Vorhang in Korea","1998.27.18053","1899-12-31","Politik, , Politik, Innenpolitik, Wirtschaft_und_Konjunktur, Wirtschaft, Vorgeschichte, Mandschurei, Macht, Krieg, Korea, Kolonialismus, China, Politik, Innenpolitik, Wirtschaft und Konjunktur, Wirtschaft, Vorgeschichte, Mandschurei, Macht, Krieg, Korea, Kolonialismus, UN, Japan, Nordkorea, Russland, China, Südkorea, Europa, New York","http://www.zeit.de/1998/27/199827.vor50j.202e.xml"
"Wolf Schneider (35)","1998.27.18054","1998-06-25","Politik, , Autor, Eltern, Gold, Zeitung, Venedig","http://www.zeit.de/1998/27/Wolf_Schneider_35_"
"Der halbierte Präsident","1998.27.18055","1899-12-31","Politik, , Roman Herzog, Richard Freiherr von Weizsäcker, Bertolt Brecht, Heinrich Heine, Grüne, Jens Reich, Präsident, Präsidentschaft, Republik, Universität Oldenburg, Europa","http://www.zeit.de/1998/27/199827.herzog_.xml"
"Einsamer Fanatiker","1998.27.18056","1998-06-25","Länderspiegel, , Junge, Erich Honecker, KPD, SED, DKP, Anzeige, Arbeitszimmer, DDR, Ehrenamt, Freundschaft, Frieden, Friedensnobelpreis, Geburt, Gedenkstätte, Gründung, Konzentrationslager, Putsch, Sozialismus, Dortmund, Dresden, Leipzig, Sachsenhausen","http://www.zeit.de/1998/27/Einsamer_Fanatiker"
"Unterm Strich","1998.27.18057","1998-06-25","Politik, , Autor, Buch, Bundestagswahl, Eichborn Verlag, Karriere, Redakteur, Roman","http://www.zeit.de/1998/27/Unterm_Strich"
"Danke, Jürgen","1998.27.18058","1899-12-31","Politik, , Wahlkampf, Wahl, Umweltpolitik, Umwelt, Innenpolitik, Partei, Macht, Identität, Wahlkampf, Wahl, Umweltpolitik, Umwelt, Innenpolitik, Partei, Macht, Jürgen Trittin, Grüne, Joschka Fischer, SPD, FDP, Flüchtling, PDS","http://www.zeit.de/1998/27/199827.gruene_.xml"
"Blauhelme gefragt","1998.27.18059","1998-06-25","Politik, , Slobodan Miloševic , Ibrahim Rugova, Nato, Kosovo, Vereinte Nationen, Abenteuer, Allianz, Blauhelm, Bürgerkrieg, Drohung, Frieden, Intervention, Jugoslawien, Präsident, Regierung, Streitkräfte, Zoran Djindjic, Kroatien, Belgrad","http://www.zeit.de/1998/27/Blauhelme_gefragt"
"Stolperei","1998.27.18060","1998-06-25","Politik, , Justizministerium, Bundesgerichtshof, Gewerkschaft, Justiz, Kirche, Landtag, Ministerpräsident, Untersuchungsausschuss, Verfassung, Nordrhein-Westfalen","http://www.zeit.de/1998/27/Stolperei"
"Warum redet er nicht Klartext?","1998.27.18061","1998-06-25","Politik, , Buendnis, Gerhard Schröder, SPD, Jürgen Habermas, Bundesregierung, Oskar Lafontaine, Walter Riester, Bündnis für Arbeit, Extremismus, Jost Stollmann","http://www.zeit.de/1998/27/Warum_redet_er_nicht_Klartext_"
"Die geheime Armee des Kosovo","1998.27.18062","1998-06-25","Politik, , Guerilla, Kosovo, Söldner, Großbritannien, Iran, Jugoslawien, Kroatien, Schweiz, Serbien, Tschetschenien, Tirana","http://www.zeit.de/1998/27/Die_geheime_Armee_des_Kosovo"
"Mucker/Innen","1998.27.18063","1998-06-25","Politik, , Fenster, Grüne, Erziehung, Gedicht, Integration, Kindergarten, Pentagon, Religionsunterricht, Seele, Skandal, Streitkräfte, Verteidigungsminister, Maryland, Schleswig-Holstein","http://www.zeit.de/1998/27/Mucker_Innen"
"Der sanfte Mullah","1998.27.18064","1998-06-25","Politik, , Khatami, Bill Clinton, Hisbollah, Iran, Madeleine Albright, Israel, Saudi Arabien, USA, Europa, Hamburg, Qom, Teheran, Washington D.C","http://www.zeit.de/1998/27/Der_sanfte_Mullah"
"Der rote Baron soll auferstehen","1998.27.18065","1998-06-25","Länderspiegel, , Brief, Manfred von Ardenne, Arbeitslosigkeit, Dokumentarfilm, Dorf, Minnesota, Ostdeutschland, Spielfilm, Vergangenheitsbewältigung, Dresden, München","http://www.zeit.de/1998/27/Der_rote_Baron_soll_auferstehen"
"Die neue Parteienlandschaft","1998.27.18066","1899-12-31","Politik, , Tony Blair, Lionel Jospin, Anthony Giddens, Frankreich, Front National, Italien, Dänemark, Großbritannien, Niederlande, Portugal, Spanien, Europa","http://www.zeit.de/1998/27/199827.europa_.xml"
"Worte der Woche","1998.27.18067","1899-12-31","Politik, , Gerhard Schröder, Grüne, Theo Waigel, Berti Vogts, Jürgen Trittin, Klaus Kinkel, Recht, Anschlag, Bodo Hombach, Bundesaußenminister, Bundesfinanzminister, Bundestrainer, Diplomat, Egidius Braun, Geschäftsführer, Hooligan, Otto, Präsident, Regierungssprecher, Werner Schulz, Jugoslawien, Bonn","http://www.zeit.de/1998/27/199827.wowos_zsp.xml"
"Besuch aus Deutschland","1998.27.18068","1998-06-25","Politik, , Weltmeisterschaft, Arbeitslose, Bundestrainer, Daniel Nivel, Epoche, Gewalt, Hooligan, Reportage, Stadion, Frankreich, Jugoslawien, Hamburg, Nizza","http://www.zeit.de/1998/27/Besuch_aus_Deutschland"
"Gewalt ohne Grenzen","1998.27.18069","1998-06-25","Politik, , Heitmeyer, Weltmeisterschaft, Alltag, Avantgarde, Fußball, Fußball-WM, Gewalt, Hooligan, Norm","http://www.zeit.de/1998/27/Gewalt_ohne_Grenzen"
"Ehrung","1998.27.18070","1899-12-31","Politik","http://www.zeit.de/1998/27/Ehrung"
"Abschiedsgesang","1998.27.18071","1998-06-25","Politik, , Bundestag, Bundestagswahl, Kabarett, Herbst","http://www.zeit.de/1998/27/Abschiedsgesang"
"Abrüstung in der Waffenindustrie","1998.27.18072","1899-12-31","Politik","http://www.zeit.de/1998/27/199827.wochengraphik_.xml"
"Phantom der Opas","1998.27.18073","1998-06-25","Politik, , SPD, Jost Stollmann, Justizministerium, Klaus Kinkel, Rudolf Scharping, Briefwechsel, Bundestagswahl, Diplomat, Jeans, Staatssekretär, Wirtschaftsminister, Bonn","http://www.zeit.de/1998/27/Phantom_der_Opas"
"Geschichten von Liebe und Torheit","1998.27.18074","1998-06-25","Länderspiegel, , Audi, Lothar Bisky, Rosa Luxemburg, Walter Ulbricht, Burg, DDR, Emigration, Markus Wolf, Schriftsteller, Wilhelm Pieck, Italien, Berlin, München","http://www.zeit.de/1998/27/Geschichten_von_Liebe_und_Torheit"
"Eh' die Fäuste fliegen","1998.27.18075","1899-12-31","Politik, , Bundesliga, Fußball, FC St. Pauli, Hamburger SV, SV Werder Bremen, Alkoholkonsum, Ausländerfeindlichkeit, Bus, Hamburger SV, Hooligan, Ronaldo, Schlägerei, Niederlande, Italien, Jugoslawien, Österreich, Bremen, Dresden, Hamburg","http://www.zeit.de/1998/27/199827.hooligans_.xml"
"Die Macht hat Vorrang","1998.27.18076","1998-06-25","Politik, , Bundeskanzler, Minister, Parlament, Regierungssprecher, Regierungswechsel, Ruhestand, Verwaltung, Wismar","http://www.zeit.de/1998/27/Die_Macht_hat_Vorrang"
"Wer gehört dazu?","1998.27.18077","1998-06-25","Politik, , Parteienlandschaft, Silvio Berlusconi, Romano Prodi, Helmut Kohl, Jacques Chirac, Die Linke, Tony Blair, DVU, Europawahl, Italien, Cardiff, Amsterdam, Brüssel","http://www.zeit.de/1998/27/Wer_gehoert_dazu_"
"Das Ding muß weg","1998.27.18078","1998-06-25","Länderspiegel, , Kirche, Walter Ulbricht, Karl Marx, DDR, Dominikaner, Kirche, Leipzig, Elbe, Moskau, Ost-Berlin, Sachsen, St. Pauli","http://www.zeit.de/1998/27/Das_Ding_muss_weg"
"Heimlich in Deutschland","1998.27.18079","1899-12-31","Politik, , Auslaender, Recht, Illegalität, Zuwanderungsgesetz, Zuwanderung, Justiz, Gesellschaft_und_soziales_Leben, Alltag, Vhb_Zeitgeschichte, Vergleich, Lebensbedingung, Ausländer, Recht, Illegalität, Zuwanderungsgesetz, Zuwanderung, Justiz, Gesellschaft und soziales Leben, Alltag, Zeitgeschichte, Vergleich, Manfred Kanther, Frank Ulrich Montgomery, Moschee, Polen, Frankreich, Berlin, Köln, Bamberg, Nordrhein-Westfalen","http://www.zeit.de/1998/27/199827.schatten.neu_.xml"
"Kohls Staat - vollschlank","1998.27.18080","1899-12-31","Politik, , Wirtschaftspolitik, Wirtschaft_und_Konjunktur, Arbeitsmarktpolitik, Arbeitsmarkt, Arbeit, Bundeswirtschaftsminister, Wirtschaftspolitik, Wirtschaft und Konjunktur, Arbeitsmarktpolitik, Arbeitsmarkt, Arbeit und Sozialstaat, Bundesregierung, Helmut Kohl, CDU, Rupert Scholz, Manfred Kanther, Innenminister, Kanzleramt, Michael Bürsch, Ministerium, Robert Koch-Institut, Berlin, Bonn, Bergen","http://www.zeit.de/1998/27/199827.schlanker_staat_.xml"
"Geht härter mit Boris Jelzin um!","1998.27.18081","1998-06-25","Politik, , Bill Clinton, Jewgeni Primakow, Russland, Alexander Lukaschenko, Dollar, Kapitalflucht, Konflikt, Korruption, Kredit, Massenvernichtungswaffe, Militärtechnologie, Präsident, Reform, Republikaner (USA), Terrorismus, Vereinte Nationen, Weltbank, China, Irak, Iran, MIT, USA, Balkan, Kaukasus, Washington D.C","http://www.zeit.de/1998/27/Geht_haerter_mit_Boris_Jelzin_um_"
"Flirt mit dem Drachen","1998.27.18082","1899-12-31","Politik, , Bill Clinton, China, Armut, Jiang Zemin, Kapitalismus, Newsweek, Provinz, Präsident, Republikaner (USA), Yuan, USA, USA, Peking, Washington D.C","http://www.zeit.de/1998/27/199827.clinton_china_.xml"
"Neu, aber durchschlagend erfolglos","1998.27.18083","1998-06-25","Politik, , Guido Westerwelle, Helmut Kohl, FDP, Wolfgang Schäuble, Jürgen Möllemann, Botschaft, Landtagswahl","http://www.zeit.de/1998/27/Neu_aber_durchschlagend_erfolglos"
"Östliches Nr. 27/1998","1998.27.18084","1899-12-31","Politik, , Grüne, SPD, DDR, Lothar de Maizière, Ministerpräsident, Opfer, Steffen Freund, Treuhandanstalt, Werner Schulz, Zeitung","http://www.zeit.de/1998/27/199827.s16_oestliches_.xml"
"Im Schatten des Wirtschaftswunders","1998.27.18085","1899-12-31","Politik, , China, Bevoelkerung, Wirtschaft_und_Konjunktur, Arbeit, Wirtschaft, Ungerechtigkeit, Wirtschaftswachstum, Produktion, Fossile_energie, Erdoel, China, Bevölkerung, Wirtschaft und Konjunktur, Arbeit und Sozialstaat, Wirtschaft, Ungerechtigkeit, Wirtschaftswachstum, Produktion, Fossile Energie, China, Japan, Shanghai, Peking","http://www.zeit.de/1998/27/199827.liaoning_.xml"
"Kurzer Abschied vom Pfund","1998.27.18086","1998-06-25","Politik, , Blair, Tony Blair, Europäische Union, Helmut Kohl, Boulevardpresse, Euro, Euro-Zone, Hooligan, Integration, Parlamentswahl, Präsidentschaft, Regierungschef, Volksabstimmung, Schweden, Europa, London, Paris","http://www.zeit.de/1998/27/Kurzer_Abschied_vom_Pfund"
"Les Sans-Papiers","1998.27.18087","1998-06-25","Dossier, , Grüne, Ausländer, Recht, Aufenthaltsgenehmigung, Charles Pasqua, Geburt, Innenminister, Jean-Pierre Chevènement, Staatsangehörigkeit, Behörde, Bildung, Eltern, Frankreich, Künstler, Mond, Republik, Student, Weltkrieg, Paris","http://www.zeit.de/1998/27/Les_Sans-Papiers"
"Illegal Aliens","1998.27.18088","1998-06-25","Dossier, , Arzt, Aufenthaltsgenehmigung, Behörde, Eltern, Flüchtling, Gefängnis, Gericht, Krankenhaus, Richter, Schule, Schüler, U-Bahn, Verbrechen, Visum, China, Mexiko, USA","http://www.zeit.de/1998/27/Illegal_Aliens"
"Rückschläge inbegriffen","1998.27.18089","1998-06-25","Wirtschaft, , Leiter, Angela Merkel, EU-Politik, Energie, Erdgas, Klimapolitik, Kohlendioxid, Umweltminister, Verkehrsminister, Japan, USA, Bonn, Rio de Janeiro","http://www.zeit.de/1998/27/Rueckschlaege_inbegriffen"
"Das asiatische Rätsel","1998.27.18090","1998-06-25","Wirtschaft, , Asien, Rätsel, Norbert Walter, Japan, Dollar, Region, Rekorddefizit, Staatsanleihe, Weltbank, Währung, Yen, China, Indien, Indonesien, Thailand, USA, Asien, Europa, Fernost","http://www.zeit.de/1998/27/Das_asiatische_Raetsel"
"Gesteigert","1998.27.18091","1998-06-25","Wirtschaft, , Manager, Reemtsma, Droge, Nikotin, Polen, Asien, Hamburg, Osteuropa","http://www.zeit.de/1998/27/Gesteigert"
"Stollmann soll machen","1998.27.18092","1998-06-25","Wirtschaft, , Gerhard Schröder, Jost Stollmann, SPD, Oskar Lafontaine, Drehbuch, Staatssekretär, Wirtschaftsminister, Rheinland","http://www.zeit.de/1998/27/Stollmann_soll_machen"
"Gewechselt","1998.27.18093","1998-06-25","Wirtschaft, , Manager, Fiat, Abfindung, Auto, Enkel, Fahrzeug, General Electric, Steuer, Student, Verwaltungsrat, Geschichte, Italien, Mailand","http://www.zeit.de/1998/27/Gewechselt"
"Falscher Anreiz","1998.27.18094","1998-06-25","Wirtschaft, , Edmund Stoiber, Erwin Teufel, CDU, CSU, Hans Eichel, SPD, Autonomie, Bundesverfassungsgericht, Grundgesetz, Ministerpräsident, Prozess, Reform, Steuerbelastung, Länderfinanzausgleich, Baden-Württemberg, Bayern, Karlsruhe","http://www.zeit.de/1998/27/Falscher_Anreiz"
"Atomares Pulverfaß","1998.27.18095","1998-06-25","Wirtschaft, , Sellafield, Atomkraftgegner, Brennelement, Müll, Großbritannien, Irland, USA, Dublin, London, Massachusetts, Tschernobyl","http://www.zeit.de/1998/27/Atomares_Pulverfass"
"Gezielt hochgejubelt","1998.27.18096","1998-06-25","Wirtschaft, , Solidus, Wolfgang Gerke, Frankfurter Börse, Aktie, New York","http://www.zeit.de/1998/27/Gezielt_hochgejubelt"
"Starker Tobak","1998.27.18097","1998-06-25","Wirtschaft, , Europaparlament, Europäischer Gerichtshof, Gericht, Herz, Hoffnung, Günter Rexrodt, Bonn, Oder","http://www.zeit.de/1998/27/Starker_Tobak"
"Mulmiges Gefühl","1998.27.18098","1998-06-25","Wirtschaft, , Marktreport, Dax, Aktienindex, Börse, Intervention, Yen, Asien","http://www.zeit.de/1998/27/Mulmiges_Gefuehl"
"Billiger Trick","1998.27.18099","1998-06-25","Wirtschaft, , Bundesregierung, Helmut Kohl, Arbeitnehmer, Betrug, Bundestagswahl, Wahl, Geschichte","http://www.zeit.de/1998/27/Billiger_Trick"
"Vergrätzt","1998.27.18100","1998-06-25","Wirtschaft, , Manager, Exxon, Katastrophe, Los Angeles","http://www.zeit.de/1998/27/Vergraetzt"
"Geopfert","1998.27.18101","1998-06-25","Wirtschaft, , Manager, Rolf Deyhle, Auktionshaus, Georg Baselitz, Kunstwerk, Käthe Kollwitz, Künstler, Louvre, Museum, Sammlung, Traum, Stuttgart","http://www.zeit.de/1998/27/Geopfert"
"Fakten, Fakten, Fakten","1998.27.18102","1998-06-25","Wirtschaft, , Max Weber, Gas, Gewinn, Grafik, Rezession, Statistik, Statistisches Bundesamt, Unternehmen, Vermögen, Versicherung, Wahlkampf, Werbung","http://www.zeit.de/1998/27/Fakten_Fakten_Fakten"
"Abrupte Wende","1998.27.18103","1998-06-25","Wirtschaft, , Hilmar Kopper, FDP, Günter Rexrodt, Botschaft, Chef, Diplomat, Produktion, Republik, Wirtschaftsminister, Öffentlichkeitsarbeit","http://www.zeit.de/1998/27/Abrupte_Wende"
"Zweifel am Big Business","1998.27.18104","1998-06-25","Wirtschaft, , Antitrust, AT&amp;T, Ronald Reagan, Netscape, Northrop Grumman, USA, Washington D.C., Brüssel, Chicago","http://www.zeit.de/1998/27/Zweifel_am_Big_Business"
"Ein Leben fürs Geld","1998.27.18105","1998-06-25","Wirtschaft, , Portrait, Warren Buffett, Bill Gates, Alkohol, Cola, Dollar, Droge, Lincoln, Übersee, Woodstock","http://www.zeit.de/1998/27/Ein_Leben_fuers_Geld"
"Kreativ","1998.27.18106","1998-06-25","Wirtschaft, , Bert Rürup, SPD, Wirtschaftspolitik, Altersversorgung, Altersvorsorge, Arbeitnehmer, Arbeitsmarkt, Betriebsrente, Rente, Rentenreform, Staatsquote, Vollbeschäftigung, Vorsorge, Bonn","http://www.zeit.de/1998/27/Kreativ"
"Es wird Streit geben","1998.27.18107","1998-06-25","Wirtschaft, , Interview, Stollmann, Interview, Gerhard Schröder, Jost Stollmann, SPD, Oskar Lafontaine, Bündnis für Arbeit, General Electric, Mitbestimmung, Gesundheitsschutz","http://www.zeit.de/1998/27/Es_wird_Streit_geben"
"Lauter blaue Socken","1998.27.18108","1998-06-25","Wirtschaft, , DDR, Bayern, Berlin, Brandenburg, Dresden, Thüringen","http://www.zeit.de/1998/27/Lauter_blaue_Socken"
"Abrüstung in der Waffenindustrie","1998.27.18109","1998-06-25","Wirtschaft, , Abrüstung, Rüstungsindustrie, US-Dollar","http://www.zeit.de/1998/27/Abruestung_in_der_Waffenindustrie"
"","1998.27.18110","1998-06-25","Wirtschaft, , Finanz, Dax, Aktienmarkt, Arbeitszeit, Gewinn, Inflation, Markus Brender, Ostern, Razzia, Strafe, Verlag, Vorstand","http://www.zeit.de/1998/27/24807"
