"title","number","date","keywords","link"
"Das Schäuble-Papier hat einen überfälligen Anstoß zur Diskussion gegeben: Die Integration Europas muß vorangetrieben werden – auch gegen den Widerstand der Zaudernden: Wer auf alle wartet, kommt nie ans Ziel |","1994.38.7266","1994-09-16","DIE ZEIT, Das Schäuble-Papier hat einen überfälligen Anstoß zur Diskussion gegeben: Die Integration Europas muß vorangetrieben werden – auch gegen den Widerstand der Zaudernden, CDU, Edouard Balladur, Wolfgang Schäuble, Integration, John Major, Klaus Hänsch, Theo Sommer, Figaro, Großbritannien, Europa, Frankreich, Norwegen, Spanien, Widerstand, Maastricht","http://www.zeit.de/1994/38/wer-auf-alle-wartet-kommt-nie-ans-ziel"
"Schweden wählt. Auch in der Industriestadt Västeräs werden die Sozialdemokraten wahrscheinlich siegen: Zurück zur guten alten Zeit |","1994.38.7267","1994-09-16","DIE ZEIT, Schweden wählt. Auch in der Industriestadt Västeräs werden die Sozialdemokraten wahrscheinlich siegen, Schweden, Carl Bildt, Volvo, Asea Brown Boveri, Ericsson, Ingvar Carlsson, Wohlfahrtsstaat, Siegen, Stockholm, Europa","http://www.zeit.de/1994/38/zurueck-zur-guten-alten-zeit"
"Worte der Woche |","1994.38.7268","1994-09-16","DIE ZEIT, , CDU, Hans-Dietrich Genscher, Wolfgang Schäuble, François Mitterrand, Hildegard Hamm-Brücher, Klaus Kinkel, Kurt Biedenkopf, Manfred Stolpe, Anschlag, Bürgerkrieg, Claude Lanzmann, Hans Koschnick, Johannes Paul II., Klaus Hänsch, Ministerpräsident, Papst, Israel, Kroatien, Brandenburg, Magdeburg, Sachsen","http://www.zeit.de/1994/38/worte-der-woche"
"Droht in Burundi ein zweites Ruanda?: Vor dem Abgrund |","1994.38.7269","1994-09-16","DIE ZEIT, Droht in Burundi ein zweites Ruanda?, Blauhelm, Bundesaußenminister, Burundi, Cholera, Diplomat, Diplomatie, Intervention, Präsident, Ruanda, Somalia, Sommer, Tutsi, Völkermord, Werner Schuster, Kigali","http://www.zeit.de/1994/38/vor-dem-abgrund"
"Zeitspiegel |","1994.38.7270","1994-09-16","DIE ZEIT, , Hans-Dietrich Genscher, Bundesaußenminister, Flugzeugträger, György Konrad, Synagoge, Tonträger, Ungarn, Marokko, Afrika, Europa, Gibraltar","http://www.zeit.de/1994/38/zeitspiegel"
"Ausländisches Votum über die Deutschen in Kairo:: Peinlicher Auftritt |","1994.38.7271","1994-09-16","DIE ZEIT, Ausländisches Votum über die Deutschen in Kairo:, Karl Popper, Manfred Kanther, Baby, Demografie, Innenminister, Intelligenz, Test, Simbabwe, Ägypten, Afrika, Asien, Kairo, Wiesbaden","http://www.zeit.de/1994/38/peinlicher-auftritt"
"Tage der Entscheidung |","1994.38.7272","1994-09-16","DIE ZEIT, , Michail Gorbatschow, Robert Havemann, Bahnhof, Botschaft, Bärbel Bohley, DDR, Forum, Reform, Republik, Leipzig, Prag","http://www.zeit.de/1994/38/tage-der-entscheidung"
"Die PDS stabilisiert sich. Rote-Socken-Kampagnen bestärken ihre Botschaft: Selbstbehauptung und eigener Weg: Und der Herkunft zugewandt |","1994.38.7273","1994-09-16","DIE ZEIT, Die PDS stabilisiert sich. Rote-Socken-Kampagnen bestärken ihre Botschaft: Selbstbehauptung und eigener Weg, Gregor Gysi, Stefan Heym, Wolfgang Thierse, SPD, CDU, PDS, DDR, Direktmandat, Brandenburg, Chemnitz, Frankfurt an der Oder, Potsdam, Sachsen","http://www.zeit.de/1994/38/und-der-herkunft-zugewandt"
"Um die FDP ist es schlecht bestellt. Nach einer Serie von Niederlagen muß sie um den Einzug in den Bundestag bangen: Brauchen wir noch eine liberale Partei? |","1994.38.7274","1994-09-16","DIE ZEIT, Um die FDP ist es schlecht bestellt. Nach einer Serie von Niederlagen muß sie um den Einzug in den Bundestag bangen, Helmut Kohl, Bundestag, FDP, Klaus Kinkel, CDU, FDP-Fraktion, Otto Graf Lambsdorff, SPD, Burkhard Hirsch, Bundestagsfraktion, CSU-Fraktion, Landtag, Liberalismus, Sonntagsfrage, Verfassung, Bayern, Brandenburg, Sachsen","http://www.zeit.de/1994/38/brauchen-wir-noch-eine-liberale-partei"
"Vier Wochen im Spätsommer 1989: Der Anfang vom Ende des DDR-Regimes: In der Höhle des Löwen |","1994.38.7275","1994-09-16","DIE ZEIT, Vier Wochen im Spätsommer 1989: Der Anfang vom Ende des DDR-Regimes, Bärbel Bohley, Jens Reich, Innenministerium, DDR, Forum, Jahrestag, Jutta Speidel, Verfassungsrecht, Verhaftung, China, Berlin, Leipzig, New York, Prag","http://www.zeit.de/1994/38/in-der-hoehle-des-loewen"
"Liegt eine Invasion Haitis im nationalen Interesse?: Clinton in der Klemme |","1994.38.7276","1994-09-16","DIE ZEIT, Liegt eine Invasion Haitis im nationalen Interesse?, Bill Clinton, Ronald Reagan, George W.  Bush, Haiti, Bill Clinton, Golfkrieg, Präsident, Republikaner (USA), Somalia, Vereinte Nationen, Vox, Kuba, Panama, USA, Grenada, Port-au-Prince, Washington D.C","http://www.zeit.de/1994/38/clinton-in-der-klemme"
"Fazit der Bevölkerungs-Konferenz: Die Zukunft ist weiblich: Ein Sieg auf dem Papier |","1994.38.7277","1994-09-16","DIE ZEIT, Fazit der Bevölkerungs-Konferenz: Die Zukunft ist weiblich, Vereinte Nationen, Abtreibung, Benin, Christian Wernicke, Entwicklungsland, Erzbischof, Gesundheit, Kondom, tTokyo, Verhütung, Bangladesch, Bolivien, Brasilien, Iran, Kairo, Bonn, Brüssel, Kopenhagen, Teheran, Washington D.C","http://www.zeit.de/1994/38/ein-sieg-auf-dem-papier"
"Brasilien: Ende der Inflation?: Geschönte Realität |","1994.38.7278","1994-09-16","DIE ZEIT, Brasilien: Ende der Inflation?, Bundesregierung, Dollar, Finanzminister, Inflation, Landwirtschaft, Sparpaket, Statistik, Steuerreform, Währung, Brasília","http://www.zeit.de/1994/38/geschoente-realitaet"
"Europa: Die neue EU-Kommission formiert sich – der Abgang des Präsidenten Jacques Delors schafft Raum für starke Persönlichkeiten: Konzert für viele Solisten |","1994.38.7279","1994-09-16","DIE ZEIT, Europa: Die neue EU-Kommission formiert sich – der Abgang des Präsidenten Jacques Delors schafft Raum für starke Persönlichkeiten, Edith Cresson, Jacques Santer, EU-Kommission, CDU, Monika Wulf-Mathies, Willy Brandt, François Mitterrand, Karel van Miert, Neil Kinnock, Griechenland, Konzert, Brüssel, Europa","http://www.zeit.de/1994/38/konzert-fuer-viele-solisten"
"Markt-Report: Mutlose Profis |","1994.38.7280","1994-09-16","DIE ZEIT, Markt-Report, FDP, Lufthansa, Ausländer, Deutsche Bank, Aktie, Anleihe, Bundestagswahl, Holzmann, Rendite, Umsatz, Wunder, Großbritannien, Brandenburg, Sachsen","http://www.zeit.de/1994/38/mutlose-profis"
"Finanzpolitik: Er verstehe das Steuersystem nicht mehr, sagt der Bundespräsident. Der Nestor des deutschen Steuerrechts zweifelt, ob er es je verstehen konnte: Blinde Justitia |","1994.38.7281","1994-09-16","DIE ZEIT, Finanzpolitik: Er verstehe das Steuersystem nicht mehr, sagt der Bundespräsident. Der Nestor des deutschen Steuerrechts zweifelt, ob er es je verstehen konnte, Ernst Benda, Bundespräsident, Georg Wilhelm Friedrich Hegel, Präsident, Richter, Steuer, Vernunft, Blinde, Verfassungsgericht, Karlsruhe","http://www.zeit.de/1994/38/blinde-justitia"
"Deutsche Waggonbau: Für den Wettbewerb ist der Koloß schlecht gerüstet, ein Käufer ist nicht in Sicht: Den Zug verpaßt |","1994.38.7282","1994-09-16","DIE ZEIT, Deutsche Waggonbau: Für den Wettbewerb ist der Koloß schlecht gerüstet, ein Käufer ist nicht in Sicht, Kurt Biedenkopf, IG Metall, Reinhard Höppner, Bundeskanzleramt, Sowjetunion, Bonn, Sachsen, Sachsen-Anhalt","http://www.zeit.de/1994/38/den-zug-verpasst"
"Bundesverdienstkreuz: Vorbildlich |","1994.38.7283","1994-09-16","DIE ZEIT, Bundesverdienstkreuz, Theo Waigel, Bundesverdienstkreuz, Besatzung, DHL, Finanzminister, Liebe, Ministerpräsident, Schauspieler, Tatort, Bayern, Bonn, Schwaben","http://www.zeit.de/1994/38/vorbildlich"
"Bayer: Schmerzfrei |","1994.38.7284","1994-09-16","DIE ZEIT, Bayer, Bayer AG, Aspirin, Bayer AG, Fabrik, Patent, Prozess, Schmerz, Schmerzmittel, US-Regierung, Weltkrieg, USA","http://www.zeit.de/1994/38/schmerzfrei"
"Solarstrom: Mit einem pfiffigen Modell wollen Freiburger Taxiunternehmer Sonnenenergie nutzen: Leise, sauber, aber teuer |","1994.38.7285","1994-09-16","DIE ZEIT, Solarstrom: Mit einem pfiffigen Modell wollen Freiburger Taxiunternehmer Sonnenenergie nutzen, VW, Mercedes-Benz, Umweltbundesamt, Sonnenenergie, Strom, MIT, Freiburg, Los Angeles, Rügen","http://www.zeit.de/1994/38/leise-sauber-aber-teuer"
"Bonner Kulisse |","1994.38.7286","1994-09-16","DIE ZEIT, , CDU, Helmut Becker, Oskar Lafontaine, Theo Waigel, Autohändler, Bundesfinanzhof, Bundesgerichtshof, Eigenkapital, Niedriglohn, Ostdeutschland, Ottmar Schreiner, Zinsabschlagsteuer, Luxemburg, Moskau","http://www.zeit.de/1994/38/bonner-kulisse"
"Kirchen: Katholiken und Protestanten müssen dauerhaft mit weniger Geld rechnen. Unter dem Druck knapper Kassen ändern sich Struktur und Status der Großinstitutionen: Das Kreuz mit dem Sparen |","1994.38.7287","1994-09-16","DIE ZEIT, Kirchen: Katholiken und Protestanten müssen dauerhaft mit weniger Geld rechnen. Unter dem Druck knapper Kassen ändern sich Struktur und Status der Großinstitutionen, Geld, Maria Jepsen, Bistum, Bundestag, Diözese, Karl Barth, Personalabbau, Solidaritätszuschlag, MIT, Sparen, Bonn, Hamburg, Wittenberg","http://www.zeit.de/1994/38/der-kreuz-mit-dem-sparen"
"Lateinamerika: Was hat die neoliberale Wirtschaftspolitik gebracht?: Therapie der vielen Schocks |","1994.38.7288","1994-09-16","DIE ZEIT, Lateinamerika: Was hat die neoliberale Wirtschaftspolitik gebracht?, Wirtschaftspolitik, Therapie, Armut, Freihandelszone, Handel, Kuba, Lateinamerika, Produktivität, Wirtschaftswachstum, Argentinien, Bolivien, Chile, China, Costa Rica, Kapitalismus, Kredit, Mexiko, Region, USA","http://www.zeit.de/1994/38/therapie-der-vielen-schocks"
"Verteidigungsminister: Angriffslustig |","1994.38.7289","1994-09-16","DIE ZEIT, Verteidigungsminister, Verteidigungsminister, Volker Rühe, Militär, Verteidigungsministerium, Chef, Minister, Personalabbau, Koblenz","http://www.zeit.de/1994/38/angriffslustig"
"Schweden: Am kommenden Sonntag rechnet die Linke fest mit einem Wahlsieg. Die bürgerliche Koalition ist mit der Hinterlassenschaft der Sozialdemokraten nicht fertig geworden: Nur noch Elend |","1994.38.7290","1994-09-16","DIE ZEIT, Schweden: Am kommenden Sonntag rechnet die Linke fest mit einem Wahlsieg. Die bürgerliche Koalition ist mit der Hinterlassenschaft der Sozialdemokraten nicht fertig geworden, Carl Bildt, Ingvar Carlsson, Fest, Grüne, Schweden, Gehalt, Immobilienkauf, Kindergarten, Linkspartei, Privatisierung, MIT, Europa","http://www.zeit.de/1994/38/nur-noch-elend"
"Postministerium: Fragwürdige Absprachen bringen die Liberalisierungspolitik in Mißkredit: Kurzer Draht nach Bonn |","1994.38.7291","1994-09-16","DIE ZEIT, Postministerium: Fragwürdige Absprachen bringen die Liberalisierungspolitik in Mißkredit, Bonn, Wolfgang Bötsch, Klaus Zumwinkel, Helmut Kohl, Telekom, Günter Rexrodt, Bundesrat, Bundestag, Friedrich Bohl, Post","http://www.zeit.de/1994/38/kurzer-draht-nach-bonn"
"Österreich: Industrie und Konsumenten freuen sich über den EU-Beitritt – die Agrarwirtschaft stöhnt: Ende der Kartelle |","1994.38.7292","1994-09-16","DIE ZEIT, Österreich: Industrie und Konsumenten freuen sich über den EU-Beitritt – die Agrarwirtschaft stöhnt, Industrie, BMW, Grüne, Chrysler, EU-Beitritt, Agrarwirtschaft, Hannes Androsch, Österreich, Ungarn, Europa, Allgäu, Brüssel, Fernost, Wien","http://www.zeit.de/1994/38/ende-der-kartelle"
"Europa will den Handelspartnern in der Dritten Welt soziale Mindestvorschriften aufzwingen: Zweifelhafte Moral |","1994.38.7293","1994-09-16","DIE ZEIT, Europa will den Handelspartnern in der Dritten Welt soziale Mindestvorschriften aufzwingen, Europa, EU-Kommission, Europäische Union, Außenhandel, Demokratie, Dienstleistung, Diktatur, Export, ILO, Kinderarbeit, Lateinamerika, Norm, Zoll, China, Iran, Afrika, Asien, Brüssel, Karibik, Pazifik","http://www.zeit.de/1994/38/zweifelhafte-moral"
"Privatisierung: Britische Fonds setzen auf die Aktien ehemaliger Staatsbetriebe: Marktführer und Monopole |","1994.38.7294","1994-09-16","DIE ZEIT, Privatisierung: Britische Fonds setzen auf die Aktien ehemaliger Staatsbetriebe, Fonds, British Telecom, Renault, Aktie, Gazprom, Unternehmen, Aktien, England, Niederlande, Spanien, Europa, Westeuropa","http://www.zeit.de/1994/38/marktfuehrer-und-monopole"
"Wirtschaftswachstum: Die Daten zeigen in West und Ost stärker nach oben als zum Jahresbeginn erwartet. Im Wahlkampf präsentiert sich die Regierung als Initiator des Aufschwungs – zu Recht?: Auf dem Trittbrett aufwärts |","1994.38.7295","1994-09-16","DIE ZEIT, Wirtschaftswachstum: Die Daten zeigen in West und Ost stärker nach oben als zum Jahresbeginn erwartet. Im Wahlkampf präsentiert sich die Regierung als Initiator des Aufschwungs – zu Recht?, Bundesregierung, CDU, Günter Rexrodt, Hans Tietmeyer, Regierung, Wahlkampf, CSU, Norbert Blüm, SPD, Bundesanstalt für Arbeit, Konsum, Langzeitarbeitslosigkeit, Pflegeversicherung, Rezession, Solidaritätszuschlag, Statistisches Bundesamt, Superwahljahr, Wirtschaftsminister, Bonn, Westeuropa","http://www.zeit.de/1994/38/auf-dem-trittbrett-aufwaerts"
"Dritte Welt: Der SPD-Kanzlerkandidat Rudolf Scharping will das Entwicklungsministerium abschaffen: „Schlag ins Gesicht“ |","1994.38.7296","1994-09-16","DIE ZEIT, Dritte Welt: Der SPD-Kanzlerkandidat Rudolf Scharping will das Entwicklungsministerium abschaffen, Rudolf Scharping, Walter Scheel, SPD, CDU, Grüne, Michael Hofmann, Indien, Pakistan, Rudolf Scharping, Berlin, Kirgisistan","http://www.zeit.de/1994/38/schlag-ins-gesicht"
"Großbritannien: Mit Wettbewerb und Leistungskontrolle will John Major seine Beamten auf Trab bringen: Helden der Arbeit |","1994.38.7297","1994-09-16","DIE ZEIT, Großbritannien: Mit Wettbewerb und Leistungskontrolle will John Major seine Beamten auf Trab bringen, Arbeit, Tony Blair, British Telecom, Standesamt, MIT","http://www.zeit.de/1994/38/helden-der-arbeit"
"Weltbank / Internationaler Währungsfonds: Die Politik der Strukturanpassung in Afrika ist noch immer heftig umstritten. Trotzdem sind erste Erfolge sichtbar: Durchhalten zahlt sich aus |","1994.38.7298","1994-09-16","DIE ZEIT, Weltbank / Internationaler Währungsfonds: Die Politik der Strukturanpassung in Afrika ist noch immer heftig umstritten. Trotzdem sind erste Erfolge sichtbar, Afrika, Internationaler Währungsfonds, Weltbank, Benin, Entwicklungsland, Protektionismus, Kongo, Madagaskar, Malaysia, Mosambik, Nigeria, Ruanda, Sambia, Thailand, Uganda, Sahara","http://www.zeit.de/1994/38/durchhalten-zahlt-sich-aus"
"Die Medienpolitiker stehen vor einem Desaster: Öde Vielfalt |","1994.38.7299","1994-09-16","DIE ZEIT, Die Medienpolitiker stehen vor einem Desaster, Mark Wössner, Oskar Lafontaine, Kurt Biedenkopf, RTL, Langenscheidt, Medienpolitik, Privatsender, Sat.1, Sender, Bayern, Nordrhein-Westfalen","http://www.zeit.de/1994/38/oede-vielfalt"
