"title","number","date","keywords","link"
"Korruption: Geldwäscheverdacht gegen Commerzbank-Vorstand","2005.30.36084","2005-07-27","Wirtschaft, Korruption","http://www.zeit.de/2005/30/commerzbank_meldung"
"Viele Läden, großes Leid","2005.30.36085","2005-07-21","Wirtschaft, , Aldi, Discounter, Madeleine Schickedanz, Smart, Sparquote, Statistisches Bundesamt, Warenhaus, Frankreich, Großbritannien","http://www.zeit.de/2005/30/Viele_Laeden_grosses_Leid"
"Kommentar: Ein Vorstand handelt","2005.30.36086","2005-07-27","Wirtschaft, Kommentar, Unternehmen, Betriebswirtschaft, Management, Aufsichtsrat, Einkommen, Arbeit, Kompetenz, Kontra, Unternehmensführung, Unternehmen, Betriebswirtschaft, Management, Aufsichtsrat, Einkommen, Arbeit und Sozialstaat, Kompetenz, Kontra","http://www.zeit.de/2005/30/commerzbank_kommentar"
"China: Zehn Euro für jeden","2005.30.36087","2005-07-21","Wirtschaft, China, Bevoelkerung, Wirtschaft_und_Konjunktur, China, Gesellschaft_und_soziales_Leben, Gesellschaft, Arbeit, Wirtschaftspolitik, Wirtschaft, Arbeitsmarkt, Kommunismus, China, Euro, Wissenschaft, Demonstration, Erziehung, Gesundheit, Premierminister, Sozialstaat, Unternehmen, Yuan, Peking, Bevölkerung, Wirtschaft und Konjunktur, China, Gesellschaft und soziales Leben, Gesellschaft, Arbeit und Sozialstaat, Wirtschaftspolitik, Wirtschaft, Arbeitsmarkt","http://www.zeit.de/2005/30/China-Sozial_Kasten"
"Interview: Merkel hat keine Machtbasis","2005.30.36088","2005-07-21","Wirtschaft, Interview, Wirtschaft_und_Konjunktur, Partei, Staatsfinanzen, Wirtschaftspolitik, Wahlkampf, Wahl, Innenpolitik, Wahlprogramme, Bundestagswahl, Wirtschaft, Steuerpolitik, Wirtschaft und Konjunktur, Partei, Staatsfinanzen, Wirtschaftspolitik, Wahlkampf, Wahl, Innenpolitik, Wahlprogramme, Bundestagswahl, Wirtschaft, Angela Merkel, Otto Graf Lambsdorff, FDP, Helmut Kohl, Norbert Blüm, CDU, SPD, Konrad Adenauer, Finanzministerium, Arbeitslosengeld, Bundesrat, Bundestag, Kanzleramt, Langzeitarbeitslosigkeit, Mehrwertsteuer, Schmuggel, Sozialstaat, Steuer, Ökosteuer, USA, Rügen","http://www.zeit.de/2005/30/Lambsdorff_Interview"
"Banken: Knauserig","2005.30.36089","2005-07-21","Wirtschaft, , Macher, Bundesbank, Autor, Bank, Studie, Umsatz, Unternehmen, Widerstand, Wirtschaftswachstum, Buch, Geld","http://www.zeit.de/2005/30/Banken_Knauserig"
"Fernsehen: Der Skandal im Skandal","2005.30.36090","2005-07-21","Wirtschaft, Fernsehen, Medien, Fernsehen, Rundfunkgebühr, Vhb_Rundfunk, Privatfernsehen, Jubiläen, Streit, Umstrukturierung, Reform, Medien, Fernsehen, Rundfunkgebühr, Rundfunk, Privatfernsehen, Jubiläen, Streit, Umstrukturierung, ARD, ZDF, Berichterstattung, Etat, Intendant, Nachrichtensendung, Popkultur, ProSieben, Redakteur, Redaktion, Rundfunk, Schleichwerbung, Sender, Sendung, TV-Sender, Tatort","http://www.zeit.de/2005/30/Analyse"
"Korruption: Willkommen in der Bakschischrepublik","2005.30.36091","2005-07-21","Wirtschaft, Korruption, Unternehmen, Betriebswirtschaft, Management, Kriminalitaet, Einkommen, Arbeit, Kompetenz, Aufsichtsrat, Wirtschaftspruefer, Wirtschaftskriminalitaet, Unternehmen, Betriebswirtschaft, Management, Kriminalität, Einkommen, Arbeit und Sozialstaat, Kompetenz, Aufsichtsrat, Wirtschaftsprüfer, Max Dietrich Kley, Bundesregierung, Siemens AG, Bernd Pischetsrieder, Peter Hartz, Aufsichtsrat, Freundschaft, Klaus-Joachim Gebauer, Korruption, Motorsport, Skandal, Universität München, Vorstand, Wolfgang Ziebart, Indien","http://www.zeit.de/2005/30/Korruption"
"China: Das Los der Vogelfreien","2005.30.36092","2005-07-21","Wirtschaft, China, Bevoelkerung, China, Wirtschaft_und_Konjunktur, Arbeit, Bauer, Statistik, Wirtschaftswachstum, Wirtschaft, Ungerechtigkeit, Medizin, Bevölkerung, China, Wirtschaft und Konjunktur, Arbeit und Sozialstaat, Bauer, Statistik, Wirtschaftswachstum, Wirtschaft, Ungerechtigkeit, China, Sozialversicherung, Unfallversicherung, Wanderarbeiter, Weltbank, Zhu Rongji, Indien, Peking, Afrika, Peking","http://www.zeit.de/2005/30/China-Sozialstaat"
"Osten: Schwächelnd","2005.30.36093","2005-07-21","Wirtschaft, , Macher, Europäische Union, Auslandsinvestition, Finanzmarkt, Studie, Wirtschaftswachstum, Währung, Autor, Polen, Slowakei, Baltikum, Mitteleuropat","http://www.zeit.de/2005/30/Osten_Schwaechelnd"
"Gleiche Steuer für alle","2005.30.36094","2005-07-21","Wirtschaft, , Aktiengesellschaft, Einkommen, Einkommensteuer, Gewerbesteuer, Gewinn, Reform, Reichensteuer, Unternehmen, Wirtschaftswachstum, Wolfgang Wiegard","http://www.zeit.de/2005/30/Gleiche_Steuer_fuer_alle"
"Autos: Hybrid","2005.30.36095","2005-07-21","Wirtschaft, , Macher, Mercedes, Toyota, Audi, Honda, Diesel, Elektromotor, Fahrzeug, Hybrid, Lexus, Motor, Technik, Umfrage, Japan, USA","http://www.zeit.de/2005/30/Autos_Hybrid"
