"title","number","date","keywords","link"
"Außenpolitik: Die Vernunftsnähe","2004.5.30839","2004-01-22","Politik, Außenpolitik, Diplomatie, Nachkriegszeit, Golfkrieg, Wiederaufbau, Realpolitik, Beziehung, Außenpolitik, UN, Europäische Union, Nato, Peter Struck, Aids, Genozid, Irak, James Baker, Bosnien und Herzegowina, Frankreich, Kosovo, USA, Europa, Berlin, Hindukusch, Paris, Washington D.C., Diplomatie, Nachkriegszeit, Golfkrieg, Wiederaufbau, Realpolitik","http://www.zeit.de/2004/05/Die_Vernunftsn_8ahe"
"afrika: Endlich wieder mal Sonnenschein","2004.5.30840","2004-01-22","Politik, afrika, Wirtschaftspolitik, Wirtschaft_und_Konjunktur, Internationale_Wirtschaftsbeziehungen, Internationale_Beziehungen, Entwicklungshilfe, Aussenpolitik, Dienstreise, Vhb_Weltwirtschaft, Reform, Programme, Gerhard Schröder, Afrika, Europäische Union, FDP, Apartheid, Hungersnot, Safari, Ghana, Kenia, Südafrika, Berlin, Europa, Westafrika, Äthiopien, Wirtschaftspolitik, Wirtschaft und Konjunktur, Internationale Wirtschaftsbeziehungen, Internationale Beziehungen, Entwicklungshilfe, Außenpolitik, Dienstreise, Weltwirtschaft, Reform","http://www.zeit.de/2004/05/afrika_schroeder"
"Glosse: Opa war okay","2004.5.30841","2004-01-22","Politik, Glosse, Partei, Staat, Nationalsozialismus, Deutschland, Familie, Innenpolitik, Politikbewusstsein, Vergangenheitsbewaeltigung, Friedrich Merz, CDU, Alter, Kommunalwahl, Sauerland, Zeitung, Stadt, Partei, Staat, Nationalsozialismus, Deutschland, Familie, Innenpolitik, Politikbewusstsein","http://www.zeit.de/2004/05/Glosse_Seite_2"
"Außenpolitik: Grüß Gott, Afrika","2004.5.30842","2004-01-22","Politik, Außenpolitik, Internationale_Wirtschaftsbeziehungen, Entwicklungshilfe, Dienstreise, Wirtschaft_und_Konjunktur, Wirtschaftspolitik, Internationale_Beziehungen, Aussenpolitik, Gerhard Schröder, Afrika, Außenpolitik, Arnold Vaatz, Aids, Armut, Artenvielfalt, Bundeskanzler, Entwicklungshilfe, Fundamentalismus, Goethe-Institut, Hilfsorganisation, Südafrika, Terrorismus, China, England, Frankreich, Ghana, Kenia, Nigeria, Simbabwe, Berlin, Europa, Äthiopien, Internationale Wirtschaftsbeziehungen, Entwicklungshilfe, Dienstreise, Wirtschaft und Konjunktur, Wirtschaftspolitik, Internationale Beziehungen","http://www.zeit.de/2004/05/dt__Afrikapolitik"
"Frankreich: Raufereien mit Trikolore","2004.5.30843","2004-01-22","Politik, Frankreich, Attentat, Demonstration, Islamismus, Religion, Islam, Laizismus, Vhb_Schulpolitik, Religion, Frankreich, Innenministerium, Charles de Gaulle, Jack Lang, Moschee, Schule, MIT, Saudi Arabien, Türkei, Paris, Marseille, Attentat, Demonstration, Islamismus, Religion, Islam, Laizismus, Schulpolitik","http://www.zeit.de/2004/05/Kopftuch"
"kommentar: Auf dem Weg ins Weiße Haus","2004.5.30844","2004-01-22","Politik, kommentar, Partei, Wahlkampf, Wahl, Innenpolitik, Präsidentschaftswahl, Bevoelkerung, Linke, Kandidaten, Recht, George W.  Bush, John Kerry, Bill Clinton, Howard Dean, John Edwards, Wesley Clark, Jimmy Carter, John F. Kennedy, Präsidentschaftskandidat, Wahlkampf, USA, Iowa, Arizona, Oklahoma, Partei, Wahlkampf, Wahl, Innenpolitik, Präsidentschaftswahl, Bevölkerung, Linke, Kandidaten","http://www.zeit.de/2004/05/hampshire"
"kelly-affäre: Blair entlastet, die BBC in Krise","2004.5.30845","2004-01-22","Politik, kelly-affäre, Tony Blair, BBC, SED","http://www.zeit.de/2004/06/hutton_bbc"
"Innovation: Das neueste Deutschland","2004.5.30846","2004-01-22","Politik, Innovation, Wirtschaftspolitik, Umwelt, Oekologie, Forschung, Forschung, Gentechnologie, Gesellschaft_und_soziales_Leben, Gesellschaft, Partei, Innenpolitik, Politik, Wirtschaftspolitik, Umwelt, Ökologie, Natur und Technik, Forschung, Gentechnologie, Gesellschaft und soziales Leben, Gesellschaft, Partei, Innenpolitik, Angela Merkel, Franz Müntefering, Reinhard Bütikofer, Grüne, Guido Westerwelle, SPD, DDR, Emissionshandel, Gentechnik, China, Berlin, Nordrhein-Westfalen","http://www.zeit.de/2004/05/Innovationspolitik"
"Familie: Die Freiheit und ihr Preis","2004.5.30847","2004-01-22","Politik, Familie, Familiengeschichte, Familie_und_Partnerschaft, Familienpolitik, Familie, Rückgang, Bevölkerungswachstum, Gesellschaft_und_soziales_Leben, Gesellschaft, Vhb_Zeitgeschichte, Deutschland, Erfahrungsbericht, Familiengeschichte, Familie und Partnerschaft, Familienpolitik, Familie, Rückgang, Bevölkerungswachstum, Gesellschaft und soziales Leben, Gesellschaft, Zeitgeschichte, Deutschland, Ehe, München, Hamburg, Singapur","http://www.zeit.de/2004/05/Familie"
"Glosse: Zu kalt","2004.5.30848","2004-01-22","Politik, Glosse, Beratungsgewerbe, Arbeitsmarktpolitik, Arbeit, Arbeitsmarkt, Behörde, Affäre, Dienstleistung, Beratungsgewerbe, Arbeitsmarktpolitik, Arbeit und Sozialstaat, Arbeitsmarkt, Behörde, Affäre, Florian Gerster, Gerhard Schröder, Wolfgang Clement, Agentur, Alfred Tacke, Arbeitsmarkt, Arbeitsmarktreform, Parlament, Öffentlichkeit, Arbeit","http://www.zeit.de/2004/05/Glosse_1__S_2"
"US-Wahlkampf: Gesucht: Der Bush-Austreiber","2004.5.30849","2004-01-22","Politik, US-Wahlkampf, Partei, Innenpolitik, Wahlkampf, Wahl, Kandidaten, Präsidentschaftswahl, Präsident, Linke, Portrait, Partei, Innenpolitik, Wahlkampf, Wahl, Kandidaten, Präsidentschaftswahl, Präsident, Linke, George W. Bush, Howard Dean, John Kerry, Bill Clinton, John Edwards, Umfrage, Wesley Clark, USA, Iowa, Washington D.C","http://www.zeit.de/2004/05/Iowa"
"WORTE DER WOCHE","2004.5.30850","2004-01-22","Politik, , SPD, CSU, FDP, Hamas, Ulla Schmidt, Bundesgesundheitsminister, Bundeskriminalamt, Bärbel Dieckmann, Christa Stewens, Demokratie, Dosenpfand, Gesundheitsreform, Weltsozialforum, Zivildienst, Ökonomie, USA, Irak, Israel, Berlin, Bombay","http://www.zeit.de/2004/05/WORTE_DER_WOCHE"
"Glosse: Otto und die bösen Zungen","2004.5.30851","2004-01-22","Politik, Glosse, Polizei, Sicherheitspolitik, Debatte, Umzug, Bundeskriminalamt, Innenpolitik, Innere_sicherheit, Terrorismus, Geheimdienst, Kriminalitaet, Verbrechensbekaempfung, Polizei, Sicherheitspolitik, Debatte, Umzug, Bundeskriminalamt, Innenpolitik, Innere Sicherheit, Terrorismus, Geheimdienst, Kriminalität, Otto Schily, Bundesnachrichtendienst, Bundesregierung, CIA, Bundesnachrichtendienst, FBI, Bundeskriminalamt, Bundeskriminalamt, Geheimdienst, Grundgesetz, Hauptstadt, Innenminister, Kanzleramt, Polizei, Ulrich Kersten, Bundesrepublik Deutschland, Berlin","http://www.zeit.de/2004/05/Doppelglosse_S_4"
"Europa braucht Einwanderer","2004.5.30852","2004-01-22","Politik, , Vitorino, Asyl, Einwanderung, Gleichberechtigung, Grundrecht, Islam, Materie, Einwanderung, Europa, Frankreich, Niederlande, Portugal, Afrika, Guantánamo, Sahara","http://www.zeit.de/2004/05/Europa_braucht_Einwanderer"
"Glosse: Militant","2004.5.30853","2004-01-22","Politik, Glosse, Linke, Globalisierung, Kontra, Konferenzen, Bombay, Konzern, Aufrufe, Gesellschaft_und_soziales_Leben, Sozialverhalten, Gewalt, Antiamerikanismus, Linke, Globalisierung, Kontra, Konferenzen, Bombay, Konzern, Aufrufe, Gesellschaft und soziales Leben, Sozialverhalten, Gewalt, Arundhati Roy, Bevölkerung, Geschichte, Gewalt, Irak-Krieg, Rhetorik, Schriftsteller, Terrorismus, Weltsozialforum, Widerstand, Bombay","http://www.zeit.de/2004/05/Glosse_Seite2_a"
"Regierung: IM Maut","2004.5.30854","2004-01-22","Politik, Regierung, Portrait, Werbung_und_Marketing, Image, Affäre, Autobahngebühr, Verkehrspolitik, Ostdeutschland, Transport_und_Verkehr, Verkehr, Portrait, Werbung und Marketing, Image, Affäre, Autobahngebühr, Verkehrspolitik, Ostdeutschland, Transport und Verkehr, Manfred Stolpe, Grüne, CDU, Franziska Eichstädt-Bohlig, Günter Nooke, Horst Friedrich, Edelgard Bulmahn, Bertelsmann Stiftung, Cargolifter, Dirk Fischer, Günther Krause, Marianne Birthler, Renate Schmidt, Stephan Hilsberg, Bonn, Brandenburg, Frankfurt an der Oder","http://www.zeit.de/2004/05/Stolpe"
"Kaffeehaus adieu","2004.5.30855","2004-01-22","Politik, , Starbucks, Alain Ducasse, Flughafen, Gourmet, McDonald's, Student, Frankreich, Miami, Paris","http://www.zeit.de/2004/05/Kaffeehaus_adieu"
"Russland: Tänzchen vorm Kreml-Tor","2004.5.30856","2004-01-22","Politik, Russland, Innenpolitik, Portrait, Staat, Demokratie, Freiheit, Partei, Wahl, Wahlkampf, Präsidentschaftswahl, Kandidaten, Innenpolitik, Portrait, Staat, Demokratie, Freiheit, Partei, Wahl, Wahlkampf, Präsidentschaftswahl, Boris Jelzin, Condoleezza Rice, Wladimir Putin, Russland, Moskau","http://www.zeit.de/2004/05/Chakamada_neu"
"Mannesmann-Prozess: 111 Millionen Peanuts","2004.5.30857","2004-01-22","Politik, Mannesmann-Prozess, Moral, Arbeit, Einkommen, Manager, Prozesse, Kapitalismus, Kriminalitaet, Wirtschaftskriminalitaet, Untreue, Fusion, Moral, Arbeit und Sozialstaat, Einkommen, Manager, Prozesse, Kapitalismus, Kriminalität, Wirtschaftskriminalität, Untreue, Josef Ackermann, Angela Merkel, Klaus Zwickel, Klaus Esser, Mannesmann, Deutsche Bank, Wolfgang Clement, Enron, Gehalt, Joachim Funk, Kapitalismus, Parmalat, Wirtschaftsprüfer, Nordrhein-Westfalen","http://www.zeit.de/2004/05/111_Millionen_Peanuts"
"Aufgerollt","2004.5.30858","2004-01-22","Politik, , Familie, Lehrer, Mord, Opfer, Polizei, Richter, Robert Steinhäuser, Schule, Tatort, Buch, Erfurt","http://www.zeit.de/2004/05/Aufgerollt"
"Österreich: Benitas Kampflächeln","2004.5.30859","2004-01-22","Politik, Österreich, Kandidaten, Bundespräsident, Innenpolitik, Kandidaten, Bundespräsident, Wolfgang Schüssel, ÖVP, Anna Lindh, Außenminister, EU-Außenminister, Heinz Fischer, Nachfolge, Sanktion, Scheidung, Thomas Klestil, Wahlkampf, Österreich, Belgien, Griechenland, Brüssel, New York, Wien","http://www.zeit.de/2004/05/Bupr_8awahl"
"Großbritannien: Der Bastard muss weg!","2004.5.30860","2004-01-22","Politik, Großbritannien, Bevoelkerung, Staatsorgane, Staat, Parlament, Opposition, Medizin, Gesundheitspolitik, Bildungspolitik, Bildung, Regierung, Parteitage, Bevölkerung, Staatsorgane, Staat, Parlament, Opposition, Medizin, Gesundheitspolitik, Bildungspolitik, Bildung, Regierung, Tony Blair, George W. Bush, Gordon Brown, Willy Brandt, Erziehung, Irak-Krieg, Mittelschicht, Pilz, Privatisierung, Reform, Revolte, Steuer, Studiengebühr, Vertrauensfrage, Westend, Widerstand","http://www.zeit.de/2004/05/Old_Labour"
"Der Irak-Krieg war keine humanitäre Intervention","2004.5.30861","2004-01-22","Politik, , Saddam Hussein, Charles Taylor, Diktatur, Genozid, Intervention, Irak, Krieg, Massenvernichtungswaffe, Militäraktion, Terrorismus, Bosnien und Herzegowina, Ruanda, Washington D.C","http://www.zeit.de/2004/05/Der_Irak-Krieg_war_keine_humanitaere_Intervention"
"Essay: Wenn Staaten zerfallen, droht Terror","2004.5.30862","2004-01-22","Politik, Essay, Innere_sicherheit, Terrorismus, Internationale_Beziehungen, Aussenpolitik, Staat, Demokratie, Rechtsstaat, Nationalstaat, Vhb_Zeitgeschichte, Innere Sicherheit, Terrorismus, Internationale Beziehungen, Außenpolitik, Staat, Demokratie, Rechtsstaat, Nationalstaat, Europäische Union, Atomwaffe, Entsorgung, Extremismus, Kapitalismus, Kommunismus, Konflikt, Massenvernichtungswaffe, Regierung, Satellitenfernsehen, Weltkrieg, Afghanistan, USA, China, Europa, Irak, Jordanien, Mazedonien, Nicaragua, Norwegen, Sowjetunion, Türkei, USA, Vietnam, Afrika, Osteuropa","http://www.zeit.de/2004/05/Essay_Cooper"
"Der Bastard muss weg!","2004.5.30863","2004-01-22","Politik, , Tony Blair, Gordon Brown, George W. Bush, Willy Brandt, Allianz, David Kelly, Erziehung, Mittelschicht, Pilz, Reform, Revolte, Steuer, Studiengebühr, Vertrauensfrage, Westend","http://www.zeit.de/2004/05/Der_Bastard_muss_weg_"
"olympia: Auf dem Olymp der Verlogenheit","2004.5.30864","2004-01-22","Dossier, olympia, Leistungssport, Doping, Sportler, Affäre, Prominent, Sportart, Leichtathletik, Sport, Kontrolle, Leistungssport, Doping, Sportler, Affäre, Prominent, Sportart, Leichtathletik, Sport, Arnold Schwarzenegger, Ben Johnson, Carl Lewis, USA, Doping, Dopingverdacht, Douglas, Mexiko, Olympia, Weltrekord, Athen, Los Angeles, San Francisco","http://www.zeit.de/2004/05/Doping_neu"
"olympia: Die sauberen Athleten sind über Jahre betrogen worden","2004.5.30865","2004-01-22","Dossier, olympia, Sport, Sportart, Zeit, Forschung, Leichtathletik, Kosmos, Weltrekord, Portrait, Laufen, Wintersport, Rodeln, Dwain Chambers, Olympia, Ben Johnson, Carl Lewis, Doping, Linford Christie, Madonna, Trainer, Olympiasieger, England, USA, Bochum, Kalifornien, München, Sport, Sportart, Zeit, Natur und Technik, Leichtathletik, Kosmos, Weltrekord, Portrait, Laufen, Wintersport","http://www.zeit.de/2004/05/Marc_Blume"
"interview: Sich quälen statt tricksen","2004.5.30866","2004-01-22","Dossier, interview, Wilhelm Schänzer, Abschreckung, DDR, Marion Jones, Pferdesport, Sporthochschule Köln, Sportler, Weltrekord, China, Missbrauch, Zoll","http://www.zeit.de/2004/05/Interview_Sch_8anzer"
"Die Mannesmann-Chronik: Anerkennung für Klaus Esser","2004.5.30867","2004-01-22","Wirtschaft, Die Mannesmann-Chronik, Kriminalitaet, Wirtschaftskriminalitaet, Untreue, Fusion, Prozesse, Aufsichtsrat, Ermittlung, Einkommen, Arbeit, Manager, Telekommunikationsgesellschaft, Klaus Esser, Josef Ackermann, Klaus Zwickel, Vodafone, Mannesmann, Aufsichtsrat, Dietmar Droste, Fusion, Joachim Funk, KPMG, Landgericht, Wirtschaftsprüfer, Übernahme, Düsseldorf, Kriminalität, Wirtschaftskriminalität, Untreue, Fusion, Prozesse, Aufsichtsrat, Ermittlung, Einkommen, Arbeit und Sozialstaat, Manager","http://www.zeit.de/2004/05/Zeitleiste"
"energie: Der letzte Grüne","2004.5.30868","2004-01-22","Wirtschaft, energie, Portrait, Emissionshandel, Gesetz, Gesetz, Energie, Energiewirtschaft, Strom, Energieversorgung, Alternative_energie, Energie, Grüne, Jürgen Trittin, Renate Künast, Europäische Union, Hans Eichel, E.on, Manfred Stolpe, Bundesrat, Bundestag, CO2, Emissionshandel, Klimaschutz, Kohlendioxid, Ostdeutschland, Shell AG, Strom, Umweltminister, Portrait, Emissionshandel, Gesetz, Gesetz, Energie, Energiewirtschaft, Strom, Energieversorgung","http://www.zeit.de/2004/05/Alternative_Energien"
"funktechnik: Werkzeug für Digitalnomaden","2004.5.30869","2004-01-22","Wirtschaft, funktechnik, Kommunikationstechnik, Informationstechnik, Forschung, Technik, Datentransfer, Sicherheit, Internet, T-Mobile, Vodafone, AOL, British Telecom, France Télécom, UMTS, Wlan, Funktechnik, USA, Europa, Kommunikationstechnik, Informationstechnik, Natur und Technik, Technik, Datentransfer, Sicherheit","http://www.zeit.de/2004/05/WLANS_komma__Haupttext"
"Automarkt: Zuversicht","2004.5.30870","2004-01-22","Wirtschaft, , Macher, BMW, Ford, VW, Fiat, Nissan, Peugeot, Toyota, Volvo, Alfa Romeo, Auto, Daewoo, Focus, Golf, Jaguar, Kia, Lancia, Mazda, PKW, Skoda, Smart, Verband der Automobilindustrie, Westeuropa","http://www.zeit.de/2004/05/Automarkt_Zuversicht"
"Achtung, Hacker hört mit!","2004.5.30871","2004-01-22","Wirtschaft, , Sicherheit, Hacker, Auslese, Flughafen, Geschäftsführer, Internet, Studie, Test","http://www.zeit.de/2004/05/Achtung_Hacker_hoert_mit_"
"die grossen unbekannten: Made in Turkey","2004.5.30872","2004-01-22","Wirtschaft, die grossen unbekannten, Unternehmen, Transport_und_Verkehr, Fahrzeugbau, Betriebswirtschaft, Automobilindustrie, Portrait, Autotyp, Ford, Fiat, Karstadt, Siemens AG, Türkei, Hapag Lloyd, Europa, USA, Istanbul, Bosporus, Harvard, Westeuropa, Unternehmen, Transport und Verkehr, Fahrzeugbau, Betriebswirtschaft, Automobilindustrie, Portrait","http://www.zeit.de/2004/05/Koc"
"argument: Bitte umschalten","2004.5.30873","2004-01-22","Wirtschaft, argument, Medien, Fernsehen, Strukturreform, Rundfunkgebühr, Reform, Erhöhungen, Gebühr, Vhb_Rundfunk, Edmund Stoiber, Peer Steinbrück, Georg Milbradt, ARD, Europäische Union, ZDF, Heide Simonis, ARTE, Gebühr, Intendant, Kinderkanal, Landtag, Ministerpräsident, Bayern, Erfurt, Nordrhein-Westfalen, Sachsen, Schleswig-Holstein, Thüringen, Medien, Fernsehen, Strukturreform, Rundfunkgebühr, Reform, Erhöhungen, Gebühr","http://www.zeit.de/2004/05/Argument05"
"kommunen: Tafelsilber ist tabu","2004.5.30874","2004-01-22","Wirtschaft, kommunen, Portrait, Oberhausen, Bielefeld, Stadt, Länderfinanzen, Innenpolitik, Kommunalpolitik, Kommunen, Staatsverschuldung, Staatsfinanzen, CDU, SPD, Bund der Steuerzahler, Euro, Haushalt, Oberhausen, Stadt, Bielefeld, Kommunen, Niederrhein, Nordrhein-Westfalen, Portrait, Oberhausen, Bielefeld, Stadt, Länderfinanzen, Innenpolitik, Kommunalpolitik, Kommunen, Staatsverschuldung","http://www.zeit.de/2004/05/Haushaltskrise_Kommunen"
"Kuddelmuddel","2004.5.30875","2004-01-22","Wirtschaft, , Microsoft, Apple, Notebook, Europa","http://www.zeit.de/2004/05/Kuddelmuddel"
"Lkw-Maut: Der Gefangene von Toll Collect","2004.5.30876","2004-01-22","Wirtschaft, Lkw-Maut, Verkehrspolitik, Transport_und_Verkehr, Lastkraftwagen, Autobahngebühr, Technik, Forschung, Schadensersatz, Recht, Transport, Gueterverkehr, Einigung, Manfred Stolpe, Bundesregierung, Telekom, DaimlerChrysler, Gerhard Schröder, Boss, Bundeskanzler, Bundesverkehrsministerium, Kredit, LKW, Maut, Vertrag, Verkehrspolitik, Transport und Verkehr, Lastkraftwagen, Autobahngebühr, Technik, Natur und Technik, Schadensersatz, Recht, Transport, Güterverkehr","http://www.zeit.de/2004/05/Toll_Collect"
"Holsten: Vorfreude","2004.5.30877","2004-01-22","Wirtschaft, , Macher, Aktie, BaFin, Bundesanstalt für Finanzdienstleistungsaufsicht, Euro, Familie, Übernahme","http://www.zeit.de/2004/05/Holsten_Vorfreude"
"mannesmann-prozess: Die Gentlemen baten zur Kasse","2004.5.30878","2006-10-24","Wirtschaft, mannesmann-prozess, Chroniken, Fusion, Kriminalitaet, Wirtschaftskriminalitaet, Telekommunikationsgesellschaft, Untreue, Prozesse, Chroniken, Fusion, Kriminalität, Wirtschaftskriminalität, Telekommunikationsgesellschaft, Untreue, Klaus Zwickel, Mannesmann, BASF, DaimlerChrysler, Florian Haffa, Klaus Esser, Vodafone, GlaxoSmithKline, Aktiengesellschaft, Dax-Unternehmen, Dietmar Droste, Gericht, Personalberatung, Universität Hamburg, Vorstand, Düsseldorf","http://www.zeit.de/2004/05/Mannesmann"
"davos: Missmut in Europa","2004.5.30879","2004-01-22","Wirtschaft, davos, Konferenzen, Globalisierung, Wirtschaft_und_Konjunktur, Wirtschaftspolitik, Vhb_Weltwirtschaft, Gipfeltreffen, Konferenzen, Globalisierung, Wirtschaft und Konjunktur, Wirtschaftspolitik, Weltwirtschaft, Forum, General Electric, Globalisierung, Industriebetrieb, Partnerschaft, Schnee, Stabilitätspakt, Umfrage, Volkswirtschaft, Weltsozialforum, Wohlfahrtsstaat, Zulieferer, China, Indien, Japan, USA, Davos, Berlin, Brüssel, Cancún, Europa, Paris","http://www.zeit.de/2004/05/Kolumne_04"
"In Treue fest","2004.5.30880","2004-01-22","Wirtschaft, , Macher, Bundesregierung, DGB, SPD, Wirtschaftspolitik, Wolfgang Clement, Botschaft, Konflikt, Regierung, Schicksal, Sozialdemokratie, Wirtschaftsminister, Öffentlichkeit","http://www.zeit.de/2004/05/In_Treue_fest"
"Preise: Hochgefühl","2004.5.30881","2004-01-22","Wirtschaft, , Macher, Bundesbank, Euro, Inflation, Währung, Italien","http://www.zeit.de/2004/05/Preise_Hochgefuehl"
"mannesmann-prozess: Ein Fall für Kempf","2004.5.30882","2004-01-22","Wirtschaft, mannesmann-prozess, Kriminalitaet, Wirtschaftskriminalitaet, Untreue, Prozesse, Fusion, Verhalten, Psyche_und_Sexualitaet, Staatsanwalt, Unternehmen, Betriebswirtschaft, Manager, Kriminalität, Wirtschaftskriminalität, Untreue, Prozesse, Fusion, Verhalten, Psyche und Sexualität, Staatsanwalt, Unternehmen, Betriebswirtschaft, Josef Ackermann, Klaus Esser, Mannesmann, Vodafone, Klaus Zwickel, Aufsichtsrat, Hans-Joachim Klein, Horst Weyrauch, Hutchison Whampoa, Prozess, Richter, Staatsanwaltschaft, Winfried Hassemer, Berlin, Heidelberg","http://www.zeit.de/2004/05/Portr_8at_Kempf"
"Es lebe das Schlupfloch","2004.5.30883","2004-01-22","Wirtschaft, , Steuer, Angela Merkel, Edmund Stoiber, Gerhard Schröder, Hans Eichel, Flut, Geschichte, Glück, Reform, Steuerreform","http://www.zeit.de/2004/05/Es_lebe_das_Schlupfloch"
"Gesundheitsreform: Selber schuld","2004.5.30884","2004-01-22","Wirtschaft, Gesundheitsreform, Kritik, Gesundheitsreform, Lobbyismus, Macht, Gesundheitswesen, Medizin, Gesundheitspolitik, Kritik, Gesundheitsreform, Lobbyismus, Macht, Gesundheitswesen, Medizin, Ulla Schmidt, Arbeit, Gebühr, Gesundheitssystem, Hygiene, Minister, Opposition, Praxisgebühr, Reform, Berlin","http://www.zeit.de/2004/05/Schmidt_Reform"
"börse: Gescheiterte Experimente","2004.5.30885","2004-01-22","Wirtschaft, börse, Börse, Betriebswirtschaft, Unternehmen, Aktienmarkt, Marktanteil, Frankfurt, Börse, Betriebswirtschaft, Unternehmen, Aktienmarkt, Marktanteil, Frankfurter Börse, Aktie, Nasdaq, Software, Großbritannien, Schweden, Berlin, Düsseldorf, Europa, München","http://www.zeit.de/2004/05/G_B_9arse_Beist_9fck"
"60 Sekunden für den Euro","2004.5.30886","2004-01-22","Wirtschaft, , Arbeitsmarkt, Devisenmarkt, Dollar, Euro, Fest, Finanzminister, Herbst, Minister, Reichtum, Vollbeschäftigung, Wechselkurs, Dubai, Florida, Oder","http://www.zeit.de/2004/05/60_Sekunden_fuer_den_Euro"
"banken: Vorteil der Knirpse","2004.5.30887","2004-01-22","Wirtschaft, banken, Fusion, Bank, Bankenfusion, Börsengang, Geldanlage, Investmentbanking, Kredit, Marketing, USA, Wertpapierhandel","http://www.zeit.de/2004/05/Bankenfusion"
"wall street: Gefangene der Wall Street","2004.5.30888","2004-01-22","Wirtschaft, wall street, Börse, Aktie, Betriebswirtschaft, Unternehmen, Manager, Kursverlust, Geld_und_Boerse, Insiderhandel, Boersenspekulation, Boersenaufsicht, Misstrauen, Börse, Aktie, Betriebswirtschaft, Unternehmen, Manager, Kursverlust, Geld und Börse, Insiderhandel, Börsenspekulation, Börsenaufsicht, Dax, US-Börse, Aktie, Aktiengesellschaft, Dax-Unternehmen, Frankfurter Börse, Nasdaq, Porsche, Softwareunternehmen, Ulrich Hartmann, Unternehmen, Vorstand, WestLB, New York, USA, Europa","http://www.zeit.de/2004/05/G_B_9arse_Wall_Street"
