"title","number","date","keywords","link"
"Terrorismus: Bonn und sein islamistisches Milieu","2009.19.49060","2009-08-28","Politik, Terrorismus, Terrorismus, Deutschland, Islam, Bonn, Terrorismus, Anschlag, Islam, Jörg Ziercke, Moschee, Statistisches Bundesamt, Verfassungsschutz, Video, Pakistan, Berlin, Braunschweig, Hamburg, München, Nordrhein-Westfalen, Rhein","http://www.zeit.de/2009/19/Islamistenszene"
"Ralf Dahrendorf: Das Weltkind","2009.19.49061","2009-06-18","Politik, Ralf Dahrendorf, Soziologie, Wissenschaftler, Ralf Dahrendorf, Helmut Schmidt, Marion Gräfin Dönhoff , Ludwig Erhard, Willy Brandt, Antiamerikanismus, Fritz Stern, Raymond Aron, USA, Ralf Dahrendorf, England, Irak, Europa, Berlin, Brüssel, Paris","http://www.zeit.de/2009/19/Dahrendorf"
"60 Jahre BRD: Das Gerät Gabriele","2009.19.49062","2009-05-06","Politik, 60 Jahre BRD, Georg Wilhelm Friedrich Hegel, Grüne, Helmut Schmidt, Willy Brandt, Ernst Jünger, Sony, Georg Simmel, Werner Sombart, Fernost, Washington D.C","http://www.zeit.de/2009/19/60-Die-Geraeterepublik"
"Saarland: »Nit de Oskar«","2009.19.49063","2009-05-03","Politik, Saarland, Deutsche_Politiker, Saarland, Lafontaine-oskar, Oskar Lafontaine, Heiko Maas, SPD, Saarland, Gerhard Schröder, Die Linke, Eugen Roth, Landtagswahl, Leiharbeit, Ottmar Schreiner, Paintball, Superwahljahr, Umweltministerium, Volksparteien, Berlin, Leipzig, Saar","http://www.zeit.de/2009/19/Portrait-Maas"
"Homosexualität: Asylgrund: Schwul","2009.19.49064","2009-04-29","Politik, Homosexualität, Asyl, Oesterreich, Recht, Homosexualitaet, Homosexualität, Österreich, Eltern, Georgien, Nordafrika, Indien, Iran, Jemen, Mosambik, Russland, Saudi Arabien, Sudan, Wien, Mauretanien, Singapur","http://www.zeit.de/2009/19/A-Asyl"
"Rechtsextremismus: Wahlkampf mit dem NPD-Verbot","2009.19.49065","2009-05-15","Politik, Rechtsextremismus, Holger Hövelmann, NPD, Bundesregierung, CDU, CSU, Ehrhart Körting, KPD, SPD, Bundestagswahlkampf, Bundesverfassungsgericht, Dokumentation, Holocaust, Innenminister, Insolvenz, Verfassungsschutz, Berlin, Bayern, Bremen, Karlsruhe, Mecklenburg-Vorpommern, Rheinland-Pfalz, Sachsen-Anhalt, Schleswig-Holstein","http://www.zeit.de/online/2009/19/npd"
"USA: Obamas neue Wirtschaftsordnung","2009.19.49066","2009-05-02","Politik, USA, Reformpolitik, Wirtschaftsordnung, Nachhaltigkeit, Obama-barack, Usa, Wirtschaft, Industrie, Barack Obama, George W.  Bush, Ronald Reagan, Bill Clinton, Warren Buffett, USA, Dollar, Franklin D. Roosevelt, Gesundheitsreform, Nachhaltigkeit, Pharmakonzern, Präsident, USA, Volkswirtschaft, China, Washington D.C","http://www.zeit.de/2009/19/Obama"
"Rechtsextremismus: Braune Flecken, weiße Flecken","2009.19.49067","2009-04-30","Politik, Rechtsextremismus, Ausländer, Ausländerfeindlichkeit, Bundesinnenministerium, Bundespressekonferenz, Fremdenfeindlichkeit, Jugendgewalt, Jugendliche, Ostdeutschland, Rechtsextremismus, Wolfgang Schäuble, Straftat, Verfassungsschutz","http://www.zeit.de/2009/19/oped-Pfeiffer"
"60 Jahre BRD: Der Kanzler-Test","2009.19.49068","2009-09-04","Politik, 60 Jahre BRD, Politik, Politiker, Geschichte, Bundeskanzler, Deutschland, Deutsche_Politiker, Helmut Kohl, Helmut Schmidt, Konrad Adenauer, Willy Brandt, Angela Merkel, Gerhard Schröder, Herbert Wehner, Oskar Lafontaine, SPD, Kurt Georg Kiesinger, CDU, CSU, FDP, Alex Möller, Bundeskanzler, DDR, Kanzleramt, Sowjetunion, Baden-Württemberg","http://www.zeit.de/2009/19/60-Die-Kanzler"
"Pakistan: Teufel im Paradies","2009.19.49069","2009-07-13","Politik, Pakistan, Pakistan, Taliban, Hillary Clinton, Pakistan, Scharia, Soldat, Taliban, Afghanistan, Islamabad, Europa, Swat-Tal, Washington D.C","http://www.zeit.de/2009/19/Pakistan"
"60 Jahre Grundgesetz: Der Bonner Reflex","2009.19.49070","2009-05-07","Politik, 60 Jahre Grundgesetz, Grundrechte, Verfassung, Verfassungsgericht, Verfassungsrecht, Politiker, Konflikt, Karl Jaspers, Franz Josef Strauß, Bundesregierung, Europäische Union, Arbeitgeberpräsident, Asyl, Bundestag, Bundesverfassungsgericht, Grundgesetz, Grundrecht, Jutta Limbach, Rauchverbot, Schwangerschaftsabbruch, Karlsruhe, Vietnam, Berlin, Brokdorf, Lissabon","http://www.zeit.de/2009/19/60-Grundgesetz"
"Weltwirtschaft: Warum Entglobalisierung gut sein kann","2009.19.49071","2009-05-03","Politik, Weltwirtschaft, Finanzkrise, Globalisierung, Chrysler, Michael Naumann, Agent, Ausbeutung, Bestseller, Callcenter, Delta Airlines, Indien, Rezession, US Airways, China, Israel, Malaysia, Afrika, Asien, Iowa, Kalifornien, Silicon Valley","http://www.zeit.de/2009/19/Zeitgeist-19"
"Wirtschaftskrise: Lob des Sozialstaats","2009.19.49072","2009-05-01","Politik, Wirtschaftskrise, Sozialpolitik, Sozialstaat, Sozialstruktur, Gesine Schwan, Michael Sommer, Angela Merkel, Peer Steinbrück, Altersversorgung, Arbeitgeber, Arbeitskampf, Arbeitslose, Arbeitslosigkeit, Demokratie, Jobcenter, Kurzarbeit, Newsweek, Rentenversicherung, Sozialstaat, USA, Berlin","http://www.zeit.de/2009/19/01-Angst"
"Sri Lanka: Krieg dem Volk","2009.19.49073","2009-04-29","Politik, Sri Lanka, Buergerkrieg, Asien, UN-Sicherheitsrat, Velupillai Prabhakaran, Diaspora, Indien, Krieg, Nationalismus, Rajiv Gandhi, Sri Lanka, Tsunami, Afghanistan, Bosnien und Herzegowina, China, Iran, Kenia, Libyen, Pakistan, Ruanda, Russland, Europa, Nordamerika","http://www.zeit.de/2009/19/Sri-Lanka"
"Deutschland in der Krise: Die Gewerkschaften sind zurück","2009.19.49074","2009-05-01","Wirtschaft, Deutschland in der Krise, Gewerkschaft, Arbeit, Arbeitskampf, Michael Sommer, Frank Walter Steinmeier, Klaus Ernst, SPD, IG Metall, Ver.di, Bernd Riexinger, Berthold Huber, Bundestagswahlkampf, Kurzarbeit, Berlin, Eisenach, Rheinland-Pfalz, Thüringen","http://www.zeit.de/2009/19/Gewerkschaften"
"Wie geht's Deutschland?: Das Lehrstellen-Drama","2009.19.49075","2009-04-30","Wirtschaft, Wie geht's Deutschland?, Ausbildung, Lehrstellenmarkt, Ausbildungsplatz, Handel, Industrie, Unternehmen","http://www.zeit.de/2009/19/Wie-gehts-Deutschland"
"Opel: Die Russen ziehen mit","2009.19.49076","2009-04-30","Wirtschaft, Opel, Automobilindustrie, Russland, Finanzkrise, Frank Walter Steinmeier, Karl-Theodor zu Guttenberg, Franz Vranitzky, Oleg Deripaska, BMW, Fiat, Roland Berger, Opel, Siegfried Wolf, Chrysler, Abwrackprämie, Burkhard Göschel, Pininfarina, MIT, Russland, Graz, Rüsselsheim, Berlin, Europa, Thüringen","http://www.zeit.de/2009/19/Opel"
"Autobau: Notgedrungen","2009.19.49077","2009-04-29","Wirtschaft, Autobau, Autotechnik, Automobilindustrie, Elektroauto, VW, Chrysler, DaimlerChrysler, Dieter Zetsche, Jürgen Schrempp, Abwrackprämie, Arbeitnehmer, Betriebsrat, Daimler AG, Einkommen, US-Dollar, Vorstand, USA, Stuttgart","http://www.zeit.de/2009/19/Kolumne-Daimler"
"Wirtschaftskrise: Fünf Fragen ...","2009.19.49078","2009-04-30","Wirtschaft, Wirtschaftskrise, Finanzkrise, Konjunktur, Rezession, Deutsche Bank, Goldman Sachs, Abwrackprämie, Arbeitslosigkeit, Bankenrettung, Bruttoinlandsprodukt, Deflation, Frühjahrsgutachten, Hedgefonds, Lehman Brothers, USA, China, Frankreich, Spanien, Europa, New York","http://www.zeit.de/2009/19/Optimismus"
"Stiftungen: Barmherzigkeit nach Kassenlage","2009.19.49079","2009-05-04","Wirtschaft, Stiftungen, Stiftung, Finanzkrise, Dividende, Staatsanleihe, Verlust, Vermögen, Vermögensverwaltung, USA","http://www.zeit.de/2009/19/F-Stiftungen"
"Medienkrise: Die Ente vom Ende","2009.19.49080","2009-05-02","Wirtschaft, Medienkrise, Usa, Medien, Medienindustrie, Zeitung, John Kerry, US-Senat, USA, Detroit, Internet, Presse, Washington Post, Zeitung, Afghanistan, Pakistan, USA, New York, Washington D.C., Europa, Kansas, Ohio, Seattle","http://www.zeit.de/2009/19/US-Zeitungskrise"
"Automobilkrise: Voll gegen die Wand","2009.19.49081","2009-04-29","Wirtschaft, Automobilkrise, Automobilindustrie, Industrie, Metallindustrie, Finanzkrise, Oesterreich, General Motors, Kurzarbeit, Zulieferer, Österreich, Graz, Kärnten, Wolfsburg","http://www.zeit.de/2009/19/A-Auto"
