"title","number","date","keywords","link"
"Martin Bäumle: Ein Mann der direkten Rede","2012.29.53855","2012-07-12","Politik, Martin Bäumle, Schweiz, Politbuero, Asyl, Asylrecht","http://www.zeit.de/2012/29/CH-Baeumle"
"Euro-Rettung: Zeit für Demokratie","2012.29.53856","2012-07-12","Politik, Euro-Rettung","http://www.zeit.de/2012/29/01-Euro-Rettung"
"EU-Ratspräsidentschaft: Eine Insel führt Europa","2012.29.53857","2012-07-12","Politik, EU-Ratspräsidentschaft, Zypern","http://www.zeit.de/2012/29/Ratspraesidentschaft-Zypern"
"Rumänien: Ist Rumänien noch eine Demokratie?","2012.29.53858","2012-07-12","Politik, Rumänien","http://www.zeit.de/2012/29/Analyse-Rumaenien"
"Ägypten: Wer regiert Ägypten?","2012.29.53859","2012-07-12","Politik, Ägypten, Aegypten","http://www.zeit.de/2012/29/Analyse-Aegypten"
"Zeitgeist: Der große Gauck...","2012.29.53860","2012-07-12","Politik, Zeitgeist","http://www.zeit.de/2012/29/P-Zeitgeist"
"Altkanzler: Ihm geht’s gold","2012.29.53861","2012-07-21","Politik, Altkanzler, Gerhard-schroeder, Europa, Europapolitik, Agenda-2010","http://www.zeit.de/2012/29/Gerhard-Schroeder"
"Arabischer Frühling: Wie die Revolution gelingt","2012.29.53862","2012-07-21","Politik, Arabischer Frühling, Libyen, Wahl, Revolution, Muammar-al-ghaddafi, Demokratie","http://www.zeit.de/2012/29/P-Oped"
"Fragen Sie Dr. Notter!: Der Fluglärm-Staatsvertrag","2012.29.53863","2012-07-12","Politik, Fragen Sie Dr. Notter!, Schweiz","http://www.zeit.de/2012/29/CH-Notter"
"EU-Außenpolitik: Europa ist keine Insel","2012.29.53864","2012-07-21","Politik, EU-Außenpolitik, Europa, Europapolitik, Aussenpolitik","http://www.zeit.de/2012/29/Europa-Aussenpolitik"
"Donnerstalk: Unbedingt","2012.29.53865","2012-07-12","Politik, Donnerstalk, Oesterreich, Alfred-dorfer, Alfred Dorfer, Recht, Gebühr, Gericht, Natur, Staatsbürgerschaft, Österreich","http://www.zeit.de/2012/29/A-Donnerstalk"
"Syrien: Es gibt ein Leben nach Assad","2012.29.53866","2012-07-12","Politik, Syrien, Syrien, Buergerkrieg, Baschar-al--assad, Rakete, Soldat, Stadt, Syrien, Türkei, Irak, Libyen, Aleppo, Daraa, Homs","http://www.zeit.de/2012/29/Syrien"
"TU Dresden: Keiner will zu kurz kommen","2012.29.53867","2012-07-12","Politik, TU Dresden, Dresden, Sachsen, Hochschule, Exzellenzinitiative, CDU, Bewerbung, Brief, Stanislaw Tillich, Student, Studiengang, Dresden","http://www.zeit.de/2012/29/S-Eliteuni"
"Wahlkampf: Die rot-grüne Illusion","2012.29.53868","2012-07-14","Politik, Wahlkampf, Oesterreich, Politbuero, Regierungswechsel, Grüne, Frank Stronach, Heinz-Christian Strache, ÖVP, SPÖ, Allianz, Minderheitsregierung, Wahlrecht, Österreich, Afghanistan, ESM, Wien","http://www.zeit.de/2012/29/A-Nationalratswahlen"
"Ökonomenpreis: Ich bin ein Euroland, holt mich hier raus","2012.29.53869","2012-07-12","Wirtschaft, Ökonomenpreis","http://www.zeit.de/2012/29/Euro-Krise-Wolfson-Preis"
"Währungsunion: Ohne Zorn","2012.29.53870","2012-07-12","Wirtschaft, Währungsunion","http://www.zeit.de/2012/29/Waehrungsunion"
"Journalismus: Berichte vom Roboter","2012.29.53871","2012-07-12","Wirtschaft, Journalismus, Journalismus, Verlag, Verlagsgewerbe, Redakteur","http://www.zeit.de/2012/29/Boerse-Journalismus"
"Meldegesetz: Ab in den Schredder","2012.29.53872","2012-07-12","Wirtschaft, Meldegesetz","http://www.zeit.de/2012/29/Meldegesetz"
"Quengel-Zone: Hausgemacht","2012.29.53873","2012-07-12","Wirtschaft, Quengel-Zone","http://www.zeit.de/2012/29/Quengelzone"
"Schatzbriefe: Behaltet euer Kleingeld!","2012.29.53874","2012-07-12","Wirtschaft, Schatzbriefe, Geldanlage, Kapitalanlage","http://www.zeit.de/2012/29/F-Schatzbriefe"
"Testament: Ihr letzter Wille?","2012.29.53875","2012-07-12","Wirtschaft, Testament, Testament","http://www.zeit.de/2012/29/F-Testament"
"Ökonomen: Aufrufe: Ohne mich!","2012.29.53876","2012-07-12","Wirtschaft, Ökonomen","http://www.zeit.de/2012/29/Euro-Krise-Oekonomenstreit"
"Vermögensabgabe: Die Tabu-Lösung","2012.29.53877","2012-07-12","Wirtschaft, Vermögensabgabe","http://www.zeit.de/2012/29/Tabu-Loesung"
"Banken: Denen traut niemand mehr","2012.29.53878","2012-07-19","Wirtschaft, Banken, Bank, Management, Barclays-bank","http://www.zeit.de/2012/29/Banken"
"Steuerflucht: Die Reichen verlassen den Süden","2012.29.53879","2012-07-20","Wirtschaft, Steuerflucht, Steuerpolitik, Steuer, Reichtum, Europa, Euro-krise, Euro-zone","http://www.zeit.de/2012/29/Steuersuender"
"Studie: Arme sterben früher","2012.29.53880","2012-07-21","Wirtschaft, Studie, Studie, Armut, Reichtum, Gesundheit","http://www.zeit.de/2012/29/Armut-Reichtum-Gesundheit"
"China: Bitte wachsen","2012.29.53881","2012-07-22","Wirtschaft, China, China, Volkswirtschaft, Wirtschaftspolitik","http://www.zeit.de/2012/29/China-Wirtschaft"
"Benzinpreise: Deutschlands liebster Feind","2012.29.53882","2012-07-22","Wirtschaft, Benzinpreise, Benzinpreis, Erdoel, Lobbyismus","http://www.zeit.de/2012/29/Erdoel-Lobby"
"Dieter Morszeck: Harte Schale, harter Kern","2012.29.53883","2012-07-23","Wirtschaft, Dieter Morszeck, Unternehmen, Management","http://www.zeit.de/2012/29/P-Morszeck"
"Bankenskandal: Moralisch bankrott","2012.29.53884","2012-07-12","Wirtschaft, Bankenskandal, Bank","http://www.zeit.de/2012/29/01-Bankenskandal"
"Griechenland: Griechischer Schein","2012.29.53885","2012-07-11","Wirtschaft, Griechenland, Griechenland, Finanzkrise, Fotografie, Europäische Union, Griechenland, Tourismus, Bank, Bunker, Diebstahl, Geld, Polizei, Wahl, Brot, Euro, Hafen, Schweiz, Steuer, Athen","http://www.zeit.de/2012/29/Interview-Salvatore-Vinci"
"Unternehmer Götz Werner: Firmenpleiten haben mich geprägt","2012.29.53886","2012-07-11","Wirtschaft, Unternehmer Götz Werner, Goetz-w.-werner, Unternehmen, Einzelhandel, Erziehung, Familie, Herz, Hobby, Schiff, Schlecker, Umsatz, Unternehmen","http://www.zeit.de/2012/29/Rettung-Goetz-Werner"
