"title","number","date","keywords","link"
"Doris Schröder-Köpf: Die Erwählte","2000.51.24557","2000-12-14","Politik, Doris Schröder-Köpf, Bundeskanzler, Ehe, Politiker, Doris Schröder-Köpf, Helmut Kohl, Helmut Schmidt, Jean-Paul Sartre, Johannes Rau, Simone De Beauvoir, Bauer Verlag, Single, Augsburg, Bonn, Hannover, München, Wackersdorf","http://www.zeit.de/2000/51/Die_Erwaehlte"
"Europa vor dem GAU","2000.51.24558","2000-12-14","Politik, , Kernkraft, Europa, Siemens AG, Kernkraftwerk, Litauen, Reaktor, Russland, Armenien, USA, Ukraine, Asien, Brüssel, Kyoto, Mitteleuropa","http://www.zeit.de/2000/51/Europa_vor_dem_GAU"
"Deideideideigaga","2000.51.24559","2000-12-14","Politik, , Lernen, Familie und Partnerschaft, Philosophie, Spielzeug, Kinder","http://www.zeit.de/2000/51/Deideideideigaga"
"Raus aus der Sektenecke","2000.51.24560","2000-12-14","Politik, , Religion, Winfried Hassemer, Katholische Kirche, Bundesverfassungsgericht, Bundesverwaltungsgericht, Islamismus, Kirchensteuer, Richter, Sekte, Karlsruhe, Hamburg","http://www.zeit.de/2000/51/Raus_aus_der_Sektenecke"
"Spenden für Ruanda","2000.51.24561","2000-12-14","Politik, , CDU, Ruanda, Bier, Junge Union, Katastrophe, Motorrad, Rechtsanwalt, Revolte, Wald, Spenden, Berlin","http://www.zeit.de/2000/51/Spenden_fuer_Ruanda"
"Tagebuch aus Ramallah","2000.51.24562","2000-12-14","Politik, , Ramallah, Ehud Barak, Jassir Arafat, Tagebuch, Israel, Palästinenser, Gazastreifen, Marokko, Saudi Arabien, Bethlehem, Hebron, Jerusalem, Palästina, Westjordanland","http://www.zeit.de/2000/51/Tagebuch_aus_Ramallah"
"Flüchtlinge","2000.51.24563","2000-12-14","Politik, , UNHCR, Bürgerkrieg, Heimat, Hilfsorganisation, Spendengeld, Vereinte Nationen, Weltkrieg, Bosnien und Herzegowina, Dollar, Kosovo, Krieg, Ruanda, Berlin, Guinea, Moskau, Washington D.C., Westafrika","http://www.zeit.de/2000/51/Fluechtlinge"
"Kerner, Beckmann","2000.51.24564","2000-12-14","Politik, , Peter Voß, ARD, Fleisch, Fußball, Sarah  Ferguson, Tagesschau, Chef, Glück, Qualität, Vertrag, München","http://www.zeit.de/2000/51/Kerner_Beckmann"
"Post-Nizza","2000.51.24565","2000-12-14","Politik, , Alltag, Archiv, Debatte, Erbe, Holocaust-Mahnmal, Krieg, Kunst, Museum, Polen, Schicksal, Geschichte, Europa, Warschau","http://www.zeit.de/2000/51/Post-Nizza"
"Hormonskandale","2000.51.24566","2000-12-14","Politik, , Boris Becker, Bambi, Beziehung, Droge, Flughafen, Rentenreform, Seele, Miami","http://www.zeit.de/2000/51/Hormonskandale"
"","2000.51.24567","2000-12-14","Politik, , Jacques Chirac, Gerhard Schröder, Roland Koch, Außenminister, Brief, Bundeskanzler, EU-Gipfel, Frieden, Gespräch, Glück, Guy Verhofstadt, Ministerpräsident, Palästinenser, Präsident, Wim Kok, Frankreich, Geschichte, Japan, Hessen, Nizza, Tokio","http://www.zeit.de/2000/51/45104"
"Amerikas Erbfolgekrieg","2000.51.24568","2000-12-14","Politik, , George W. Bush, Bill Clinton, Willy Brandt, USA, Gericht, Richard Gephardt, Bagdad, Belgrad, Florida, Nizza, Nordirland, Peking, Pjöngjang, Silicon Valley, Washington D.C","http://www.zeit.de/2000/51/Amerikas_Erbfolgekrieg"
"Ein ganzer Europäer","2000.51.24569","2000-12-14","Politik, , Guy Verhofstadt, Gerhard Schröder, Tony Blair, Belgien, EU-Gipfel, Gleichstellung, Paavo Lipponen, Regierungschef, Europa, Frankreich, Irland, Nizza, Portugal, Ruanda, Rumänien, Spanien, Bonn, Brüssel, Flandern, Paris","http://www.zeit.de/2000/51/Ein_ganzer_Europaeer"
"Von unten statt von oben","2000.51.24570","2000-12-14","Politik, , Roman Herzog, Diplomat, Grundrecht, Internet, Ratifizierung, Verfassung, USA, Debatte, Dänemark, Irland, Minister, Parlament, Republik, USA, Vertrag, Europa, Nizza, Philadelphia","http://www.zeit.de/2000/51/Von_unten_statt_von_oben"
"Zurück zur Natur","2000.51.24571","2000-12-14","Politik, , Grüne, Herbert Gruhl, Robert Jungk, CDU, Joschka Fischer, Petra Kelly, Rudolf Bahro, Bernhard Grzimek, Bundestag, Club of Rome, Eugène Ionesco, Hoimar von Ditfurth, Umweltschutz, Ökologie, Ökologisch-Demokratische Partei","http://www.zeit.de/2000/51/Zurueck_zur_Natur"
"Schlauch-Test","2000.51.24572","2000-12-14","Politik, , Grüne, Rezzo Schlauch, Mercedes, Fritz Kuhn, Auto, Fahrzeug, Mobilität, Partnerschaft, Selbstbewusstsein, Smart, Vernunft, Stuttgart, Schwaben","http://www.zeit.de/2000/51/Schlauch-Test"
"Spione und Ausspionierte","2000.51.24573","2000-12-14","Politik, , Nomos, Helmut Kohl, Otto Schily, Innenministerium, Bundesbeauftragter für Stasi-Unterlagen, Behörde, Erbe, Gespräch, Grundgesetz, Innenminister, Opfer, Stasi, Verfassung","http://www.zeit.de/2000/51/Spione_und_Ausspionierte"
"Die neuen Lehrer","2000.51.24574","2000-12-14","Politik, , Spielzeug, Astrid Lindgren, Karstadt, Harry Potter, Lego, Puppe, Dänemark, Hamburg","http://www.zeit.de/2000/51/Die_neuen_Lehrer"
"Widerwillig ausgestreckte Hand","2000.51.24575","2000-12-14","Politik, , Eurocorps, Europäische Union, Jacques Chirac, Nato, Tony Blair, Allianz, USA, Frankreich, Marathon, Regierungswechsel, Belgien, Großbritannien, Schweden, Türkei, Europa, Berlin, Brüssel, Nizza, Paris, Stockholm, Washington D.C","http://www.zeit.de/2000/51/Widerwillig_ausgestreckte_Hand"
"Ruin auf Raten","2000.51.24576","2000-12-14","Dossier, , Versteigerung, Altbau, Baufinanzierung, Kredit, Wittenberg, Magdeburg","http://www.zeit.de/2000/51/Ruin_auf_Raten"
"Letzte Gebote","2000.51.24577","2000-12-14","Dossier, , Absicherung, Darlehen, Gericht, Ratgeber","http://www.zeit.de/2000/51/Letzte_Gebote"
"Allzu sorglos","2000.51.24578","2000-12-14","Dossier, , SPD, Altbau, Bank, Ostdeutschland, Personal, Scheidung, Städtebau, Wohnungsbau, Konjunktur, Kredit, Verkehr, Nordrhein-Westfalen, Sachsen-Anhalt","http://www.zeit.de/2000/51/Allzu_sorglos"
"Säuberlich aufgeteilt","2000.51.24579","2000-12-14","Wirtschaft, , Architekt","http://www.zeit.de/2000/51/Saeuberlich_aufgeteilt"
"Strittige Werbung","2000.51.24580","2000-12-14","Wirtschaft, , Werbung, Anzeige, Benetton, Bundesgerichtshof, Bundesverfassungsgericht, Grundgesetz, Kinderarbeit, Oliviero Toscani, Stern","http://www.zeit.de/2000/51/Strittige_Werbung"
"Marode Gleise","2000.51.24581","2000-12-14","Wirtschaft, , Bahn, Behörde, Diskriminierung, Intervention, Präsident","http://www.zeit.de/2000/51/Marode_Gleise"
"Streit der Stillhalter","2000.51.24582","2000-12-14","Wirtschaft, , Commerzbank, Dresdner Bank, Merrill Lynch, Aktie, Allianz, Euro, Konjunktur, Privatisierung, Société Générale, Umstrukturierung, Versicherung, Übernahme, Frankreich","http://www.zeit.de/2000/51/Streit_der_Stillhalter"
"Die dritte Revolution","2000.51.24583","2000-12-14","Wirtschaft, , Mitsubishi, Jürgen Schrempp, Carlos Ghosn, Revolution, Nissan, Allianz, Entlassung, Japan, tTokyo, Stuttgart","http://www.zeit.de/2000/51/Die_dritte_Revolution"
"Aus den Fugen geraten","2000.51.24584","2000-12-14","Wirtschaft, , BASF, Dresdner Bank, Lufthansa, Wolfgang Berghofer, Siemens AG, Landgericht, Margrit Lichtinghagen, Südmilch, Berlin, Heidelberg, Neckar, Paraguay","http://www.zeit.de/2000/51/Aus_den_Fugen_geraten"
"Schwergängige Autos","2000.51.24585","2000-12-14","Wirtschaft, , Ferdinand Dudenhöffer, Ford, Opel, VW, Audi, Chrysler, Ferdinand Piëch, Jürgen Schrempp, Auto, Fahrzeug, PKW, Seat, Skoda, England, Frankreich, Niederlande, USA, Westeuropa","http://www.zeit.de/2000/51/Schwergaengige_Autos"
"","2000.51.24586","2000-12-14","Wirtschaft, , Erdöl, Jahreszeit, Konjunktur, Wetter","http://www.zeit.de/2000/51/45066"
"Weihnachtseuro","2000.51.24587","2000-12-14","Wirtschaft, , Bundesregierung, Hans Eichel, Recht, Französisch, Bank, Euro, Geld, Glück, Regierung, Berlin, Oder","http://www.zeit.de/2000/51/Weihnachtseuro"
"Das elektrische Monopoly","2000.51.24588","2000-12-14","Wirtschaft, , RWE, E.on, Veba, Bewag, Viag, Stromkonzern, Strommarkt, Monopoly, Baden-Württemberg, Biblis, Elbe, Stockholm","http://www.zeit.de/2000/51/Das_elektrische_Monopoly"
"Schlanke Verwaltung","2000.51.24589","2000-12-14","Wirtschaft, , Verwaltung, Heide Simonis, Innenministerium, Geld, Landesregierung, Hamburg, Kiel, Sachsen-Anhalt, Schleswig-Holstein","http://www.zeit.de/2000/51/Schlanke_Verwaltung"
"Rettet die WTO","2000.51.24590","2000-12-14","Wirtschaft, , WTO, Grüne, Armut, Bahn, Entwicklungsland, Export, Globalisierung, Umweltschutz, WTO, Seattle","http://www.zeit.de/2000/51/Rettet_die_WTO"
"Grüner Strom","2000.51.24591","2000-12-14","Wirtschaft, , Energie, Sonne, Strom, Stromverbrauch, Wasser, Wasserkraft","http://www.zeit.de/2000/51/Gruener_Strom"
"","2000.51.24592","2000-12-14","Wirtschaft, , Aktie, Arbeit, Börse, Eltern, Erzeuger, Gedicht, Geld, Geschichte, Glaube, Märchen, Traum","http://www.zeit.de/2000/51/45071"
"Immer das Heft in der Hand halten","2000.51.24593","2000-12-14","Wirtschaft, , Henning Schulte-Noelle, BASF, Bayer AG, Dresdner Bank, Paul Achleitner, Siemens AG, Beiersdorf AG, E.on, Allianz, HypoVereinsbank, Unternehmen, Gespräch, Pharmakonzern","http://www.zeit.de/2000/51/Immer_das_Heft_in_der_Hand_halten"
"Fortbildung für alle Arbeitslosen","2000.51.24594","2000-12-14","Wirtschaft, , Grüne, SPD, Ulla Schmidt, Arbeitsmarktreform, Thea Dückert","http://www.zeit.de/2000/51/Fortbildung_fuer_alle_Arbeitslosen"
"Wirtschaftssanktionen sind beliebt und meistens nutzlos","2000.51.24595","2000-12-14","Wirtschaft, , Fidel Castro, Atombombe, Entwicklungsland, Fleisch, ILO, Birma, Irak, Kuba, USA, Florida","http://www.zeit.de/2000/51/Wirtschaftssanktionen_sind_beliebt_und_meistens_nutzlos"
"Studieren im Ausland","2000.51.24596","2000-12-14","Wirtschaft, , Hochschule, Nachwuchs, Sprache, Student, Frankreich, Osteuropa","http://www.zeit.de/2000/51/Studieren_im_Ausland"
"Daimlers Fehler","2000.51.24597","2000-12-14","Wirtschaft, , Jürgen Schrempp, BMW, Chrysler, DaimlerChrysler, General Motors, Daewoo, Daimler AG, Rover, Automobilindustrie, David Marsh, Fusion, Integration, Prozess, Schiff, US-Dollar, Unternehmen, Verlust, Übernahme, Hoffnung, USA","http://www.zeit.de/2000/51/Daimlers_Fehler"
"Auf Schnäppchenjagd","2000.51.24598","2000-12-14","Wirtschaft, , Rabattgesetz, Karstadt, Dior, Douglas, Heimarbeit","http://www.zeit.de/2000/51/Auf_Schnaeppchenjagd"
"Im Griff des Architekten","2000.51.24599","2000-12-14","Wirtschaft, , Europäische Union, Akustik, Architekt, Mario Monti, Verbraucherschutz, Griechenland","http://www.zeit.de/2000/51/Im_Griff_des_Architekten"
"Bewegung an der Börse","2000.51.24600","2000-12-14","Wirtschaft, , Dow Jones, Morgan Stanley, Aktie, DWS, Fonds, US-Dollar, US-Wirtschaft, New York, Asien, Europa","http://www.zeit.de/2000/51/Bewegung_an_der_Boerse"
"www.oeko-invest.de","2000.51.24601","2000-12-14","Wirtschaft, , Aktie, Anleihe, Geldanlage, Redaktion","http://www.zeit.de/2000/51/www_oeko-invest_de"
"Jobs für Asylbewerber?","2000.51.24602","2000-12-14","Wirtschaft, , Arbeitsamt, Bundesregierung, Ausländer, Arbeitgeber, Arbeitserlaubnis, Arbeitslose, Arbeitslosenquote, Arbeitsministerium, Asyl, Courage, Ernte, Flüchtling, Gaststätte, Rechtsradikalismus, Rente, Schwarzarbeit, Sozialversicherung, Tariflohn, Jugoslawien, Baden-Württemberg, Bayern, Osteuropa","http://www.zeit.de/2000/51/Jobs_fuer_Asylbewerber_"
