"title","number","date","keywords","link"
"Rußland: Ein Flughafendirektor will Touristen nach Tschukotka locken: Rote Sonne überm Packeis |","1992.50.4896","1992-12-04","DIE ZEIT, Rußland: Ein Flughafendirektor will Touristen nach Tschukotka locken","http://www.zeit.de/1992/50/rote-sonne-ueberm-packeis"
"Nach der Wahl und dem Abtreibungs-Referendum in Irland: Die Konservativen verlieren an Einfluß: Die Nase voll |","1992.50.4897","1992-12-04","DIE ZEIT, Nach der Wahl und dem Abtreibungs-Referendum in Irland: Die Konservativen verlieren an Einfluß, Wahl, Abtreibung, Bischofskonferenz, Chaos, Erpressung, Gericht, Gesundheit, Irland, Kirche, Mary Robinson, Parlamentswahl, Schwangerschaftsabbruch, Selbstmord, Wüste, England, Dublin","http://www.zeit.de/1992/50/die-nase-voll"
"Bei den Wahlen am 20. Dezember stimmen die Serben auch über die Fortsetzung des Krieges in Bosnien ab: Die Illusion des normalen Lebens |","1992.50.4898","1992-12-04","DIE ZEIT, Bei den Wahlen am 20. Dezember stimmen die Serben auch über die Fortsetzung des Krieges in Bosnien ab, Bosnien und Herzegowina, Autotest, Bosnien und Herzegowina, Präsidentschaft, Serbien, Belgrad, Jugoslawien, Kroatien, Sarajevo, Bonn, Zagreb","http://www.zeit.de/1992/50/die-illusion-des-normalen-lebens"
"Streben nach Konsens |","1992.50.4899","1992-12-04","DIE ZEIT, , Boris Jelzin, Ideologie, Juri Andropow, Kabinett, Regierung, Rüstungsindustrie, Vizepräsident, Präsident, Russland, Wahl, Moskau","http://www.zeit.de/1992/50/streben-nach-konsens"
"Worte der Woche |","1992.50.4900","1992-12-04","DIE ZEIT, , Gerhard Schröder, Helmut Kohl, SPD, Björn Engholm, Rainer Barzel, Konzentrationslager, Mord, Parlament, Selbstjustiz, Simon Wiesenthal, Solidaritätszuschlag, Vergewaltigung, Windsor, Israel, Bergen-Belsen, Dachau, Niedersachsen, Thüringen, Wien","http://www.zeit.de/1992/50/worte-der-woche"
"Verlangen nach mehr Eigenständigkeit: Die Ostdeutschen finden längst nicht alles gut, was ihnen der Westen beschert: Schluß mit der Schocktherapie |","1992.50.4901","1992-12-04","DIE ZEIT, Verlangen nach mehr Eigenständigkeit: Die Ostdeutschen finden längst nicht alles gut, was ihnen der Westen beschert, CDU, Wolfgang Schäuble, Birgit Breuel, DDR, Ostdeutschland, Renate Schmidt, Selbstbestimmung, Separatismus, Wiedervereinigung, MIT, Berlin","http://www.zeit.de/1992/50/schluss-mit-der-schocktherapie"
"Die Enquetekommission des Bundestages inspiziert „Geschichte und Folgen der SED-Diktatur in Deutschland“: Haschen nach Wind? |","1992.50.4902","1992-12-04","DIE ZEIT, Die Enquetekommission des Bundestages inspiziert „Geschichte und Folgen der SED-Diktatur in Deutschland“, CDU, Rainer Eppelmann, Wolfgang Templin, Christoph Dieckmann, DDR, Klagemauer, Rudolf Bahro, Bayern, Berlin, Bonn, Frankfurt an der Oder, Leipzig, München","http://www.zeit.de/1992/50/haschen-nach-wind"
"Zeitspiegel |","1992.50.4903","1992-12-04","DIE ZEIT, , Bill Clinton, Lufthansa, Benzin, Berichterstattung, Bundesgerichtshof, Diesel, Freihandelszone, Ostdeutschland, Patent, Bosnien und Herzegowina, Bulgarien, Kanada, Mexiko, Rumänien, Dresden, Sachsen, Bayern, Belgrad, München, Washington D.C","http://www.zeit.de/1992/50/zeitspiegel"
"Mit einer Reform von oben versucht die englische Königin die institutionelle Krise zu entschärfen: Ein kluger Schachzug der Queen |","1992.50.4904","1992-12-04","DIE ZEIT, Mit einer Reform von oben versucht die englische Königin die institutionelle Krise zu entschärfen, Elisabeth II, Margaret Thatcher, Queen, John Major, Königshaus, Monarchie, Staatsoberhaupt, Windsor, England, Großbritannien, MIT, Reform, London","http://www.zeit.de/1992/50/ein-kluger-schachzug-der-queen"
"Von der Asyldebatte und dem Terror in Deutschland unberührt: Inmitten der Herbststürme richtet sich der Kanzler aufs Überwintern ein: Bereit sein scheint alles |","1992.50.4905","1992-12-04","DIE ZEIT, Von der Asyldebatte und dem Terror in Deutschland unberührt: Inmitten der Herbststürme richtet sich der Kanzler aufs Überwintern ein, Helmut Kohl, CDU, SPD, Volker Rühe, Gerhard Schröder, Norbert Blüm, Theo Waigel, François Mitterrand, Hans-Ulrich Klose, Advent, Asylrecht, Aussiedler, CSU-Fraktion, Herbst, Kanzleramt, Leuna, Opposition, Rechtsradikalismus, Adria, Bonn, Hamburg, Maastricht, Paris","http://www.zeit.de/1992/50/bereit-sein-scheint-alles"
"In Europa sind die rechtsextremen Parteien auf dem Vormarsch. Sie finden immer mehr Anhänger in der Mittelschicht. Die Demokraten reagieren hilflos: Eine Schneise ins Establishment |","1992.50.4906","1992-12-04","DIE ZEIT, In Europa sind die rechtsextremen Parteien auf dem Vormarsch. Sie finden immer mehr Anhänger in der Mittelschicht. Die Demokraten reagieren hilflos, Europa, Jean-Marie Le Pen, Jörg Haider, Franz Schönhuber, FPÖ, Frankreich, Francesco Cossiga, Front National, Rechtsextremismus, Umberto Bossi, Österreich, Italien, Paris, Westeuropa","http://www.zeit.de/1992/50/eine-schneise-ins-establishment"
"„Rußland muß nicht zerfallen“ |","1992.50.4907","1992-12-04","DIE ZEIT, , Boris Jelzin, Rubel, Russland, Währung, USA, Ukraine, Moskau, München, Texas","http://www.zeit.de/1992/50/russland-muss-nicht-zerfallen"
"Wenig Hoffnung auf Karlsruhe |","1992.50.4908","1992-12-04","DIE ZEIT, , CDU, Ernst-Wolfgang Böckenförde, SPD, Karlsruhe, CSU, Grüne, Hans Hugo Klein, Abtreibung, Bundesverfassungsgericht, Gericht, Hoffnung, Paul Kirchhof, Richter, Bonn, Braunschweig","http://www.zeit.de/1992/50/wenig-hoffnung-auf-karlsruhe"
"In Italien erstarkt die radikale lombardische Partei Lega Nord – ihr Führer Umberto Bossi ruft zur Trennung von Süditalien auf: Carabinieri gegen Christdemokraten |","1992.50.4909","1992-12-04","DIE ZEIT, In Italien erstarkt die radikale lombardische Partei Lega Nord – ihr Führer Umberto Bossi ruft zur Trennung von Süditalien auf, Italien, Bettino Craxit , Kroatien, Slowenien, Rom, Bayern, Helsinki","http://www.zeit.de/1992/50/carabinieri-gegen-christdemokraten"
"Die Amerikaner wollen in Somalia intervenieren – im Namen der UNO, aber unter eigenem Kommando: „Wir müssen führen“ |","1992.50.4910","1992-12-04","DIE ZEIT, Die Amerikaner wollen in Somalia intervenieren – im Namen der UNO, aber unter eigenem Kommando, George W.  Bush, Bill Clinton, Somalia, Vereinte Nationen, Golfkrieg, Intervention, Militäraktion, Pentagon, Präsident, Präsidentschaft, Öffentlichkeit, Bosnien und Herzegowina, USA, Washington D.C., Beirut, Mogadischu, New York","http://www.zeit.de/1992/50/wir-muessen-fuehren"
"Schweden: Ein Störfall im Kernkraftwerk Barsebäck setzt die Energiepolitiker unter Druck: Der verdrängte Ausstieg |","1992.50.4911","1992-12-04","DIE ZEIT, Schweden: Ein Störfall im Kernkraftwerk Barsebäck setzt die Energiepolitiker unter Druck, Kernkraftwerk, Wirtschaftsministerium, Schweden, Vattenfall, Atomenergie, Atomkraft, Olof Palme, Strompreis, Dänemark, Norwegen, Harrisburg, Kopenhagen","http://www.zeit.de/1992/50/der-verdraengte-ausstieg"
"Australien: Der fünfte Kontinent droht in neoliberale Wirtschaftspolitik zurückzufallen: Zielscheibe Sozialstaat |","1992.50.4912","1992-12-04","DIE ZEIT, Australien: Der fünfte Kontinent droht in neoliberale Wirtschaftspolitik zurückzufallen, Wirtschaftspolitik, Bundesregierung, Sozialstaat, Australien, Altersversorgung, Arbeitsrecht, Gewerkschaft, Neoliberalismus, Neuseeland, Canberra, Melbourne","http://www.zeit.de/1992/50/zielscheibe-sozialstaat"
"Autoindustrie: Innocenti am Ende, Maserati und Ferrari in der Krise: Das lange Sterben der Exoten |","1992.50.4913","1992-12-04","DIE ZEIT, Autoindustrie: Innocenti am Ende, Maserati und Ferrari in der Krise, Fiat, Ferrari, Alfa Romeo, British Leyland, Gewerkschaft, Italien, Lancia, Maserati, England, Indien, Sterben, USA, Mailand, Turin","http://www.zeit.de/1992/50/das-lange-sterben-der-exoten"
"John Maynard Keynes begründete die moderne Konjunkturpolitik. Ein Jahrzehnt lang waren seine Ideen verpönt, nun werden sie wieder modern: Der Staat als Hebel |","1992.50.4914","1992-12-04","DIE ZEIT, John Maynard Keynes begründete die moderne Konjunkturpolitik. Ein Jahrzehnt lang waren seine Ideen verpönt, nun werden sie wieder modern, John Maynard Keynes, Richard Nixon, Franklin D. Roosevelt, Virginia Woolf, Berlin, Europa, Versailles, Westeuropa","http://www.zeit.de/1992/50/der-staat-als-hebel"
"Rußland (II): Boris Jelzins Wirtschaftspolitik nach dem Moskauer Volkskongreß. Kritische Bilanz der Reformen aus der Sicht eines Ökonomen: Vertane Chancen |","1992.50.4915","1992-12-04","DIE ZEIT, Rußland (II): Boris Jelzins Wirtschaftspolitik nach dem Moskauer Volkskongreß. Kritische Bilanz der Reformen aus der Sicht eines Ökonomen, Boris Jelzin, Russland, Wirtschaftspolitik, Jegor Gajdar, Inflation, Kapitalflucht, Rubel, Währung, Sowjetunion, Moskau","http://www.zeit.de/1992/50/vertane-chancen"
"Ostdeutschland: Die Bundesregierung hat mit einiger Verspätung die aktive Industriepolitik entdeckt: Kohls Wende mit Macken |","1992.50.4916","1992-12-04","DIE ZEIT, Ostdeutschland: Die Bundesregierung hat mit einiger Verspätung die aktive Industriepolitik entdeckt, Helmut Kohl, Bundesregierung, Johannes Ludewig, Björn Engholm, Jürgen Möllemann, SPD, Industriepolitik, Kanzleramt, Ostdeutschland, Treuhandanstalt, Unternehmen, MIT, Sachsen","http://www.zeit.de/1992/50/kohls-wende-mit-macken"
"Sparmaßnahmen: Weder Politiker noch Wissenschaftler haben ein klares Konzept zur Sanierung des Haushalts: Kopflos ins Chaos |","1992.50.4917","1992-12-04","DIE ZEIT, Sparmaßnahmen: Weder Politiker noch Wissenschaftler haben ein klares Konzept zur Sanierung des Haushalts, Theo Waigel, Thilo Sarrazin, Wissenschaft, Sanierung, Bundesanstalt für Arbeit, Finanzministerium, Boss, Deutsches Institut für Wirtschaftsforschung, Landwirtschaft, Ostdeutschland, Wohnungsbau, Chaos, Bonn, Berlin, Brüssel, Rheinland-Pfalz","http://www.zeit.de/1992/50/kopflos-ins-chaos"
"Waffenhandel: Besorgt |","1992.50.4918","1992-12-04","DIE ZEIT, Waffenhandel, Michael Glos, Brief, Bundeskanzler, Export, Gefängnis, Konjunktur, Regierung, Richter, Strafe, Straftat, Terrorbekämpfung, Waffenhandel, Türkei","http://www.zeit.de/1992/50/besorgt"
"Markt-Report: Gepflegte Kurse |","1992.50.4919","1992-12-04","DIE ZEIT, Markt-Report, Dax, Deutsche Bank, VW, Aktie, Aktienindex, Aktienmarkt, Börse, Industrie, Rallye, Wunder, England","http://www.zeit.de/1992/50/gepflegte-kurse"
"Cocom: Die Exportbeschränkungen werden nur langsam gelockert. Neue Mitglieder müssen sich zu strikten Kontrollen verpflichten: Erbe des Kalten Krieges |","1992.50.4920","1992-12-04","DIE ZEIT, Cocom: Die Exportbeschränkungen werden nur langsam gelockert. Neue Mitglieder müssen sich zu strikten Kontrollen verpflichten, Chemieprodukt, Island, Kuba, Russland, Technologie, Vereinte Nationen, Australien, China, Erbe, Nordkorea, Polen, Rumänien, Sowjetunion, Ungarn, Vietnam, Bonn, Paris, Westeuropa","http://www.zeit.de/1992/50/erbe-des-kalten-krieges"
"Karrieren: Den Steakhaus-König Eugen Block kann sein Mißerfolg mit der Hamburg Airlines nicht bremsen: Kratzer am Ego |","1992.50.4921","1992-12-04","DIE ZEIT, Karrieren: Den Steakhaus-König Eugen Block kann sein Mißerfolg mit der Hamburg Airlines nicht bremsen, Hamburg, DAG, Gastronomie, MIT, Nürnberg, Saarland, Berlin, Brüssel, Frankfurt am Main, München, Saarbrücken, Warschau","http://www.zeit.de/1992/50/kratzer-am-ego"
"Mercedes-Benz: Mitten in einer schweren Absatzkrise wechselt das Autounternehmen seinen Chef: Ein neuer Stern |","1992.50.4922","1992-12-04","DIE ZEIT, Mercedes-Benz: Mitten in einer schweren Absatzkrise wechselt das Autounternehmen seinen Chef, Carl Horst Hahn, Helmut Werner, Werner Niefer, BMW, Edzard Reuter, Stern, Alfred Herrhausen, Continental, Jürgen Hubbert, Mercedes-Benz, LKW, Chef, Südkorea, Bad Homburg, Berlin, Hannover, Rastatt","http://www.zeit.de/1992/50/ein-neuer-stern"
"Dritte Welt: Die Ernährungskonferenz will den Kampf gegen den Hunger forcieren: Mehr als ein guter Vorsatz? |","1992.50.4923","1992-12-04","DIE ZEIT, Dritte Welt: Die Ernährungskonferenz will den Kampf gegen den Hunger forcieren, Weltgesundheitsorganisation, Bevölkerungsgruppe, FAO, Gesundheitsvorsorge, Lebensmittelindustrie, Guatemala, Unterernährung, Rom, Washington D.C","http://www.zeit.de/1992/50/mehr-als-ein-guter-vorsatz"
"Beim Agrarstreit entscheidet sich Europas Zukunft: Seite an Seite |","1992.50.4924","1992-12-04","DIE ZEIT, Beim Agrarstreit entscheidet sich Europas Zukunft, Bundesbank, Jacques Chirac, Charles de Gaulle, Frankreich, Agrarpolitik, Geldpolitik, Inflation, Premierminister, Raymond Barre, Vertrauensfrage, Währung, Europa, USA, Brüssel, Maastricht, Paris","http://www.zeit.de/1992/50/seite-an-seite"
"Bonner Kulisse |","1992.50.4925","1992-12-04","DIE ZEIT, , Volker Rühe, Heinz Riesenhuber, CDU, Unionsfraktion, Golfkrieg, Ingrid Matthäus-Maier, Java, Minister, Ruhestand, Stress, Urlaub, Singapur, Südostasien","http://www.zeit.de/1992/50/bonner-kulisse"
"Rudolf Engen: Oh Weiwei |","1992.50.4926","1992-12-04","DIE ZEIT, Rudolf Engen, EMMA, Emanzipation, Frauenbewegung, Gleichberechtigung, Bundesverfassungsgericht, Marketing, Ostern","http://www.zeit.de/1992/50/oh-weiwei"
"Ozonloch: Behütet |","1992.50.4927","1992-12-04","DIE ZEIT, Ozonloch, Autobahn, Fabrik, Hautkrebs, Müll, Ozonloch, Rezession, Steuer, Umsatz","http://www.zeit.de/1992/50/behuetet"
"ZEIT/Südprojekt-Prognose: Wenig Lichtblicke |","1992.50.4928","1992-12-04","DIE ZEIT, ZEIT/Südprojekt-Prognose, Bundesbank, Dollar, Finanzpolitik, Haushalt, Hoffnung, Kapitalmarkt, Konjunktur, Präsident, Wahl, USA, Atlantik","http://www.zeit.de/1992/50/wenig-lichtblicke"
"Ruhrkohle: Der Absatz sinkt, der Vorstand wächst: Holzen und Forsten |","1992.50.4929","1992-12-04","DIE ZEIT, Ruhrkohle: Der Absatz sinkt, der Vorstand wächst, Absatz, Vorstand, Aufsichtsrat, Personalabbau, Ruhrkohle","http://www.zeit.de/1992/50/holzen-und-forsten"
"EG-Binnenmarkt: Der Wegfall der Warenkontrollen an den Grenzen innerhalb Europas erhöht Kosten und Bürokratie: Schlagbaum im Betrieb |","1992.50.4930","1992-12-04","DIE ZEIT, EG-Binnenmarkt: Der Wegfall der Warenkontrollen an den Grenzen innerhalb Europas erhöht Kosten und Bürokratie, Bürokratie, Binnenmarkt, Bundesverband der Deutschen Industrie, Tyll Necker, Umsatzsteuer, Unternehmen, Hongkong, Bonn, Brüssel, Nordrhein-Westfalen, Paris, Saarland, Saarlouis","http://www.zeit.de/1992/50/schlagbaum-im-betrieb"
