"title","number","date","keywords","link"
"Thomas Hobbes’ Kritik des Common Law: Die Macht des Souveräns |","1992.42.4600","1992-10-09","DIE ZEIT, Thomas Hobbes’ Kritik des Common Law","http://www.zeit.de/1992/42/die-macht-des-souveraens"
"In Angolas ersten freien Wahlen haben die Sozialisten ihre Macht behauptet: Neue Aufgaben für alte Kader |","1992.42.4601","1992-10-09","DIE ZEIT, In Angolas ersten freien Wahlen haben die Sozialisten ihre Macht behauptet, Jonas Savimbi, Alte, Horst Bieber, Angola, Dürre, Erdrutsch, Landwirtschaft, Mine, Privatisierung, Stichwahl, Streitkräfte, Vertreibung, Waffenruhe, Kuba, Mosambik, Südafrika, Moskau, Rom","http://www.zeit.de/1992/42/neue-aufgaben-fuer-alte-kader"
"Volker Rühe und die höheren Weihen der Macht: Ist er zu ungeduldig? |","1992.42.4602","1992-10-09","DIE ZEIT, Volker Rühe und die höheren Weihen der Macht, Volker Rühe, FDP, Helmut Schmidt, Bundeswehr, Finanzminister, Kanzleramt, Minister, Ministerium, Selbstbewusstsein, Verteidigungsminister, Karriere","http://www.zeit.de/1992/42/ist-er-zu-ungeduldig"
"Der Streit um Manfred Stolpe kommt nicht zur Ruhe: Kirchenmann, Diplomat, Politiker – wie weit durfte der Konsistorialpräsident gegenüber der Stasi gehen?: Am Schnittpunkt von Macht und Ohnmacht |","1992.42.4603","1992-10-09","DIE ZEIT, Der Streit um Manfred Stolpe kommt nicht zur Ruhe: Kirchenmann, Diplomat, Politiker – wie weit durfte der Konsistorialpräsident gegenüber der Stasi gehen?, Rainer Eppelmann, Richard Schröder, CDU, Evangelische Kirche, Stasi, Bischof, DDR, Freya Klier, Humboldt-Universität, Ministerium für Staatssicherheit, Wolfgang Templin","http://www.zeit.de/1992/42/am-schnittpunkt-von-macht-und-ohnmacht"
"Parteispendenprozeß: Ende mit Schrecken |","1992.42.4604","1992-10-09","DIE ZEIT, Parteispendenprozeß, CDU, Bundesgerichtshof, Geldstrafe, Justiz, Landgericht, Parteispende, Richter, Widerstand, Bundesrepublik Deutschland, MIT","http://www.zeit.de/1992/42/ende-mit-schrecken"
"Ist Volker Rühe auf dem Sprung ins Kanzleramt? Der Minister winkt ab. Aber er hält sich mit fünfzig Jahren durchaus für geeignet, „schwierige Ämter innezuhaben“: „Ich gehöre zur Führungsgeneration“ |","1992.42.4605","1992-10-09","DIE ZEIT, Ist Volker Rühe auf dem Sprung ins Kanzleramt? Der Minister winkt ab. Aber er hält sich mit fünfzig Jahren durchaus für geeignet, „schwierige Ämter innezuhaben“, Volker Rühe, CDU, Helmut Schmidt, Oskar Lafontaine, Minister, SPD, Europäische Gemeinschaft, Vereinte Nationen, Bundestag, Ostdeutschland, Solidaritätszuschlag, Europa, Jugoslawien, MIT, Spanien, Maastricht, Osteuropa, Westeuropa, Bremen","http://www.zeit.de/1992/42/ich-gehoere-zur-fuehrungsgeneration"
"Gerd Bucerius zu Fragen der Zeit: Den Helden stürzen? |","1992.42.4606","1992-10-09","DIE ZEIT, Gerd Bucerius zu Fragen der Zeit, Karl Schiller, SPD, CDU, Oskar Lafontaine, DDR, Darlehen, Eigentum, Lothar de Maizière, Misstrauensvotum, Vermögen, Wiedervereinigung, Übernahme, Gerd Bucerius, Frankreich, Sowjetunion, Bonn","http://www.zeit.de/1992/42/den-helden-stuerzen"
"SPD-Linke in der Offensive: Wird Björn Engholm auf dem Sonderparteitag scheitern?: Keiner will den Brutus spielen |","1992.42.4607","1992-10-09","DIE ZEIT, SPD-Linke in der Offensive: Wird Björn Engholm auf dem Sonderparteitag scheitern?, Björn Engholm, Gerhard Schröder, Bundesregierung, Grüne, CDU, CSU, Oskar Lafontaine, SPD-Fraktion, Asyl, Asylrecht, Bundesratsinitiative, Militärpolitik, Sonderparteitag, Baden-Württemberg, Hannover","http://www.zeit.de/1992/42/keiner-will-den-brutus-spielen"
"Auf dem Bremer Parteitag bewies die FDP, daß ihr die Koalition wichtiger ist als ein eigenes Profil: Prinzipien sind nicht mehr gefragt |","1992.42.4608","1992-10-09","DIE ZEIT, Auf dem Bremer Parteitag bewies die FDP, daß ihr die Koalition wichtiger ist als ein eigenes Profil, FDP, Hans-Dietrich Genscher, Jörg Haider, Manfred Gerlach, Burkhard Hirsch, Gerhart Baum, Asylrecht, Plenum, Wolfgang Kubicki, Bremen, Parteitag, Pirna, Sachsen","http://www.zeit.de/1992/42/prinizpien-sind-nicht-mehr-gefragt"
"Die Männer-Bastionen wanken: Nie zuvor bewarben sich in Amerika so viele Frauen für einen Sitz im Kongreß: Die Töchter des Zorns |","1992.42.4609","1992-10-09","DIE ZEIT, Die Männer-Bastionen wanken: Nie zuvor bewarben sich in Amerika so viele Frauen für einen Sitz im Kongreß, USA, Abgeordnetenhaus, USA, Repräsentantenhaus, Washington D.C., Kalifornien, New York, Georgia, Illinois, Pennsylvania, San Francisco","http://www.zeit.de/1992/42/die-toechter-des-zorns"
"Wolfgang Ebert: Mein Kohl |","1992.42.4610","1992-10-09","DIE ZEIT, Wolfgang Ebert, Bundeskanzler, Frieden, Hoffnung, Kakao, Opposition, Wasser, Bundesrepublik Deutschland, Wolfgang Ebert","http://www.zeit.de/1992/42/mein-kohl"
"ARD-Personalpolitik: Makler unter sich |","1992.42.4611","1992-10-09","DIE ZEIT, ARD-Personalpolitik, CDU, Manfred Schell, SPD, Franz Josef Strauß, Günter Struve, Peter Voß, WDR, ZDF, MDR, Bodo H. Hauser, Nachfolge, Berlin","http://www.zeit.de/1992/42/makler-unter-sich"
"Wie das österreichische Bundesheer Blauhelme ausbildet: Haudegen sind nicht gefragt |","1992.42.4612","1992-10-09","DIE ZEIT, Wie das österreichische Bundesheer Blauhelme ausbildet, Vereinte Nationen, Verteidigungsministerium, Volker Rühe, Auslandseinsatz, Blauhelm, Bundesheer, Bundestag, Soldat, Somalia, Blauhelm, Israel, Syrien, Zypern, Österreich, Wien, Beirut, Graz, Kuwait","http://www.zeit.de/1992/42/haudegen-sind-nicht-gefragt"
"Bei einem Patt im Präsidentschaftskampf: Wenn der Kongreß entscheidet... |","1992.42.4613","1992-10-09","DIE ZEIT, Bei einem Patt im Präsidentschaftskampf, Bill Clinton, George W.  Bush, Ross Perot, Thomas Jefferson, Columbia, Präsident, Präsidentschaftswahl, Repräsentantenhaus, Stichwahl, USA, Washington D.C","http://www.zeit.de/1992/42/wenn-der-kongress-entscheidet"
"Europa: Die wirtschaftlichen Vorteile einer gemeinsamen Währung: Bollwerk gegen Spekulanten |","1992.42.4614","1992-10-09","DIE ZEIT, Europa: Die wirtschaftlichen Vorteile einer gemeinsamen Währung, Bundesbank, Bundesregierung, Helmut Kohl, Dresdner Bank, Jacques Delors, Binnenmarkt, Europa, Währung, Bonn, Maastricht","http://www.zeit.de/1992/42/bollwerk-gegen-spekulanten"
"Autoseller: Langsame Talfahrt |","1992.42.4615","1992-10-09","DIE ZEIT, Autoseller, VW, Renault, Auto, Golf, PKW, Polo","http://www.zeit.de/1992/42/langsame-talfahrt"
"Haftungsrecht: Die EG-Kommission will es den Verbrauchern erleichtern, Dienstleister für Folgeschäden zur Kasse zu bitten: Wenn die Dauerwelle ätzt |","1992.42.4616","1992-10-09","DIE ZEIT, Haftungsrecht: Die EG-Kommission will es den Verbrauchern erleichtern, Dienstleister für Folgeschäden zur Kasse zu bitten, Bauwirtschaft, Bundesjustizministerium, Bundesverband der Deutschen Industrie, Europäische Gemeinschaft, England, Italien, USA, Brüssel, Europa","http://www.zeit.de/1992/42/wenn-die-dauerwelle-aetzt"
"Deutsche Einheit: Der Zusammenschluß hat die Wirtschaftskriminalität angefacht. Die Justiz steht auf verlorenem Posten: Boom für Betrüger |","1992.42.4617","1992-10-09","DIE ZEIT, Deutsche Einheit: Der Zusammenschluß hat die Wirtschaftskriminalität angefacht. Die Justiz steht auf verlorenem Posten, Justiz, Betrug, Bundeskriminalamt, D-Mark, DDR, Polizeipräsident, Treuhandanstalt, Wirtschaftskriminalität, Währungsunion, Berlin, Bonn, Osteuropa, Rostock, Wiesbaden","http://www.zeit.de/1992/42/boom-fuer-betrueger"
"Ostdeutschland: Subventionen für Staatsbetriebe provozieren den Protest der westdeutschen Konkurrenz: Kampfpreise im Visier |","1992.42.4618","1992-10-09","DIE ZEIT, Ostdeutschland: Subventionen für Staatsbetriebe provozieren den Protest der westdeutschen Konkurrenz, Birgit Breuel, Jürgen Möllemann, Protest, Dieter Wolf, Bundesverband der Deutschen Industrie, Kartellamt, Treuhandanstalt, Unternehmen, Sowjetunion, Subventionen, Berlin, Brüssel, Europa","http://www.zeit.de/1992/42/kampfpreise-im-visier"
" Die Bank Austria leidet unter ihrem Optimismus: Fehlprognosen als Standard |","1992.42.4619","1992-10-09","DIE ZEIT,  Die Bank Austria leidet unter ihrem Optimismus, Bank, Dax, Bank Austria, Europäische Gemeinschaft, Österreich, Europa, Maastricht","http://www.zeit.de/1992/42/fehlprognosen-als-standard"
"Bonner Kulisse |","1992.42.4620","1992-10-09","DIE ZEIT, , Theo Waigel, Helmut Kohl, Finanzministerium, Norbert Blüm, Heide Simonis, Bundesfinanzminister, Bundestag, Föderalismus, Ratifizierung, Bonn, Brüssel, Europa, Maastricht","http://www.zeit.de/1992/42/bonner-kulisse"
"Großbritannien: Die Pfundkrise stürzte die Wirtschaftspolitik ins Chaos: Nichts als Entschuldigungen |","1992.42.4621","1992-10-09","DIE ZEIT, Großbritannien: Die Pfundkrise stürzte die Wirtschaftspolitik ins Chaos, Wirtschaftspolitik, Bundesbank, John Major, Margaret Thatcher, Auswärtiges Amt, Europapolitik, Finanzminister, Großbritannien, Helmut Schlesinger, Regierung, Chaos, England, London, Brighton","http://www.zeit.de/1992/42/nichts-als-entscheidungen"
"Frankreich: Nach langem Gezerre bleibt der legendenumwobene Schafskäse Roquefort in einheimischer Hand: Folgen eines Schäferstündchens |","1992.42.4622","1992-10-09","DIE ZEIT, Frankreich: Nach langem Gezerre bleibt der legendenumwobene Schafskäse Roquefort in einheimischer Hand, Nestlé, Käse, Society, Europa","http://www.zeit.de/1992/42/folgen-eines-schaeferstuendchens"
"GUS: Die Zerrüttung des Geldwesens lähmt die ehemaligen Sowjetrepubliken: Chaos in der Rubelzone |","1992.42.4623","1992-10-09","DIE ZEIT, GUS: Die Zerrüttung des Geldwesens lähmt die ehemaligen Sowjetrepubliken, Boris Jelzin, Jegor Gajdar, Internationaler Währungsfonds, Russland, Kasachstan, Staatssymbol, Ukraine, Wechselkurs, Währung, Chaos, Litauen, Sowjetunion, Weißrussland, Moskau, Kaukasus","http://www.zeit.de/1992/42/chaos-in-der-rubelzone"
"Bundespräsident: Überholt |","1992.42.4624","1992-10-09","DIE ZEIT, Bundespräsident, Bundespräsident, DDR, Frieden, Gewinn, Glück, Grundgesetz, Jahrestag, Rezession, Richard Freiherr von Weizsäcker, Schmerz, Schwerin, Staatsoberhaupt, Währung","http://www.zeit.de/1992/42/ueberholt"
"Einigkeit bei der neuen Gesundheitsreform: Große Koalition |","1992.42.4625","1992-10-09","DIE ZEIT, Einigkeit bei der neuen Gesundheitsreform, Horst Seehofer, Norbert Blüm, Rudolf Dreßler, SPD, CSU, FDP, Sozialpolitik, Arzt, Gesundheitsrisiko, Gesundheitswesen, Krankenhaus, Krankenkasse, Medikament, Pflegeversicherung, Pharmaindustrie, Reform, Gesundheitsreform, Große Koalition","http://www.zeit.de/1992/42/grosse-koalition"
"Gewerkschaften: Am Wochenende beginnt in Hamburg der IG-Metall-Kongreß. Ein ZEIT-Gespräch mit dem Vorsitzenden Franz Steinkühler: „Lohnverzicht rettet keinen Arbeitsplatz“ |","1992.42.4626","1992-10-09","DIE ZEIT, Gewerkschaften: Am Wochenende beginnt in Hamburg der IG-Metall-Kongreß. Ein ZEIT-Gespräch mit dem Vorsitzenden Franz Steinkühler, Franz Steinkühler, Hamburg, Bundesregierung, IG Metall, Bundesbank, Arbeitnehmer, Gewerkschaft, Ostdeutschland, Produktivität, Tarifvertrag, Wiedervereinigung, MIT, Sowjetunion, Tariflohn, Osteuropa","http://www.zeit.de/1992/42/lohnverzicht-rettet-keinen-arbeitsplatz"
"Wirtschaftspolitik: Niedrige Zinsen, Staatsschulden, Konsumverzicht, Außenschutz für die ostdeutsche Wirtschaft – die unverzichtbaren Bestandteile eines Solidarpakts Umkehr in die Rezession: Umkehr in der Rezession |","1992.42.4627","1992-10-09","DIE ZEIT, Wirtschaftspolitik: Niedrige Zinsen, Staatsschulden, Konsumverzicht, Außenschutz für die ostdeutsche Wirtschaft – die unverzichtbaren Bestandteile eines Solidarpakts Umkehr in die Rezession, Bundesbank, Bundesregierung, Wolfgang Thierse, Helmut Schmidt, Bundesanstalt für Arbeit, Bundeswirtschaftsministerium, D-Mark, DDR, Kanzleramt, Ostdeutschland, Produktivität, Rezession, Tyll Necker, Unternehmen, Volkswirtschaft, Bonn, Saarbrücken, Washington D.C","http://www.zeit.de/1992/42/umkehr-in-der-rezession"
"Markt-Report: Niemand hält dagegen |","1992.42.4628","1992-10-09","DIE ZEIT, Markt-Report, Ausländer, Aktie, Aktienmarkt, Anleihe, Bank, Gewinn, Konjunktur, Strom, Unternehmen, Wunder","http://www.zeit.de/1992/42/niemand-haelt-dagegen"
"Autobahngebühr: Überflüssig |","1992.42.4629","1992-10-09","DIE ZEIT, Autobahngebühr, Europäische Gemeinschaft, Steuer, Verkehrsminister, Bonn, Europa","http://www.zeit.de/1992/42/ueberfluessig"
"Brasilien: Das Parlament setzt den Präsidenten ab. Kann sich Lateinamerika nun von der Korruption befreien?: Moral schlägt Macht |","1992.42.4630","1992-10-09","DIE ZEIT, Brasilien: Das Parlament setzt den Präsidenten ab. Kann sich Lateinamerika nun von der Korruption befreien?, Korruption, Lateinamerika, Parlament, Max Weber, Argentinien, Pablo Escobar, Peru, Bolivien, Brasilien, Kolumbien, Mexiko, Nicaragua, Panama, Sowjetunion, Venezuela","http://www.zeit.de/1992/42/moral-schlaegt-macht"
