"title","number","date","keywords","link"
"USA: »Antisemitismus!«","2006.19.38673","2006-05-04","Politik, USA, USA, Condoleezza Rice, Debatte, Harvard University, Irak-Krieg, Israel, National Rifle Association, Rentenreform, Tzipi Livni, Washington Post, Jordanien, Ägypten, New York, Warschau, Washington D.C","http://www.zeit.de/2006/19/lobby_usa"
"Energie: Che würde jubeln","2006.19.38674","2006-05-04","Politik, Energie, Energie, Evo Morales, Recht, Armut, Bodenschätze, Bolivien, Botschaft, Energieversorgung, Ernesto Che Guevara, Hoffnung, Industrie, Lateinamerika, Präsident, Raffinerie, Regierung, Verstaatlichung, Argentinien, Brasilien, Chile, Venezuela, Havanna","http://www.zeit.de/2006/19/Bolivien"
"Bundeswehr: Antreten zur Debatte!","2006.19.38675","2006-05-04","Politik, Bundeswehr, Zivildienst, Wehrpflicht, Militär, Urteile, Statistiken, Soldaten, Reformen, Kritik, Debatten, Bundeswehr, Bundeswehr, Auslandseinsatz, Debatte, Frieden, Krieg, Minister, Soldat, Terrorismus, Wiedervereinigung","http://www.zeit.de/2006/19/Berlin_Kongo"
"Wie denken sie?","2006.19.38676","2005-05-04","Online, , Ausländer, Bundesfamilienministerium, Alter, Berliner Senat, Bundesliga, Demokratie, Ehe, Eltern, Frauenhaus, Grundgesetz, Konrad-Adenauer-Stiftung, Kopftuch, Koran, Millî Görüs, Umfrage, Verfassung, Verfassungsschutz, Türkei","http://www.zeit.de/2006/19/Fragen_denken"
"Österreich: Freud global","2006.19.38677","2006-05-04","Politik, Österreich, Österreich, Sigmund Freud, Carl Gustav Jung, Jacques Lacan, Psychoanalyse, Strukturalismus, Tiefenpsychologie, Sigmund Freud, Wien, Berlin, Europa, London, Afrika, Asien, Lissabon, Zürich","http://www.zeit.de/2006/19/515_Freud"
"Gebete für die Donau","2006.19.38678","2006-05-04","Politik, , Donau, Donauausbau, Europäische Gemeinschaft, Fluss, Mauritius, Schifffahrt, Unesco-Weltkulturerbe, Rumänien, Ungarn, Amazonas, Bayern, Berlin, München, Vilshofen, Wien","http://www.zeit.de/2006/19/Gebete_fuer_die_Donau"
"Wie leben sie?","2006.19.38679","2005-05-04","Online, , Ausländer, Gesellschaft und soziales Leben, Gesellschaft, Einwanderung, Alltag, Ausländer, Bischofskonferenz, Bistum, Bundespresseamt, Flüchtling, Grafik, Integration, Konzentration, Migration, Minderheit, Moschee, USA, Frankfurt am Main, Nordrhein-Westfalen, Offenbach","http://www.zeit.de/2006/19/Fragen_leben"
"Flaschenpost eines Flüchtigen","2006.19.38680","2006-05-04","Politik, , François Mitterrand, Bernard-Henri Lévy, Daniel Cohn-Bendit, Frankreich, Italien, Bettino Craxi, Claude Chabrol, Hilfsaktion, Japan, Paris","http://www.zeit.de/2006/19/Flaschenpost_eines_Fluechtigen"
"Frankreich: Selbstzerfleischung","2006.19.38681","2006-05-04","Politik, Frankreich, Innenpolitik, Regierungen, Wahlen, Werbung und Marketing, Karriere, Image, Beruf, Arbeit und Sozialstaat, Wahlniederlagen, Regionalwahlen, Portraits, Nicolas Sarkozy, Frankreich, Dominique de Villepin, Jacques Chirac, Außenminister, Edith Cresson, Geldwäsche, Herbst, Innenminister, Opfer, Premierminister","http://www.zeit.de/2006/19/Kommentar_S__8"
"Wie stehen sie zu Frauen?","2006.19.38682","2006-05-04","Online, , Ausländer, Bundesfamilienministerium, Drohung, Frauenhaus, Freundschaft, Gewalt, Grafik, Jugendliche, Ministerium, Opfer","http://www.zeit.de/2006/19/Fragen_Frauen"
"Antisemitismus!","2006.19.38683","2006-05-04","Politik, , USA, Antisemitismus, Debatte, Harvard University, Irak-Krieg, Israel, National Rifle Association, Rentenreform, Jordanien, Ägypten, Florida, New York, Warschau, Washington D.C","http://www.zeit.de/2006/19/_Antisemitismus_"
"Wie kriminell sind sie?","2006.19.38684","2006-05-04","Online, , Ausländer, Bevölkerung, Anzeige, Hooligan, Jugendliche, Kriminalstatistik, Mord, Opfer, Polizei, Raub, Schüler, Straftat, Straftäter, Vergewaltigung","http://www.zeit.de/2006/19/Fragen_kriminell"
"Ausländer: Sag mir, woher du kommst","2006.19.38685","2006-05-04","Politik, Ausländer, Ausländer, Europäische Union, Frankreich, Lukas Podolski, England, Feridun Zaimoglu, Gerald Asamoah, Statistik, Statistisches Bundesamt, Zinédine Zidane, Großbritannien, Niederlande, Polen, Portugal, Schweden, Schweiz, Europa","http://www.zeit.de/2006/19/Auslaender"
"Es ist schwer, anders zu handeln","2006.19.38686","2006-05-04","Politik, , Bundesregierung, Recht, Bundesverfassungsgericht, Erpressung, Geld, Norm, Opfer, Rechtsstaat, Regierung, Richter, Irak, Berlin, Karlsruhe","http://www.zeit.de/2006/19/_Es_ist_schwer_anders_zu_handeln_"
"Atomstreit: Das persische Puzzle","2006.19.38687","2006-05-04","Politik, Atomstreit, Atomwaffen, Osten, Naher, Kritik, Europäer, EU, Rüstung, Naturkatastrophe, Natur und Technik, Militär, Internationale Beziehungen, Angela Merkel, UN-Sicherheitsrat, Condoleezza Rice, Javier Solana, John McCain, Atomenergie, Auswärtiges Amt, Gernot Erler, Iran, Präsident, Resolution, Sanktion, China, Irak, Russland, USA, Washington D.C., Bagdad, Europa, Moskau","http://www.zeit.de/2006/19/US_Iran"
"Ein Gott bleibt ein Gott","2006.19.38688","2006-05-04","Politik, , Nepal, Nepal, Allianz, Amulett, Apotheke, Dorf, Monarch, Streitkräfte, Waffenruhe, Großbritannien, Indien, USA, Kathmandu","http://www.zeit.de/2006/19/_Ein_Gott_bleibt_ein_Gott_"
"Kongo: Große Schlachten, kleine Wunder","2006.19.38689","2006-05-04","Politik, Kongo, Europäische Union, Joseph Kabila, Kongo, Patrice Lumumba, Wunder, Blauhelm, Mobutu Sese Seko, Stadion, Wahl, Indien, Kinshasa, Pakistan, Westeuropa","http://www.zeit.de/2006/19/Kinshasa"
"Wer sind sie?","2006.19.38690","2006-05-04","Online, , Ausländer, Aussiedler, Bevölkerungsgruppe, Eltern, Kasachstan, Staatsangehörigkeit, Schweden","http://www.zeit.de/2006/19/Fragen_Wer"
"Nachruf: Einsames Amt","2006.19.38691","2006-05-04","Politik, Nachruf, Bevölkerung, Verhältnis, Portraits, Affären, Paul Spiegel, CDU, Ignatz Bubis, Antisemitismus, Obdachlose, Pflege, Synagoge, Verlust, Sowjetunion","http://www.zeit.de/2006/19/Nachruf_Spiegel"
"Entführungen: Solange es nur Geld ist","2006.19.38692","2006-05-04","Politik, Entführungen, Bundesregierung, Geld, Angela Merkel, Bonus, Bundestag, Bundeswehrsoldat, Irak, Susanne Osthoff, Thomas Nitzschke, Afghanistan, Bali, Saudi Arabien, Tunesien, USA, Bagdad, Berlin, Hindukusch, New York","http://www.zeit.de/2006/19/01_leit_2_19_06"
"Österreich: Der Zug der roten Lemminge","2006.19.38693","2006-05-04","Politik, Österreich, Verhandlungen, Regierungen, Parteien, Koalitionen, Wolfgang Schüssel, Österreich, Alfred Gusenbauer, Silvio Berlusconi, ÖVP, Bundesrat, Skandal, Volksparteien, Salzburg","http://www.zeit.de/2006/19/516_SP_Text"
"Entführung: Unvorstellbare Routine","2006.19.38694","2006-05-04","Politik, Entführung, Bundesregierung, Entführung, Gerhard Schröder, Auswärtiges Amt, Außenminister, Außenpolitik, Debatte, Glück, Irak, Kanzleramt, Staatssekretär, Susanne Osthoff, Transport, Bagdad, Berlin, Europa, Washington D.C","http://www.zeit.de/2006/19/Auswrtiges_Amt"
"Wie lernen sie?","2006.19.38695","2006-05-04","Online, , Ausländer, Bildung, Schüler, Schule, Studien, Schulen, Unterricht, Sprache, Kultur, Kommunikation, Bildungspolitik, Lernen, Abitur, Berufswahl, Flüchtling, Jugendliche, Mobilität, Mädchen, Schule, Schulsystem, Schüler, Italien, Neukölln","http://www.zeit.de/2006/19/Fragen_lernen"
"Selim blieb ein Einzelkind","2006.19.38696","2006-05-04","Politik, , Film, Literatur, Rainer Werner Fassbinder, Barbara Frischmuth, Einbürgerung, Fernsehserie, Hark Bohm, Jugendarbeitslosigkeit, Jugendgewalt, Schriftsteller, Zwangsheirat, Polen, Berlin","http://www.zeit.de/2006/19/Selim_blieb_ein_Einzelkind"
"Drogenbericht: Kein Anlass zur Entwarnung","2006.19.38697","1899-12-31","Online, Drogenbericht, Werbung und Marketing, Werbung, Tabak, Sucht, Rauchen, Psyche und Sexualität, Produkt, Medizin, Industrie, Gesundheit, Kontra","http://www.zeit.de/2006/19/drogenbericht"
"Ausländer: Was man wissen sollte","2006.19.38698","2006-05-04","Politik, Ausländer, Ausländer, Gesellschaft und soziales Leben, Gesellschaft, Einwanderung, Sozialstaat, Lebensstandard, Gleichberechtigung, Familie und Partnerschaft, Ausländerpolitik, Armut, Arbeitsmarkt, Ausländer, Arbeitslosigkeit, Gewalt, Islam, Kriminalstatistik, Millî Görüs, Moschee, Unternehmensgründung, Übergewicht","http://www.zeit.de/2006/19/Auslnder_Wahrheit"
"Ausländer: Auch wir sind Deutschland","2006.19.38699","2006-05-04","Politik, Ausländer, Ausländer, Gesellschaft und soziales Leben, Gesellschaft, Einwanderung, Alltag, Ausländer, Hans-Olaf Henkel, Bentley, DDR, Fatih Akin, Indien, Kanada, Türkei, USA, Vietnam, Ibiza","http://www.zeit.de/2006/19/Auslnder_Aufsteiger"
"Nur am Rand ist was los!","2006.19.38700","2006-05-04","Politik, , Borreliose, Bühne, Familienpolitik, Focus, Hauptstadt, Jugendliche, Jugendstrafrecht, Justizsenator, Roger Kusch, Wetter, Berlin, Hamburg","http://www.zeit.de/2006/19/Nur_am_Rand_ist_was_los_"
"PDS: Trotz und Trotzki","2006.19.38701","2007-08-03","Politik, PDS, PDS, Innenpolitik, Politische_linke, PDS, Innenpolitik, Alois Rhiel, Harald Wolf, Grüne, CDU, Oskar Lafontaine, PDS, Bodo Ramelow, Die Linke, Parteitag, Strompreis, WASG, Bild-Zeitung, Indien, Ludwigshafen, Berlin, Asien, Hessen","http://www.zeit.de/2006/19/Trotz_und_Trotzki"
"Österreich: Prächtige Pralinen, nicht mehr","2006.19.38702","2006-05-04","Politik, Österreich, Kultur, Festspiele, Salzburg, Opertitel, Hoffmann, Österreich, Kulturbetrieb, Kanzleramt, Wien, Mailand, Saale","http://www.zeit.de/2006/19/516_artgenossen_Text"
"Holocaust-Mahnmal: Ratlos im Steinemeer","2006.19.38703","2006-05-10","Politik, Holocaust-Mahnmal, Vergangenheitsbewältigung, Rassismus, Politikbewusstsein, Innenpolitik, Holocaust, Bevölkerung, Streit, Juden, Deutschland, Denkmäler, Holocaust-Mahnmal","http://www.zeit.de/2006/19/holocaustmahnmal_bilanz"
"Die Aldisierung des Lebens","2006.19.38704","2006-05-04","Politik, , Aldi, Mönchengladbach, Niederrhein, Nordrhein-Westfalen, Rheinland","http://www.zeit.de/2006/19/Die_Aldisierung_des_Lebens"
"Nichts bleibt, wie es ist","2006.19.38705","2006-05-04","Dossier, , Wissenschaft, Bachelor, Diplom, Forschung, Globalisierung, Master, Nobelpreis, Reform, Student, Studiengang, Oxford","http://www.zeit.de/2006/19/Nichts_bleibt_wie_es_ist"
"Gerechtigkeit: Erben zahlen mehr","2006.19.38706","2007-05-02","Wirtschaft, Gerechtigkeit, Staat, Staat, Sozialstaat, Medizin, Arbeit und Sozialstaat, Steuerpolitik, Staatsfinanzen, Gesundheitswesen, Reformen, Sozialpolitik, Staat, Gesundheitsreformen, Gesundheitspolitik, SPD, Einkommen, Erbe, Erbschaft, Erbschaftsteuer, Euro, Familienunternehmen, Finanzamt, Inflation, John Stuart Mill, Krankenversicherung, Liberalismus, Pflege, Sozialstaat, Sozialversicherung, Schweiz","http://www.zeit.de/2007/19/Gerechtigkeit-Steuer"
"Steuern: Reichlich riskant","2006.19.38707","2006-05-04","Wirtschaft, Steuern, Staatsfinanzen, Staatsverschuldung, Finanzpolitik, Steuerpolitik, Steuerreformen, Subventionsabbau, Subventionen, Sparpolitik, Bundeshaushalt, 2005, Wirtschaft und Konjunktur, Peer Steinbrück, SPD, CSU, Bundesregierung, CDU, Franz Müntefering, Hartz IV, Bundesfinanzminister, Bundeshaushalt, Elterngeld, Euro, Finanzminister, Haushaltsentwurf, Mehrwertsteuer, Neuverschuldung, Unternehmensbesteuerung, Verfassungsgericht, Wirtschaftswachstum, Berlin, Bremen, Saarbrücken, Saarland","http://www.zeit.de/2006/19/Konjunktur_Steuern"
"Genosse mit beschränktem Recht","2006.19.38708","2006-05-04","Wirtschaft, , Recht, Bundesregierung, Aktiengesellschaft, Bundesrat, Demokratie, Geldanlage, Unternehmen, Vorstand, MIT","http://www.zeit.de/2006/19/Genosse_mit_beschraenktem_Recht"
"Briten: Undiplomatisch","2006.19.38709","2006-05-04","Wirtschaft, , Beziehung, Botschaft, Gebühr, Hauptstadt, Stadt, Steuer, Angola, USA, Wien","http://www.zeit.de/2006/19/Briten_Undiplomatisch"
"Bundesliga: Gefühlsecht","2006.19.38710","2006-05-04","Wirtschaft, , Deutsche Telekom, Bundesliga, DFL, Euro, Gespräch, Internet, Liebe, Sender, Vermarktung, Vertrag, Baden-Württemberg, Hessen, Köln, Nordrhein-Westfalen","http://www.zeit.de/2006/19/Bundesliga_Gefuehlsecht"
"Ü-Eier: Freigesprochen","2006.19.38711","2006-05-04","Wirtschaft, , Agentur, Bundesgerichtshof, Dienstleistung, Fußball, Fußball-WM, Richter, Spielzeug, Unternehmen, Karlsruhe, München","http://www.zeit.de/2006/19/Ue-Eier_Freigesprochen"
"Kleine Schritte","2006.19.38712","2006-05-04","Wirtschaft, , Bevölkerung, Arbeitslosigkeit, Armut, Brasilien, Dienstleistung, Einkommen, Euro, Landwirtschaft, Mindestlohn, Produktion, Präsident, Verwaltung","http://www.zeit.de/2006/19/Kleine_Schritte"
"Argument: Merkel, die Merkantilistin","2006.19.38713","2006-05-04","Wirtschaft, Argument, Wirtschaft und Konjunktur, Wirtschaft, Konjunktur, Wirtschaftswachstum, Verbraucher, Konsum, Volkswirtschaft, Wirtschaftspolitik, Sparpolitik, Wettbewerb, Staatsfinanzen, Europäische Union, Bosch AG, Siemens AG, Wirtschaftspolitik, Arbeitslosenversicherung, Blindheit, Bruttoinlandsprodukt, Export, Frankreich, Italien, Mehrwertsteuer, Metallindustrie, Produktivität, Reichensteuer, Staatsverschuldung, Wechselkurs, Währungsunion, Zoll, Spanien","http://www.zeit.de/2006/19/Argument_19"
"Eltern: Beruf statt Herd","2006.19.38714","2006-05-04","Wirtschaft, Eltern, Kinder, Arbeit und Sozialstaat, Frauen, Gesellschaft und soziales Leben, Gesellschaft, Familien, Mütter, Werbung und Marketing, Sozialstruktur, Mittelstand, Image, Eltern, Sozialpolitik, Ausbildung, Dänemark, Erwachsene, Erziehung, Euro, Familie, Gehalt, Island, Karriere, Kindergarten, Kindergeld, Nachwuchs, Umfrage, Urlaub, Wohlfahrtsstaat, Berlin, Kopenhagen","http://www.zeit.de/2006/19/DK-Familie"
"EU: Machtmissbrauch","2006.19.38715","2006-05-04","Wirtschaft, EU, Wirtschaft und Konjunktur, Wettbewerb, Software, Informationstechnik, Computer, Kontra, Wettbewerbsrecht, Prozesse, Klagen, Kartellverfahren, EU, Microsoft, Karel van Miert, Europäische Union, Aktie, Eigentum, Euro, Gericht, Gewinn, Mario Monti, Missbrauch, Richter, Steve Ballmer, Strafe, Sun Microsystems, Luxemburg, Brüssel","http://www.zeit.de/2006/19/Kasten_Microsoft"
"VW: Vertrag verlängert","2006.19.38716","2006-05-04","Wirtschaft, , Vertrag, Bernd Pischetsrieder, Christian Wulff, VW, Ferdinand Piëch, Martin Winterkorn, Wendelin Wiedeking, Aufsichtsrat, Betriebsrat, Ministerpräsident, Porsche, Niedersachsen","http://www.zeit.de/2006/19/VW_Vertrag_verlaengert"
"Steuererhöhungen: Wer den Mehrwert schafft","2006.19.38717","2006-05-04","Politik, Steuererhöhungen, Wirtschaft und Konjunktur, Wirtschaft, Konjunktur, Wirtschaftswachstum, Wirtschaftspolitik, Sparpolitik, Verbraucher, Konsum, Sozialstaat, Sozialpolitik, Arbeit und Sozialstaat, Angela Merkel, Bundesregierung, CSU, Ursula von der Leyen, John Maynard Keynes, Karl Lauterbach, Staatsfinanzen, Apotheke, Arbeitslose, Arbeitslosenversicherung, Bauindustrie, Ein-Euro-Job, Einkommensteuer, Elterngeld, Euro, Familienpolitik, Gesundheitssystem, Konjunktur, Mehrwertsteuer, Steuererhöhungen, Maastricht","http://www.zeit.de/2006/19/01_leit_1_19_06"
"Illusion Familie","2006.19.38718","2006-05-04","Wirtschaft, , Familienpolitik, CDU, Familie, SPD, CSU, Margot Käßmann, Tony Blair, Ursula von der Leyen, Chaos, Deutsches Institut für Wirtschaftsforschung, Ehegattensplitting, Elterngeld, Euro, Familienpolitik, Kanzleramt, Kinderarmut, Maria Böhmer, Sozialversicherung, Hannover","http://www.zeit.de/2006/19/Illusion_Familie"
"Europa: Am Ende ist das Wort","2006.19.38719","2006-05-04","Wirtschaft, Europa, Wirtschaft und Konjunktur, Wirtschaft, Wettbewerb, EU-Wettbewerbspolitik, EU, Behörden, Europa, Europäische Union, Microsoft, EuGH, Europäischer Gerichtshof, Gericht, Richter, Österreich, Bielefeld","http://www.zeit.de/2006/19/EUGH"
"Vita: Amory Lovins","2006.19.38720","2006-05-04","Wirtschaft, Vita, Buch, Energie, Energieeffizienz, Erdöl, Nobelpreis, Pentagon, Physik, Richard Freiherr von Weizsäcker, Studie, Umwelt, Präsident, Regierung, USA, Colorado, Oxford","http://www.zeit.de/2006/19/Lovins_vita"
"30 SEKUNDEN FÜR Dubai","2006.19.38721","2006-05-04","Wirtschaft, , Dubai, Tourismus, Dorf, Erdöl, Gebäude, Golf, Hotel, Nahverkehr, Palm, Sonne, U-Bahn, Ankara, Berlin, Damaskus","http://www.zeit.de/2006/19/30_SEKUNDEN_FUeR_Dubai"
"Eltern: Viel Pfund fürs Kind","2006.19.38722","2006-05-04","Wirtschaft, Eltern, Eltern, Sozialpolitik, Ausbildung, Einkommen, Euro, Familie, Geburt, Gehalt, Geld, Kinderbetreuung, Kindergarten, Kindergeld, Regierung, Staatssekretär, Steuer, Großbritannien, Europa","http://www.zeit.de/2006/19/GB-Familie"
"Zeit der Zocker","2006.19.38723","2006-05-04","Wirtschaft, , Air Berlin, Dax, Airline, Aktie, Aktiengesellschaft, Aktienindex, Billigflieger, Börsengang, Gewinn, Joachim Hunold, Kapitalmarkt, Test, Unternehmen, Verlust, Wirtschaftspresse, Ölpreis, Berlin, Europa","http://www.zeit.de/2006/19/Zeit_der_Zocker"
"Arbeitsmarkt: Falsch verdächtigt","2006.19.38724","2006-05-04","Wirtschaft, Arbeitsmarkt, Sozialstaat, Sozialhilfe, Arbeitsmarktpolitik, Arbeitsmarkt, Arbeitslosenversicherung, Arbeit und Sozialstaat, Zusammenlegung, Reformen, Folgen, Arbeitslosenhilfe, Arbeitsmarkt, Bundesregierung, Hartz IV, Arbeitsmarktreform, Bundesarbeitsministerium, Euro, Geld, Jobcenter, Kabinett, Missbrauch, Personal, Reform, Regierung, Sanktion, Training","http://www.zeit.de/2006/19/Zwischenruf"
"Brasilien: Der Ernährer der Welt","2006.19.38725","2006-05-04","Wirtschaft, Brasilien, Landwirtschaft, Agrarwirtschaft und Ernährung, Umwelt, Lebensstandard, Armut, Arbeit und Sozialstaat, Preispolitik, Preise, Nord-Süd-Gefälle, Kaffee, Globalisierung, Brasilien, Greenpeace, OECD, Soja, China, Europa","http://www.zeit.de/2006/19/Brasilien-Ernhrer"
"Eltern: Land ohne Kinderteller","2006.19.38726","2006-05-04","Wirtschaft, Eltern, Silvio Berlusconi, Eltern, Romano Prodi, Apotheke, Augustus, Elternzeit, Euro, Familie, Geburtenrate, Gehalt, Italien, Kindergeld, Rom, Europa, Mailand","http://www.zeit.de/2006/19/I-Familie"
"Gasfelder: Verstaatlicht","2006.19.38727","2006-05-04","Wirtschaft, , Hugo Chávez, Evo Morales, Militär, Bolivien, Gas, Petrobras, Raffinerie, Steuer, Unternehmen, Venezuela, Vertrag, Präsident, Südamerika","http://www.zeit.de/2006/19/Gasfelder_Verstaatlicht"
"Eltern: Im Land der Tagesmütter","2006.19.38728","2006-05-04","Wirtschaft, Eltern, Bevölkerung, Gesellschaft und soziales Leben, Gesellschaft, Familienpolitik, Familie und Partnerschaft, Kinder, Familie, Eltern, Bildungspolitik, Bildung, Familien, Eltern, Einkommen, Einkommensteuer, Euro, Familie, Frankreich, Geburtenrate, Haushalt, Kinderbetreuung, Kindergeld, Personal, Sozialversicherung","http://www.zeit.de/2006/19/F-Familie"
"Nachruf: Kritiker der Macht","2006.19.38729","2006-05-04","Wirtschaft, Nachruf, John Kenneth Galbraith, Alter, Bestseller, Finanzmarkt, Konsum, Ski, Werbekampagne, Oder","http://www.zeit.de/2006/19/Galbraith"
"Eltern: Illusion Familie","2006.19.38730","2006-05-04","Wirtschaft, Eltern, Gesellschaft und soziales Leben, Gesellschaft, Familienpolitik, Familie und Partnerschaft, Arbeitsmarkt, Arbeit und Sozialstaat, Statistiken, Rückgang, Regierungen, Gespräche, CDU, Eltern, Familie, SPD, CSU, Margot Käßmann, Tony Blair, Ursula von der Leyen, Deutsches Institut für Wirtschaftsforschung, Ehegattensplitting, Eigenheimzulage, Elterngeld, Familienpolitik, Kanzleramt, Kinderarmut, Maria Böhmer, Riester-Rente, Sozialversicherung, Hannover","http://www.zeit.de/2006/19/Familienpolitik"
"Interview: »Das hat religiöse Züge«","2006.19.38731","2006-05-04","Wirtschaft, Interview, Energiepolitik, Energie und Rohstoff, Atompolitik, Fossile Energie, Erdöl, Energieverbrauch, Preise, Energien, Energieeinsparungen, Alternative, Strom, George W.  Bush, Winston Churchill, Energie, Energiekosten, Erdgas, Kernkraftwerk, USA, Antriebssystem, Auto, Biokraftstoff, China, Heizung, Indien, Kernenergie, Pentagon, Russland, Strom, Rocky Mountains","http://www.zeit.de/2006/19/Interv__Lovins"
