"title","number","date","keywords","link"
"Im Kampf für Palästina |","1991.11.1949","1991-03-08","DIE ZEIT, , Saddam Hussein, Irak, Jassir Arafat, Palästina, Israel, Jordanien, Palästinenser, Vereinte Nationen, Waffenruhe, Iran, Kuwait, USA, Amman, Beirut, Europa, Washington D.C","http://www.zeit.de/1991/11/im-kampf-fuer-palaestina"
"Nachlese: Jugoslawien zerfällt: Zermürbender Kleinkrieg |","1991.11.1950","1991-03-08","DIE ZEIT, Nachlese: Jugoslawien zerfällt, Jugoslawien, Autonomie, Bürgerkrieg, Drohung, Minderheit, Republik, Tatort, Verfassung, Kroatien, Slowenien, Belgrad","http://www.zeit.de/1991/11/zermuerbender-kleinkrieg"
"Die Republiken der Sowjetunion fordern ihre nationale Souveränität Aber Moskau stemmt sich dagegen.: „Der Bürgerkrieg findet schon statt“ |","1991.11.1951","1991-03-08","DIE ZEIT, Die Republiken der Sowjetunion fordern ihre nationale Souveränität Aber Moskau stemmt sich dagegen., Boris Jelzin, Moskau, Sowjetunion, Islam Karimow, Michail Gorbatschow, Nursultan Nasarbajew, Bürgerkrieg, Souveränität, Usbekistan, Beziehung, Eigentum, Innenministerium , Kasachstan, Norm, Russland, Territorium, Vereinte Nationen, Litauen, Ukraine, Kaukasus","http://www.zeit.de/1991/11/der-buergerkrieg-findet-schon-statt"
"Zufrieden mit dem eigenen Land |","1991.11.1952","1991-03-08","DIE ZEIT, , George W.  Bush, Harry S. Truman, Michail Gorbatschow, Ronald Reagan, Saddam Hussein, USA, Winston Churchill, Europäische Gemeinschaft, Golf, Golfkrieg, Sowjetunion, Irak, Libyen, MIT, Washington D.C., New York","http://www.zeit.de/1991/11/zufrieden-mit-dem-eigenen-land"
"Die Demokratie bleibt in der Familie |","1991.11.1953","1991-03-08","DIE ZEIT, , Demokratie, Familie, Finanzministerium, Opposition, Vereinte Nationen, Dubai, Kuwait, Libanon, Abu Dhabi, Kairo, Manhattan, Washington D.C","http://www.zeit.de/1991/11/die-demokratie-bleibt-in-der-familie"
"Worte der Woche |","1991.11.1954","1991-03-08","DIE ZEIT, , CDU, George W.  Bush, Lothar de Maizière , Volker Rühe, Außenminister, Dieter Wellershoff, Golf, Hans-Otto Wilhelm, Johannes Gross, Roland Dumas, Soldat, Streitkräfte, Unterhaus, Bundesrepublik Deutschland, Vietnam, Kuwait","http://www.zeit.de/1991/11/worte-der-woche"
"Unter Dach und Fach: Das Strohfeuer der Kalten Krieger |","1991.11.1955","1991-03-08","DIE ZEIT, Unter Dach und Fach, Michail Gorbatschow, Bundesregierung, DDR, Deutschlandpolitik, Jegor Ligatschow, Kreml, Ratifizierung, Sowjetunion, Vertrag, Bonn, Moskau, Europa, Ural","http://www.zeit.de/1991/11/das-strohfeuer-der-kalten-krieger"
"Stille Wut nach dem lauten Jubel |","1991.11.1956","1991-03-08","DIE ZEIT, , Saddam Hussein, Algerien, Golfkrieg, Ramadan, Schlichtung, Vereinte Nationen, Frankreich, Saudi Arabien, Bagdad, Kuwait, Washington D.C","http://www.zeit.de/1991/11/stille-wut-nach-dem-lauten-jubel"
"Wolfgang Ebert: Irren ist menschlich |","1991.11.1957","1991-03-08","DIE ZEIT, Wolfgang Ebert, Oskar Lafontaine, Golfkrieg, Regierung, Krieg, Regierungschef, Sprache, Wolfgang Ebert, Öffentlichkeit, Saarbrücken","http://www.zeit.de/1991/11/irren-ist-menschlich"
"Bonner Bühne: Stachel im Fleisch |","1991.11.1958","1991-03-08","DIE ZEIT, Bonner Bühne, Norbert Blüm, Bühne, CDU, Fleisch, Johannes Rau, Bundesregierung, SPD, Kurt Biedenkopf, Auswärtiges Amt, Bundestag, Estland, Ostdeutschland, PDS, Pflegeversicherung, Resolution, Selbstbestimmung, Lettland, Sowjetunion, Baltikum, Bonn, Düsseldorf, Niedersachsen, Rheinland-Pfalz","http://www.zeit.de/1991/11/stachel-im-fleisch"
"Volksbefragungen im Baltikum: „Lieber tot als rot!“ |","1991.11.1959","1991-03-08","DIE ZEIT, Volksbefragungen im Baltikum, Baltikum, Bevölkerung, Lettland, Abgeordnetenhaus, Arnold Rüütel, Estland, Parlament, Sowjetunion, Litauen, Tallinn, Riga, Europa","http://www.zeit.de/1991/11/lieber-tot-als-rot"
"Weil das Recht zum Krieg stets umstritten blieb, versuchten die Völkerrechtler, wenigstens dem Recht im Krieg Geltung zu verschaffen. In einem Nachwort zum Golfkonflikt fragt ZEIT-Autor Richard Schröder nach den Möglichkeiten, die Grundzüge der internationalen Rechtsordnung durchzusetzen.: Ohne Unrecht im Frieden leben |","1991.11.1960","1991-03-08","DIE ZEIT, Weil das Recht zum Krieg stets umstritten blieb, versuchten die Völkerrechtler, wenigstens dem Recht im Krieg Geltung zu verschaffen. In einem Nachwort zum Golfkonflikt fragt ZEIT-Autor Richard Schröder nach den Möglichkeiten, die Grundzüge der internationalen Rechtsordnung durchzusetzen., Krieg, Recht, Aristoteles, Frieden, Richard Schröder, Saddam Hussein, Thomas von Aquin, Peter Glotz, SPD-Fraktion, Vereinte Nationen, Cicero, DDR, Dschihad, Gewalt, Golfkrieg, Volkskammer, Völkerrecht, Weltsicherheitsrat, Israel, Spanien, USA, Kuwait","http://www.zeit.de/1991/11/ohne-unrecht-im-frieden-leben"
"Ein Pakt wird begraben |","1991.11.1961","1991-03-08","DIE ZEIT, , Nato, Abschreckung, George F.  Kennan, Putsch, Staatsoberhaupt, Ungarn, Polen, Tschechoslowakei, Österreich, Budapest, Moskau","http://www.zeit.de/1991/11/ein-pakt-wird-begraben"
"Auch jetzt noch einig? |","1991.11.1962","1991-03-08","DIE ZEIT, , Saddam Hussein, Sicherheitsrat, UN-Sicherheitsrat, Vereinte Nationen, Abrüstung, Allianz, Diplomat, Golf, Irak, Sowjetunion, Waffenstillstand, New York, Washington D.C., Kuwait, Moskau","http://www.zeit.de/1991/11/auch-jetzt-noch-einig"
"Ben Witter: Angetippt |","1991.11.1963","1991-03-08","DIE ZEIT, Ben Witter, Arzt, Ausdauer, Ben Witter, Eltern, Gespräch, Heide, Krankheit, Naturschutzgebiet, Geld, Israel, Krieg, Polen, USA, New York","http://www.zeit.de/1991/11/angetippt"
"Rückblick: Justiz in Großbritannien: Das Gesicht wahren |","1991.11.1964","1991-03-08","DIE ZEIT, Rückblick: Justiz in Großbritannien, Großbritannien, Justiz, Recht, Attentat, Drama, Gaststätte, Independent, Polizei, Prozess, Richter, Staatsanwaltschaft, Birmingham","http://www.zeit.de/1991/11/das-gesicht-wahren"
"Lehren aus dem Golfkrieg: Menetekel für Moskaus Militärs |","1991.11.1965","1991-03-08","DIE ZEIT, Lehren aus dem Golfkrieg, Saddam Hussein, Moskau, Verteidigungsministerium, Flugzeug, Golf, Golfkrieg, Irak, Soldat, Sowjetunion, Saudi Arabien, Kuwait, Moskau, Budapest, Europa, Fernost, Wladiwostok","http://www.zeit.de/1991/11/menetekel-fuer-moskaus-militaers"
"Nach dem Krisengipfel beim Kanzler: Späte Stütze in akuter Not |","1991.11.1966","1991-03-08","DIE ZEIT, Nach dem Krisengipfel beim Kanzler, Helmut Kohl, Theo Waigel, Bundesregierung, Manfred Stolpe, Werner Münch, Kurt Biedenkopf, Christian Wernicke, Finanzminister, Föderalismus, Heizung, Irmgard Schwaetzer, Kajo Schommer, Bonn, Dresden, Elbe, Magdeburg, München, Rhein, Saarbrücken, Sachsen-Anhalt","http://www.zeit.de/1991/11/spaete-stuetze-in-akuter-not"
"Der Frieden als Fata Morgana |","1991.11.1967","1991-03-08","DIE ZEIT, , Saddam Hussein, George W.  Bush, Frieden, Israel, Jassir Arafat, Phoenix, Golf, Golfkrieg, Gomorrha, Hosni Mubarak, Jordanien, Palästinenser, Irak, Libanon, Bagdad, Jerusalem, Kairo, Kuwait, Palästina, Washington D.C","http://www.zeit.de/1991/11/der-frieden-als-fata-morgana"
"Zeitspiegel |","1991.11.1968","1991-03-08","DIE ZEIT, , Diplomat, Dollar, Exxon, Gold, Grafik, Guido Brunner, Handel, Stadt, Sowjetunion, Vietnam, Madrid, Moskau, Washington D.C","http://www.zeit.de/1991/11/zeitspiegel"
"Bonner Bilanz nach dem Golfkrieg: Alles in bester Ordnung? |","1991.11.1969","1991-03-08","DIE ZEIT, Bonner Bilanz nach dem Golfkrieg, Hans-Dietrich Genscher, Volker Rühe, Helmut Kohl, SPD, Paul Kennedy, Björn Engholm, USA, Blauhelm, Bundeswehr, Golf, Partnerschaft, Vereinte Nationen, Golfkrieg, Jugoslawien, Bonn, Europa, Washington D.C., Davos","http://www.zeit.de/1991/11/alles-in-bester-ordnung"
"Die Straße des Schreckens |","1991.11.1970","1991-03-08","DIE ZEIT, , Flüchtling, Soldat, Irak, Basra, Kuwait, Moskau","http://www.zeit.de/1991/11/die-strasse-des-schreckens"
"Markt-Report: Kein klarer Trend |","1991.11.1971","1991-03-08","DIE ZEIT, Markt-Report, Dax, Hoechst, Aktie, Aktienindex, Aktienmarkt, Anleihe, Bank, Börse, Daimler AG, Golf, Golfkrieg, Rendite, Unternehmen, Geld","http://www.zeit.de/1991/11/kein-klarer-trend"
"Französische Rüstungsindustrie: Ende der goldenen Jahre |","1991.11.1972","1991-03-08","DIE ZEIT, Französische Rüstungsindustrie, François Mitterrand, François Hollande, Frankreich, Rüstungsindustrie, Verteidigungsministerium, Golfkrieg, Jaguar, Brasilien, Irak, USA, Europa, Paris","http://www.zeit.de/1991/11/ende-der-goldenen-jahre"
"Wolfgang Hoffmann:: Keine Moral aus der Geschicht’ |","1991.11.1973","1991-03-08","DIE ZEIT, Wolfgang Hoffmann:, Edzard Reuter, Bundesregierung, Grüne, Richard Freiherr von Weizsäcker, DDR, Export, Frankreich, Hans-Jürgen Wischnewski, Irak, Tornado, Waffenexport, Saudi Arabien, Südafrika, Südkorea, Bonn, Seoul","http://www.zeit.de/1991/11/keine-moral-aus-der-geschicht"
"Im Gewirr der neuen Paragraphen finden sich weder die ostdeutschen Arbeitnehmer noch die Arbeitgeber, noch die Richter zurecht: Wie ein Lotteriespiel |","1991.11.1974","1991-03-08","DIE ZEIT, Im Gewirr der neuen Paragraphen finden sich weder die ostdeutschen Arbeitnehmer noch die Arbeitgeber, noch die Richter zurecht, Richter, Robert Müller, Arbeitnehmer, Theo Waigel, Arbeitgeber, Arbeitsgericht, Arbeitsrecht, Ostdeutschland, Sozialplan, Magdeburg, Berlin, Bonn","http://www.zeit.de/1991/11/wie-ein-lotteriespiel"
"Sanfter Machtkampf |","1991.11.1975","1991-03-08","DIE ZEIT, , Continental AG, Veba, Aktie, Bayerische Vereinsbank, Bridgestone, Hannover, Wiesbaden","http://www.zeit.de/1991/11/sanfter-machtkampf"
"Umweltpolitik: Der Kohlenpott als Müllpott |","1991.11.1976","1991-03-08","DIE ZEIT, Umweltpolitik, Klaus Matthiesen, Umweltpolitik, Umweltbundesamt, Bürgerinitiative, Essen, Landesregierung, Oberhausen, Ruhrgebiet, Umweltminister, Duisburg, Krefeld, Nordrhein-Westfalen","http://www.zeit.de/1991/11/der-kohlenpott-als-muellpott"
"Kopf in den Sand |","1991.11.1977","1991-03-08","DIE ZEIT, , Saddam Hussein, Rüstungsindustrie, Frankreich, Litauen, Kuwait, Paris","http://www.zeit.de/1991/11/kopf-in-den-sand"
"Treuhand: Hauen und Stechen |","1991.11.1978","1991-03-08","DIE ZEIT, Treuhand, CDU, Heinz Bauer, Manfred Stolpe, Bauer Verlag, DDR, Kanzleramt, Verlag, Dresden, Berlin, Brandenburg, Chemnitz, Hamburg, Magdeburg, Potsdam","http://www.zeit.de/1991/11/hauen-und-stechen"
"Bonner Kulisse |","1991.11.1979","1991-03-08","DIE ZEIT, , Theo Waigel, Gregor Gysi, Bundesregierung, Dieter Vogel, Gerhard Stoltenberg, Grüne, Hermann Otto Solms, Grundgesetz, Norbert Gansel, PDS, Solidaritätszuschlag, U-Boot, Verfassungsgericht, Südkorea, Berlin","http://www.zeit.de/1991/11/bonner-kulisse"
"Wirtschaftsbuch: Der gläserne Manager |","1991.11.1980","1991-03-08","DIE ZEIT, Wirtschaftsbuch, Betriebsrat, Doktorarbeit, Großunternehmen","http://www.zeit.de/1991/11/der-glaeserne-manager"
"Signal zum Ausharren |","1991.11.1981","1991-03-08","DIE ZEIT, , Bundesregierung, Norbert Blüm, DDR, Gewerkschaft, Heer, Metallindustrie, Ostdeutschland, Produktivität, Tarifvertrag, Vertrag, Bonn, Elbe, Mecklenburg-Vorpommern","http://www.zeit.de/1991/11/signal-zum-ausharren"
"Bonn will die Tabaksteuer erhöhen: Rauchen für Waigel |","1991.11.1982","1991-03-08","DIE ZEIT, Bonn will die Tabaksteuer erhöhen, Bonn, Theo Waigel, Bundesumweltminister, Ostdeutschland, Philip Morris, Rauchen, Theo Waigel, Berlin","http://www.zeit.de/1991/11/rauchen-fuer-waigel"
"Drohung mit dem Rücktritt |","1991.11.1983","1991-03-08","DIE ZEIT, , Bundesregierung, FDP, Airbus, Drohung, Ignaz Kiechle, DDR, Entschädigung, MIT, Sowjetunion, Bonn","http://www.zeit.de/1991/11/drohung-mit-dem-ruecktritt"
"Streiks, Entlassungen und Inflation – die brasilianische Wirtschaft gleitet in ihre tiefste Krise: Mit Glamour ins Chaos |","1991.11.1984","1991-03-08","DIE ZEIT, Streiks, Entlassungen und Inflation – die brasilianische Wirtschaft gleitet in ihre tiefste Krise, Fernando Collor de Mello, Inflation, Bundesregierung, Saddam Hussein, Lateinamerika, Weltbank, Brasília, Chaos, Indien, MIT, Mexiko, Rio de Janeiro, São Paulo","http://www.zeit.de/1991/11/mit-glamour-ins-chaos"
"Autoseller: Neuer Rekord |","1991.11.1985","1991-03-08","DIE ZEIT, Autoseller, Rekord, Auto, Gebrauchtwagen, Konjunktur, Statistik, Frankreich, Großbritannien, Spanien","http://www.zeit.de/1991/11/neuer-rekord"
"Bank und Börse: Unscheinbare Steuerschnäppchen |","1991.11.1986","1991-03-08","DIE ZEIT, Bank und Börse, Theo Waigel, Bank, Börse, Bundesanleihe, Finanzamt, Immobilienbesitz, Kapitalanlage, Rendite, Steuer, Steuerbelastung, Wertpapierhandel","http://www.zeit.de/1991/11/unscheinbare-steuerschnaeppchen"
"Europäische Währungsunion: Ein Streit um des Kaisers Bart |","1991.11.1987","1991-03-08","DIE ZEIT, Europäische Währungsunion, Bundesbank, Bundesregierung, Hans Tietmeyer, Währungsunion, Frankreich, Geldpolitik, Italien, Staatsdefizit, Währungspolitik, Europäische Währungsunion, Großbritannien, Paris, Portugal, Bonn, London, Rom","http://www.zeit.de/1991/11/ein-steit-um-des-kaisers-bart"
"Nach dem Ende des Golfkrieges beginnt der Wettlauf der Industriestaaten um lukrative Aufträge. Wirkt der Wiederaufbau als Konjunktur-Lokomotive?: Der Griff nach den Früchten des Sieges |","1991.11.1988","1991-03-08","DIE ZEIT, Nach dem Ende des Golfkrieges beginnt der Wettlauf der Industriestaaten um lukrative Aufträge. Wirkt der Wiederaufbau als Konjunktur-Lokomotive?, Ford, Chrysler, USA, Bechtel, Dow-Jones-Index, Golf, Golfkrieg, Irak, Motorola, Rezession, Saudi Arabien, Vereinte Nationen, Kuwait, Bagdad","http://www.zeit.de/1991/11/der-griff-nach-den-fruechten-des-sieges"
"Italien: Römisches Imperium |","1991.11.1989","1991-03-08","DIE ZEIT, Italien, Italien, Algerien, Erdgas, Gas, Libyen, Angola, Australien, Malta, Nigeria, Venezuela, Ägypten, Europa, Bayern, Cagliari, Mittelmeer, Rom, Sizilien, Teheran","http://www.zeit.de/1991/11/roemisches-imperium"
"Private Haushalte: Konzentration des Reichtums |","1991.11.1990","1991-03-08","DIE ZEIT, Private Haushalte, Konzentration, Statistisches Bundesamt, Notenbank, Wiesbaden","http://www.zeit.de/1991/11/konzentration-des-reichtums"
