"title","number","date","keywords","link"
"Die Südkoreaner sehnen sich nicht nach der Wiedervereinigung, sondern nach einer „neuen Moral“: Starker Mann im Blauen Haus |","1993.10.5215","1993-03-05","DIE ZEIT, Die Südkoreaner sehnen sich nicht nach der Wiedervereinigung, sondern nach einer „neuen Moral“, Chun Doo Hwan, Amtseid, Cadillac, Dissident, ICE, Seoul","http://www.zeit.de/1993/10/starker-mann-im-blauen-haus"
"Die amerikanische Luftbrücke für Bosnien hat einen Streit in Serbien ausgelöst: Die Armee fordert eine harte Reaktion, die Politiker wiegeln ab: Provokative Hilfe |","1993.10.5216","1993-03-05","DIE ZEIT, Die amerikanische Luftbrücke für Bosnien hat einen Streit in Serbien ausgelöst: Die Armee fordert eine harte Reaktion, die Politiker wiegeln ab, Bill Clinton, Bosnien und Herzegowina, Serbien, Slobodan Miloševic, Boris Jelzin, Militär, Allianz, Bosnien und Herzegowina, Flugzeug, Genozid, Hilfsaktion, Jugoslawien, Russland, Belgrad, Washington D.C","http://www.zeit.de/1993/10/provokative-hilfe"
"Italiens Ministerpräsident Giuliano Amato durchlebt Tage, „die zu den dramatischsten gehören“: Hart bleiben und die Wahrheit sagen |","1993.10.5217","1993-03-05","DIE ZEIT, Italiens Ministerpräsident Giuliano Amato durchlebt Tage, „die zu den dramatischsten gehören“, Ministerpräsident, Giuliano Amato, Italien, Giulio Andreotti, Italien, Regierungschef, Turin","http://www.zeit.de/1993/10/hart-bleiben-und-die-wahrheit-sagen"
"Wolfgang Ebert: Für alle Störfälle |","1993.10.5218","1993-03-05","DIE ZEIT, Wolfgang Ebert, Medien, Katastrophe, Öffentlichkeit, Wolfgang Ebert","http://www.zeit.de/1993/10/fuer-alle-stoerfaelle"
"Potsdamer Affentheater |","1993.10.5219","1993-03-05","DIE ZEIT, , SPD, Medien, Öffentlichkeit, Potsdam","http://www.zeit.de/1993/10/potsdamer-affentheater"
"Übervater |","1993.10.5220","1993-03-05","DIE ZEIT, , Johannes Paul II., Kirche, Mädchen, Papst, Vergewaltigung, Bosnien und Herzegowina","http://www.zeit.de/1993/10/uebervater"
"Nach dem Chemieunfall bei Hoechst: Die Kommunalwahlen in Hessen werden wieder spannend: Giftwolken im Bundestrend |","1993.10.5221","1993-03-05","DIE ZEIT, Nach dem Chemieunfall bei Hoechst: Die Kommunalwahlen in Hessen werden wieder spannend, CDU, Daniel Cohn-Bendit, Hessen, FDP, Joschka Fischer, Petra Roth, SPD, Hoechst AG, Volker Hauff, Walter Wallmann, Abfallwirtschaft, Ausländerpolitik, Kommunalpolitik, Mallorca","http://www.zeit.de/1993/10/giftwolken-im-bundestrend"
"Die Verfassungskommission auf Abwegen: Das Parlament soll sich selber auflösen dürfen: Ein Putsch gegen den Präsidenten |","1993.10.5222","1993-03-05","DIE ZEIT, Die Verfassungskommission auf Abwegen: Das Parlament soll sich selber auflösen dürfen, Jürgen Rüttgers, Parlament, Unionsfraktion, Bundespräsident, Grundgesetz, Misstrauensvotum, Umweltschutz, Verfassung, Beziehung, Debatte, Putsch, Schiedsrichter, Staatsoberhaupt","http://www.zeit.de/1993/10/ein-putsch-gegen-den-praesidenten"
"Wie Ignatz Bubis den Israelis erklärt, warum er als Jude in Deutschland lebt: Bewährung in seltsamer Rolle |","1993.10.5223","1993-03-05","DIE ZEIT, Wie Ignatz Bubis den Israelis erklärt, warum er als Jude in Deutschland lebt, Ignatz Bubis, Israel, Schimon Peres, Diaspora, Heinz Galinski, Judentum, Judenverfolgung, Kibbuz, Bundesrepublik Deutschland, Irak, Sowjetunion, Spanien, Dublin, Europa, Jerusalem, München, Rostock, Tel Aviv","http://www.zeit.de/1993/10/bewaehrung-in-seltsamer-rolle"
"Nach dem Anschlag auf das New Yorker Welthandelszentrum: Die nächste Bombe? |","1993.10.5224","1993-03-05","DIE ZEIT, Nach dem Anschlag auf das New Yorker Welthandelszentrum, Anschlag, Airbus, Bill Clinton, CIA, Hisbollah, FBI, Fox, Sekte, USA, Iran, Jugoslawien, New York, Manhattan, Texas, Washington D.C","http://www.zeit.de/1993/10/die-naechste-bombe"
"Worte der Woche |","1993.10.5225","1993-03-05","DIE ZEIT, , CDU, Günther Jansen, Michael Glos, Wolfgang Schäuble, Björn Engholm, Otto Graf Lambsdorff, Chelsea Clinton, Feuerwehr, Gebäude, Günter Behnisch, Hoechst AG, Bosnien und Herzegowina, Berlin, Schleswig-Holstein","http://www.zeit.de/1993/10/worte-der-woche"
"Ein moderner Patriotismus hat nichts mit dem völkischen Verständnis von Nation gemein: Ein Vaterland der Bürger |","1993.10.5226","1993-03-05","DIE ZEIT, Ein moderner Patriotismus hat nichts mit dem völkischen Verständnis von Nation gemein, Dolf Sternberger, Patriotismus, Nationalismus, Republik, Thomas Schmid, Verfassung, MIT","http://www.zeit.de/1993/10/ein-vaterland-der-buerger"
"Warum eine Umweltministerin (Ost) über ihren Staatssekretär (West) zu Fall kommen könnte: „Papa“ wird’s schon richten |","1993.10.5227","1993-03-05","DIE ZEIT, Warum eine Umweltministerin (Ost) über ihren Staatssekretär (West) zu Fall kommen könnte, CDU, Grüne, Greenpeace, Umweltministerium, Uwe Barschel, Alfred Gomolka, Giftmüll, Müll, Staatssekretär, Mecklenburg-Vorpommern, Kiel","http://www.zeit.de/1993/10/papa-wirds-schon-richten"
"In Bonn wächst der Unmut der CDU über die politische Führung – gemeint ist natürlich der Kanzler: Die Not im elften Jahr |","1993.10.5228","1993-03-05","DIE ZEIT, In Bonn wächst der Unmut der CDU über die politische Führung – gemeint ist natürlich der Kanzler, Helmut Kohl, Wolfgang Schäuble, Bonn, CDU, Theo Waigel, CSU, Erwin Teufel, Kurt Biedenkopf, Brian Mulroney, SPD, Manfred Kanther, München","http://www.zeit.de/1993/10/die-not-um-elften-jahr"
"Ein Mann der Reserve |","1993.10.5229","1993-03-05","DIE ZEIT, , Volker Rühe, Augusto Pinochet, Bundeswehr, Dorf, Eurofighter, Verteidigungsminister, Santiago","http://www.zeit.de/1993/10/ein-mann-der-reserve"
"Die Tabuschwellen sinken, die Gewalt nimmt zu – doch Englands Politiker können den Verfall nicht stoppen: Ein Land gerät aus den Fugen |","1993.10.5230","1993-03-05","DIE ZEIT, Die Tabuschwellen sinken, die Gewalt nimmt zu – doch Englands Politiker können den Verfall nicht stoppen, Gewalt, Die Linke, Bill Clinton, Tony Blair, Kriminalität, Alkoholismus, David Blunkett, Großbritannien, Labour Partei, Straftäter, London","http://www.zeit.de/1993/10/ein-land-geraet-aus-den-fugen"
"Alltag in Bosnien: Während die Männer schießen und schwätzen, organisieren Frauen das Überleben im Krieg: „Wir machen Käse ohne Milch“ |","1993.10.5231","1993-03-05","DIE ZEIT, Alltag in Bosnien: Während die Männer schießen und schwätzen, organisieren Frauen das Überleben im Krieg, Krieg, Alltag, Käse, Evakuierung, Kriegsfilm, Sarajevo, Belgrad, Berlin, Europa, Genf, London","http://www.zeit.de/1993/10/wir-machen-kaese-ohne-milch"
"Energiewirtschaft: Eine Initiative von Umweltschützern und der Industrie zeigt auf, wie das Atomproblem im Osten zu entschärfen ist: Der Dreh mit der Birne |","1993.10.5232","1993-03-05","DIE ZEIT, Energiewirtschaft: Eine Initiative von Umweltschützern und der Industrie zeigt auf, wie das Atomproblem im Osten zu entschärfen ist, Industrie, Greenpeace, Bulgarien, Energiesparlampe, Glühbirne, Dänemark, MIT, Niederlande, Europa, Südamerika, Wien","http://www.zeit.de/1993/10/der-dreh-mit-der-birne"
"Brasilien: Auch der neue Präsident Itamar Franco hat kein Konzept: Heillos verheddert |","1993.10.5233","1993-03-05","DIE ZEIT, Brasilien: Auch der neue Präsident Itamar Franco hat kein Konzept, Präsident, VW, Bill Clinton, Ford, Fiat, General Motors, Auto, Bauindustrie, Dollar, Fernando Collor de Mello, Industriepolitik, Industrieroboter, Inflation, Steuer, Mexiko, São Paulo, Washington D.C","http://www.zeit.de/1993/10/heillos-verheddert"
"Markt-Report: Im Sog der Zinsen |","1993.10.5234","1993-03-05","DIE ZEIT, Markt-Report, Bundesbank, Hilmar Kopper, Aktie, Aktienmarkt, Gewinn, Leitzins, Verlust, Vorstand, Zinsen","http://www.zeit.de/1993/10/im-sog-der-zinsen"
"Bonner Kulisse |","1993.10.5235","1993-03-05","DIE ZEIT, , Helmut Kohl, Theo Waigel, Bundesregierung, SPD, Siemens AG, CSU, Gerhard Schröder, Wirtschaftsministerium, Annette Fugmann-Heesing, Bundeskanzler, Erich Riedl, Europäische Gemeinschaft, Expo, Finanzminister, Solidaritätszuschlag, Staatssekretär, Umsatzsteuer, Weltausstellung, Bonn, Hannover, Hessen, Niedersachsen","http://www.zeit.de/1993/10/bonner-kulisse"
"Angst vor der Revolte |","1993.10.5236","1993-03-05","DIE ZEIT, , Internationaler Währungsfonds, Ägypten, Arbeitslose, Fonds, Kredit, Privatisierung, Weltbank, Revolte, Kairo","http://www.zeit.de/1993/10/angst-vor-der-revolte"
"Kernkraft: Zwietracht |","1993.10.5237","1993-03-05","DIE ZEIT, Kernkraft, Grüne, SPD, RWE, Veba, Chef, Hoffnung, Ministerpräsident, Regierung, Niedersachsen","http://www.zeit.de/1993/10/zwietracht"
"Joan Robinson begründete den Linkskeynesianismus. Die Nonkonformistin dachte über den Umbau der Industriegesellschaft nach: Genie im Männerzirkus |","1993.10.5238","1993-03-05","DIE ZEIT, Joan Robinson begründete den Linkskeynesianismus. Die Nonkonformistin dachte über den Umbau der Industriegesellschaft nach, Rosa Luxemburg, Karl Marx, Arbeitslosigkeit, Produktion, Vollbeschäftigung, Cambridge, Marburg","http://www.zeit.de/1993/10/genie-um-maennerzirkus"
"Hoechst: Der Störfall war vermeidbar – unter dem Vertrauensverlust leidet nun die ganze Branche: Preis des Versagens |","1993.10.5239","1993-03-05","DIE ZEIT, Hoechst: Der Störfall war vermeidbar – unter dem Vertrauensverlust leidet nun die ganze Branche, Hoechst AG, Joschka Fischer, Bundesgerichtshof, Chemikalie, Landesregierung, Umweltministerium, Hessen","http://www.zeit.de/1993/10/preis-des-versagens"
"Bundeshaus: Mißklang |","1993.10.5240","1993-03-05","DIE ZEIT, Bundeshaus, Siemens AG, Architekt, Bundestag, Herbst, Skandal, Bonn","http://www.zeit.de/1993/10/missklang"
"Stahl: Erst unter dem Druck Brüssels hat die Industrie in den achtziger Jahren Kapazitäten und Arbeitsplätze abgebaut: Feilschen um jede Tonne |","1993.10.5241","1993-03-05","DIE ZEIT, Stahl: Erst unter dem Druck Brüssels hat die Industrie in den achtziger Jahren Kapazitäten und Arbeitsplätze abgebaut, Industrie, Bundesregierung, Dieter Spethmann, Europäischer Gerichtshof, Hoesch, Stahlindustrie, Brüssel, Italien, Spanien, Europa, Bonn, Düsseldorf","http://www.zeit.de/1993/10/feilschen-um-jede-tonne"
"Versicherungen werden billiger, aber riskanter: Falsche Policen? |","1993.10.5242","1993-03-05","DIE ZEIT, Versicherungen werden billiger, aber riskanter, Bundesregierung, Leon Brittan, Margaret Thatcher, Deutsche Bank, Binnenmarkt, Bundesaufsichtsamt für das Versicherungswesen, Verbraucherschutz, Großbritannien, Irland, Spanien, Versicherungen, Bonn","http://www.zeit.de/1993/10/falsche-policen"
"ZEIT/Südprojekt-Prognose: Die Mark verliert |","1993.10.5243","1993-03-05","DIE ZEIT, ZEIT/Südprojekt-Prognose, Aktienmarkt, Dollar, Währung, Yen, Hoffnung","http://www.zeit.de/1993/10/die-mark-verliert"
"Weltwirtschaft: Eintopf |","1993.10.5244","1993-03-05","DIE ZEIT, Weltwirtschaft, Helmut Kohl, Bundeskanzler, Finanzminister, Generation, Protektionismus, Qualität, Rente, Staatsverschuldung, Japan, London","http://www.zeit.de/1993/10/eintopf"
