"title","number","date","keywords","link"
"Modern, einflussreich, genießerisch","2000.26.23317","2000-06-21","Politik, , Phoenix, Forschungspolitik, Frankreich, EU-Osterweiterung, EU-Politik, Malerei, Mode, Motor, Nahrungsmittel, Raumfahrt, Umweltschutz, Italien, Spanien, Berlin, Mittelmeer, Paris","http://www.zeit.de/2000/26/200026.frk.umfrage_.xml"
"Streitgespräch Joschka Fischer contra Jean-Pierre Chevènement","2000.26.23318","1899-12-31","Politik, , Joschka Fischer, Jean-Pierre Chevènement, Europäische Union, Robert Schuman, Frankreich, Europaparlament, Globalisierung, Polen, Russland, Debatte, Europa, Nationalsozialismus, Revolution, Berlin, Auschwitz, Brüssel, Seattle","http://www.zeit.de/2000/26/200026.titelei_.xml"
"Grün matt, Gelb satt","2000.26.23319","2000-06-21","Politik, , Reform, Koalition, Innenpolitik, Oekologie, Umwelt, Sozialstaat, Arbeit, Zukunft, Umfrage, Regierung, Parteitage, Reform, Koalition, Innenpolitik, Ökologie, Umwelt, Sozialstaat, Arbeit und Sozialstaat, Zukunft, Umfrage, Regierung, FDP, Gerhard Schröder, Grüne, CDU, Gesundheitssystem, Liberalismus, PDS, Postmoderne, Sozialdemokratie, Volksparteien","http://www.zeit.de/2000/26/200026.schroedersglueck.xml"
"ZEIT-Spezial Frankreich","2000.26.23320","2000-06-21","Politik, , Frankreich, Europäische Union, Jacques Chirac, Joschka Fischer, Lionel Jospin, Rudolf Augstein, Bundesaußenminister, Eliteschule, Generation, Jack Lang, Jean-Pierre Chevènement, Klischee, Mond, Nachtleben, Renaissance, Staatsbesuch, Technologie, Volkswirtschaft, Berlin, Europa","http://www.zeit.de/2000/26/ZEIT-Spezial_Frankreich"
"Die CDU braucht wieder Kompetenz","2000.26.23321","2000-06-21","Politik, , Biedenkopf, Edmund Stoiber, Gerhard Schröder, CDU, Kurt Biedenkopf, Angela Merkel, FDP, Guido Westerwelle, Helmut Kohl, SPD, CSU, Altersvorsorge, Rente, Bundesrepublik Deutschland, Europa","http://www.zeit.de/2000/26/Die_CDU_braucht_wieder_Kompetenz"
"Die neue Lust an der Revolution","2000.26.23322","2000-06-21","Politik, , Frankreich, Revolution, Frankreich, Standesamt, Christine Boutin, Elisabeth Guigou, Gleichstellung, Jura, Paris","http://www.zeit.de/2000/26/Die_neue_Lust_an_der_Revolution"
"Korallenriff Europa","2000.26.23323","2000-06-21","Politik, , Europa, Joschka Fischer, Europäische Union, Alain Juppé, Ass, Außenminister, Chris Patten, EU-Gipfel, Emotion, Ostpolitik, Partnerschaft, Patriotismus, Test, Italien, Portugal, Russland, USA, Berlin, Brüssel, Nizza, Paris, Rom","http://www.zeit.de/2000/26/Korallenriff_Europa"
"Schlagt ihn, wo ihr ihn trefft","2000.26.23324","2000-06-21","Politik, , Rechtsextremismus, Innenpolitik, Extremismus, Musik, Wahlkampf, Wahl, Partei, Landtagswahl, Verfassungsschutz, Verfassung, Staat, Christian Worch, SPD, Thomas Wulff, Demonstration, Früherkennung, Innenminister, Ostdeutschland, Rechtsextremismus, Hamburg, Schleswig-Holstein, Neumünster, Pinneberg, Wilhelmshaven, Rechtsextremismus, Innenpolitik, Extremismus, Musik, Wahlkampf, Wahl, Partei, Landtagswahl, Verfassungsschutz, Verfassung","http://www.zeit.de/2000/26/200026.elmshorn_.xml"
"Verzweiflung","2000.26.23325","2000-06-21","Politik, , Armut, Asyl, Droge, Handel, LKW, Menschenhandel, Regierung, Belgien, China, England, Frankreich, Großbritannien, Niederlande, Russland, Osteuropa","http://www.zeit.de/2000/26/Verzweiflung"
"Ich bin kein Idiot","2000.26.23326","2000-06-21","Politik, , Wolfensohn, James Wolfensohn, Bank, Entwicklungsland, Entwicklungspolitik, Globalisierung, Internationaler Währungsfonds, Shell AG, Tschad, Václav Havel, Weltbank, Botsuana, Dollar, Fonds, Freihandel, Kamerun, Kohle, Nigeria, Osttimor, Uganda, Afrika, Berlin, Lesotho, Prag, Seattle, Washington D.C","http://www.zeit.de/2000/26/Ich_bin_kein_Idiot"
"Schurken-Abgang","2000.26.23327","2000-06-21","Politik, , China, Wladimir Putin, Bill Clinton, Kim Dae Jung, Atomprogramm, Bumerang, Nordkorea, Südkorea, China, Irak, Italien, Spanien, USA, Seoul, Asien, Peking, Pjöngjang, Ural, Washington D.C","http://www.zeit.de/2000/26/Schurken-Abgang"
"Bescheiden und entschieden","2000.26.23328","2000-06-21","Politik, , Roman Herzog, Ehe, Emanzipation, Familie, Geschichte, Stiftung, Rom","http://www.zeit.de/2000/26/Bescheiden_und_entschieden"
"Holland 1, Belgien 0 - Weißrussen für Schröder","2000.26.23329","2000-06-21","Politik, , Gerhard Schröder, Belgien, Niederlande, Alexander Lukaschenko, Bill Clinton, Wladimir Putin, Fidel Castro, Bier, Droge, Haschisch, Hooligan, Polizei, Niederlande, Portugal, Weißrussland, Europa, Hannover, Minsk","http://www.zeit.de/2000/26/Holland_1_Belgien_0_-_Weissrussen_fuer_Schroeder"
"Europas Einheit, ein einzigartiges Abenteuer","2000.26.23330","2000-06-21","Politik, , Integration, Europäische Union, François Mitterrand, Jacques Delors, EU-Ratspräsidentschaft, Grundschule, Innovation, Jack Lang, Jean Monnet, Lateinamerika, Robert Schuman, Student, Unterricht, Europa, Frankreich, Nizza, Paris","http://www.zeit.de/2000/26/Europas_Einheit_ein_einzigartiges_Abenteuer"
"Opfer auf dem Altar der Nation","2000.26.23331","2000-06-21","Politik, , Sucht, Sozialverhalten, Psyche_und_Sexualitaet, Politischer_widerstand, Medizin, Lebensstandard, Krankheit, Innenpolitik, Gewalt, Gesellschaft_und_soziales_Leben, Drogen, Sucht, Sozialverhalten, Psyche und Sexualität, Politischer Widerstand, Medizin, Lebensstandard, Krankheit, Innenpolitik, Gewalt, Gesellschaft und soziales Leben, Eritrea, Vereinte Nationen, Italien, Sowjetunion, USA, Europa, Äthiopien, Afrika","http://www.zeit.de/2000/26/200026.eritrea_.xml"
"Japan vor den Wahlen","2000.26.23332","2000-06-21","Politik, , Parlamentswahl, Premierminister, Wahl, Wirtschaftskrise, Japan, Tokio","http://www.zeit.de/2000/26/Japan_vor_den_Wahlen"
"Lernendes System","2000.26.23333","2000-06-21","Politik, , Wladimir Putin, Bundesregierung, Wladimir Gussinskij, Bier, DDR, Kanzleramt, Kreml, Übersetzung, Berlin, Moskau, Madrid","http://www.zeit.de/2000/26/200026.putin-besuch_.xml"
"Pfusch am Bau","2000.26.23334","2000-06-21","Politik, , Chris Patten, Europäische Union, Javier Solana, Romano Prodi, Außenhandel, Außenpolitik, Diplomat, EU-Gipfel, Echo, Kreml, Misstrauensvotum, Nato-Generalsekretär, Regierungschef, Umwelt, Verteidigungsminister, Balkan, Brüssel","http://www.zeit.de/2000/26/Pfusch_am_Bau"
"Wieder ein Toter","2000.26.23335","2000-06-21","Politik, , Dessau, Bier, Gedenkstätte, Jugendliche, Justiz, Opfer, Ostdeutschland, Rassismus, Schwerin, Dessau, Eberswalde, Leipzig, Sachsen-Anhalt, Sachsenhausen, Wiesbaden","http://www.zeit.de/2000/26/Wieder_ein_Toter"
"Die Kompromissler","2000.26.23336","2000-06-21","Politik, , Funktionär, Grietje Bettin, Grüne, Harald Schmidt, Klaus Müller, Renate Künast, Atomausstieg, Bundestagsfraktion, Friedensbewegung, Landtag, Berlin, Nordrhein-Westfalen, Seattle, Tschernobyl","http://www.zeit.de/2000/26/Die_Kompromissler"
"Das Unbehagen an der Macht","2000.26.23337","2000-06-21","Politik, , Partei, Regierung, Reform, Parteitage, Koalition, Innenpolitik, Umwelt, Politik, Sozialdemokratie, Rentenreformen, Krise, Partei, Regierung, Reform, Parteitage, Koalition, Innenpolitik, Umwelt, Politik, Sozialdemokratie, Rentenreformen, Joschka Fischer, Grüne, Reinhard Bütikofer, Renate Künast, Intervention, Parteitag, Rezzo Schlauch, Berlin, Europa, Karlsruhe, Nordrhein-Westfalen","http://www.zeit.de/2000/26/200026.zerreissprobe_.xml"
"Staatsanwälte am Gängelband der Politik","2000.26.23338","2000-06-21","Politik, , Staatsanwalt, Herta Däubler-Gmelin, Chronik, Ermittlung, Justizminister, Karlheinz Schreiber, Polizei, Richter, Italien, Bayern","http://www.zeit.de/2000/26/Staatsanwaelte_am_Gaengelband_der_Politik"
"Worte der Woche","2000.26.23339","2000-06-21","Politik, , Bundesregierung, Grüne, FDP, Franz Müntefering, Guido Westerwelle, SPD, Wladimir Putin, Heimat, Kernenergie, Papst, Pierre Bourdieu, Präsident, Tod, Dessau","http://www.zeit.de/2000/26/200026.wowos_zsp.pol.xml"
"Bahnfahrt durchs Götterland","2000.26.23340","2000-06-21","Politik, , Yasuhiro Nakasone, Siemens AG, Deutsche Bahn, Japan, Bahnhof, China, Taiwan, Kyoto, Asien, Berlin, Hokkaido","http://www.zeit.de/2000/26/Bahnfahrt_durchs_Goetterland"
"Joschka Fischer: Der Föderalist","2000.26.23341","2000-06-21","Dossier, , Internationale_Beziehungen, Europapolitik, Aussenpolitik, EU, Sicherheitspolitik, Verfassung, Osterweiterung, Gipfeltreffen, Beziehung, Internationale Beziehungen, Europapolitik, Außenpolitik, EU, Sicherheitspolitik, Verfassung, Osterweiterung, Gipfeltreffen, Arbeit, Außenminister, Integration, Verfassung, Europa","http://www.zeit.de/2000/26/200026.portrait.fisch_.xml"
"Eine Föderation akzeptieren!","2000.26.23342","2000-06-21","Dossier, , Staat, Internationale_Beziehungen, Europapolitik, Demokratie, Aussenpolitik, Verfassung, EU, Strukturen, Regierung, Reform, Macht, Staat, Internationale Beziehungen, Europapolitik, Demokratie, Außenpolitik, Verfassung, EU, Strukturen, Regierung, Reform, Joschka Fischer, Tony Blair, Frankreich, Alfred Grosser, Avantgarde, Debatte, EU-Bürger, Europarat, Europäischer Gerichtshof, Figaro, Geldpolitik, Integration, Justiz, Minister, Politikwissenschaft, Präsidentschaft, Robert Schuman, Souveränität, Europa","http://www.zeit.de/2000/26/200026.kasten.bianco_.xml"
"Jean-Pierre Chevènement: Der Souveränist","2000.26.23343","2000-06-21","Dossier, , Jean-Pierre Chevènement, Lionel Jospin, Direktwahl, Innenminister, Nationalismus, Premierminister, Frankreich, Glaube, Protest, Präsident, Vertrag, Maastricht","http://www.zeit.de/2000/26/200026.portrait.chev_.xml"
"www.fortschritt.fr","2000.26.23344","2000-06-21","Wirtschaft, , André Santini, Siemens AG, Finanzministerium, Frankreich, SAP, Internet, Marseille, Paris","http://www.zeit.de/2000/26/200026.frankreich-spez..xml"
"Hochzeitsträume","2000.26.23345","2000-06-21","Wirtschaft, , Commerzbank, Bernd Fahrholz, Martin Kohlhaussen, Dresdner Bank, Aktie, Bankenfusion, Börse, Comdirect, Ehe, Euro, Fusion, Geschäftsführer, Gewinn, Handel, Hochzeit, Investmentbanking","http://www.zeit.de/2000/26/Hochzeitstraeume"
"Nur grün getarnt","2000.26.23346","2000-06-21","Wirtschaft, , Bundesregierung, Grüne, Gerhard Schröder, Gesundheitspolitik, Umweltpolitik, Artenvielfalt, Atomausstieg, Atommüll, Bundestag, Bündnisgrüne, Naturschutz, Regierungswechsel, Vereinte Nationen","http://www.zeit.de/2000/26/Nur_gruen_getarnt"
"Verfall der Kernkompetenz","2000.26.23347","2000-06-21","Wirtschaft, , Industrie, Bildung, Unternehmen, Studium, Forschung, Maschinenbau, Hochschule, Forschung, Betriebswirtschaft, Universität, Studienfächer, Bundesregierung, Fachhochschulen, Siemens AG, Atommüll, Kernforschung, Plutonium, Reaktor, China, USA, Aachen, Harrisburg, Osteuropa, Tschernobyl, Industrie, Bildung, Unternehmen, Studium, Natur und Technik, Maschinenbau, Hochschule, Forschung, Betriebswirtschaft, Universität","http://www.zeit.de/2000/26/200026.atomausstieg_.xml"
"CNN-Chef im Medienkrieg","2000.26.23348","2000-06-21","Wirtschaft, , Medien, Film, Fernsehen, Unternehmen, Internet, Informationstechnik, Betriebswirtschaft, Statistik, Kursverlust, Krise, Freizeitpark, Time Warner, AOL, CNN, Saddam Hussein, Kofi Annan, Allianz, Hollywood, Hollywoodfilm, Jane Fonda, Thomas Middelhoff, Irak, Bagdad, Washington D.C., Medien, Film, Fernsehen, Unternehmen, Internet, Informationstechnik, Betriebswirtschaft, Statistik, Kursverlust, Krise","http://www.zeit.de/2000/26/200026.cnn_.xml"
"Abpfiff? Nein, nur Halbzeit","2000.26.23349","2000-06-21","Wirtschaft, , Grüne, Gerhard Schröder, Jürgen Trittin, Atomausstieg, Atommüll, Brennelement, Energiepolitik, Energieversorgung, Energiewirtschaft, Kernenergie, Kernkraftwerk, Kohlendioxid, Nadelstich, Reaktor, Ulrich Hartmann, Vivendi, Gorleben","http://www.zeit.de/2000/26/Abpfiff_Nein_nur_Halbzeit"
"Medigene: Die Suche nach dem Wundermittel","2000.26.23350","2000-06-21","Wirtschaft, , Bill Clinton, Tony Blair, Aventis, Bayer AG, Biochemie, Deutsche Forschungsgemeinschaft, Ernst-Ludwig Winnacker, Gebärmutterhalskrebs, Genforschung, Virus, Bayern, München, Stuttgart","http://www.zeit.de/2000/26/Medigene_Die_Suche_nach_dem_Wundermittel"
"Per Saldo","2000.26.23351","2000-06-21","Wirtschaft, , Saldo, Wirtschaftspolitik, Aktie, Daimler AG, Dividende, Finanzamt, Fußball, Geld, Gewinn, Steuer, Unternehmen, England","http://www.zeit.de/2000/26/Per_Saldo"
"Wasser schluckt Whisky","2000.26.23352","2000-06-21","Wirtschaft, , Management, Betriebswirtschaft, Medienwirtschaft, Unternehmenskrise, Portrait, Kritik, Expansion, Verlag, Unternehmenspolitik, Unternehmensführung, Kongress, Wasser, Sony, Vodafone, Vivendi, Börsengang, Frankreich, Fusion, Smokey Robinson, Stevie Wonder, Thomas Middelhoff, Time Warner, Universal Studios, Montreal, Management, Betriebswirtschaft, Medienwirtschaft, Unternehmenskrise, Portrait, Kritik, Expansion, Verlag, Unternehmenspolitik, Unternehmensführung","http://www.zeit.de/2000/26/200026.seagram-vivendi_.xml"
"","2000.26.23353","2000-06-21","Wirtschaft, , Hans Apel, Rudolf Scharping, Absicherung, Börse, Dienstleistung, Management, Tornado","http://www.zeit.de/2000/26/40966"
"Freihandel","2000.26.23354","2000-06-21","Wirtschaft, , David Ricardo, Britney Spears, Freihandel, Henkel, Musik, Handel, Käse, Mafia, Patent, Traum, Zoll, Geld, USA, Ukraine, Europa, Osteuropa, Südostasien","http://www.zeit.de/2000/26/Freihandel"
"Der Machtkampf","2000.26.23355","2000-06-21","Wirtschaft, , Bundesbankreform, Hans Eichel, Bundesbank, Deutsche Bundesbank, Helmut Schmidt, Europäische Zentralbank, Heide Simonis, Geldpolitik, Gründung, Europa, Bonn, Hannover","http://www.zeit.de/2000/26/Der_Machtkampf"
"Subventionen in Deutschland","2000.26.23356","2000-06-21","Wirtschaft, , Bundesanstalt für Arbeit, Landwirtschaft, Subventionen","http://www.zeit.de/2000/26/Subventionen_in_Deutschland"
"Subventionen in Deutschland - ein heikles Thema","2000.26.23357","2000-06-21","Wirtschaft, , Europäische Union, Bundesanstalt für Arbeit, Staatsfinanzen, Finanzen, Subventionen","http://www.zeit.de/2000/26/200026.wochengrafik_.xml"
"Kettenreaktion","2000.26.23358","2000-06-21","Wirtschaft, , Bundesregierung, Reinhard Loske, Finanzministerium, Frankreich, AKW, Atomausstieg, Atomenergie, Atommüll, Brennelement, Erdöl, Kraftwerk, Reaktor, Strom, Stromkonzern, Transport, Weltausstellung, Wiederaufbereitung, Zwischenlager, Berlin, Gorleben, Hannover","http://www.zeit.de/2000/26/Kettenreaktion"
"Taschenspiele mit dem Budget","2000.26.23359","2000-06-21","Wirtschaft, , Staatsfinanzen, Finanzpolitik, Sparpolitik, Staatsverschuldung, Bundeshaushalt, Wirtschaft_und_Konjunktur, Wirtschaft, Konjunktur, Kontra, Wirtschaftswachstum, Hans Eichel, Theo Waigel, Finanzministerium, Bundesfinanzminister, Bundeshaushalt, Finanzminister, Haushalt, Haushaltspolitik, Minister, Neuverschuldung, Steuerreform, MIT, Staatsfinanzen, Finanzpolitik, Sparpolitik, Staatsverschuldung, Bundeshaushalt, Wirtschaft und Konjunktur, Wirtschaft, Konjunktur, Kontra","http://www.zeit.de/2000/26/200026.kolumne.xml"
"Rechenwerk","2000.26.23360","2000-06-21","Wirtschaft, , DaimlerChrysler, Bilanzierung, Finanzmarkt, Frits Bolkestein, KPMG, Unternehmen, Europa","http://www.zeit.de/2000/26/Rechenwerk"
"","2000.26.23361","2000-06-21","Wirtschaft, , Helmut Kohl, SPD, Verkehrsminister","http://www.zeit.de/2000/26/40967"
"","2000.26.23362","2000-06-21","Wirtschaft, , Chef, Regierung, Berlin, Bonn","http://www.zeit.de/2000/26/40965"
"Eine Allianz fürs Leben","2000.26.23363","2000-06-21","Wirtschaft, , Versicherung, Lebensversicherung, Lebenserwartung, Auszahlung, Vhb_Altersvorsorge, Versicherung, Lebensversicherung, Lebenserwartung, Auszahlung, Wolfgang Gerke, Bundeswirtschaftsministerium, Altersvorsorge, Betriebsrente, Bundesarbeitsministerium, Erwerbsunfähigkeit, Hans-Böckler-Stiftung, Investmentgesellschaft, Rente, Rentenreform, Rentenversicherung, Ruhestand, Vorsorge, Niederlande, Nordrhein-Westfalen, Würzburg","http://www.zeit.de/2000/26/200026.private_rente_.xml"
"Das gibt einen Riesenkonflikt","2000.26.23364","2000-06-21","Wirtschaft, , Simonis, Interview, Simonis, Heide Simonis, Bundesbank, Europäische Zentralbank, SPD, Bundesrechnungshof, Euro, Geldpolitik, Gespräch, Ministerpräsident, Region, Arbeit, Präsident, Berlin, Europa, Schleswig-Holstein","http://www.zeit.de/2000/26/Das_gibt_einen_Riesenkonflikt"
"Aktien lieben's kalt","2000.26.23365","2000-06-21","Wirtschaft, , Aktie, Aktienmarkt, Geldpolitik, Jahreszeit, Konjunkturentwicklung, Liquidität, Notenbank, Sommer, US-Dollar, Zürich","http://www.zeit.de/2000/26/Aktien_lieben's_kalt"
"Green Card unnötig","2000.26.23366","2000-06-21","Wirtschaft, , Ausländer, Arbeitsmarkt, Behörde, Bewerbung, Brief, Debatte, Diplom, Einstellung, Französisch, Gehalt, Internet, Personal, Frankreich, Marokko","http://www.zeit.de/2000/26/Green_Card_unnoetig"
"Staatsstück","2000.26.23367","2000-06-21","Wirtschaft, , Brief, Privatisierung, Regierung, Steuer, Verlust, USA, Großbritannien, Europa","http://www.zeit.de/2000/26/Staatsstueck"
"Hausse im Karpfenteich","2000.26.23368","2000-06-21","Wirtschaft, , Christoph Daum, Bayer AG, Edelstein, Europameisterschaft, Fisch, Fußballtrainer, Geldanlage, Glück, Japan, Kapitalanlage, Belgien, Niederlande, Bottrop, Duisburg, Leverkusen, Niederrhein","http://www.zeit.de/2000/26/200026.solidus.xml"
"Alles eine Frage des Niveaus","2000.26.23369","2000-06-21","Wirtschaft, , Rentenkonzept, Walter Riester, Altersversorgung, Altersvorsorge, Arbeitsminister, Einkommen, Gewerkschaft, Ministerium, Reform, Rente, Single, Vorsorge","http://www.zeit.de/2000/26/Alles_eine_Frage_des_Niveaus"
"Motley Fool","2000.26.23370","2000-06-21","Wirtschaft, , Bier, Champagner, Europameisterschaft, Finanzdienstleister, Fonds, Football, Getränk, Investmentfonds, Nationalmannschaft, Rentenfonds, England, Asien, Europa","http://www.zeit.de/2000/26/Motley_Fool"
