"title","number","date","keywords","link"
"Politiker luden ein, Linksradikale störten – mehr als 300 000 Menschen demonstrierten gegen Fremdenfeindlichkeit: Ein Spaziergang der Demokraten |","1992.47.4779","1992-11-13","DIE ZEIT, Politiker luden ein, Linksradikale störten – mehr als 300 000 Menschen demonstrierten gegen Fremdenfeindlichkeit, Richard Freiherr von Weizsäcker, Antje Vollmer, Grüne, Joschka Fischer, Björn Engholm, Burkhard Hirsch, Fremdenfeindlichkeit, Thomas Gottschalk, Walter Jens, Wolfgang Thierse, Klaus Naumann, Konrad Weiß, Richard Schröder, Spanien, Berlin","http://www.zeit.de/1992/47/ein-spaziergang-der-demokraten"
"Afrodite handelt mit dem Tod |","1992.47.4780","1992-11-13","DIE ZEIT, , Tod, Benzin, Bulgarien, Diesel, Dollar, Handelskammer, Lancia, Serbien, Vereinte Nationen, MIT, Mazedonien, Rumänien, Sarajevo, Paris, Sofia, Thessaloniki","http://www.zeit.de/1992/47/afrodite-handelt-mit-dem-tod"
"Ein Manifest: Weil das Land sich ändern muß |","1992.47.4781","1992-11-13","DIE ZEIT, Ein Manifest, CDU, Jörg Haider, Abrüstung, DDR, Entwicklungshilfe, Gewalt, Nationalismus, Weltbank, Belgien, Jugoslawien, Niederlande, USA, Europa, Bonn, Osteuropa","http://www.zeit.de/1992/47/weil-das-land-sich-aendern-muss"
"Warschau drängt, der Westen zögert: Polen in die Nato? |","1992.47.4782","1992-11-13","DIE ZEIT, Warschau drängt, der Westen zögert, Polen, Warschau, Nato, Leszek Kolakowski, Nato-Generalsekretär, Solidarnosc, Jugoslawien, Russland, Osteuropa, Südosteuropa","http://www.zeit.de/1992/47/polen-in-die-nato"
"Zum Tode von Alexander Dubcek: Menschlichkeit in der Politik |","1992.47.4783","1992-11-13","DIE ZEIT, Zum Tode von Alexander Dubcek, Asche, Burg, Emigration, Italien, Russland, Sowjetunion, Sozialismus, Tschechoslowakei, Türkei, Bratislava, Moskau, Prag","http://www.zeit.de/1992/47/menschlichkeit-in-der-politik"
"Der Kölner Soziologe Alphons Silbermann hat eine Studie über die jüdische Bevölkerung veröffentlicht: Die Juden sollen sich nicht verstecken |","1992.47.4784","1992-11-13","DIE ZEIT, Der Kölner Soziologe Alphons Silbermann hat eine Studie über die jüdische Bevölkerung veröffentlicht, Bevölkerung, Studie, Bundesregierung, Zentralrat der Juden, Antisemitismus, Ausländerfeindlichkeit, Bundesverdienstkreuz, Rechtsextremismus, Rechtsradikalismus, Öffentlichkeitsarbeit, Australien, Köln, Amsterdam, Auschwitz, Bonn, Paris, Sachsenhausen, Sydney","http://www.zeit.de/1992/47/die-juden-sollen-sich-nicht-verstecken"
"Worte der Woche |","1992.47.4785","1992-11-13","DIE ZEIT, , Bill Clinton, George W.  Bush, Grüne, CDU, CSU, Helmut Kohl, Richard Freiherr von Weizsäcker, SPD, Hans-Jochen Vogel, Martin Bangemann, Otto Graf Lambsdorff, Ausländerfeindlichkeit, Bundesverfassungsgericht, Demonstration, Friedrich Bohl, Heinrich Lummer, Otto, Republikaner (USA), Vizepräsident, Rostock","http://www.zeit.de/1992/47/worte-der-woche"
"Amerika nach dem Kalten Krieg: die außenpolitischen Vorstellungen des neuen Präsidenten: Atlas ist müde |","1992.47.4786","1992-11-13","DIE ZEIT, Amerika nach dem Kalten Krieg: die außenpolitischen Vorstellungen des neuen Präsidenten, George W.  Bush, USA, Bill Clinton, Jimmy Carter, Saddam Hussein, USA, Außenpolitik, Demokratie, Jugoslawien, Time Magazine, Umstrukturierung, Vereinte Nationen, Wahlkampf, China, Kambodscha, Sowjetunion, Südafrika, Arkansas, Europa, Washington D.C., Osteuropa","http://www.zeit.de/1992/47/atlas-ist-muede"
"Als Präsident muß Bill Clinton drei Beziehungen klären: zu seiner Frau, zu seinem Vize und zum Kongreß: Keine Angst vor Hillary |","1992.47.4787","1992-11-13","DIE ZEIT, Als Präsident muß Bill Clinton drei Beziehungen klären: zu seiner Frau, zu seinem Vize und zum Kongreß, George W.  Bush, Ronald Reagan, John F. Kennedy, Präsident, Bill Clinton, Lyndon B. Johnson, Nancy Reagan, Bill Clinton, Präsidentschaft, USA, Veteran, Walter Mondale, Arkansas, Washington D.C","http://www.zeit.de/1992/47/keine-angst-vor-hillary"
"Die brandenburgische SPD scheut die Stimme des Volkes: Wachsweiche Ideale |","1992.47.4788","1992-11-13","DIE ZEIT, Die brandenburgische SPD scheut die Stimme des Volkes, SPD, FDP, Bürgerinitiative, Demokratie, Direktwahl, Landtagswahl, Misstrauensvotum, Ostdeutschland, Selbstbewusstsein, Volksbegehren, Volksentscheid, Brandenburg, Niederrhein, Nordrhein-Westfalen","http://www.zeit.de/1992/47/wachsweiche-ideale"
"Zeitspiegel |","1992.47.4789","1992-11-13","DIE ZEIT, , Jassir Arafat, George W.  Bush, Klaus Kinkel, Außenminister, Erpressung, Hauptstadt, Hobby, Jane Fonda, Palästinenser, Vertreibung, Wirtschaftshilfe, Ghana, Accra, Tunis","http://www.zeit.de/1992/47/zeitspiegel"
"„Der Koran ist unsere Verfassung“ |","1992.47.4790","1992-11-13","DIE ZEIT, , Koran, Algerien, Allianz, Francis Fukuyama, Iran, Islam, Mohammed, Muslimbruderschaft, Scharia, Wladimir Iljitsch Lenin, Vivendi, Indien, Israel, Syrien, Ägypten, Europa","http://www.zeit.de/1992/47/der-koran-ist-unserer-verfassung"
"Wolfgang Ebert: Gute Deutsche |","1992.47.4791","1992-11-13","DIE ZEIT, Wolfgang Ebert, Mercedes, Reise, Fremdenfeindlichkeit, Klima, Personal, Skinhead, Wolfgang Ebert, Bayern","http://www.zeit.de/1992/47/gute-deutsche"
"Die CSU gibt sich selbstbewußt aus Unsicherheit: Franz Josef Strauß’ Erben mühen sich, Bayerns Staatspartei zu bleiben: Der Löwe und die Angst vor der Maus |","1992.47.4792","1992-11-13","DIE ZEIT, Die CSU gibt sich selbstbewußt aus Unsicherheit: Franz Josef Strauß’ Erben mühen sich, Bayerns Staatspartei zu bleiben, Edmund Stoiber, Theo Waigel, CSU, Franz Josef Strauß, Max Streibl, Helmut Schmidt, SPD, Björn Engholm, Asylrecht, Loewe, Plenum, Republikaner (USA), Thomas Goppel, Bayern, Berlin, Europa, Nürnberg, München","http://www.zeit.de/1992/47/der-loewe-und-die-angst-vor-der-maus"
"Walter Koisser, der Vertreter des Flüchtlingshochkommissars der Vereinten Nationen in Bonn, verschafft sich Gehör im deutschen Asylstreit: „Mehr über die Not sprechen“ |","1992.47.4793","1992-11-13","DIE ZEIT, Walter Koisser, der Vertreter des Flüchtlingshochkommissars der Vereinten Nationen in Bonn, verschafft sich Gehör im deutschen Asylstreit, CSU, Asylrecht, Sudan, Vereinte Nationen, Afrika, Bonn, Asien, Berlin, Europa, Genf, Südsudan, Wien, Äthiopien","http://www.zeit.de/1992/47/mehr-ueber-die-not-sprechen"
"Der Streit um das Donau-Kraftwerk Gabcíkovo entzweit Ungarn und Slowaken: Jetzt sitzen die Bauern auf dem Trockenen |","1992.47.4794","1992-11-13","DIE ZEIT, Der Streit um das Donau-Kraftwerk Gabcíkovo entzweit Ungarn und Slowaken, Ungarn, Slowakei, Kraftwerk, Post, Tschechoslowakei, Donau, Bratislava, Budapest, Prag","http://www.zeit.de/1992/47/jetzt-sitzen-die-bauern-auf-dem-trockenen"
"Die Regierungspartei in Japan steckt in einer Identitätskrise: Eine neue Generation drängt an die Spitze: Machtkampf um das Erbe des Paten |","1992.47.4795","1992-11-13","DIE ZEIT, Die Regierungspartei in Japan steckt in einer Identitätskrise: Eine neue Generation drängt an die Spitze, Japan, Ichiro Ozawa, Generation, Kiichi Miyazawa, Noboru Takeshita, Ryutaro Hashimoto, Yasuhiro Nakasone, tTokyo, Erbe, New York","http://www.zeit.de/1992/47/machtkampf-um-das-erbe-des-paten"
"Ostdeutschland: Die Angst um die versprochenen Investitionen wächst: Der Abstand wird größer |","1992.47.4796","1992-11-13","DIE ZEIT, Ostdeutschland: Die Angst um die versprochenen Investitionen wächst, Udo Ludwig, Walter Hirche, Mercedes-Benz, DDR, Ostdeutschland, Unternehmen, Ungarn, Brandenburg, Berlin, Bremen, Eisenhüttenstadt, Elbe","http://www.zeit.de/1992/47/der-abstand-wird-groesser"
"Markt-Report: Der Dollar belebt |","1992.47.4797","1992-11-13","DIE ZEIT, Markt-Report, Dollar, Commerzbank, Aktie, Aktienmarkt, Bank, Gewinn, Handel, Hoffnung, Konjunktur, Unternehmen, USA","http://www.zeit.de/1992/47/der-dollar-belebt"
"Brasilien: Nach der Amtsenthebung seines Vorgängers steht Präsident Itamar Franco vor einem Scherbenhaufen: Wut und Verzweiflung |","1992.47.4798","1992-11-13","DIE ZEIT, Brasilien: Nach der Amtsenthebung seines Vorgängers steht Präsident Itamar Franco vor einem Scherbenhaufen, Präsident, Fernando Collor de Mello, Steuerreform, Brasília, New York, Rio de Janeiro, São Paulo, Südamerika","http://www.zeit.de/1992/47/wut-und-verzweiflung"
"Widerstand der Kleinen |","1992.47.4799","1992-11-13","DIE ZEIT, , Computer, Dienstleistung, Finanzmarkt, Frankfurter Börse, Gründung, Handel, Umsatz, Widerstand, Berlin, Bremen, Düsseldorf, Hamburg, Hannover, München, Stuttgart","http://www.zeit.de/1992/47/widerstand-der-kleinen"
"Wirtschaftsbuch: Otto Wolff von Amerongen erinnert sich an vierzig Jahre Ostgeschäft: Grenzgänger |","1992.47.4800","1992-11-13","DIE ZEIT, Wirtschaftsbuch: Otto Wolff von Amerongen erinnert sich an vierzig Jahre Ostgeschäft, Konrad Adenauer, Bundesregierung, Fritz Berg, Ludwig Erhard, Michail Gorbatschow, Otto Wolff von Amerongen, Otto, Auswärtiges Amt, Bundesverband der Deutschen Industrie, Sanktion, Sowjetunion, Wiedervereinigung, Afghanistan, China, Köln, Moskau, Ostberlin, Osteuropa","http://www.zeit.de/1992/47/grenzgaenger"
"Milton Friedman hat mit seinem Monetarismus die Welt verändert. Die Bilanz des Chicagoer Wirtschaftsprofessors ist zwiespältig: Geld, Freiheit, Ideologie |","1992.47.4801","1992-11-13","DIE ZEIT, Milton Friedman hat mit seinem Monetarismus die Welt verändert. Die Bilanz des Chicagoer Wirtschaftsprofessors ist zwiespältig, Ronald Reagan, John Maynard Keynes, Milton Friedman, Margaret Thatcher, Ideologie, Richard Nixon, Augusto Pinochet, Geldpolitik, Inflation, Kapitalmarkt, Sozialstaat, Staatsquote, MIT, USA, Chicago, Berlin, San Francisco, Washington D.C","http://www.zeit.de/1992/47/geld-freiheit-ideologie"
"Norwegen: Die regierende Arbeiterpartei ist für einen EG-Beitritt, die Mehrheit der Bevölkerung dagegen: Ein Ja mit Widerwillen |","1992.47.4802","1992-11-13","DIE ZEIT, Norwegen: Die regierende Arbeiterpartei ist für einen EG-Beitritt, die Mehrheit der Bevölkerung dagegen, Bevölkerung, Gro Harlem Brundtland, Norwegen, Europäische Gemeinschaft, Fischfang, Parteitag, Umfrage, Wohlfahrtsstaat, Dänemark, MIT, Brüssel","http://www.zeit.de/1992/47/ein-ja-mit-widerwillen"
"Vereinigte Staaten (I): Führende amerikanische Vertreter aus Wirtschaft und Wissenschaft beschreiben ihre Erwartungen an den künftigen Präsidenten Bill Clinton: Die Last des Siegers |","1992.47.4803","1992-11-13","DIE ZEIT, Vereinigte Staaten (I): Führende amerikanische Vertreter aus Wirtschaft und Wissenschaft beschreiben ihre Erwartungen an den künftigen Präsidenten Bill Clinton, Wissenschaft, Bill Clinton, George W.  Bush, James Jones, USA, Bill Clinton, Japan, Konjunktur, Präsident, tTokyo, Europa, Washington D.C., Asien, New York","http://www.zeit.de/1992/47/die-last-des-siegers"
"Bonner Kulisse |","1992.47.4804","1992-11-13","DIE ZEIT, , Theo Waigel, Matthias Wissmann, Helmut Kohl, CDU, CSU, Heinz Riesenhuber, SPD, Wolfgang Bötsch, Hermann Otto Solms, Klaus Töpfer, Otto Graf Lambsdorff, Bundestag, Haushaltsentwurf, Industriepolitik, Kanzleramt, Staatssekretär, Umweltminister, Vereinte Nationen, Bonn, New York","http://www.zeit.de/1992/47/bonner-kulisse"
"Rußland: Sieben marode Atommeiler und Unmengen hochradioaktiven Mülls – Sosnowij Bor bei Sankt Petersburg lebt am Rande der nuklearen Katastrophe: „Besser, man denkt nicht drüber nach“ |","1992.47.4805","1992-11-13","DIE ZEIT, Rußland: Sieben marode Atommeiler und Unmengen hochradioaktiven Mülls – Sosnowij Bor bei Sankt Petersburg lebt am Rande der nuklearen Katastrophe, Katastrophe, Grüne, Siemens AG, Atommüll, Kernkraftwerk, Kraftwerk, Reaktor, Russland, Atomkraftwerk, St. Petersburg, St. Petersburg, Berlin, Bremen, Europa, Nagasaki, Ostsee, Tschernobyl","http://www.zeit.de/1992/47/besser-man-denkt-nicht-drueber-nach"
"Der Handelskonflikt ist vermeidbar: Krieg um Raps |","1992.47.4806","1992-11-13","DIE ZEIT, Der Handelskonflikt ist vermeidbar, Krieg, Bill Clinton, Europäische Gemeinschaft, Agrarpolitik, Agrarprodukt, Frankreich, Freihandel, Handel, Rückfalltäter, Soja, Tyll Necker, USA, Europa, Bonn, Brüssel, Chicago, Paris, Washington D.C","http://www.zeit.de/1992/47/krieg-um-raps"
"Wolfgang Hoffmann: Der Anfang vom Ausstieg |","1992.47.4807","1992-11-13","DIE ZEIT, Wolfgang Hoffmann, Gerhard Schröder, Björn Engholm, SPD, Veba, Kernenergie, Kernkraftwerk, Kraftwerk, Landesregierung, Rudolf von Bennigsen-Foerder, Schweden, Niedersachsen, Kiel, Lübeck, Mecklenburg-Vorpommern, Osteuropa, Stade","http://www.zeit.de/1992/47/der-anfang-vom-ausstieg"
"Pflegeversicherung: Ärgerlich |","1992.47.4808","1992-11-13","DIE ZEIT, Pflegeversicherung, Hermann Rappe, Pflegeversicherung, Recht, Arbeitnehmer, Feiertag, Pflege, Region, Versicherung","http://www.zeit.de/1992/47/aergerlich"
"Börse Leipzig: Das Land Sachsen kämpft um einen eigenen Kapitalmarkt: Zur Not reicht ein Klappstuhl |","1992.47.4809","1992-11-13","DIE ZEIT, Börse Leipzig: Das Land Sachsen kämpft um einen eigenen Kapitalmarkt, Börse, Dax, Kapitalmarkt, Sachsen, Finanzministerium, IHK, Kurt Biedenkopf, Geschäftsführer, Leipzig","http://www.zeit.de/1992/47/zur-not-reicht-ein-klapptstuhl"
"U-Boot-Affäre: Skandalös |","1992.47.4810","1992-11-13","DIE ZEIT, U-Boot-Affäre, Gerhard Stoltenberg, Helmut Kohl, Behörde, Bundesfinanzminister, Bundeskanzler, Finanzminister, Geldstrafe, Presse, Südafrika, Kiel","http://www.zeit.de/1992/47/skandaloes"
"Rudolf Engen: Fabelhafte Wirtschaft |","1992.47.4811","1992-11-13","DIE ZEIT, Rudolf Engen, EMMA, Börse, Fabel, Gesundheit, Konjunktur","http://www.zeit.de/1992/47/fabelhafte-wirtschaft"
"Assekuranz: Rolf Gerling übernimmt den Aufsichtsratsvorsitz seines Versicherungskonzerns: Grüner Sproß |","1992.47.4812","1992-11-13","DIE ZEIT, Assekuranz: Rolf Gerling übernimmt den Aufsichtsratsvorsitz seines Versicherungskonzerns, Hans Gerling, Hilmar Kopper, Günter Vogelsang, Roland Berger, Carl Gustav Jung, Herstatt-Bank, Ludwig Poullain, Gerling, Köln, Zürich","http://www.zeit.de/1992/47/gruener-spross"
"Vereinigte Staaten (II): Bill Clintons Stellvertreter Al Gore überrascht mit unbequemen ökologischen Forderungen: Ein Vize mit Vision |","1992.47.4813","1992-11-13","DIE ZEIT, Vereinigte Staaten (II): Bill Clintons Stellvertreter Al Gore überrascht mit unbequemen ökologischen Forderungen, Bill Clinton, George W.  Bush, Helmut Kohl, Umweltpolitik, S. Fischer Verlag, Umweltbehörde, Umweltschutz, MIT, USA, Tennessee","http://www.zeit.de/1992/47/ein-vize-mit-vision"
"Börsenspiel Die Unabhängigkeit von einem großen Bankhaus zahlt sich aus: Auf Nummer Sicher |","1992.47.4814","1992-11-13","DIE ZEIT, Börsenspiel Die Unabhängigkeit von einem großen Bankhaus zahlt sich aus, Dax, RWE, Bank Austria, Deutsche Bank, Preussag, Aktienindex, Frankfurter Börse, Linde, USA, Europa","http://www.zeit.de/1992/47/auf-nummer-sicher"
"Magere Zeiten für Fondssparer |","1992.47.4815","1992-11-13","DIE ZEIT, , Dax, Aktie, Aktienfonds, BHF BANK, Fonds, Investmentfonds, Luxemburg, Management, Rente, Rentenfonds, Zinsabschlagsteuer, Mosel, Oppenheim","http://www.zeit.de/1992/47/magere-zeiten-fuer-fondssparer"
"Lufthansa: Erfinderisch |","1992.47.4816","1992-11-13","DIE ZEIT, Lufthansa, Lufthansa, Airbus, Flugzeug, Jürgen Weber, Piper Verlag, Verlust, Vermögen","http://www.zeit.de/1992/47/erfinderisch"
"Ostdeutschland: Die Treuhandanstalt wehrt gegen die Einmischung von Politikern. Über Leben und Tod von Unternehmen will sie entscheiden: Grenzenlos überfordert |","1992.47.4817","1992-11-13","DIE ZEIT, Ostdeutschland: Die Treuhandanstalt wehrt gegen die Einmischung von Politikern. Über Leben und Tod von Unternehmen will sie entscheiden, Unternehmen, Birgit Breuel, Tod, Bundesregierung, Bundesrechnungshof, DDR, Europäische Gemeinschaft, Industriepolitik, Kartellamt, Ostdeutschland, Privatisierung, Überwachung, Bundesrepublik Deutschland, Sanierung, Treuhandanstalt, Chemnitz","http://www.zeit.de/1992/47/grenzenlos-ueberfordert"
"Zeitliches aus Italien: Verregneter Wein |","1992.47.4818","1992-11-13","DIE ZEIT, Zeitliches aus Italien, Italien, Wein, Alkohol, Atmosphäre, Ernte, Essen, Export, Kraftstoff, Physik, Werbung, Alpen","http://www.zeit.de/1992/47/verregneter-wein"
