"title","number","date","keywords","link"
"Peer Steinbrück: Auf Messers Schneide","2011.28.52269","2011-07-10","Politik, Peer Steinbrück, Spd, Deutsche_Politiker, Bundeskanzler, Wahl, Peer Steinbrück, Wolfgang Schäuble, Gerhard Schröder, Grüne, Helmut Schmidt, Kurt Beck, SPD, Heiner Geißler, Cicero, Friedrich-Ebert-Stiftung, Planet, Torsten Albig, Baden-Württemberg, Berlin, Nordrhein-Westfalen","http://www.zeit.de/2011/28/Steinbrueck"
"Unabhängigkeit: Frei und zerrissen","2011.28.52270","2011-07-08","Politik, Unabhängigkeit, Sudan, Suedsudan, Staat, Afrika, Barack Obama, Rind, Kenia, Südsudan, Nil","http://www.zeit.de/2011/28/Sudan"
"Südkorea: Die gekaufte Braut","2011.28.52271","2011-07-08","Politik, Südkorea, Suedkorea, Suedostasien, Südkorea, Ausländer, Cyberspace, Dollar, Erzdiözese, Heirat, US-Dollar, Ulan Bator, Vietnam, Seoul","http://www.zeit.de/2011/28/Kolumne-Suedkorea"
"Dominique Strauss-Kahn: Frauen, immer wieder Frauen","2011.28.52272","2011-07-08","Politik, Dominique Strauss-Kahn, Frankreich, Vergewaltigung, Politiker, Wahl, Nicolas Sarkozy, Dominique Strauss-Kahn, Die Linke, Anzeige, Frankreich, François Hollande, Justiz, Martine Aubry, Dominique Strauss-Kahn, Paris, Christo, Marrakesch, Normandie","http://www.zeit.de/2011/28/DOS-Frankreich"
"Saudi-Arabien: In den Sand gesetzt","2011.28.52273","2011-07-07","Politik, Saudi-Arabien, Panzer, Waffenhandel, Saudi-arabien, Bundesregierung, CDU, Europäische Union, FDP, George W.  Bush, Helmut Kohl, Helmut Schmidt, Saudi Arabien, Al-Dschasira, Blog, Bundeswehrreform, Facebook, Frühling, Iran, Königshaus, Region, Rüstungsindustrie, Taliban, Twitter, Waffenexport, Afghanistan, Irak, Israel, Russland, USA, Bahrain, Berlin, Dschidda, Riad","http://www.zeit.de/2011/28/01-Leopard-Panzer"
"Saudi-Arabien: Die Wüstenfestung","2011.28.52274","2011-07-07","Politik, Saudi-Arabien, Saudi-arabien, Protest, Jemen, Golf, Barack Obama, Hosni Mubarak, Saudi Arabien, Iran, Atomprogramm, Frühling, Jemen, Königshaus, Revolte, Ägypten, Bahrain, Großbritannien, Irak, Syrien, USA, Riad, Teheran, Dschidda, Sanaa","http://www.zeit.de/2011/28/Saudi-Arabien"
"Panzergeschäft: Dr. Jekyll und Mr. Saud","2011.28.52275","2011-07-06","Politik, Panzergeschäft, Panzer, Saudi-arabien, Ruestung, CDU, CSU, Gerhard Schröder, Joachim Herrmann, SPD, EADS, Saudi Arabien, Antiterrorkampf, Ausbildungsförderung, Innenminister, Salafisten, UPS, Verfassungsschutz, Großbritannien, Jemen, Chicago, Riad, Ulm","http://www.zeit.de/2011/28/Arabien-Panzer"
"Ungarn: Bitte nicht wegschauen!","2011.28.52276","2011-07-10","Politik, Ungarn, Ungarn, Praesident, Zensur, Viktor Orbán, Europäische Union, Medien, OSZE, Ungarn, EU-Ratspräsidentschaft, Pianist, TV-Sender, Rumänien, Serbien, Ukraine, Europa","http://www.zeit.de/2011/28/P-OpEd-Ungarn"
"Politik und Lyrik Nr. 18: Adoneus Helmut","2011.28.52277","2011-07-08","Politik, Politik und Lyrik Nr. 18, Politik, Lyrik, Rainer Maria Rilke, Gedicht, Geschichte, Katastrophe, Michael Lentz, Pelz, Stern, Landshut","http://www.zeit.de/2011/28/Gedicht-Lentz"
"Kultur: Raus in die Kultur","2011.28.52278","2011-07-07","Politik, Kultur, Helge Schneider, Joe Cocker, Marilyn Manson, Schweiz, Chemnitz, Dresden, Elbe, Sachsen","http://www.zeit.de/2011/28/Sachsen-die-Schoensten-saechsischen-Sommer-Kultur-Orte"
"Kurt Biedenkopf: Das ist mir unbegreiflich","2011.28.52279","2011-07-10","Politik, Kurt Biedenkopf, Deutsche_Politiker, Cdu, Atomausstieg, Kurt Biedenkopf, Angela Merkel, CDU, Grüne, SPD, CSU, Gerhard Schröder, Bevölkerung, Atomausstieg, Bundesrat, Bundestag, Ethikkommission, Euro-Krise, Kernenergie, Regierungserklärung, Vermittlungsausschuss, Volksparteien, USA, Energiewende, Bayern, Europa, Fukushima, Hannover, Harrisburg","http://www.zeit.de/2011/28/Biedenkopf-Interview"
"Baden-Württemberg: Völlig schwerelos","2011.28.52280","2011-07-09","Politik, Baden-Württemberg, Baden-wuerttemberg, Gruene, Landesregierung, Stuttgart-21, Grüne, Nils Schmid, SPD, Winfried Kretschmann, Kurt Georg Kiesinger, Renate Künast, Bahn, Landesregierung, Ministerpräsident, Thomas Oppermann, Verkehrsminister, Stuttgart, Baden-Württemberg, Gorleben, Mannheim","http://www.zeit.de/2011/28/Baden-Wuerttemberg"
"Schwarz-gelbe Koalition: »Wir haben uns Illusionen gemacht«","2011.28.52281","2011-07-07","Politik, Schwarz-gelbe Koalition, Schwarz-gelbe-koalition, Sachsen, Politik, CDU, FDP, Stanislaw Tillich, Markus Ulbig, SPD, Antiterrorgesetz, Bundesverkehrsministerium, Freya Klier, Junge Union, Landtag, Lutz Rathenow, Sachsen, Berlin, Dresden","http://www.zeit.de/2011/28/S-Koalition"
"Steiermark: Trachtenrock und Eigensinn","2011.28.52282","2011-07-07","Politik, Steiermark, Oesterreich, Partei, Politik, Michael Spindelegger, ÖVP, Volksparteien, Graz, Wien","http://www.zeit.de/2011/28/A-Steiermark"
"Donnerstalk: Kanzler Zufall","2011.28.52283","2011-07-07","Politik, Donnerstalk, Oesterreich, Demokratie, Frank Stronach, Alfred Dorfer, Bundeskanzler, Computer, Demokratie, Gewerkschaft, Glück, Heimat, Liebe, Parlament, Training, Österreich, USA","http://www.zeit.de/2011/28/A-Donnerstalk"
"Kernkraft: Asiens Schlacht ums Atom","2011.28.52284","2011-07-12","Wirtschaft, Kernkraft, Atomindustrie, Kernenergie, Asien, Japan, China, Atomausstieg, Asien, China, Indien, Japan, Atomenergie, Atomkraft, Atomkraftwerk, Reaktor, Tokio, Tsunami, Fukushima, Asien, Delhi, Peking","http://www.zeit.de/2011/28/Atom-Asien"
"Staatsanleihen: Geld verdienen mit den Griechen","2011.28.52285","2011-07-10","Wirtschaft, Staatsanleihen, Griechenland, Finanzkrise, Staatsfinanzen, Kapitalanlage, Christian Wulff, Geld, Griechenland, Advent, Anleihe, Bundespräsident, Euro, Kapitalmarkt, Kredit, Rendite, Rettungsschirm, Irland, Italien, MIT, Portugal, Spanien, Athen","http://www.zeit.de/2011/28/F-Griechenland-Anleihen"
"Krankenkasse: Ansteckend und tödlich","2011.28.52286","2011-07-09","Wirtschaft, Krankenkasse, Krankenkasse, Krankenversicherung, Gesundheitspolitik, Gesundheitswesen, Ulla Schmidt, FDP, Gesundheitsministerium, Daniel Bahr, Euro, DAK, Krankenkasse, Polen, Berlin, Bremen, Hamburg, Stuttgart","http://www.zeit.de/2011/28/Krankenkassen-Krise"
"Agglomeration: Die Agglo kommt","2011.28.52287","2011-07-07","Wirtschaft, Agglomeration, Schweiz, Bevoelkerungsentwicklung, Stadt, Staedtebau, Gucci, Jaguar, Julius Bär, Louis Vuitton, Schweiz, Zürich, Genf","http://www.zeit.de/2011/28/CH-Agglo-kommt"
"Deutsche Bank: Duell der Alphatiere","2011.28.52288","2011-07-06","Wirtschaft, Deutsche Bank, Vorstand, Bank, Fuehrungskraft, Unternehmen, Josef Ackermann, Axel Weber, Bank, Bundesbank, Jürgen Fitschen, Wolfgang Schäuble, RWE, Deutsche Bank, Anshu Jain, Finanzkrise, Hugo Bänziger, Investmentbanking, Berlin, London","http://www.zeit.de/2011/28/Deutsche-Bank"
"Finanzkrise: Ewige Retter","2011.28.52289","2011-07-06","Wirtschaft, Finanzkrise, Euro, Eurozone, Finanzkrise, Staatsfinanzen, Finanzkrise, Agent, Agentur, Anleihe, Bank, Finanzmarkt, Fonds, Gold, Griechenland, Kapitalismus, Sommer, Irland, Portugal, Berlin, Europa, Brüssel, Paris","http://www.zeit.de/2011/28/Kolumne-Euro"
"Finanzen: Einfach mal lassen","2011.28.52290","2011-07-12","Wirtschaft, Finanzen, Geld_und_Boerse, Kapitalanlage, Finanzen, Immobilie, Aktie, Alltag, Altersvorsorge, Fernsehserie, Geld, Onlinebanking, Oper, Dollar, Opfer, Technik, Unternehmen, Oder","http://www.zeit.de/2011/28/F-Kolumne-Anlage"
"Schweiz: Verdunkelungsgefahr","2011.28.52291","2011-07-11","Wirtschaft, Schweiz, Schweiz, Verhaftung, Bankgeheimnis, Wikileaks, Medien, Bankgeheimnis, Bernard Madoff, Franken, Geldstrafe, Nötigung, Schweiz, Staatsanwaltschaft, Untersuchungshaft, Zürich","http://www.zeit.de/2011/28/CH-Rudolf-Elmer"
"Alvin Ailey Kompanie: Fliegen lernen","2011.28.52292","2011-07-11","Wirtschaft, Alvin Ailey Kompanie, Theater, Tournee, Unternehmen, Sponsoring, Ford, USA, JPMorgan Chase, Bentley, Dollar, Tanzen, World Trade Center, USA, Europa, New York, Manhattan","http://www.zeit.de/2011/28/Alvin-Ailey"
"Steuerreform: Wir alle sehen die Schlaglöcher","2011.28.52293","2011-07-08","Wirtschaft, Steuerreform, Steuer, Steuerreform, Steuervergehen, Betrug, Spitzensteuersatz, Einkommen, Geld, Körperschaftsteuer, Reform, Steuer, Steuerhinterziehung, Straftäter, Urwald, Bochum","http://www.zeit.de/2011/28/Steuerfahnder-Kilmer-Kirchhof"
"Atomausstieg: Ihr wollt gar nicht sparen!","2011.28.52294","2011-07-07","Wirtschaft, Atomausstieg, Energie, Energiesparen, Energieverbrauch, Energiewirtschaft, Angela Merkel, Greenpeace, Grüne, Philipp Rösler, Bundesregierung, Bundeswirtschaftsministerium, Europäische Union, Günther Oettinger, Umweltbundesamt, Atomausstieg, Elektromobilität, Energie, Kraftwerk, Berlin, Brüssel, Fukushima","http://www.zeit.de/2011/28/Energiewende"
"Pro EU-Steuer: Die EU-Kommission braucht Macht – und Geld!","2011.28.52295","2011-07-07","Wirtschaft, Pro EU-Steuer, Steuer, Steuerpolitik, Europa, Wirtschaftspolitik, Europäische Union, Debatte, Euro, Finanzmarkt, Haushalt, Kernkraftwerk, Klimaschutz, Mehrwertsteuer, Nationalismus, Regierungschef, Selbstmord, Steuer, Versicherung, Brüssel, Europa, Bayern, Prag","http://www.zeit.de/2011/28/EU-Steuer-Pro-Contra"
