"title","number","date","keywords","link"
"Wolfgang Ebert: Sport mit Tradition |","1992.6.3437","1992-01-31","DIE ZEIT, Wolfgang Ebert, Fußball, Jagd, Jahreszeit, Opfer, Tier, MIT, Wolfgang Ebert","http://www.zeit.de/1992/06/sport-mit-tradition"
"Bürgerkrieg in Somalia: Nach der Befreiung die Apokalypse |","1992.6.3438","1992-01-31","DIE ZEIT, Bürgerkrieg in Somalia, Siad Barre, Bürgerkrieg, Somalia, Apokalypse, Vereinte Nationen, Friedenstruppe, Medikament, Libanon, Mogadischu, Dschibuti, New York","http://www.zeit.de/1992/06/nach-der-befreiung-die-apokalypse"
"Angst herrscht im Maghreb-Staat: Zuflucht bei den Bärtigen |","1992.6.3439","1992-01-31","DIE ZEIT, Angst herrscht im Maghreb-Staat, Moschee, Algerien, Brüssel, Paris","http://www.zeit.de/1992/06/zuflucht-bei-den-baertigen"
"Rückblick: Erschießung in Kuba: Zahn um Zahn |","1992.6.3440","1992-01-31","DIE ZEIT, Rückblick: Erschießung in Kuba, Fidel Castro, Kuba, Anschlag, Desperado, Gericht, Geschichte, Handfeuerwaffe, Opposition, Parteitag, Sozialismus, Tod, Widerstand","http://www.zeit.de/1992/06/zahn-um-zahn"
"Botschaft zur Lage der Nation: Der Präsident im Zugzwang |","1992.6.3441","1992-01-31","DIE ZEIT, Botschaft zur Lage der Nation, George W.  Bush, Präsident, Botschaft, Football, Krankenversicherung, Republikaner (USA), Rüstungsindustrie, Sowjetunion, Houston, New York, Texas, Washington D.C","http://www.zeit.de/1992/06/der-praesident-im-zugzwang"
"KOLUMNE: Die Macht und der Schmutz |","1992.6.3442","1992-01-31","DIE ZEIT, KOLUMNE, Manfred Stolpe, Dietrich Bonhoeffer, Helmut Schmidt, Klaus von Dohnanyi, Bärbel Bohley, CSU, SPD, Willy Brandt, Björn Engholm, Johannes Rau, DDR, Freya Klier, Ostdeutschland","http://www.zeit.de/1992/06/die-macht-und-der-schmutz"
"Als Nachfolger von Josef Duchac: Aus dem Westen nichts Neues |","1992.6.3443","1992-01-31","DIE ZEIT, Als Nachfolger von Josef Duchac, Bernhard Vogel, CDU, Helmut Kohl, Klaus Zeh, Kurt Biedenkopf, Christine Lieberknecht, DDR, Konrad-Adenauer-Stiftung, Erfurt, Bonn, Thüringen, Eisenach, Rheinland-Pfalz, Sachsen","http://www.zeit.de/1992/06/aus-dem-westen-nichts-neues"
"Im Wiener Bundesparlament Initiativen gegen die Neonazis: Brauner Spuk in den Alpen |","1992.6.3444","1992-01-31","DIE ZEIT, Im Wiener Bundesparlament Initiativen gegen die Neonazis, Jörg Haider, Alpen, Simon Wiesenthal, ÖVP, Österreich, Franz Vranitzky, Polizeipräsident, USA, Wien, Cottbus, Osteuropa, Wien","http://www.zeit.de/1992/06/brauner-spuk-in-den-alpen"
"Rivalität zwischen den Wirtschaftsgiganten: Das Ende der Bescheidenheit |","1992.6.3445","1992-01-31","DIE ZEIT, Rivalität zwischen den Wirtschaftsgiganten, George W.  Bush, Japan, Außenminister, tTokyo, USA, Sowjetunion, Washington D.C., Europa","http://www.zeit.de/1992/06/das-ende-der-bescheidenheit"
"Frauenpolitik in Kuwait: Eine Prinzessin mit Prinzipien |","1992.6.3446","1992-01-31","DIE ZEIT, Frauenpolitik in Kuwait, Saddam Hussein, Kuwait, Allianz, Golf, Wahlrecht, MIT, Saudi Arabien, Kairo","http://www.zeit.de/1992/06/eine-prinzessin-mit-prinzipien"
"Flüchtlingspolitik als Wahlkampfthema: Das Asylrecht aus den Angeln heben |","1992.6.3447","1992-01-31","DIE ZEIT, Flüchtlingspolitik als Wahlkampfthema, CDU, Angeln, Asylrecht, Asyl, Bleiberecht, Flüchtling, Grundgesetz, Grundrecht, Jugoslawien, Staatsangehörigkeit, Verfassungsrecht, Slowenien, Baden-Württemberg, Dublin, Schleswig-Holstein","http://www.zeit.de/1992/06/das-asylrecht-aus-den-angeln-heben"
"Bonner Bühne: Das Jahr der Partei |","1992.6.3448","1992-01-31","DIE ZEIT, Bonner Bühne, Helmut Kohl, Bernhard Vogel, Bühne, CDU, Hans-Otto Wilhelm, Werner Langen, Erwin Teufel, Landtag, Ministerpräsident, Baden-Württemberg, Hessen, Niedersachsen, Rheinland-Pfalz, Saarland, Schleswig-Holstein, Thüringen","http://www.zeit.de/1992/06/das-jahr-der-partei"
"Worte der Woche |","1992.6.3449","1992-01-31","DIE ZEIT, , Bundesregierung, Hans-Dietrich Genscher, Boris Jelzin, Dieter Althaus, Franz Steinkühler, IG Metall, Joachim Gauck, Atomwaffe, Bundesaußenminister, Bundeswehr, Bärbel Bohley, James Baker, Ministerpräsident, Muammar al-Gaddafi, Rechtsanwalt, Stahlindustrie, Jugoslawien, Libyen, USA, Breslau, Moskau, Rom, Thüringen","http://www.zeit.de/1992/06/worte-der-woche"
"Zeitspiegel |","1992.6.3450","1992-01-31","DIE ZEIT, , Helmut Kohl, Salman Rushdie, EWE, Europäische Gemeinschaft, Olympia, Schleichwerbung, Tier, Währung, Iran, Berlin, Brüssel, London, Teheran","http://www.zeit.de/1992/06/zeitspiegel"
"Warum blockt Bonn ab? |","1992.6.3451","1992-01-31","DIE ZEIT, , Bonn, Hans-Dietrich Genscher, Rupert Neudeck, Auswärtiges Amt, Wirtschaftsministerium, Bürgerkrieg, Diplomat, Fahrzeug, Glaube, Mine, Schicksal, Somalia, Vereinte Nationen","http://www.zeit.de/1992/06/warum-blockt-bonn-ab"
"Weltbühne: Menschliches Treibgut |","1992.6.3452","1992-01-31","DIE ZEIT, Weltbühne, Abschiebung, Flüchtlingslager, Indien, Rajiv Gandhi, Treibhauseffekt, Vereinte Nationen, Hongkong, Malaysia, Sri Lanka, Thailand, Colombo, Delhi","http://www.zeit.de/1992/06/menschliches-treibgut"
"Diplomatische Beziehungen: Goliath umarmt David |","1992.6.3453","1992-01-31","DIE ZEIT, Diplomatische Beziehungen, China, Jassir Arafat, UN-Sicherheitsrat, Atomprogramm, Beziehung, David Levy, Vereinte Nationen, Diplomatische Beziehungen, Indien, Irak, Iran, Libyen, Pakistan, Peking, Fernost, Jerusalem, Madrid, Washington D.C","http://www.zeit.de/1992/06/goliath-umarmt-david"
"Der andere Vogel |","1992.6.3454","1992-01-31","DIE ZEIT, , Bernhard Vogel, Helmut Kohl, CDU, CSU, FDP, Konrad-Adenauer-Stiftung, Stützpunkt, Vogel, Rheinland-Pfalz, Eifel, Erfurt, Mainz, Thüringen","http://www.zeit.de/1992/06/der-andere-vogel"
"Das atlantische Bündnis ausdehnen?: „Egal, ob das noch Nato heißt“ |","1992.6.3455","1992-01-31","DIE ZEIT, Das atlantische Bündnis ausdehnen?, Oskar Lafontaine, Björn Engholm, SPD, Nato, Bundesregierung, Atomwaffe, Integration, Peter Boenisch, Sowjetunion, Griechenland, Iran, Türkei, Ukraine, Balkan, Osteuropa, Saarbrücken","http://www.zeit.de/1992/06/egal-ob-das-noch-nato-heisst"
"Großbritannien: Abstieg eines Magnaten |","1992.6.3456","1992-01-31","DIE ZEIT, Großbritannien, Großbritannien, Audi, Edward Heath, Kühne &amp; Nagel, Mauritius, Skandal, Abstieg, Indien, London, Afrika, Frankfurt am Main, Glasgow","http://www.zeit.de/1992/06/abstieg-eines-magnaten"
"Nachlese: Hinrichtung in Arkansas: Auge um Auge |","1992.6.3457","1992-01-31","DIE ZEIT, Nachlese: Hinrichtung in Arkansas, Bill Clinton, Medien, Körper, Post, Presse, Präsident, Präsidentschaftskandidat, Tod, Todesstrafe, Arkansas, Washington D.C","http://www.zeit.de/1992/06/auge-um-auge"
"Nicht mehr Frontstadt, noch nicht Hauptstadt: Berlin befindet sich im Umbruch, doch die Richtung bleibt ungewiß.: Die Mauer in den Herzen |","1992.6.3458","1992-01-31","DIE ZEIT, Nicht mehr Frontstadt, noch nicht Hauptstadt: Berlin befindet sich im Umbruch, doch die Richtung bleibt ungewiß., Berlin, CDU, Eberhard Diepgen, DDR, Theodor Fontane, Verwaltung, Bonn, Brandenburg, Berlin, Europa, Ostberlin","http://www.zeit.de/1992/06/die-mauer-in-den-herzen"
"Rudolf Engen Was nun, Mölli?: Was nun, Mölli? |","1992.6.3459","1992-01-31","DIE ZEIT, Rudolf Engen Was nun, Mölli?, Jürgen Möllemann, EMMA, Agentur, Agrarpolitik, Bundeskanzler, Bundeswirtschaftsminister, Europäische Gemeinschaft, Gespräch, Minister, Tarifrunde, USA, Osteuropa, Schwarzes Meer","http://www.zeit.de/1992/06/was-nun-moelli"
"Bank und Börse: Online in die Pleite |","1992.6.3460","1992-01-31","DIE ZEIT, Bank und Börse, Bank, Börse, tTokyo, New York","http://www.zeit.de/1992/06/online-in-die-pleite"
"Banken contra Bundesbank: Zank ums kurze Ende |","1992.6.3461","1992-01-31","DIE ZEIT, Banken contra Bundesbank, Theo Waigel, Bundesbank, Claus Köhler, Fonds, Geldpolitik, Kapitalmarkt, Sparkasse, Banken, Hessen, Niedersachsen","http://www.zeit.de/1992/06/zank-ums-kurze-ende"
"Absturzkatastrophe: Wunderwerk im Zwielicht |","1992.6.3462","1992-01-31","DIE ZEIT, Absturzkatastrophe, Airbus, Hartmut Mehdorn, McDonnell Douglas, Pilotenvereinigung Cockpit, Indien, Straßburg, Toulouse","http://www.zeit.de/1992/06/wunderwerk-im-zwielicht"
"Fritz Vorholz:: Monopole unter Strom |","1992.6.3463","1992-01-31","DIE ZEIT, Fritz Vorholz:, Strom, Bundesregierung, Ausbeutung, Deregulierung, Treibhauseffekt, Umwelt, Frankreich, Luxemburg, Europa, Ludwigshafen","http://www.zeit.de/1992/06/monopole-unter-strom"
"Claus Noé:: Lieber ein Runder Tisch als eine Rezession |","1992.6.3464","1992-01-31","DIE ZEIT, Claus Noé:, Jürgen Möllemann, Bundesbank, Bundesregierung, Theo Waigel, Autonomie, Bundesfinanzminister, Deutsches Institut für Wirtschaftsforschung, Einkommen, Rezession, Solidaritätszuschlag, Tariflohn, Unternehmensbesteuerung","http://www.zeit.de/1992/06/lieber-ein-runder-tisch-als-eine-rezession"
"Bundesbankgewinn: Unverdient |","1992.6.3465","1992-01-31","DIE ZEIT, Bundesbankgewinn, Theo Waigel, Bundesbank, Bank, Bundesfinanzminister, Finanzminister, Geld, Gewinn, Inflation, Kapitalismus, Konjunktur, Minister, Staatsverschuldung, Volkswirtschaft","http://www.zeit.de/1992/06/unverdient"
"Ende der Rubelzeit |","1992.6.3466","1992-01-31","DIE ZEIT, , Boris Jelzin, Leonid Krawtschuk, Russland, Ukraine, Europäische Gemeinschaft, Rubel, Sowjetunion, Währung, Kiew, Kuba, Litauen, Brüssel, Sibirien","http://www.zeit.de/1992/06/ende-der-rubelzeit"
"Bonner Kulisse |","1992.6.3467","1992-01-31","DIE ZEIT, , Bundesregierung, Gerda Hasselfeldt, Peter Wichert, Jürgen Möllemann, Verteidigungsministerium, Generalbundesanwalt, Helmut Haussmann, Spionage, Staatssekretär, Stiftung, Wirtschaftsminister, Irak, Bonn","http://www.zeit.de/1992/06/bonner-kulisse"
"Vergebliche Abwicklung |","1992.6.3468","1992-01-31","DIE ZEIT, , Bundesregierung, Dresdner Bank, Hermann Josef Abs, Ludwig Erhard, Alliierte, England, Bonn","http://www.zeit.de/1992/06/vergebliche-abwicklung"
"Ist der Industriestandort Deutschland in Gefahr? Der IG-Metall-Chef hält nichts von den Klagen der Unternehmer.: Schwachstelle High-Tech |","1992.6.3469","1992-01-31","DIE ZEIT, Ist der Industriestandort Deutschland in Gefahr? Der IG-Metall-Chef hält nichts von den Klagen der Unternehmer., Franz Steinkühler, Auslandsinvestition, Europäische Gemeinschaft, Heinrich Weiss, Industrie, Japan, Produktivität, Polen, Portugal, USA","http://www.zeit.de/1992/06/schwachstelle-high-tech"
"Gatt-Verhandlungen: Der Markt versagt |","1992.6.3470","1992-01-31","DIE ZEIT, Gatt-Verhandlungen, Bauernverband, Agrarpolitik, Tierhaltung","http://www.zeit.de/1992/06/der-markt-versagt"
"Versicherungen: Verhoben und verschoben |","1992.6.3471","1992-01-31","DIE ZEIT, Versicherungen, Aktie, Allianz, Binnenmarkt, Europäische Gemeinschaft, Hans Otto Eglau, Immobilienbesitz, Volksfürsorge, Sowjetunion, Versicherungen, Paris, Aachen, Brüssel, Osteuropa","http://www.zeit.de/1992/06/verhoben-und-verschoben"
"Nachtarbeit: Unkontrolliert |","1992.6.3472","1992-01-31","DIE ZEIT, Nachtarbeit, Arbeitszeit, Bundesverfassungsgericht, Computer, Gaststätte, Industrie, Krankenhaus, Produktion, Richter, Verfassungsgericht, Bonn, Karlsruhe","http://www.zeit.de/1992/06/unkontrolliert"
"Markt-Report: Stufenweise aufwärts |","1992.6.3473","1992-01-31","DIE ZEIT, Markt-Report, VW, Ausländer, Deutsche Bank, Aktie, Allianz, Daimler AG, Staatsanleihe, Umsatz, Wertpapierhandel, USA","http://www.zeit.de/1992/06/stufenweise-aufwaerts"
"Arbeitskampf: Um die Ehre |","1992.6.3474","1992-01-31","DIE ZEIT, Arbeitskampf, Franz Steinkühler, Arbeitskampf, Ekkehard Schulz, IG Metall, Hoesch, Abfindung, Arbeitgeber, Essen, Personalabbau, Sozialplan, Streik","http://www.zeit.de/1992/06/um-die-ehre"
"Teure Zugpferde |","1992.6.3475","1992-01-31","DIE ZEIT, , Leo Kirch, Günther Jauch, Thomas Gottschalk, Gerhard Zeiler, SPD, Silvio Berlusconi, Werner Klatten, Stefan Aust, Georg Kofler, Privatsender, Sender, WestLB, München","http://www.zeit.de/1992/06/teure-zugpferde"
