"title","number","date","keywords","link"
"Innenpolitik: Die Kümmerer","2012.33.53976","2012-08-09","Politik, Innenpolitik, Schweiz","http://www.zeit.de/2012/33/CH-Kuemmerer-Politker-Schweiz"
"Kommentar: Alles verschweizern?","2012.33.53977","2012-08-09","Politik, Kommentar, Schweiz, Euro-krise, Steuerpolitik","http://www.zeit.de/2012/33/CH-Kommentar-Ansehen-Schweiz"
"Hans-Georg Maaßen: Eiskalter Technokrat","2012.33.53978","2012-08-15","Politik, Hans-Georg Maaßen, Verfasssungsschutz, Innere-sicherheit, Neonazi-gruppe-nationalsozialistischer-untergrund, Rechtsextremismus","http://www.zeit.de/2012/33/Maassen"
"Drygalla-Affäre: Das ist bigott und skandalös","2012.33.53979","2012-08-09","Politik, Drygalla-Affäre","http://www.zeit.de/2012/33/Interview-Daniel-Cohn-Bendit"
"Großbritannien: Gibt Olympia den Briten neues Selbstvertrauen?","2012.33.53980","2012-08-09","Politik, Großbritannien","http://www.zeit.de/2012/33/Analyse-Olympia-Grossbritannien"
"Sigmar Gabriel: Siggi Superdaddy","2012.33.53981","2012-08-09","Politik, Sigmar Gabriel","http://www.zeit.de/2012/33/P-Berliner-Buehne"
"Liberale: Wann stürzt der FDP-Chef Philipp Rösler?","2012.33.53982","2012-08-16","Politik, Liberale, Philipp-roesler, Fdp","http://www.zeit.de/2012/33/Analyse-FDP"
"Aufrüstung: Raketen bluten nicht","2012.33.53983","2012-08-18","Politik, Aufrüstung, Drohne, Bundeswehr, Ruestung, Ruestungsindustrie","http://www.zeit.de/2012/33/P-Meinungsleiter"
"Tony Blair: Der Hauptzweck Europas ist Macht","2012.33.53984","2012-08-18","Politik, Tony Blair, Tony-blair, Schulden, Euro-krise, Euro, Euro-bond, Euro-zone","http://www.zeit.de/2012/33/Blair-Interview"
"Italienische Mafia: Staatsfeinde an der Wall Street","2012.33.53985","2012-08-18","Politik, Italienische Mafia, Italienische-mafia, Mafia, Wall-street","http://www.zeit.de/2012/33/Geldfluss"
"Euro-Rettung: Panik statt Politik","2012.33.53986","2012-08-19","Politik, Euro-Rettung, Finanzkrise, Euro, Euro-krise, Euro-zone","http://www.zeit.de/2012/33/01-Europa-Krise-Euro-Rettung"
"Norbert Lammert: Demokratie ist unbequem","2012.33.53987","2012-08-19","Politik, Norbert Lammert, Norbert-lammert","http://www.zeit.de/2012/33/Interview-Lammert"
"Erwin Riess: Mit Groll gesagt","2012.33.53988","2012-08-09","Politik, Erwin Riess, Oesterreich, Schriftsteller, Kaernten, Jörg Haider, Josef Winkler, Landesregierung, Peter Turrini, Österreich, Gesundheitssystem, Kriminalroman, Kärnten, Künstler, MIT, Polen, Ökonomie, Adria, London, New York","http://www.zeit.de/2012/33/A-Erwin-Riess-Kaernten"
"Donnerstalk: Zur Abstimmung","2012.33.53989","2012-08-09","Politik, Donnerstalk, Oesterreich, Alfred-dorfer, Alfred Dorfer, Generation, Gesundheitsminister, Nachwuchs, Republik, Solidarität, Studiengebühr","http://www.zeit.de/2012/33/A-Donnerstalk"
"Syrisches Staatsfernsehen: Ich grüße meine Mama","2012.33.53990","2012-08-09","Politik, Syrisches Staatsfernsehen, Syrien, Fernsehen, Buergerkrieg, Baschar-al--assad, Wladimir Putin, Hugo Chávez, Syrien, UN-Sicherheitsrat, Al-Dschasira, Bildbearbeitung, Moderator, Reportage, Siedlungsbau, Homs, Israel, Libanon, Libyen, Russland, Damaskus, Aleppo, Bahrain, Europa, Jerusalem, Teheran","http://www.zeit.de/2012/33/Syrien-TV-Staatsfernsehen"
"Marina Weisband: »Ich muss nicht mit den coolen Jungs spielen«","2012.33.53991","2012-08-09","Politik, Marina Weisband, Mobbing, Piratenpartei, Medien, Twitter, Forum, Hobby, Internet, Konflikt, Ukraine, Kiew, Wuppertal","http://www.zeit.de/2012/33/Rettung-Marina-Weisband"
"Ausserdem: Unter Brüdern","2012.33.53992","2012-08-09","Politik, Ausserdem, Jörg Haider, Erbe, Geschwister, Stern","http://www.zeit.de/2012/33/A-Ausserdem"
"Anti-Banken-Proteste: Ausgezeltet","2012.33.53993","2012-08-09","Wirtschaft, Anti-Banken-Proteste","http://www.zeit.de/2012/33/Occupy-Banken-Protest"
"Gregor Gysi: Viele Reiche sponsern gar nichts","2012.33.53994","2012-08-09","Wirtschaft, Gregor Gysi, Nachbarschaft","http://www.zeit.de/2012/33/Nachbarschaftshilfe-Interview-Gysi"
"Standard Chartered: Schurkeninstitution","2012.33.53995","2012-08-09","Wirtschaft, Standard Chartered","http://www.zeit.de/2012/33/Bank-Standard-Chartered-Iran"
"Dax: Hoch, runter, hoch","2012.33.53996","2012-08-09","Wirtschaft, Dax","http://www.zeit.de/2012/33/F-Boerse-Dax"
"Indien: Kein Grund, sich aufzuregen","2012.33.53997","2012-08-09","Wirtschaft, Indien","http://www.zeit.de/2012/33/Indien-Energie-Stromausfall"
"Nachbarschaftshilfe: Das Netzwerk nebenan","2012.33.53998","2012-08-16","Wirtschaft, Nachbarschaftshilfe, Nachbarschaft, Sozialer-dienst","http://www.zeit.de/2012/33/Netzwerk-Nachbarschaft"
"Euro-Krise: Drucken oder nicht?","2012.33.53999","2012-08-17","Wirtschaft, Euro-Krise, Euro-krise, Euro-zone, Europaeische-zentralbank, Jens-weidmann, Mario-draghi","http://www.zeit.de/2012/33/Euro-Krise-Jens-Weidmann-Mario-Draghi"
"Euro-Krise: Jeder muss sich selbst helfen","2012.33.54000","2012-08-17","Wirtschaft, Euro-Krise, Euro-krise, Euro-zone, Europaeische-union, Europapolitik","http://www.zeit.de/2012/33/Europa-Krise-Politische-Union"
"Rüstungsindustrie: Wir stellen keine Angriffswaffen her","2012.33.54001","2012-08-18","Wirtschaft, Rüstungsindustrie, Ruestungsindustrie, Drohne, Cyberwar, Eads","http://www.zeit.de/2012/33/Ruestungsindustrie-EADS-Interview-Zoller"
"Verleger Rudolf Hetzel: Berliner Intimitäten","2012.33.54002","2012-08-17","Wirtschaft, Verleger Rudolf Hetzel, Verlagsgewerbe, Medien, Unternehmen","http://www.zeit.de/2012/33/Helios-Media-Rudolf-Hetzel"
"Euro-Rettung: Deutschland ruiniert sich","2012.33.54003","2012-08-19","Wirtschaft, Euro-Rettung, Euro, Euro-krise, Euro-zone","http://www.zeit.de/2012/33/Euro-Rettung-Zahlung-Deutschland"
"Niedrigzinsen: Es jammern die Falschen","2012.33.54004","2012-08-21","Wirtschaft, Niedrigzinsen, Lebensversicherungen, Versicherung, Geldanlage, Kapitalanlage, Zinsen","http://www.zeit.de/2012/33/F-Lebensversicherung-Geldanlage"
"Reichensteuer: Bitte rechnen!","2012.33.54005","2012-08-09","Wirtschaft, Reichensteuer, Steuer, Steuerpolitik","http://www.zeit.de/2012/33/01-Reichensteuer"
"Nordirak: Viel Öl, viel Korruption","2012.33.54006","2012-08-22","Wirtschaft, Nordirak, Irak, Kurdistan, Erdoel, Wirtschaftswachstum, Korruption","http://www.zeit.de/2012/33/Irak-Kurdistan-Wirtschaftswachstum"
