"title","number","date","keywords","link"
"China: 540 Menschen aus Sklavenarbeit befreit","2007.25.42345","2007-06-16","Politik, China, Medien, Arbeitsministerium, Armut, Behörde, Brot, Fabrik, Gefängnis, Nachrichtenagentur, Provinz, Skandal, Xinhua, China, Fernsehen, Polizei, Region","http://www.zeit.de/online/2007/25/china"
"Korruption: „Aufklärung wurde behindert“","2007.25.42346","2007-06-15","Politik, Korruption, Sachsen, Korruption, Innenpolitik, Innenpolitik, Organisierte Kriminalität, Verfassungsschutz, Fredrik Roggan, Sachsen, Korruption, Innenpolitik, Innenpolitik, Organisierte Kriminalität, Verfassungsschutz, Bundesregierung, Bundeskriminalamt, Ermittlung, Geheimdienst, Landesregierung, Polizei, Verfassungsrecht, Bundesverfassungsgericht, Erpressung, Kriminalität, Landtag, Mord, Offenheit, Rechtsstaat, Skandal, Straftat, Verfassungsgericht, Sachsen","http://www.zeit.de/online/2007/25/Sachsen"
"LÄNDERSPIEGELZUM BEISPIEL: Jo Müller","2007.25.42347","1899-12-31","Politik, LÄNDERSPIEGELZUM BEISPIEL","http://www.zeit.de/2007/25/Jo_Mueller"
"Falsche Freunde","2007.25.42348","1899-12-31","Politik","http://www.zeit.de/2007/25/Falsche_Freunde"
"Österreich: Böses Geschlecht","2007.25.42349","2007-06-13","Politik, Österreich, Religion, Geistlicher, Sprache, Glosse, Österreich, Alfred Dorfer, Caritas, Ehe, Geschlechtsverkehr, Papst, Paul VI., Sprache, Venus, München","http://www.zeit.de/2007/25/Donnerstalk"
"SPD: »Auf sie mit Gebrüll«","2007.25.42350","2007-06-16","Politik, SPD, Innenpolitik, Partei, SPD, Innenpolitik, Partei, Jürgen Rüttgers, Oskar Lafontaine, Hannelore Kraft, SPD, CDU, Christoph Matschie, Heiko Maas, Ludwig Stiegler, Andrea Ypsilanti, Die Linke, Landtagswahl, MIT, Saarland, Bayern, Berlin, Hamburg","http://www.zeit.de/2007/25/SPD-Reise"
"SPD: Alter, Krankheit, Überzeugung","2007.25.42351","2007-06-17","Politik, SPD, Innenpolitik, Partei, Innenpolitik, SPD, Gerhard Schröder, Arbeitsmarktreform, Gesundheitsreform, Mindestlohn, Niedriglohn, Sozialversicherung, WASG, Bremen, Kiel","http://www.zeit.de/2007/25/SPD-Mitglieder"
"Österreich: Kleinmut statt Visionen","2007.25.42352","2007-06-13","Politik, Österreich, Kunst, Kunst, Innenpolitik, Kommunalpolitik, Kunst, Kunst, Innenpolitik, Österreich, China, Peter Weibel, Graz, Wien, Basel, Kassel, New York, Peking","http://www.zeit.de/2007/25/Grazer-Kunsthalle"
"DRAUSSEN: Eine Niere als Dankeschön","2007.25.42353","1899-12-31","Politik, DRAUSSEN","http://www.zeit.de/2007/25/Eine_Niere_als_Dankeschoen"
"WAS BLEIBT VOM G8-GIPFEL?: Jetzt nicht nachlassen, Miss World!","2007.25.42354","1899-12-31","Politik, WAS BLEIBT VOM G8-GIPFEL?, Internationale_wirtschaftsbeziehungen","http://www.zeit.de/2007/25/Jetzt_nicht_nachlassen_Miss_World"
"ZEITSPIEGEL: Ausgezeichnet","2007.25.42355","1899-12-31","Politik, ZEITSPIEGEL","http://www.zeit.de/2007/25/Ausgezeichnet"
"Still ruht die Spree","2007.25.42356","1899-12-31","Politik","http://www.zeit.de/2007/25/Still_ruht_die_Spree"
"Nahost: Außer Kontrolle","2007.25.42357","2007-06-13","Politik, Nahost, Gaza, Internationale_Beziehungen, Hamas, Israel, Gaza, Internationale_Beziehungen, Hamas, Hamas, Besatzung, Bürgerkrieg, Fatah, Gazastreifen, Gewalt, Krieg, Palästinenser, Prozess, Regierung, Verlust, Israel, Gaza","http://www.zeit.de/2007/25/Glosse_1"
"Raketenstreit: Putins unmoralisches Angebot","2007.25.42358","2007-06-15","Politik, Raketenstreit, Internationale_Beziehungen, Russland, USA, Raketen, Internationale_Beziehungen, Russland, USA, Wladimir Putin, Tony Blair, Demokratisierung, Pipeline, Raketenabwehr, Russland, Sergej Lawrow, Tschechische Republik, U-Boot, USA, USA, Georgien, Irak, Polen, Sowjetunion, Türkei, Ukraine, Moskau, Alaska, Balkan, Baltikum, Berlin, Washington D.C","http://www.zeit.de/2007/25/Raketen"
"Linkspartei: Einen Stich ins Rötliche","2007.25.42359","2007-06-16","Politik, Linkspartei, Innenpolitik, Partei, SPD, PDS, Innenpolitik, Partei, SPD, Grüne, Bodo Ramelow, Franz Walter, Die Linke, Die Linke, Bundestag, Landtag, Landtagswahl, PDS, Volksparteien, WASG, Bayern, Berlin, Bremen, Hessen","http://www.zeit.de/2007/25/Linkspartei"
"WAS BLEIBT VOM G8-GIFPEL?: Wachtmeister Kapuze","2007.25.42360","1899-12-31","Politik, WAS BLEIBT VOM G8-GIFPEL?, Kriminalitaet, Kriminalitaet, Recht, Internationale_wirtschaftsbeziehungen, Kriminalitaet, Kriminalitaet, Recht","http://www.zeit.de/2007/25/Wachtmeister_Kapuze"
"Demenz: Zukunft mit Greisen","2007.25.42361","2007-06-14","Politik, Demenz, Innenpolitik, Medizin, Krankheit, Innenpolitik, Medizin, Caritas, Alzheimer, Demenz, Familienpolitik, Pflege, MIT, Nordrhein-Westfalen","http://www.zeit.de/2007/25/LS-Demenzkommune"
"Der Lächler und die Mörder","2007.25.42362","1899-12-31","Politik, , Kriminalitaet, Kriminalitaet, Recht, Kriminalitaet, Kriminalitaet","http://www.zeit.de/2007/25/Der_Laechler_und_die_Moerder"
"ZEITSPIEGEL: Berichtigung","2007.25.42363","1899-12-31","Politik, ZEITSPIEGEL, Jugendkriminalitaet, Kriminalitaet, Kriminalitaet, Recht, Jugendkriminalitaet, Kriminalitaet, Kriminalitaet","http://www.zeit.de/2007/25/Berichtigung"
"Kleiner König","2007.25.42364","1899-12-31","Politik","http://www.zeit.de/2007/25/Kleiner_Koenig"
"Sachsen-Affäre: Von oben gestoppt?","2007.25.42365","2007-06-13","Politik, Sachsen-Affäre, Innenpolitik, Verfassungsschutz, Innenpolitik, Thomas de Maizière, SPD, Innenministerium, PKK, Geheimdienst, Immobilienmakler, Justiz, Landesamt für Verfassungsschutz, Landtag, Rauschgift, Razzia, Staatsanwaltschaft, Dresden, Leipzig, Sachsen","http://www.zeit.de/2007/25/Laenderspiegel-Sachsen"
"Europa: Zum Glück vereint","2007.25.42366","2007-06-18","Politik, Europa, Innenpolitik, Internationale_Beziehungen, Internationale_Beziehungen, Aussenpolitik, Innenpolitik, Internationale_Beziehungen, Internationale_Beziehungen, Angela Merkel, Europa, Europäische Union, Glück, Javier Solana, EU-Gipfel, Flagge, Newsweek, Säkularisierung, Türkei, Vereinte Nationen, Verfassung, Václav Havel, Litauen, Russland, USA, Berlin, Brüssel, Heiligendamm, Warschau","http://www.zeit.de/2007/25/01-Merkel-Europa"
"Lebendiger und schärfer","2007.25.42367","1899-12-31","Politik","http://www.zeit.de/2007/25/Lebendiger_und_schaerfer"
"Simbabwe: Der ruinierte Traum","2007.25.42368","2007-06-19","Dossier, Simbabwe, Internationale_Beziehungen, Ausland, Simbabwe, Internationale_Beziehungen, Ausland, Robert Mugabe, Morgan Tsvangirai, Traum, Simbabwe, Benzin, Erzbischof, Südafrika, US-Dollar, Großbritannien, Landsberg, Rhodesien","http://www.zeit.de/2007/25/Simbabwe"
"FRAGEN ZU EUROPA: Reden wir von Eurafrika","2007.25.42369","1899-12-31","Politik, FRAGEN ZU EUROPA, Europapolitik, Internationale_Beziehungen, Europapolitik","http://www.zeit.de/2007/25/Reden_wir_von_Eurafrika"
"Zwei Freunde Amerikas","2007.25.42370","1899-12-31","Politik, , Aussenpolitik, Internationale_Beziehungen, Aussenpolitik","http://www.zeit.de/2007/25/Zwei_Freunde_Amerikas"
"SPD: Eine Utopie muss her!","2007.25.42371","2008-03-03","Politik, SPD, Innenpolitik, Partei, Innenpolitik, Partei, SPD, SPD, George W.  Bush, Sigmar Gabriel, Willy Brandt, CDU, Erhard Eppler, Die Linke, Ulrich Beck, Dürre, Erderwärmung, Globalisierung, Kapitalismus, Klimapolitik, Klimawandel, Kohlendioxid, Meeresspiegel, Treibhausgas, Indien, Russland, Europa, Afrika, Alaska, München, New York, Osteuropa","http://www.zeit.de/2007/25/SPD-Essay"
"Schluss mit putzmunter","2007.25.42372","1899-12-31","Politik","http://www.zeit.de/2007/25/Schluss_mit_putzmunter"
"Kosovo: »Die Leute haben keine Geduld mehr«","2007.25.42373","2007-06-15","Politik, Kosovo, Internationale_Beziehungen, Militaerhilfe, Kosovo, Serbien, Internationale_Beziehungen, Militaerhilfe, Kosovo, Europäische Union, Fatmir Sejdiu, Kosovo, UN-Sicherheitsrat, OSZE, Gastarbeiter, Martti Ahtisaari, Serbien, USA, Vereinte Nationen, China, Jugoslawien, Russland, Österreich, Europa","http://www.zeit.de/2007/25/Kosovo"
"Meuchelwort","2007.25.42374","1899-12-31","Politik","http://www.zeit.de/2007/25/Meuchelwort"
"Worte der woche","2007.25.42375","1899-12-31","Politik","http://www.zeit.de/2007/25/Worte_der_woche"
"Fall Ermyas M.: Kein Grund zur Entwarnung","2007.25.42376","2007-06-15","Politik, Fall Ermyas M., Kriminalitaet, Ausländerfeindliche Gewalt, Vhb_Prozess, Ermyas M., No-go-Areas, Kriminalitaet, Ausländerfeindliche Gewalt, Prozess, Ermyas M., Ausländer, Medien, Bundesanwaltschaft, Ermittlung, Gericht, Justiz, Klischee, Opfer, Staatsanwaltschaft, Überfall, Halberstadt, Potsdam","http://www.zeit.de/online/2007/25/ermyas"
"Kosovo: Die Leute haben keine Geduld mehr","2007.25.42377","2007-06-17","Politik, Kosovo, Internationale_Beziehungen, Aussenpolitik, Diplomatische_beziehungen, Voelkerrecht, Internationale_Beziehungen, Aussenpolitik, Diplomatische_beziehungen, Europäische Union, Fatmir Sejdiu, Kosovo, OSZE, Serbien, Europa, Jugoslawien, USA, Österreich, Balkan, Belgrad, Heiligendamm","http://www.zeit.de/online/2007/25/kosovo"
"Linke: Angst vor Lafontaine","2007.25.42378","2007-06-18","Politik, Linke, Linke, Lafontaine, Parteienlandschaft, Linke, Lafontaine, Grüne, Oskar Lafontaine, Oskar Lafontaine, SPD, FDP, Die Linke, PDS, Tracht, Volksparteien, WASG, Zeitung, USA, Berlin, Magdeburg","http://www.zeit.de/online/2007/25/linke"
"Aids-Prozess: Böses Spiel","2007.25.42379","2007-06-20","Politik, Aids-Prozess, Internationale_Beziehungen, Libyen, Aids-Prozess, Internationale_Beziehungen, Libyen, Frank Walter Steinmeier, Muammar al-Gaddafi, Benita Ferrero-Waldner, Tony Blair, Libyen, Aids, Arzt, BP, Epidemie, Hepatitis, Marathon, Staatsbürgerschaft, Großbritannien, Europa, Tripolis","http://www.zeit.de/online/2007/25/aidsprozess"
"Fall Litwinenko: Die Wahrheit?","2007.25.42380","2007-06-16","Politik, Fall Litwinenko, Internationale_Beziehungen, Russland, Litwinenko, Putin, Geheimdienst, Polonium, Internationale_Beziehungen, Russland, Litwinenko, Putin, Geheimdienst, Alexander Litwinenko, Andrej Lugowoi, Anna Politkowskaja, Boris Beresowski, Ermittlung, FSB, KGB, MI6, Oligarch, Polonium, Tschetschenien, Großbritannien, USA, Moskau, Davos, Europa, Istanbul, London, New York","http://www.zeit.de/online/2007/25/Litwinenko"
"Österreich: Der Herrenreiter","2007.25.42381","2007-06-14","Politik, Österreich, Österreich, Waldheim, UN, Nationalsozialismus, NS-Zeit, Österreich, Waldheim, UN, Nationalsozialismus, Österreich, Kurt Waldheim, Grüne, FPÖ, Wolfgang Schüssel, ÖVP, Bundespräsident, Fred Sinowatz, Heinz-Christian Strache, Kriegsverbrechen, Nationalsozialismus, ORF, Simon Wiesenthal, Staatsoberhaupt, Vatikan, Wehrmacht, Alliierte, Griechenland, Holocaust, Jugoslawien, USA","http://www.zeit.de/online/2007/25/waldheim"
"Zweiter Weltkrieg: 27 Millionen","2007.25.42382","2008-10-31","Politik, Zweiter Weltkrieg, Sowjetunion, Bolschewismus, Krieg, Kriegsgefangene, Russland, Wehrmacht, Weltkrieg, Zweiter Weltkrieg, Berlin, Europa, Leningrad, Auschwitz, Kiew, Moskau, Stalingrad, Ural","http://www.zeit.de/2007/25/27-Millionen-Tote"
"Österreich: Kaufen, verkaufen, verschwinden","2007.25.42383","2007-06-13","Politik, Österreich, Recht, Justiz, Immobilien, Recht, Justiz, Jörg Haider, Österreich, Bayerische Landesbank, Immobiliengeschäft, Jugoslawien, Kroatien, Klagenfurt, Kärnten, Wien, Zagreb, Bayern, München","http://www.zeit.de/2007/25/Istrien"
"Stillstand in der Grünkernhöhle","2007.25.42384","1899-12-31","Wirtschaft, , Einzelhandel, Dienstleistung, Einzelhandel","http://www.zeit.de/2007/25/Stillstand_in_der_Gruenkernhoehle"
"MACHER &amp; MÄRKTE: Autos: Viele Probleme","2007.25.42385","1899-12-31","Wirtschaft, MACHER &amp; MÄRKTE","http://www.zeit.de/2007/25/Autos_Viele_Probleme"
"Finderlohn für Ingenieure","2007.25.42386","1899-12-31","Wirtschaft, , Hochschule, Bildung, Hochschule","http://www.zeit.de/2007/25/Finderlohn_fuer_Ingenieure"
"Der Landnehmer","2007.25.42387","1899-12-31","Wirtschaft","http://www.zeit.de/2007/25/Der_Landnehmer"
"»Ökoeffizienz ist rentabel«","2007.25.42388","1899-12-31","Wirtschaft","http://www.zeit.de/2007/25/Oekoeffizienz_ist_rentabel"
"Frauensteuer","2007.25.42389","1899-12-31","Wirtschaft, , Arbeit, Sozialstaat, Arbeit","http://www.zeit.de/2007/25/Frauensteuer"
"MACHER &amp; MÄRKTE: Richtigstellung","2007.25.42390","1899-12-31","Wirtschaft, MACHER &amp; MÄRKTE","http://www.zeit.de/2007/25/Richtigstellung"
"FORUM: Für viele Kinder wäre es ein Segen, wenn sie betreut würden","2007.25.42391","1899-12-31","Wirtschaft, FORUM, Kindergarten, Kind, Familie, Familie_und_Partnerschaft, Kindergarten, Kind, Familie","http://www.zeit.de/2007/25/Fuer_viele_Kinder_waere_es"
"Zinsen: Schluss mit billig","2007.25.42392","2007-06-15","Wirtschaft, Zinsen, Geld_und_Boerse, Kapitalmarkt, Zinsen, Geld_und_Boerse, Kapitalmarkt, Alan Greenspan, Ben Bernanke, Aktie, Anleihe, Bundesanleihe, Geldpolitik, Globalisierung, Kapitalmarkt, Leitzins, Rendite, Rätsel, Staatsanleihe, USA, China, Indien, Japan, MIT, Zinsen","http://www.zeit.de/2007/25/Zwischenruf-Greenspan"
"Mindestlöhne: Fünf Euro? Kein Problem","2007.25.42393","2007-06-14","Wirtschaft, Mindestlöhne, Wirtschaft_und_Konjunktur, Wirtschaftspolitik, Mindestlohn, Wirtschaft_und_Konjunktur, Wirtschaftspolitik, Bert Rürup, Bundesregierung, SPD, Hartz IV, DDR, Euro, Thomas Straubhaar, USA, Berlin, Kentucky","http://www.zeit.de/2007/25/Mindestlohn"
"Im Rausch der Entdeckung","2007.25.42394","1899-12-31","Wirtschaft, , Literatur","http://www.zeit.de/2007/25/Im_Rausch_der_Entdeckung"
"Anlagebetrug: Täter mit Komplexen","2007.25.42395","2007-06-18","Wirtschaft, Anlagebetrug, Geld_und_Boerse, Kapitalanlage, Boerse, Recht, Gesetz, Recht, Geld_und_Boerse, Kapitalanlage, Boerse, Recht, Gesetz, Jürgen Harksen, Manfred Schmider, Bundeskriminalamt, FlowTex, Anlagebetrug, MIT","http://www.zeit.de/2007/25/G-Betrueger"
"AUTOSELLER: Verschreckte Konsumenten","2007.25.42396","1899-12-31","Wirtschaft, AUTOSELLER","http://www.zeit.de/2007/25/Verschreckte_Konsumenten"
"ARGUMENT: Die Mär vom fairen Wettbewerb","2007.25.42397","1899-12-31","Wirtschaft, ARGUMENT","http://www.zeit.de/2007/25/Die_Maer_vom_fairen_Wettbewerb"
"MACHER &amp; MÄRKTE: EADS:Wenig Eintracht","2007.25.42398","1899-12-31","Wirtschaft, MACHER &amp; MÄRKTE","http://www.zeit.de/2007/25/EADSWenig_Eintracht"
"Umwelttechnik: Alle Signale auf Grün","2007.25.42399","2007-06-16","Wirtschaft, Umwelttechnik, Technik, Technik, Wirtschaft_und_Konjunktur, Wirtschaft, Umwelt, Umwelt, Technik, Technik, Wirtschaft_und_Konjunktur, Wirtschaft, Umwelt, Sigmar Gabriel, Siemens AG, BP, General Electric, Chicago, Silicon Valley","http://www.zeit.de/2007/25/Umwelttechnologie"
"Neue Ermittlungswelle","2007.25.42400","1899-12-31","Wirtschaft, , Geld_und_Boerse","http://www.zeit.de/2007/25/Neue_Ermittlungswelle"
"MACHER &amp; MÄRKTE: Energie: Viel Kohle","2007.25.42401","1899-12-31","Wirtschaft, MACHER &amp; MÄRKTE, Energiepolitik, Energie, Rohstoff, Energiepolitik, Energie","http://www.zeit.de/2007/25/Energie_Viel_Kohle"
"Schwarzarbeit: Der Schummel-Test","2007.25.42402","2007-06-13","Wirtschaft, Schwarzarbeit, Arbeit, Arbeit, Schwarzarbeit, Arbeit, Arbeit, FDP, Bundesanstalt für Arbeit, Dirk Niebel, Schwarzarbeit, Einzelhandel, MP3, Neckermann, Halle an der Saale, Heilbronn, München, Nürnberg","http://www.zeit.de/2007/25/Schwarzarbeit"
"Streik: Mauern am Bau","2007.25.42403","2007-06-18","Wirtschaft, Streik, Streik, Klaus Wiesehügel, Wolfgang Clement, Arbeitskampf, Gewerkschaft, Großunternehmen, Mindestlohn, Thomas Bauer, Niedersachsen, Baden-Württemberg, Schleswig-Holstein","http://www.zeit.de/2007/25/Bau"
"Finanzmärkte: Verdienen trotz Scharia","2007.25.42404","2007-06-19","Wirtschaft, Finanzmärkte, Geld_und_Boerse, Kapitalmarkt, Malaysia, Geld_und_Boerse, Kapitalmarkt, Malaysia, Barclays, Premierminister, Scharia, Versicherung, Dubai, Indien, Indonesien, Kuala Lumpur, Bahrain, Kuwait, Singapur, Südostasien","http://www.zeit.de/2007/25/Malaysia"
"Korruption: Der Prinz und das große Geld","2007.25.42405","2007-06-15","Wirtschaft, Korruption, Internationale_Wirtschaftsbeziehungen, Internationale_wirtschaftsbeziehungen, Recht, Recht, Korruption, Internationale_Wirtschaftsbeziehungen, Internationale_wirtschaftsbeziehungen, Recht, Recht, Geld, Korruption, BBC, Jacques Chirac, OECD, Verteidigungsministerium, England, Eurofighter, Industriegeschichte, Saudi Arabien, Terrorismus, Tornado, London, Washington D.C., Aspen, Colorado, Paris","http://www.zeit.de/2007/25/BAE-Skandal"
"30 SEKUNDEN: den Arzt","2007.25.42406","1899-12-31","Wirtschaft, 30 SEKUNDEN","http://www.zeit.de/2007/25/den_Arzt"
"MACHER &amp; MÄRKTE: Manager: Wenig Balance","2007.25.42407","1899-12-31","Wirtschaft, MACHER &amp; MÄRKTE, Management, Betriebswirtschaft, Management","http://www.zeit.de/2007/25/Manager_Wenig_Balance"
"Gerechtigkeit: Neoliberale Sozis","2007.25.42408","2007-06-19","Wirtschaft, Gerechtigkeit, Wirtschaft_und_Konjunktur, Volkswirtschaft, Neoliberalismus, Kurt Beck, Wirtschaft_und_Konjunktur, Volkswirtschaft, Neoliberalismus, CDU, SPD, Kurt Beck, Armut, Erbschaftsteuer, Kinderarmut, Neoliberalismus, Politikwissenschaft, Sozialstaat, Wiesbaden","http://www.zeit.de/online/2007/25/neoliberalismus"
