"title","number","date","keywords","link"
"Gewerkschaften: Nein! Nein! Nein!","2003.16.29283","2003-04-10","Politik, Gewerkschaften, Arbeit, Partei, Reform, Regierung, Sozialstaat, Gewerkschaft, Portrait, Sozialdemokratie, Sozialpolitik, Wahlnachlese, Gerhard Schröder, Klaus Zwickel, Angela Merkel, Hans Eichel, Rüdiger Veit, Frank Bsirske, IG Metall, Michael Sommer, CSU, Grüne, Ver.di, Ernst Thälmann, Kündigungsschutz, Sozialversicherung, Widerstand, Heidelberg, Mannheim, Arbeit und Sozialstaat, Partei, Reform, Regierung, Sozialstaat, Gewerkschaft, Portrait, Sozialdemokratie, Sozialpolitik","http://www.zeit.de/2003/16/Gewerkschaften"
"WORTE DER WOCHE","2003.16.29284","2003-04-10","Politik, , Condoleezza Rice, Abrüstung, Bundeswirtschaftsminister, Irak, Ritus, Sender, Vollbeschäftigung, Zulieferer, China, USA, Bagdad, Basra, Palästina, Sars","http://www.zeit.de/2003/16/WORTE_DER_WOCHE"
"Normalität auf Russisch","2003.16.29285","2003-04-10","Politik, , Recht, Alltag, Alter, Dorf, Euro, Gewalt, Kreml, Körper, Mord, Statistik, Verfassung, Wunder, Tschetschenien, Thüringen","http://www.zeit.de/2003/16/Normalitaet_auf_Russisch"
"Gesunde Reform","2003.16.29286","2003-04-10","Politik, , Bert Rürup, Karl Lauterbach, Ver.di, Arbeitslosigkeit, Arbeitsmarkt, Gesundheitssystem, Krankenversicherung, Wirtschaftskrise, Reform","http://www.zeit.de/2003/16/Gesunde_Reform"
"Teheran: Umzingelt von Vipern und Skorpionen","2003.16.29287","2003-04-10","Politik, Teheran, Staat, Demokratie, Internationale_Beziehungen, Aussenpolitik, Krieg, Krise, Reform, Regierung, Folgen, Golfkrieg, Mohammed Chatami, Colin Powell, Donald Rumsfeld, Teheran, Bill Clinton, George W.  Bush, Jimmy Carter, Ronald Reagan, Saddam Hussein, Iran, Atombombe, Demokratie, Irak-Krieg, Krieg, Massenvernichtungswaffe, Pentagon, Reform, US-Außenpolitik, USA, Videospiel, Irak, Syrien, Türkei, Bagdad, Washington D.C., Staat, Demokratie, Internationale Beziehungen, Außenpolitik, Krieg, Krise, Reform, Regierung, Folgen","http://www.zeit.de/2003/16/Teheran"
"Kalt abgewiesen","2003.16.29288","2003-04-10","Politik, , Grüne, Bundestagsfraktion, Diktatur, Exil, Föderalismus, Hoffnung, Krieg, Opposition, Terrorismus, Irak, Europa, Palästina","http://www.zeit.de/2003/16/Kalt_abgewiesen"
"Aktuell: Aus der ZEIT 17/ 2003","2003.16.29289","2003-04-10","Politik, Aktuell, Europäische Union, Nena, Vaclav Klaus, Irak, EU-Beitritt, Nahrungsmittel, Nuklearwaffe, Sänger, US-Regierung, USA, Iran, Sudan, Syrien, Europa, Äthiopien, Afrika, Washington D.C","http://www.zeit.de/2003/16/vorabmeldungen_16"
"Arbeit: Freiheit für die Mitarbeiter, Profit für das Unternehmen","2003.16.29290","2007-12-21","Wirtschaft, Arbeit, Arbeitszeit, Reform, Wertpapier, Arbeitsplatz, Personalpolitik, Betriebswirtschaft, Unternehmen, Arbeitszeitmodell, Arbeitszeit, Reform, Wertpapier, Arbeitsplatz, Personalpolitik, Betriebswirtschaft, Unternehmen, Arbeitszeitmodell, Arbeit und Sozialstaat, Arbeit, Unternehmen, Lufthansa, Reinhard Bispinck, Hewlett-Packard, Siemens AG, Arbeitnehmer, Arbeitszeit, USA, Asien","http://www.zeit.de/2003/16/Arbeitszeit_neu"
"momente der entscheidung, folge 7: Cornelius der Große","2003.16.29291","2003-04-10","Wirtschaft, momente der entscheidung, folge 7, Mineraloelindustrie, Fossile_energie, Erdoel, Alternative_energie, Portrait, Bestechung, Reichtum, Schiff, USA, Vermögen, New York, Nicaragua, Chicago, Europa, Manhattan, New Orleans, San Francisco, Tennessee, Washington D.C., Mineralölindustrie, Fossile Energie, Erdöl, Energie und Rohstoff","http://www.zeit.de/2003/16/Vanderbilt"
"EZB: Job ohne Altersgrenze","2003.16.29292","2003-04-10","Wirtschaft, , Macher, Jean-Claude Trichet, Wim Duisenberg, Alan Greenspan, Europäische Zentralbank, Gerichtsverfahren, Präsident, Ruhestand, Frankreich","http://www.zeit.de/2003/16/EZB_Job_ohne_Altersgrenze"
"umwelt: Müllers Mission","2003.16.29293","2003-04-10","Wirtschaft, umwelt, Kohle, Bergbau, Subvention, Alternative_energie, Energiewirtschaft, Portrait, Fossile_energie, Umwelt, Werner Müller, RWE, Peer Steinbrück, Degussa, ThyssenKrupp, Bergbau, Kohle, Landesregierung, Ulrich Hartmann, Saar, Kohle, Bergbau, Subvention, Energie und Rohstoff, Energiewirtschaft, Portrait","http://www.zeit.de/2003/16/M_9fller_2fRAG"
"iwf/g-7: Hoffen auf den heiligen Alan","2003.16.29294","2003-04-10","Wirtschaft, iwf/g-7, Wirtschaft_und_Konjunktur, Wirtschaft, Konjunktur, Zinspolitik, Volkswirtschaft, EU, Verbraucher, Konsum, Vhb_Weltwirtschaft, Deflation, Staatsfinanzen, Alan Greenspan, George W.  Bush, Europäische Zentralbank, Morgan Stanley, USA, Golfkrieg, Internationaler Währungsfonds, Notenbank, US-Finanzmarkt, US-Wirtschaft, Weltbank, Wim Duisenberg, Atlantik, Europa, Kuwait, Washington D.C., Wirtschaft und Konjunktur, Wirtschaft, Konjunktur, Zinspolitik, Volkswirtschaft, EU, Verbraucher, Konsum, Weltwirtschaft, Deflation","http://www.zeit.de/2003/16/Vor-IWF"
"USA: Beef für die Jugend","2003.16.29295","2003-04-10","Wirtschaft, , Macher, Einstellung, Essen, Körper, Mädchen, Umfrage, Colorado","http://www.zeit.de/2003/16/USA_Beef_fuer_die_Jugend"
"trinken: Viele Flaschen, wenig Durst","2003.16.29296","2003-04-10","Wirtschaft, trinken, Unternehmensverkauf, Brauerei, Biere, Wirtschaft_und_Konjunktur, Wettbewerb, Getränkeindustrie, EU, Roland Berger, Bier, Heineken, Ruhrgebiet, Trinken, München, Brunnen, Jever, Unternehmensverkauf, Brauerei, Biere, Wirtschaft und Konjunktur, Wettbewerb, Getränkeindustrie","http://www.zeit.de/2003/16/Bier"
"Dem Himmel so fern","2003.16.29297","2003-04-10","Wirtschaft, , Lungenkrankheit, Golfkrieg, Krise, Fluggesellschaft, Transport_und_Verkehr, Verkehr, Luftverkehr, Folgen, Krieg, Lufthansa, Continental, Insolvenz, Jürgen Weber, Tarifvertrag, US Airways, Wolfgang Mayrhuber, Irak, USA, Asien, Chicago, Dallas, Europa, Sars, Lungenkrankheit, Golfkrieg, Krise, Fluggesellschaft, Transport und Verkehr, Verkehr, Luftverkehr, Folgen","http://www.zeit.de/2003/16/Airlines"
"islam: Fremdkapital","2003.16.29298","2003-04-10","Wirtschaft, islam, Zinsverbote, Religion, Islam, Geldanlage, Geld_und_Boerse, Geld, Religion, Staaten, Islam, Millî Görüs, Moschee, Rechtsanwalt, Türkei, Liechtenstein, Europa, Zinsverbote, Religion, Islam, Geldanlage, Geld und Börse, Geld, Religion","http://www.zeit.de/2003/16/G-Gr_9fnes_Kapital_Beist_9fck"
"Die smarten Büßer","2003.16.29299","2003-04-10","Wirtschaft, , Florian Haffa, Bilanzfälschung, Bundesgerichtshof, Bundestag, Dreisprung, Fälschung, Grundlagenforschung, Rainer Hamm, Richter, Straftat, Wirtschaftsprüfer, München","http://www.zeit.de/2003/16/Die_smarten_Buesser"
"Emotionen zählen","2003.16.29300","2003-04-10","Wirtschaft, , Werbung_und_Marketing, Marketing, Autoindustrie, Werbung, Ferdinand Dudenhöffer, BMW, VW, Audi, Ford, Mercedes, Opel, Volvo, ADAC, Citroën, Peugeot, Renault, Rover, Toyota, Anzeige, Auto, Etat, Euro, Hyundai, Lancia, PKW, Werbung, Werbung und Marketing, Marketing, Autoindustrie","http://www.zeit.de/2003/16/Auto-Werbung"
"Signori! Der Mythos lebt!","2003.16.29301","2003-04-10","Wirtschaft, , Enzo Ferrari, BMW, Fiat, Niki Lauda, Silvio Berlusconi, Alfa Romeo, Auto, Design, Lancia, Maserati, Porsche, SUV, USA, Verwaltungsrat, Italien, Spanien","http://www.zeit.de/2003/16/Signori_Der_Mythos_lebt_"
"Konflikte im IWF: Am langen Arm Amerikas","2003.16.29302","2003-04-10","Wirtschaft, Konflikte im IWF, Insolvenzrecht, Staatsverschuldung, Staatsfinanzen, Horst Köhler, Internationaler Währungsfonds, Internationaler Währungsfonds, Abgeordnetenhaus, Entwicklungsland, Finanzmarkt, Finanzminister, Fonds, Golfkrieg, Insolvenz, John Snow, Kredit, US-Regierung, USA, Brasilien, Irak, Türkei, Uruguay, Washington D.C., Insolvenzrecht, Staatsverschuldung","http://www.zeit.de/2003/16/Kasten_IWF-Reformen"
"60 Sekunden für die Freiheit","2003.16.29303","2003-04-10","Wirtschaft, , Betriebswirtschaft, Produktion, Service, Erfahrungsbericht, Betriebswirtschaft, Produktion, Service, Reise, Autonomie, Bahn, Elisabeth von Thadden, Erzählung, Komödie, Liebe, Natur, Provinz, Roman, Vernunft, Geld","http://www.zeit.de/2003/16/Kolumne_2"
"Bosch: Her mit Buderus","2003.16.29304","2003-04-10","Wirtschaft, , Macher, Bosch AG, Börse, Euro, Kartellbehörde, Umsatz, Übernahme, Schwaben, Wetzlar","http://www.zeit.de/2003/16/Bosch_Her_mit_Buderus"
"Eichels einzige Chance","2003.16.29305","2003-04-10","Wirtschaft, , Argument, Hans Eichel, Gerhard Schröder, CDU, Peer Steinbrück, Roland Koch, SPD, Bundesfinanzminister, Bundeshaushalt, Bundesrat, Etat, Finanzminister, Finanzpolitik, Irak-Krieg, Neuverschuldung, Stabilitätspakt, Steuer","http://www.zeit.de/2003/16/Eichels_einzige_Chance"
"Reformland Deutschland: Die Bilanz der rot-grünen Regierung","2003.16.29306","2003-04-10","Wirtschaft, , Gerhard Schröder, Ich-AG, Kündigungsschutz, Ladenschluss, Reform, Umfrage, Wunder, Ökonomie, Ökosteuer","http://www.zeit.de/2003/16/Reformland_Deutschland_Die_Bilanz_der_rot-gruenen_Regierung"
"reformen: Fünf Jahre Vergeblichkeit","2003.16.29307","2003-04-10","Wirtschaft, reformen, Sozialstaat, Arbeit, Reform, Arbeitsmarkt, Wirtschaft_und_Konjunktur, Wirtschaft, Konjunktur, Staatsfinanzen, Steuerreform, Arbeitsmarktpolitik, Arbeitslosigkeit, Sozialstaat, Arbeit und Sozialstaat, Reform, Arbeitsmarkt, Wirtschaft und Konjunktur, Wirtschaft, Konjunktur, Staatsfinanzen, Steuerreform, Arbeitsmarktpolitik, Gerhard Schröder, Peter Hartz, Bundesregierung, Linkspartei, SPD, Ulla Schmidt, Wolfgang Clement, Gesundheitswesen, Hans-Peter Schwarz, Körperschaftsteuer, Kündigungsschutz, Reform, Steuerreform, Allensbach, Berlin, Bonn","http://www.zeit.de/2003/16/Reformen"
"Rauswurf in Wolfsburg","2003.16.29308","2003-04-10","Wirtschaft, , Macher, Bernd Pischetsrieder, Absatz, Geschichte, Opfer, Vorstand, Wolfsburg","http://www.zeit.de/2003/16/Rauswurf_in_Wolfsburg"
"arbeit: <U+0084>Ich lebe ständig zwischen Bangen und Hoffen<U+0093>","2003.16.29309","2003-04-10","Wirtschaft, arbeit, Arbeitsmarktpolitik, Arbeitsmarkt, Arbeit, Umstrukturierung, Statistik, Reform, Initiativen, Bericht, Arbeitsamt, Arbeitslose, Arbeitsmarktpolitik, Arbeitsmarkt, Arbeit und Sozialstaat, Umstrukturierung, Statistik, Reform, Initiativen, Bericht, Arbeitsamt, Statistisches Bundesamt, Humboldt-Universität, Ver.di, Oberhausen, Ostdeutschland, Vertrag, Bonn, Düsseldorf, Nürnberg","http://www.zeit.de/2003/16/Befrist__Besch_8aftigung"
"David zückt die Schleuder","2003.16.29310","2003-04-10","Wirtschaft, , Wendelin Wiedeking, Dax, EU-Kommission, Betrug, Management, Porsche, Unternehmen","http://www.zeit.de/2003/16/David_zueckt_die_Schleuder"
"transatlantische beziehungen: Deutsche Lasur hält länger","2003.16.29311","2003-04-10","Wirtschaft, transatlantische beziehungen, Golfkrieg, Folgen, Wirtschaftsboykott, Wirtschaftsbeziehung, Krieg, Golfkrieg, Folgen, Wirtschaftsboykott, Wirtschaftsbeziehung, Saddam Hussein, Finanzministerium, Pentagon, Schloss Bellevue, USA, USA, Berlin, München, Nymphenburg, Ohio, Schwaben","http://www.zeit.de/2003/16/Keimfarben"
"islam: Konkurs im Schatten Allahs","2003.16.29312","2003-04-10","Wirtschaft, islam, Konkurs, Religion, Islam, Kaufhaus, Betriebswirtschaft, Unternehmen, Konkurs, Religion, Islam, Kaufhaus, Betriebswirtschaft, Allah, Anlagebetrug, Insolvenz, Koran, Mannheimer, Darmstadt, Ludwigshafen","http://www.zeit.de/2003/16/G-Gr_9fnes_Kapital_Hauptst_9fck"
"Bertelsmann: Ehre den Ex","2003.16.29313","2003-04-10","Wirtschaft, , Macher, Bertelsmann AG, Thomas Middelhoff, Unternehmen, Weltkrieg","http://www.zeit.de/2003/16/Bertelsmann_Ehre_den_Ex"
