"title","number","date","keywords","link"
"Keine Berührungsängste","1998.26.18003","1998-06-18","Politik, , Otto Graf Lambsdorff, Osnabrück, Berlin","http://www.zeit.de/1998/26/Keine_Beruehrungsaengste"
"Schon wieder Milosevic","1998.26.18004","1998-06-18","Politik, , Kosovo, Slobodan Miloševic , Gerhard Schröder, Nato, SPD, UN-Sicherheitsrat, Vojislav Seselj, Boris Jelzin, Kosovo, Rudolf Scharping, Volker Rühe, Intervention, Kanzleramt, Nato-Generalsekretär, Schmuggel, Souveränität, UCK, Vereinte Nationen, Völkermord, Jugoslawien, Tschetschenien, Europa, Belgrad, Tirana, Westeuropa","http://www.zeit.de/1998/26/Schon_wieder_Milosevic"
"Waffe gegen das Greuel","1998.26.18005","1899-12-31","Politik, , Internationale_Beziehungen, Voelkerrecht, Verbrechen, Menschlichkeit, Recht, Internationale Beziehungen, Völkerrecht, Verbrechen, Menschlichkeit, Waffen, UN-Sicherheitsrat, Drogenhandel, Gericht, Staatsgrenze, Verbrechen, Albanien, Burma, Irak, Kambodscha, Kanada, Kongo, Kosovo, Libyen, Nigeria, Ruanda, Russland, Syrien, Tschetschenien, Rom, Srebrenica","http://www.zeit.de/1998/26/199826.gericht.2_.xml"
"Frivole Scheinchen","1998.26.18006","1899-12-31","Politik, , Freddy Quinn, Friedrich Engels, Christian Morgenstern, D-Mark, DDR, Rita Hayworth, Versace, Italien, Hawaii, Kalabrien, Lago Maggiore, New York","http://www.zeit.de/1998/26/199826.geld_.xml"
"Schultaufe","1998.26.18007","1998-06-18","Politik, , Realschule, Schule, Schulleiter, Brühl","http://www.zeit.de/1998/26/Schultaufe"
"Der Lernprozeß","1998.26.18008","1998-06-18","Politik, , Gerhard Schröder, Rudolf Scharping, Volker Rühe, Helmut Kohl, Joschka Fischer, Oskar Lafontaine, SPD, Günter Verheugen, Jürgen Habermas, Karsten Voigt, Willy Brandt, EU-Osterweiterung, Frühgeburt, Kosovo, Bosnien und Herzegowina, Europa, Berlin, Brüssel, Warschau","http://www.zeit.de/1998/26/Der_Lernprozess"
"Dauerwahlkampf ade","1998.26.18009","1998-06-18","Politik, , Erich Mende, Theodor Eschenburg, FDP, Demoskopie, Industrie, Korruption, Landtagswahl, Misstrauensvotum, Parlamentswahl, Berlin","http://www.zeit.de/1998/26/Dauerwahlkampf_ade"
"Sparen statt jammern","1998.26.18010","1899-12-31","Politik, , Staatsfinanzen, Steuerpolitik, Staatsverschuldung, Sozialstaat, Arbeit, Subvention, Stabilitätspolitik, Krise, Haushaltspolitik, EU, Staatsfinanzen, Steuerpolitik, Staatsverschuldung, Sozialstaat, Arbeit und Sozialstaat, Subvention, Stabilitätspolitik, Krise, Haushaltspolitik, Europäische Union, Helmut Kohl, Bundeskanzler, EU-Gipfel, Finanzminister, Geld, Theo Waigel, Regierung, Bonn, Brüssel, Cardiff","http://www.zeit.de/1998/26/199826.kolumne.xml"
"Es gibt viel zu kämpfen","1998.26.18011","1899-12-31","Politik, , Sozialstaat, Sozialpolitik, Arbeit, Rentenversicherung, Rentenreformen, Rentenpolitik, Rente, Vhb_Altersvorsorge, Wirtschaftspolitik, Wirtschaft_und_Konjunktur, Wirtschaft, Sozialstaat, Sozialpolitik, Arbeit und Sozialstaat, Rentenversicherung, Rentenreformen, Rentenpolitik, Rente, Altersvorsorge, Wirtschaftspolitik, Wirtschaft und Konjunktur, Norbert Blüm, BMW, Bundesanstalt für Arbeit, Arbeitslose, Bevölkerungsentwicklung, Einkommen, Rente, Rentenversicherung, Sozialstaat, Tariflohn, Vorsorge, Schweiz","http://www.zeit.de/1998/26/199826.bluem-interview_.xml"
"Krieg und Frieden","1998.26.18012","1998-06-18","Politik, , Grüne, Jürgen Trittin, Aggression, Amos Oz, Bundestag, Bundeswehr, Fahrzeug, Gelöbnis, Krieg, Soldat, Somalia, Bosnien und Herzegowina, England, Jugoslawien, Kambodscha, Kosovo, USA, Berlin, Sarajevo, Europa","http://www.zeit.de/1998/26/Krieg_und_Frieden"
"Dampfradio der Werktätigen","1998.26.18013","1998-06-18","Länderspiegel, , Stadtfunk, SPD, Kurt Masur, Stasi, Leipzig, Dresden","http://www.zeit.de/1998/26/Dampfradio_der_Werktaetigen"
"Die Suche nach Rußlands Identität","1998.26.18014","1998-06-18","Politik, , Russland, Marion Gräfin Dönhoff, Europäische Union, Russland, Diplomat, Friedrich-Naumann-Stiftung, USA, Europa, Krakau, Moskau, St. Petersburg, Westeuropa","http://www.zeit.de/1998/26/Die_Suche_nach_Russlands_Identitaet"
"Wolf Schneider (34)","1998.26.18015","1998-06-18","Politik, , Kasachstan, Jean Paul, Asien","http://www.zeit.de/1998/26/Wolf_Schneider_34_"
"Sieg","1998.26.18016","1998-06-18","Politik, , Gerhard Schröder, Guido Westerwelle, Oskar Lafontaine, Autobiografie, Brief, Globalisierung, Publikum, Spiegel, Frankreich","http://www.zeit.de/1998/26/Sieg"
"Der absolute Linke","1998.26.18017","1998-06-18","Politik, , Bourdieu, Pierre Bourdieu, Die Linke, Linkspartei, Raymond Aron, Frankreich, Sowjetunion, Paris","http://www.zeit.de/1998/26/Der_absolute_Linke"
"Bei Guido stehlen","1998.26.18018","1998-06-18","Politik, , Guido Westerwelle, FDP, Grüne, Gunda Röstel, Hubert Kleinert, Wolfgang Schäuble, Hermann Otto Solms, EU-Ratspräsidentschaft, Fußball, Kirchentag, Parteitag, Stern, Wahlkampf","http://www.zeit.de/1998/26/Bei_Guido_stehlen"
"Die Welt gegen Kovacevic","1998.26.18019","1899-12-31","Politik, , Internationale_Beziehungen, Recht, Kriegsverbrechen, Krieg, Richter, Gericht, Justiz, Innenpolitik, Prozesse, Internationale Beziehungen, Recht, Kriegsverbrechen, Krieg, Richter, Gericht, Justiz, Innenpolitik, Bosnien und Herzegowina, Jugoslawien, Serbien, Völkermord, Den Haag, Rechtsanwalt, Nürnberg, Belgrad, Chicago","http://www.zeit.de/1998/26/199826.kovacevic_.xml"
"Worte der Woche","1998.26.18020","1899-12-31","Politik, , Bill Clinton, CDU, FDP, Helmut Kohl, SPD, Tony Blair, Bernhard Vogel, Matthias Wissmann, Bundeskanzler, Bundesverkehrsminister, Charlton Heston, Fußball-Nationalmannschaft, Glück, Julius Cäsar, Kirche, Ministerpräsident, Premierminister, Restaurant, Selbstmord, Waffenbesitz, Wechselkurs, Wim Duisenberg, USA, Nizza, Thüringen","http://www.zeit.de/1998/26/199826.wowos_zsp.xml"
"Die neue Angst vor Europa","1998.26.18021","1899-12-31","Politik, , Wirtschaftspolitik, Wirtschaft_und_Konjunktur, Internationale_Beziehungen, Europapolitik, Aussenpolitik, Verfassung, EU, Wettbewerb, Verbraucherschutz, Verbraucher, Wirtschaftspolitik, Wirtschaft und Konjunktur, Internationale Beziehungen, Europapolitik, Außenpolitik, Verfassung, EU, Wettbewerb, Verbraucherschutz, Helmut Kohl, Europa, Europäische Union, Wolfgang Schäuble, Theo Waigel, VW, Werner Hoyer, Auswärtiges Amt, Kurt Biedenkopf, EU-Haushalt, Europapolitik, Integration, Kurt Faltlhauser, Tabakwerbung, Währungsunion, Brüssel, Cardiff, Bonn","http://www.zeit.de/1998/26/199826.cdu.europa_.xml"
"Habt acht","1998.26.18022","1998-06-18","Politik, , Bundesregierung, Volker Rühe, Bildung, Bundestag, Bundeswehr, Forum, Jugendliche, Minister, Opposition, Soldat, Untersuchungsausschuss, Weiterbildung","http://www.zeit.de/1998/26/Habt_acht"
"Östliches","1998.26.18023","1899-12-31","Politik, , CDU, SED, SPD, Ausländer, Jörg Schönbohm, DDR, Friedrich Schorlemmer, Kunst, Lothar de Maizière, Peter Radunski, Tagesspiegel, Berlin","http://www.zeit.de/1998/26/199826.oestliches_.xml"
"Vor 50 Jahren: Zweimal Viet Nam","1998.26.18024","1899-12-31","Politik, , Bao Dai, Präsidentschaft, Verfassung, Weltkrieg, Beziehung, China, Frankreich, Moskau, Singapur, Verdun","http://www.zeit.de/1998/26/199826.vor50j.12115.xml"
"Falsche Kassandrarufe","1998.26.18025","1998-06-18","Politik, , NPD, DVU, Ausbildungsplatz, Bundestag, DDR, Günter Schabowski, Landtagswahl, PDS, Rechtsextremismus, Sonde, Zivilcourage, Magdeburg, Rotenburg, Rügen, Sachsen, Weimar","http://www.zeit.de/1998/26/Falsche_Kassandrarufe"
"Wider die Vereinfacher","1998.26.18026","1899-12-31","Politik, , Rita Süssmuth, CDU, CSU, SPD, DVU, Arbeitslosigkeit, Ausländerpolitik, DDR, Freizeit, Liberalismus, Ostdeutschland, PDS, Regierungssprecher, Wahl, Wahlkampf, Europa, Sachsen-Anhalt","http://www.zeit.de/1998/26/199826.suessmuth_.xml"
"Nimm zwei","1998.26.18027","1998-06-18","Politik, , Innenministerium, Abschiebung, Innenminister, Justizminister, Regierung, Verfassung, Verwaltung, Nordrhein-Westfalen","http://www.zeit.de/1998/26/Nimm_zwei"
"Der Mythos von der slawischen Freundschaft","1998.26.18028","1998-06-18","Politik, , Albaner, Boris Jelzin, Slobodan Miloševic , Freundschaft, Nato, Jugoslawien, Russland, Serbien, Bruderschaft, Sanktion, Sowjetunion, Indien, Irak, Kosovo, Ungarn, Moskau, Balkan, Belgrad, Brüssel, Europa, Kaukasus","http://www.zeit.de/1998/26/Der_Mythos_von_der_slawischen_Freundschaft"
"Der Welthandel","1998.26.18029","1899-12-31","Politik","http://www.zeit.de/1998/26/199826.wochengrafik_.xml"
"Verdrossene Jugend","1998.26.18030","1998-06-18","Politik, , Jugendlich, CDU, SPD, Medien, Arbeitslosigkeit, Auszubildende, Demokratie, Einstellung, Erziehung, Fernsehen, Freie Universität Berlin, Haushalt, Jugendliche, Klima, Lebensstil, Mädchen, Nachwuchs, Schüler, Studie, Vernunft","http://www.zeit.de/1998/26/Verdrossene_Jugend"
"Erste Schritte aus der Kälte","1998.26.18031","1899-12-31","Politik, , Innenpolitik, Religion, Protestanten, Katholik, Politischer_widerstand, Opfer, Kriminalitaet, Buergerkrieg, Vhb_Zeitgeschichte, Täter, Republik, Innenpolitik, Religion, Protestanten, Katholik, Politischer Widerstand, Opfer, Kriminalität, Bürgerkrieg, Zeitgeschichte, Täter, Gerry Adams, Grüne, John Hume, IRA, Mittelschicht, Nordirland, Belfast","http://www.zeit.de/1998/26/199826.nordirland_.xml"
"Der deutsche Volkskörper","1998.26.18032","1998-06-18","Politik, , Jörg Schönbohm, Ausländer, Bus, Frieden, Ganztagsschule, Geburtenrate, Hauptstadt, Innenminister, Offenheit, Schüler","http://www.zeit.de/1998/26/199826.editorial_.xml"
"Der Henker und sein Richter","1998.26.18033","1998-06-18","Dossier, , Wesel, Richter, Immanuel Kant, Alliierte, Asylrecht, Gefängnis, Krieg, Kriegsverbrechen, Prozess, tTokyo, U-Boot, Afghanistan, Jugoslawien, Niederlande, Ruanda, Vietnam, Berlin, Den Haag, Hiroshima, Nagasaki, Nürnberg, Rom","http://www.zeit.de/1998/26/Der_Henker_und_sein_Richter"
"Auf die harte Tour","1998.26.18034","1998-06-18","Wirtschaft, , Horst Siebert, Energieverbrauch, Arbeit, Arbeitgeber, Arbeitnehmer, Arbeitslose, Arbeitslosigkeit, Arbeitsmarkt, Arbeitsvertrag, Armut, Kündigungsschutz, Schlaf, Schrift, Umweltschaden, Ökosteuer, Frankfurt am Main, Wiesbaden","http://www.zeit.de/1998/26/Auf_die_harte_Tour"
"Sicherer Hafen","1998.26.18035","1998-06-18","Wirtschaft, , Hafen, VW, Dax, Renault, Volvo, Aktie, Aktienindex, Anleihe, Autoindustrie, Dollar, Finanzmarkt, Lamborghini, Rolls Royce, Umsatz, Yen, Asien","http://www.zeit.de/1998/26/Sicherer_Hafen"
"Hiobsmeldung","1998.26.18036","1998-06-18","Wirtschaft, , Birgit Breuel, Expo, Weltausstellung, Hannover, Lissabon, Sevilla","http://www.zeit.de/1998/26/Hiobsmeldung"
"Welthandel 1997","1998.26.18037","1998-06-18","Wirtschaft, , Europäische Union, WTO, Export, Handel, Import, Produktion, Region, Sommer, WTO, USA, USA","http://www.zeit.de/1998/26/Welthandel_1997"
"Einblick","1998.26.18038","1998-06-18","Wirtschaft, , Deutsche Bank, Finanzbehörde, Staatsanwaltschaft, Frankfurt (Oder","http://www.zeit.de/1998/26/Einblick"
"Arbeiterbewegungslosigkeit","1998.26.18039","1998-06-18","Wirtschaft, , Gerhard Schröder, DGB, Grüne, Walter Riester, Altersvorsorge, Arbeitgeber, Bündnis für Arbeit, Detlef Hensche, Dieter Schulte, Europäische Währungsunion, Gewerkschaft, Herbert Mai, Kündigungsschutz, Lohnfortzahlung, Berlin, Bonn, Düsseldorf, Niedersachsen","http://www.zeit.de/1998/26/Arbeiterbewegungslosigkeit"
"Allianz der Sünder","1998.26.18040","1998-06-18","Wirtschaft, , Gerhard Schröder, Tony Blair, Roman Herzog, Bundespräsident, Umweltschutz, Wuppertal","http://www.zeit.de/1998/26/Allianz_der_Suender"
"Ein ganz besonderes Paar","1998.26.18041","1998-06-18","Wirtschaft, , Europäische Union, Bruttoinlandsprodukt, Dienstleistung, Frankreich, Produktivität, Ruhestand, Währung, Europa, Paris, Rhein","http://www.zeit.de/1998/26/Ein_ganz_besonderes_Paar"
"Geschönt","1998.26.18042","1998-06-18","Wirtschaft, , Horst Seehofer, Theo Waigel, Bundesbank, Finanzministerium, Gesundheitsministerium, Hans Tietmeyer, D-Mark, Gesundheitsminister, Krankenkasse, Krankenversicherung, Sanktion, Bayern, Europa","http://www.zeit.de/1998/26/Geschoent"
"Der Tag X","1998.26.18043","1998-06-18","Wirtschaft, , Bundesbank, Ludwig Erhard, Briefmarke, D-Mark, US-Regierung, Währungsreform, Barcelona, New York, Washington D.C","http://www.zeit.de/1998/26/Der_Tag_X"
"Durchblick","1998.26.18044","1998-06-18","Wirtschaft, , Telekom, Protest, Umfrage","http://www.zeit.de/1998/26/Durchblick"
"Den Test nicht bestanden","1998.26.18045","1998-06-18","Wirtschaft, , Bundesbank, Bundesbank, Europäische Zentralbank, Test, Internationaler Währungsfonds, Konjunktur, Notenbank, Otmar Issing, Rezession, Wirtschaftswachstum, USA","http://www.zeit.de/1998/26/Den_Test_nicht_bestanden"
"Lichtblick","1998.26.18046","1998-06-18","Wirtschaft, , Lothar Späth, Aktie, Börse, Ostdeutschland, Geld, Unternehmen, Thüringen","http://www.zeit.de/1998/26/Lichtblick"
"Japan muß aufwachen!","1998.26.18047","1998-06-18","Wirtschaft, , Japan, Sony, Toyota, Europäische Union, Finanzministerium, Japan, Canon, Herbert Hoover, Kredit, Ostasien, Regierung, US-Dollar, Yen, Yuan, USA, Asien, Südkorea, USA, Europa","http://www.zeit.de/1998/26/Japan_muss_aufwachen_"
"Phantasie","1998.26.18048","1998-06-18","Wirtschaft, , Insider, Aktie, Börse, Märchen, Traum, Unternehmen, Vermögen, Vogue, Vorstand, Wunder, Zeitung","http://www.zeit.de/1998/26/Phantasie"
"Absolution","1998.26.18049","1998-06-18","Wirtschaft, , Shell AG, Brent Spar, Fritz Vahrenholt, Gelsenkirchen, Gesundheitsrisiko, Luftverschmutzung, Offenheit, Protest, Unternehmen, Vorstand, Atlantik, Heidelberg","http://www.zeit.de/1998/26/Absolution"
"Machtkampf","1998.26.18050","1998-06-18","Wirtschaft, , Telecom Italia, Aktie, Hut, Italien, Management, Privatisierung, Vorstand, Beziehung, Krieg, Präsident, Regierung, Unternehmen, Wahl, Europa, Rom","http://www.zeit.de/1998/26/Machtkampf"
"Die Markt-Wächter","1998.26.18051","1998-06-18","Wirtschaft, , Helmut Kohl, Jacques Chirac, Karel van Miert, VW, Boeing, Bundeskartellamt, EU-Kommission, Bertelsmann AG, Fusion, Hollywood, Kartellamt, USA, Brüssel, Europa, Bonn","http://www.zeit.de/1998/26/Die_Markt-Waechter"
