"title","number","date","keywords","link"
"Führungsstil: Helmut Schmidt schätzt Kritik","2008.28.45642","2008-07-17","Politik, Führungsstil","http://www.zeit.de/online/2008/28/helmut"
"Arbeitskampf: Ausfälle und Verspätungen bei Lufthansa","2008.28.45643","2008-07-23","Politik, Arbeitskampf, Lufthansa, Arbeitskampf, Piloten, Streik","http://www.zeit.de/online/2008/28/streik"
"Arbeitskampf: Ausfälle und Verspätungen bei Lufthansa","2008.28.45644","2009-04-01","Politik, Arbeitskampf, Lufthansa, Arbeitskampf, Piloten, Streik, Transport","http://www.zeit.de/online/2008/28/streik"
"Jugendschutz: Mit Platzpatronen gegen Killerspiele","2008.28.45645","2009-03-16","Politik, Jugendschutz, Medienpolitik, Medien, Ursula von der Leyen, Medien, Amoklauf, Gewalt, Jugendschutz, Medienkompetenz, Selbstjustiz, Universität Leipzig, Videospiel, Volksverhetzung, MIT, Emsdetten, Erfurt, Normandie","http://www.zeit.de/online/2008/28/killerspiele"
"Pakistan: Lernen für den Kampf","2008.28.45646","2008-07-10","Politik, Pakistan, Schule, Religionen, Islam, Lernen, Unterricht, Osama bin Laden, Pakistan, Lernen, Afghanistan, Saudi Arabien, USA, Dschihad, Islam, Koran, Taliban, Schüler, Karatschi","http://www.zeit.de/2008/28/DOS-madrasas"
"Verkehr: Der letzte Stau","2008.28.45647","2008-08-20","Politik, Verkehr, Verkehr, Erdoel, Verkehr, Blaise Pascal, Erich Kästner, Auto, Badesee, Schweden, Schweiz, Flensburg, Gardasee, New York, Nizza, Venedig, Wien, Würzburg","http://www.zeit.de/2008/28/01-Spritpreis"
"SPD: Beck über Berlin","2008.28.45648","2009-07-30","Politik, SPD, Partei, Politiker, Medienpolitik, Berichterstattung, Kurt Beck, Berlin, SPD, Gerhard Schröder, Helmut Kohl, Gesine Schwan, Die Linke, Journalismus, Regierungssprecher, Hessen, Pfalz","http://www.zeit.de/2008/28/SPD-und-Medien"
"G-8-Gipfel: Die nächste Welt","2008.28.45649","2008-07-30","Politik, G-8-Gipfel, Internationale_Beziehungen, Wirtschaftspolitik, Internationale_wirtschaftsbeziehungen, John McCain, China, G-8-Gipfel, Russland, Vereinte Nationen, ASEAN, Brasilien, Indien, Kasachstan, Klimawandel, Nordafrika, Saudi Arabien, Staatsfonds, Türkei, US-Außenpolitik, USA, Europa, Iran, Südkorea, Zentralasien, Afrika","http://www.zeit.de/2008/28/Neue-Welt"
"Atomprogramm: Brandgeruch","2008.28.45650","2008-07-06","Politik, Atomprogramm, Atomprogramm, IAEA, Iran, Sicherheitsrat, UN-Sicherheitsrat, Atomtest, Israel, Reaktor, Sicherheitskonferenz, Vogel, Indien, Nordkorea, Pakistan, USA, Peking, Pjöngjang, Teheran","http://www.zeit.de/2008/28/01-Nordkorea"
"Terrorismus: Vom Saarland in den Dschihad","2008.28.45651","2008-09-26","Politik, Terrorismus, Saarland, Terrorismus, Jörg Ziercke, Dschihad, Afghanistan, Bundesanwaltschaft, Islam, Pakistan, Sauerland, Kanada, Ägypten, Europa","http://www.zeit.de/2008/28/Homegrown"
"Simbabwe: Familienbild mit Despoten","2008.28.45652","2009-03-05","Politik, Simbabwe, Politik, Internationale_Beziehungen, Diplomatische_beziehungen, Staatsoberhaupt, Thabo Mbeki, Ian Khama, Morgan Tsvangirai, Jakaya Kikwete, Simbabwe, Afrikanische Union, Botsuana, Hosni Mubarak, Nigeria, Präsident, Gabun, MIT, Südafrika, Afrika, Au","http://www.zeit.de/2008/28/Simbabwe"
"","2008.28.45653","2008-07-03","Politik","http://www.zeit.de/2008/28/01-Inhalt-Internet"
"","2008.28.45654","2008-07-03","Politik","http://www.zeit.de/2008/28/01-Vorspann_Titel"
"Kinderarmut","2008.28.45655","2008-07-03","Politik","http://www.zeit.de/2008/28/KI-28-Wochenstichwort"
"Technisch gesehen","2008.28.45656","2008-07-03","Politik","http://www.zeit.de/2008/28/Buchbesprechung"
"","2008.28.45657","2008-07-03","Politik","http://www.zeit.de/2008/28/N-chste-Woche"
"Auch Ärzte irren","2008.28.45658","2008-07-03","Politik","http://www.zeit.de/2008/28/Widerspruch28"
"","2008.28.45659","2008-07-03","Politik","http://www.zeit.de/2008/28/KI-Zum-Ausschneiden"
"","2008.28.45660","2008-07-03","Politik","http://www.zeit.de/2008/28/01-Leben_Inhalt"
"Angst vor den Taliban","2008.28.45661","2008-07-03","Politik","http://www.zeit.de/2008/28/DOS-beist-ck-peschawar"
"Nächste Woche:","2008.28.45662","2008-07-03","Politik","http://www.zeit.de/2008/28/KI-28-Sandelf-Vorschau"
"","2008.28.45663","2008-07-03","Politik","http://www.zeit.de/2008/28/Wowos-28"
"","2008.28.45664","2008-07-03","Politik","http://www.zeit.de/2008/28/Wowos28"
"","2008.28.45665","2008-07-03","Politik","http://www.zeit.de/2008/28/01-Titel_Ressort"
"Bücher machen Politik: Der Fall Bolek","2008.28.45666","2008-08-19","Politik, Bücher machen Politik, Gregor Gysi, Polen, Ostdeutschland, Kommunismus, Präsident, Verhaftung, Danzig","http://www.zeit.de/2008/28/Buecher-Politik"
"Großes Leuchten","2008.28.45667","2008-07-03","Politik","http://www.zeit.de/2008/28/Bild-heute"
"Qualvoll","2008.28.45668","2008-07-03","Politik","http://www.zeit.de/2008/28/01-Prominent"
"","2008.28.45669","2008-07-03","Politik","http://www.zeit.de/2008/28/KI-28-R-tselfrage"
"Großes Hallo","2008.28.45670","2008-07-03","Politik","http://www.zeit.de/2008/28/Bild-damals"
"Gurken für alle","2008.28.45671","2008-07-03","Politik","http://www.zeit.de/2008/28/Berliner-B-hne"
"Türkei: Wem nutzt die Entführung?","2008.28.45672","2008-07-09","Politik, Türkei, Dschalal Talabani, Militär, PKK, Türkei, AKP, Abdullah Öcalan, Anschlag, DTP, Entführung, Irak, Armenien, USA, Istanbul",NA
"Türkei: Wem nutzt die Entführung?","2008.28.45673","2008-07-09","Politik, Türkei, Dschalal Talabani, Militär, PKK, Türkei, AKP, Abdullah Öcalan, Anschlag, DTP, Entführung, Irak, Armenien, USA, Istanbul",NA
"Piraterie: Die neuen Piraten","2008.28.45674","2008-07-09","Politik, Piraterie, Kriminalitaet, Wasserstrasse, Schifffahrt, CDU, CSU, SPD, UN-Sicherheitsrat, Hafen, Jagd, Marine, Schiff, Somalia, Überfall, Bangladesch, China, Haiti, Indonesien, Afrika, Mombasa","http://www.zeit.de/2008/28/Somalia-Piraterie"
"Italien: Die Paten zittern","2008.28.45675","2008-10-26","Politik, Italien, Boss, Camorra, Italien, Justiz, Brasilien, Neapel, Portugal, Rom","http://www.zeit.de/2008/28/Casalesi"
"Atomdebatte: Wollen wir Tschernobyl wirklich vergessen?","2008.28.45676","2008-07-06","Politik, Atomdebatte, Umweltpolitik, Klimawandel, Energiepolitik, Kernenergie, Angela Merkel, CDU, CSU, Grüne, Armutsrisiko, Atomkraft, Atommüllendlager, Klimawandel, Frankreich, Großbritannien, Italien, Spanien, Stonehenge","http://www.zeit.de/2008/28/Risikogesellschaft"
"Afghanistan: Anschlag auf deutsche Polizeiausbilder","2008.28.45677","2008-07-06","Politik, Afghanistan, Anschlag, Auto, Bundeswehr, Fahrzeug, Mädchen, Opfer, Provinz, Schüler, Soldat, Afghanistan, Stadt, Kundus, Potsdam","http://www.zeit.de/2008/28/afghanistan-anschlag-bundeswehr-meldung"
"NS-Zeit: Kriegerische Idylle","2008.28.45678","2009-07-10","Politik, NS-Zeit, Internationale_beziehungen, Botschaft, Diplomatische_beziehungen, Intervention, George F.  Kennan, Joachim von Ribbentrop, USA, Diplomat, USA, Berlin, Portugal, Washington D.C., Lissabon, New York, Bern, West Virginia","http://www.zeit.de/2008/28/A-US-Botschaft"
"Österreich: Weiter so!","2008.28.45679","2008-08-28","Politik, Österreich, Gesellschaft, Sozialpolitik, Politik, Grüne, Alfred Dorfer, Alte, Chef, Gesundheit, Globalisierung, Tier, Spanien","http://www.zeit.de/2008/28/Donnerstalk-28"
"Österreich: Dacapo für Sozialfighter","2008.28.45680","2008-07-04","Politik, Österreich, Politik, Innenpolitik, Werner Faymann, ÖVP, SPÖ, Alfred Gusenbauer, Eurofighter, Europapolitik, Frühling, Gesundheit, Kanzleramt, Sozialdemokratie, Vizekanzler, Volksparteien, Europa, Kärnten, Salzburg","http://www.zeit.de/2008/28/Subtext"
"Neonazi-Angriff: Ermutigung für braune Schläger","2008.28.45681","2008-07-04","Politik, Neonazi-Angriff, Politik, Extremismus, CDU, Deutsche Bahn, Bundespolizei, S-Bahn, Staatsanwaltschaft, Udo Pastörs, Rostock, Neonazi, Mecklenburg-Vorpommern",NA
"Österreich: »Die Leute denken, ich sei verrückt«","2008.28.45682","2008-07-03","Politik, Österreich, Asyl, Politik, Auslaender, Einwanderung, Auslaenderpolitik, Fluechtling, Bundeskanzleramt, Jugendamt, Ausländerfeindlichkeit, Maria Fekter, NGO, Österreich, Kosovo, Wien","http://www.zeit.de/2008/28/Interview-Bock"
"Nahost: Rein oder nicht rein","2008.28.45683","2008-11-25","Politik, Nahost, Golf, Israel, Luftwaffe, Ölpreis, USA, Irak, Iran, USA, Washington D.C., Harvard, Teheran, Tel Aviv, Ägäis","http://www.zeit.de/2008/28/Zeitgeist"
"Österreich: Nicht genügend","2008.28.45684","2008-07-03","Politik, Österreich, Politik, Koalition, Partei, ÖVP, Europäische Union, FPÖ, SPÖ, Alfred Gusenbauer, Allianz, Europapolitik, Franz Vranitzky, Gesundheitsreform, Stefan Raab, Werner Faymann, Wilhelm Molterer, Österreich, Lissabon, Tirol","http://www.zeit.de/2008/28/Zensuren"
"China: Vorolympische Bauchschmerzen","2008.28.45685","2009-07-28","Wirtschaft, China, Internationale_Wirtschaftsbeziehungen, Unternehmen, Unternehmer, China, Adidas, VW, Siemens AG, Bernd Pischetsrieder, Tibet, Kommunistische Partei, Lama, Olympia, Peking, Berlin, Lhasa, Paris","http://www.zeit.de/2008/28/Deutsche-in-China"
"Ölreserven: Die Welt muss noch warten","2008.28.45686","2009-08-03","Wirtschaft, Ölreserven, Saddam Hussein, Irak, Shell AG, Iran, Pipeline, Angola, Bagdad, Kirkuk, Asien, Basra, Europa","http://www.zeit.de/2008/28/Oel-Irak"
"Chrysler: Cerberus droht eine Blamage","2008.28.45687","2009-07-22","Wirtschaft, Chrysler, Chrysler, Ford, Robert Nardelli, Nissan, Benzinpreis, Daimler AG, Detroit, Dollar, Energiekosten, Liquidität, Management, USA","http://www.zeit.de/2008/28/Chrysler"
"eBay: Streit um Duftwässerchen","2008.28.45688","2008-07-02","Wirtschaft, eBay, Ebay, LVMH, Bundesgerichtshof, Christian Dior, Gericht, Givenchy, Handel, Prozess, Waschmittel, Unternehmen, Berlin, Paris","http://www.zeit.de/2008/28/ebay"
"Bank der Union","2008.28.45689","2008-07-03","Wirtschaft","http://www.zeit.de/2008/28/P-Trichet-Kasten"
"Osama","2008.28.45690","2008-07-03","Wirtschaft","http://www.zeit.de/2008/28/Glosse-Osama-2"
"","2008.28.45691","2008-07-03","Wirtschaft","http://www.zeit.de/2008/28/Tab-Finanzen"
"Illusionskünstler","2008.28.45692","2008-07-03","Wirtschaft","http://www.zeit.de/2008/28/Kolumne-Arbeitsmarkt"
"Klimaschutz: China will keine Fesseln","2008.28.45693","2008-07-17","Wirtschaft, Klimaschutz, China, G-8-Gipfel, Universität Heidelberg, Ölpreis, Indien, Schwellenland, Kyoto","http://www.zeit.de/online/2008/28/interview"
"G-8-Gipfel: Rettet die Globalisierung!","2008.28.45694","2008-07-08","Wirtschaft, G-8-Gipfel, Estland, G-8-Gipfel, Globalisierung, Inflation, Japan, Nahrungsmittelkrise, Nouriel Roubini, Produktivität, Schwellenland, Brasilien, China, England, Indien, Irland, Italien, Kanada, Lettland, Neuseeland, Portugal, Russland, Spanien, USA, Vietnam","http://www.zeit.de/2008/28/Argument-Weltwirtschaft"
"Entwicklungshilfe: Testgelände der Wohltätigkeit","2008.28.45695","2009-03-05","Wirtschaft, Entwicklungshilfe, Internationale_wirtschaftsbeziehungen, Entwicklungshilfe, Tadschikistan, Angola, DDR, Dorf, Welthungerhilfe, Portugal, Russland, Sowjetunion, Afrika","http://www.zeit.de/2008/28/Tadschikistan"
"G8-Gipfel: »Das Spiel ist aus«","2008.28.45696","2009-05-04","Wirtschaft, G8-Gipfel, Volkswirtschaft, Inflation, Kaufkraft, Geldpolitik, China, USA, Arbeitsmarkt, Bank für Internationalen Zahlungsausgleich, Bruttoinlandsprodukt, Deflation, Geldpolitik, Konjunktur, Notenbank, Privathaushalt, Schwellenland, Sparquote, Wechselkurs, Währung, Ölpreis, Depression, Finanzkrise, Indien, Wirtschaftswachstum, Afrika, Asien, Europa","http://www.zeit.de/2008/28/Interv-White"
"Nahrungsmittelpreise: Im Kasino des Finanzsystems","2008.28.45697","2009-01-22","Wirtschaft, Nahrungsmittelpreise, Wirtschaft, Boersenspekulation, Nahrungsmittel, Preis, Agrarprodukt, Ernte, Fonds, Getreide, Heiner Flassbeck, Herbst, Intervention, Produktivität, Rendite, Weizen, Genf","http://www.zeit.de/2008/28/Forum-Finanzmaerkte"
