"title","number","date","keywords","link"
"Am Sonntag stimmen die Finnen über den EU-Beitritt ab: Wenig begeistert |","1994.42.7411","1994-10-14","DIE ZEIT, Am Sonntag stimmen die Finnen über den EU-Beitritt ab, EU-Beitritt, Finnland, Russland, Schweden, Sowjetunion, Europa, Helsinki, Brüssel","http://www.zeit.de/1994/42/wenig-begeistert"
"Worte der Woche |","1994.42.7412","1994-10-14","DIE ZEIT, , Helmut Kohl, Erich Honecker, Europäische Union, Grüne, Lufthansa, Theo Waigel, Klaus Kinkel, Salman Rushdie, Stefan Heym, Außenminister, Jean Bertrand Aristide, Pest, Schriftsteller, Tunnel, Haiti, Iran","http://www.zeit.de/1994/42/worte-der-woche"
"Der Diktator Raoul Cédras gab auf und verläßt Haiti, aber seine Offiziere bleiben – unser Autor wagte sich ins Hinterland: „Das Volk ist böse“ |","1994.42.7413","1994-10-14","DIE ZEIT, Der Diktator Raoul Cédras gab auf und verläßt Haiti, aber seine Offiziere bleiben – unser Autor wagte sich ins Hinterland, Autor, Hans Christoph Buch, Haiti, Unesco, Jean Bertrand Aristide, Somalia, Port-au-Prince, Europa","http://www.zeit.de/1994/42/das-volk-ist-boese"
"Als „Vater von Mostar“ will Hans Koschnick Muslime und Kroaten wieder zusammenführen: „So machen wir’s“ |","1994.42.7414","1994-10-14","DIE ZEIT, Als „Vater von Mostar“ will Hans Koschnick Muslime und Kroaten wieder zusammenführen, Hans Koschnick, Café, Stadt, Bosnien und Herzegowina, Bremen, Sarajevo","http://www.zeit.de/1994/42/so-machen-wirs"
"Saddam Hussein macht sich erneut zum Buhmann der Welt. Warum liefert er seinen Gegnern ständig Munition?: Seine Natur ist die Gewalt |","1994.42.7415","1994-10-14","DIE ZEIT, Saddam Hussein macht sich erneut zum Buhmann der Welt. Warum liefert er seinen Gegnern ständig Munition?, Saddam Hussein, Natur, Bill Clinton, Gewalt, George W.  Bush, Jassir Arafat, Irak, Kriegsfilm, Tarik Asis, Vertreibung, China, Frankreich, Iran, Israel, Jordanien, Russland, USA, Kuwait, Bagdad","http://www.zeit.de/1994/42/seine-natur-ist-die-gewalt"
"Zeitspiegel |","1994.42.7416","1994-10-14","DIE ZEIT, , Jimmy Carter, Bill Clinton, CNN, Blauhelm, Flugzeug, Somalia, US-Präsident, Jugoslawien, Rumänien, Addis Abeba, Georgia, Mogadischu, Niedersachsen, Paris","http://www.zeit.de/1994/42/zeitspiegel"
"Warum der Oktober-Aufstand gegen das SED-Regime nicht in einem Blutbad endete: Die Angst vor der chinesischen Lösung |","1994.42.7417","1994-10-14","DIE ZEIT, Warum der Oktober-Aufstand gegen das SED-Regime nicht in einem Blutbad endete, Erich Honecker, Egon Krenz, Günter Schabowski, Jens Reich, Innenministerium, DDR, Demonstration, Forum, China, Berlin, Leipzig, Bonn, Dresden, Warschau, Washington D.C","http://www.zeit.de/1994/42/die-angst-vor-der-chinesischen-loesung"
"Im Wahljahr scheuten die Parteien die große Debatte. Nichts wurde gewagt: Aus Furcht vor dem Volk |","1994.42.7418","1994-10-14","DIE ZEIT, Im Wahljahr scheuten die Parteien die große Debatte. Nichts wurde gewagt, Wolfgang Schäuble, SPD, FDP, Grüne, Heiner Geißler, Asylrecht, Bioethik, Ernst Nolte, Klaus Naumann, Republik, S-Bahn, Tempolimit, Europa","http://www.zeit.de/1994/42/aus-furcht-vor-dem-volk"
"Raub und Mordversuche: Wer macht die Berliner S-Bahn sicher?: Terror auf den Schienen |","1994.42.7419","1994-10-14","DIE ZEIT, Raub und Mordversuche: Wer macht die Berliner S-Bahn sicher?, Eberhard Diepgen, Manfred Stolpe, Raub, DDR, Grenzschutz, Jugendgewalt, Polizei, Sachbeschädigung, Skinhead, Straftat, Überwachung, Ghana, Mosambik, S-Bahn, Potsdam","http://www.zeit.de/1994/42/terror-auf-den-schienen"
"Der Beginn der Wende |","1994.42.7420","1994-10-14","DIE ZEIT, , Erich Honecker, SED, Hans Modrow, DDR, Demonstration, Egon Krenz, Forum, Gespräch, Gewalt, Gründung, Jubiläum, Konzert, Polizei, Reform, Schriftsteller, Stadt, Sänger, Wahl, Dresden, Leipzig, Magdeburg","http://www.zeit.de/1994/42/der-beginn-der-wende"
"Landtagswahl in Mecklenburg-Vorpommern: Schon jetzt streiten CDU, SPD und PDS um mögliche Koalitionen: Wer überlebt die Gründerzeit? |","1994.42.7421","1994-10-14","DIE ZEIT, Landtagswahl in Mecklenburg-Vorpommern: Schon jetzt streiten CDU, SPD und PDS um mögliche Koalitionen, SPD, CDU, Harald Ringstorff, Landtagswahl, FDP, PDS, Bündnisgrüne, DDR, Schwerin, Mecklenburg-Vorpommern, Berlin, Magdeburg, Rostock, Stralsund, Vorpommern","http://www.zeit.de/1994/42/wer-ueberlebt-die-gruenderzeit"
"Die Bonner Ausländerpolitik muß von Grund auf erneuert werden: Einwanderer? Wo? |","1994.42.7422","1994-10-14","DIE ZEIT, Die Bonner Ausländerpolitik muß von Grund auf erneuert werden, FDP, SPD, Bundesregierung, CDU, CSU, Abschiebung, Asylrecht, Ausländerpolitik, Aussiedler, Bundesrat, Bundestag, Cornelia Schmalz-Jacobsen, Einbürgerung, Entwicklungspolitik, Integration, Koalitionsverhandlung, Kommunalpolitik, Reform, Staatsbürgerschaft, Russland, Osteuropa","http://www.zeit.de/1994/42/einwanderer-wo"
"Das UN-Embargo hat den Irak in die Knie gezwungen. Das Volk hungert, die Fabriken stehen still: „Amerika will, daß wir verrecken“ |","1994.42.7423","1994-10-14","DIE ZEIT, Das UN-Embargo hat den Irak in die Knie gezwungen. Das Volk hungert, die Fabriken stehen still, Saddam Hussein, Irak, UN, IAEA, Bagdad, Kuwait, Washington D.C","http://www.zeit.de/1994/42/amerika-will-dass-wir-verrecken"
"Republikanisches Tagebuch (10. Folge): Auf der Schattenseite |","1994.42.7424","1994-10-14","DIE ZEIT, Republikanisches Tagebuch (10. Folge), Carl von Ossietzky, FDP, CDU, Tagebuch, Walter Jens, Papst, Vatikan, Wahlkampf, Zivilcourage, Bautzen, Köln, Lausitz, Rotterdam","http://www.zeit.de/1994/42/auf-der-schattenseite"
"Das Bananen-Urteil und die Folgen: Horrorvision |","1994.42.7425","1994-10-14","DIE ZEIT, Das Bananen-Urteil und die Folgen, Europäische Union, EU-Kommission, EuGH, Europäischer Gerichtshof, Integration, Richter, Europa","http://www.zeit.de/1994/42/horrorvision"
"Mit der Wettbewerbsfähigkeit der deutschen Wirtschaft steht es nicht zum besten – eine Herausforderung für die nächste Bundesregierung: Die schwere Last des Sieges |","1994.42.7426","1994-10-14","DIE ZEIT, Mit der Wettbewerbsfähigkeit der deutschen Wirtschaft steht es nicht zum besten – eine Herausforderung für die nächste Bundesregierung, Bundesregierung, CDU, CSU, Helmut Kohl, Siemens AG, Bauwirtschaft, Fahrzeugbau, Finanzpolitik, Kredit, Rezession, Tarifrunde, Volkswirtschaft, MIT, Dresden, Nordamerika, Südostasien","http://www.zeit.de/1994/42/die-schwere-last-des-siegers"
"Wirtschaftsgeschichte: Vor fünfzig Jahren entstand im amerikanischen Finanzministerium der Vorschlag, die Waffenschmieden an der Ruhr zu demontieren. Sollte aus ganz Deutschland ein Kartoffelacker werden?: Die Morgenthau-Legende |","1994.42.7427","1994-10-14","DIE ZEIT, Wirtschaftsgeschichte: Vor fünfzig Jahren entstand im amerikanischen Finanzministerium der Vorschlag, die Waffenschmieden an der Ruhr zu demontieren. Sollte aus ganz Deutschland ein Kartoffelacker werden?, Franklin D. Roosevelt, Joseph Goebbels, Winston Churchill, NSDAP, Finanzministerium, Ruhr, Rüstungsindustrie, USA, Verbrechen, Polen, Rabbi, Türkei, Europa, New York","http://www.zeit.de/1994/42/die-morgenthau-legende"
"Rußland: Die zweite Welle der Reformen wird die Arbeitslosigkeit drastisch erhöhen: Vor dem nächsten Schock |","1994.42.7428","1994-10-14","DIE ZEIT, Rußland: Die zweite Welle der Reformen wird die Arbeitslosigkeit drastisch erhöhen, Viktor Tschernomyrdin, Arbeitslosigkeit, Boris Jelzin, Bill Clinton, Theo Waigel, Internationaler Währungsfonds, Anatoli Tschubais, BIP, Inflation, Privatisierung, Rubel, Russland, US-Dollar, Weltbank, Boston, Madrid, Moskau","http://www.zeit.de/1994/42/vor-dem-naechsten-schock"
"Markt-Report: Neue Zuversicht |","1994.42.7429","1994-10-14","DIE ZEIT, Markt-Report, Dax, Aktie, Aktienindex, Allianz, Bundestagswahl, Börse, Rendite, Rente, Versicherung, Währung","http://www.zeit.de/1994/42/neue-zuversicht"
"Die neue Regierung kommt an zwei Dingen nicht vorbei:: Sparen und Schröpfen |","1994.42.7430","1994-10-14","DIE ZEIT, Die neue Regierung kommt an zwei Dingen nicht vorbei:, Regierung, FDP, Helmut Kohl, Arbeitslosigkeit, Bruttoinlandsprodukt, Kabinett, Konjunktur, Regierungswechsel, Rezession, Steuer, Wirtschaftswachstum, Sparen","http://www.zeit.de/1994/42/sparen-und-schroepfen"
"Rudolf Engen: Irrwege zur Arbeit |","1994.42.7431","1994-10-14","DIE ZEIT, Rudolf Engen, Arbeit, John Maynard Keynes, EMMA, Arbeitslosigkeit, Fabrik, Pharao, Rüstung, Satire, Wehrmacht, Bundesrepublik Deutschland, Großbritannien, USA, Bergisch Gladbach, Bonn, Frankfurt am Main, London, Portsmouth","http://www.zeit.de/1994/42/irrwege-zur-arbeit"
"Ein Memorandum wider die Arbeitslosigkeit: Aufruf zum Konsens |","1994.42.7432","1994-10-14","DIE ZEIT, Ein Memorandum wider die Arbeitslosigkeit, Arbeitslosigkeit, Armut, Botschaft, Bundestagswahl, Deregulierung, Innovation, Vollbeschäftigung, Wahl, Wahlwerbung, Wirtschaftswachstum","http://www.zeit.de/1994/42/aufruf-zum-konsens"
"Bonner Kulisse |","1994.42.7433","1994-10-14","DIE ZEIT, , Hermann Otto Solms, Helmut Kohl, Helmut Schmidt, CDU, Bundesregierung, Friedrich Bohl, Konrad Adenauer, Bundeskabinett, Rudolf Scharping, Arbeitsmarktpolitik, Existenzminimum, Kabinett, Pflegeversicherung, Staatssekretär, Verkehrsministerium, Wahl, Wohnungsbau","http://www.zeit.de/1994/42/bonner-kulisse"
"Mecklenburg-Vorpommern: Wie kein anderes Bundesland hängt die Region von der Landwirtschaft ab: Warten auf die fetten Jahre |","1994.42.7434","1994-10-14","DIE ZEIT, Mecklenburg-Vorpommern: Wie kein anderes Bundesland hängt die Region von der Landwirtschaft ab, Landwirtschaft, Region, CDU, Theo Waigel, DDR, Treuhandanstalt, Mecklenburg-Vorpommern, Europa, Rostock","http://www.zeit.de/1994/42/warten-auf-die-fetten-jahre"
"Thüringen: Nach dem schnellen Zusammenbruch der alten Strukturen schaffte das Land die höchsten Wachstumsraten Ostdeutschlands: Magnet in der Mitte |","1994.42.7435","1994-10-14","DIE ZEIT, Thüringen: Nach dem schnellen Zusammenbruch der alten Strukturen schaffte das Land die höchsten Wachstumsraten Ostdeutschlands, Bernhard Vogel, CDU, SPD, Andreas Trautvetter, Bruttoinlandsprodukt, Wirtschaftsminister, Thüringen, Bayern, Eisenach, Sachsen, Baden-Württemberg, Europa","http://www.zeit.de/1994/42/magnet-in-der-mitte"
"Im geschundenen Kroatien leiden die Menschen unter Arbeitslosigkeit und Armut. Es wächst die Gefahr eines politischen Rückschlags. Ein ZEIT-Gespräch mit dem kroatischen Gewerkschafter Mario Uccellini: Krieg oder Diktatur |","1994.42.7436","1994-10-14","DIE ZEIT, Im geschundenen Kroatien leiden die Menschen unter Arbeitslosigkeit und Armut. Es wächst die Gefahr eines politischen Rückschlags. Ein ZEIT-Gespräch mit dem kroatischen Gewerkschafter Mario Uccellini, Krieg, Arbeitslosigkeit, Diktatur, Kroatien, Gewerkschaft, Handelskammer, Kommunistische Partei, Arbeitsrecht, Jugoslawien, Kommunismus, MIT, Oder, Pandora, Polen, Privatisierung, Regierung, Steuer, Zagreb","http://www.zeit.de/1994/42/krieg-oder-diktatur"
"Multimedia: Telephon, Fernsehen und Computer wachsen zusammen. Konzerne formieren sich für neue Märkte: Bits ohne Grenzen |","1994.42.7437","1994-10-14","DIE ZEIT, Multimedia: Telephon, Fernsehen und Computer wachsen zusammen. Konzerne formieren sich für neue Märkte, Fernsehen, Computer, Rupert Murdoch, Telekom, Deutsche Telekom, Ted Turner, Time Warner, Sony, Bertelsmann AG, Columbia, Filmstudio, Nicholas Negroponte, Technologie, Teleshopping, Videospiel, Märkte, USA, Europa","http://www.zeit.de/1994/42/bits-ohne-grenzen"
"Italien: Mit einem radikalen Sparprogramm will die Regierung den Staatshaushalt sanieren. Die Gewerkschaften wehren sich: Schmerzhafte Schnitte |","1994.42.7438","1994-10-14","DIE ZEIT, Italien: Mit einem radikalen Sparprogramm will die Regierung den Staatshaushalt sanieren. Die Gewerkschaften wehren sich, Silvio Berlusconi, Regierung, Italien, OECD, Staatsfinanzen, Haushaltsentwurf, Kabinett, Sanierung, Staatsdefizit, Streik, MIT, Europa, Rom","http://www.zeit.de/1994/42/schmerzhafte-schnitte"
"Zeitliches aus Frankreich: Die zweite Pleite |","1994.42.7439","1994-10-14","DIE ZEIT, Zeitliches aus Frankreich, Frankreich, François Mitterrand, Michel Rocard, Finanzen, Europawahl, Gebäude, Laurent Fabius, Parlamentswahl, Wunder, Paris","http://www.zeit.de/1994/42/die-zweite-platte"
"Wahlwerbung: Den Kampf um die Stimmen haben sich die Parteien mehr als 150 Millionen Mark kosten lassen: Wellenreiter statt Wellenmacher |","1994.42.7440","1994-10-14","DIE ZEIT, Wahlwerbung: Den Kampf um die Stimmen haben sich die Parteien mehr als 150 Millionen Mark kosten lassen, Rudolf Scharping, CDU, FDP, Helmut Kohl, Oskar Lafontaine, SPD, CSU, Grüne, Björn Engholm, RTL, Bündnisgrüne, PDS, Werbung, Bremen","http://www.zeit.de/1994/42/wellenreiter-statt-wellenmacher"
"Investmentclubs: Beim Thema Geldanlage wollen immer mehr Frauen unter sich bleiben: Gewinne als Nebeneffekt |","1994.42.7441","1994-10-14","DIE ZEIT, Investmentclubs: Beim Thema Geldanlage wollen immer mehr Frauen unter sich bleiben, Geldanlage, Börsenmakler, Vermögensverwaltung, Bremen, Hamburg, Nordrhein-Westfalen, Nürnberg","http://www.zeit.de/1994/42/gewinne-als-nebeneffekt"
"Schlank aus der Krise |","1994.42.7442","1994-10-14","DIE ZEIT, , Europäische Union, EU-Kommission, Ford, Honda, Internationaler Währungsfonds, Jacques Delors, Siemens AG, Industrie, Produktivität, Rezession, USA, Unwetter, Weißbuch, China, Dänemark, Europa, Schweiz, Taiwan, Asien, Brüssel","http://www.zeit.de/1994/42/schlank-aus-der-krise"
"Offerte der Metaller |","1994.42.7443","1994-10-14","DIE ZEIT, , IG Metall, Arbeitgeber, Arbeitnehmer, Gewerkschaft, Produktivität, Rezession, Tarifrunde, Urlaub, Vorstand, Winter","http://www.zeit.de/1994/42/offerte-der-metaller"
