"title","number","date","keywords","link"
"Unsere Klassengesellschaft","2001.2.24685","2001-01-04","Politik, , Margaret Thatcher, Roland Koch, Grüne, SPD, CDU, Adam Smith, Heiner Geißler, Helmut Schelsky, DDR, Türkei","http://www.zeit.de/2001/02/Unsere_Klassengesellschaft"
"","2001.2.24686","2001-01-04","Politik, , CDU, CSU, Gerhard Schröder, Ariel Scharon, Erwin Teufel, Fritz Kuhn, IG Metall, BSE, Bernhard Gertz, Bundestagsfraktion, Bündnisgrüne, Dienstwagen, Globalisierung, Muammar al-Gaddafi, Nationalhymne, Palästinenser, Ramadan, Russland","http://www.zeit.de/2001/02/45614"
"Pop oder Klassik?","2001.2.24687","2001-01-04","Politik, , Guido Westerwelle, FDP, Pop, Gerhard Schröder, Grüne, SPD, Volksparteien, Oder, Berlin, Stuttgart","http://www.zeit.de/2001/02/Pop_oder_Klassik_"
"Feind in Sicht","2001.2.24688","2001-01-04","Politik, , Bill Clinton, Jesse Helms, Bibel, Diplomat, Gericht, Krieg, Kriegsverbrechen, Pentagon, Prozess, Präsident, Soldat, Verbrechen, USA","http://www.zeit.de/2001/02/Feind_in_Sicht"
"Europa ist anderswo","2001.2.24689","2001-01-04","Politik, , Schweden, Europa, Europäische Union, Göran Persson, Schweden, EU-Beitritt, EU-Politik, Europaparlament, Minderheitsregierung, Wohlfahrtsstaat, Brüssel, Stockholm, Westeuropa","http://www.zeit.de/2001/02/Europa_ist_anderswo"
"Ostdeutschland steht auf der Kippe","2001.2.24690","2001-01-04","Politik, , Thierse, Wolfgang Thierse, Gerhard Schröder, Ostdeutschland, SPD, Helmut Kohl, Arbeitslosenquote, Arbeitsvermittlung, Berufsberatung, Jugendarbeitslosigkeit, Berlin, Bonn","http://www.zeit.de/2001/02/Ostdeutschland_steht_auf_der_Kippe"
"Ausgezeichnet","2001.2.24691","2001-01-04","Politik, , FAZ, Gabriele Zimmer, Thomas Mann, Ulrich Beck, Auszeichnung, Demokratie, Essay, Francis Fukuyama, Ian Kershaw, Jeremy Rifkin, PDS, Sammlung, Umfrage, Wien","http://www.zeit.de/2001/02/Ausgezeichnet"
"Das Personal","2001.2.24692","2001-01-04","Politik, , Ford, Jimmy Carter, Personal, Dick Cheney, Finanzen, Erzeuger, Opposition, Pentagon, Repräsentantenhaus, Schicksal, Wahl, Oder, Texas","http://www.zeit.de/2001/02/Das_Personal"
"Leitwirtschaft","2001.2.24693","2001-01-04","Politik, , Alan Greenspan, Arbeitsmarkt, Universität, Wiedervereinigung, Währung, Öffentlichkeit, USA, Niederlande, Irland, Europa, Oder","http://www.zeit.de/2001/02/Leitwirtschaft"
"Auf ein Neues","2001.2.24694","2001-01-04","Politik, , Bundesregierung, FDP, Tourismus, Arbeit, Bewusstsein, Entschädigung, Geld, Hoffnung, Laurenz Meyer, Regierung, Öffentlichkeit","http://www.zeit.de/2001/02/Auf_ein_Neues"
"Zwei Männer im Schnee","2001.2.24695","2001-01-04","Politik, , Gerhard Schröder, Wladimir Putin, Europäische Union, Jacques Chirac, USA, Russland, Allianz, Tschetschenien, China, Europa, Polen, Sowjetunion, Ukraine, Berlin, Moskau, Kiew, Washington D.C","http://www.zeit.de/2001/02/Zwei_Maenner_im_Schnee"
"Mit Kreide im Rachen","2001.2.24696","2001-01-04","Politik, , Scharon, Ariel Scharon, Ehud Barak, Benjamin Netanjahu, Jassir Arafat, Schimon Peres, Slobodan Miloševic , David Ben Gurion, Israel, Mosche Dajan, Jordanien, Camp David, Jerusalem, Westjordanland","http://www.zeit.de/2001/02/Mit_Kreide_im_Rachen"
"Alle müssen länger arbeiten","2001.2.24697","2001-01-04","Politik, , Rente, Bundesregierung, Alte, Arbeitslosigkeit, Bundestag, Rente, Wohlfahrtsstaat, Dänemark, Niederlande, Japan, USA, Sizilien","http://www.zeit.de/2001/02/Alle_muessen_laenger_arbeiten"
"Wer hat wann versagt?","2001.2.24698","2001-01-04","Politik, , EU-Kommission, Sigmar Gabriel, Wissenschaftsrat, Alltag, BSE, Gesundheitsminister, Ministerium, Ministerpräsident, Revolution, Show, Vernunft, Berlin, Brüssel","http://www.zeit.de/2001/02/Wer_hat_wann_versagt_"
"Schau westwärts, Putin","2001.2.24699","2001-01-04","Politik, , Wladimir Putin, Gerhard Schröder, Europäische Union, Russland, USA, Europa, Indien, Iran, Sowjetunion, Tschetschenien, Moskau, Asien, Berlin, Ostsee, Schwarzes Meer, Ural, Washington D.C","http://www.zeit.de/2001/02/Schau_westwaerts_Putin"
"Ein Königreich für einen Lehrer","2001.2.24700","2001-01-04","Dossier, , Lehrer, Klaus Böger, CDU, Lehrer, Gymnasium, Physik, Schule, Schuljahr, Schulleiter, Schüler, Berlin, Hessen, Hamburg, Nordrhein-Westfalen, Stuttgart","http://www.zeit.de/2001/02/Ein_Koenigreich_fuer_einen_Lehrer"
"Die Suche nach der Elite","2001.2.24701","2001-01-04","Dossier, , USA, Arbeitserlaubnis, Baseball, Berufsanfänger, Bundesbildungsministerium, Lehrer, Privatschule, Schule, Schulleiter, Indien, Philippinen, Afrika, Asien, Chicago, Europa, Houston, North Carolina, Oregon, South Carolina, Texas, Washington D.C","http://www.zeit.de/2001/02/Die_Suche_nach_der_Elite"
"Wenn der Wahnsinn Schule macht","2001.2.24702","2001-01-04","Dossier, , Grüne, Biologie, Frauenbeauftragte, Lehrer, Mitbestimmung, Schule, Baden-Württemberg, Nordrhein-Westfalen, Rotterdam","http://www.zeit.de/2001/02/Wenn_der_Wahnsinn_Schule_macht"
"","2001.2.24703","2001-01-04","Wirtschaft","http://www.zeit.de/2001/02/45596"
"Hoffnungsschimmer","2001.2.24704","2001-01-04","Wirtschaft, , Autosellertext, BMW, DaimlerChrysler, Peugeot, Toyota, Citroën, PKW, Skoda, Smart","http://www.zeit.de/2001/02/Hoffnungsschimmer"
"Von Quoten und Klickraten: Die Medienmacher der Zukunft","2001.2.24705","2001-01-04","Wirtschaft, , Leo Kirch, Claus Larass, Doris Schröder-Köpf, Mathias Döpfner, Thomas Haffa, Axel Springer Verlag, Bauer Verlag, Andreas Schmidt, Aufsichtsrat, Bernd Kundrun, Thomas Middelhoff, Europa","http://www.zeit.de/2001/02/Von_Quoten_und_Klickraten_Die_Medienmacher_der_Zukunft"
"Dank Hans im Glück","2001.2.24706","2001-01-04","Wirtschaft, , Glück, BASF, Hans Eichel, Dresdner Bank, Aktie, Allianz, Altersvorsorge, Axa, BHF BANK, Beiersdorf AG, Betrug, Dinosaurier, Kapitalanlage, Manfred Poweleit, Rentenreform, Mexiko, Boston","http://www.zeit.de/2001/02/Dank_Hans_im_Glueck"
"Mahlzeit! Es ist angerichtet","2001.2.24707","2001-01-04","Wirtschaft, , Bundesregierung, David Byrne, Gerhard Schröder, Grüne, Andrea Fischer, BSE, Rind, Dänemark, Bayern, Europa","http://www.zeit.de/2001/02/Mahlzeit_Es_ist_angerichtet"
"Das böse Erwachen","2001.2.24708","2001-01-04","Wirtschaft, , Chrysler, Dieter Zetsche, Ford, General Motors, Jürgen Schrempp, Detroit, Fahrzeug, Wal-Mart, USA, Michigan, Ohio","http://www.zeit.de/2001/02/Das_boese_Erwachen"
"","2001.2.24709","2001-01-04","Wirtschaft, , Coca-Cola, Cola, USA, Atlanta, Georgia, Lateinamerika","http://www.zeit.de/2001/02/45591"
"Wenn's ums Netz geht: Sparkasse","2001.2.24710","2001-01-04","Wirtschaft, , Deutsche Bank, HypoVereinsbank, Autowerkstatt, Direktbank, UBS, Schweiz, Österreich, Plauen","http://www.zeit.de/2001/02/Wenn's_ums_Netz_geht_Sparkasse"
"Der verlockende Markt","2001.2.24711","2001-01-04","Wirtschaft, , Glück, Computernetz, Demografie, Gymnasium, Leistungsgesellschaft, Ökonomie, USA, Japan, USA, Allensbach, Europa","http://www.zeit.de/2001/02/Der_verlockende_Markt"
"Der Ausbau des Sozialstaats","2001.2.24712","2001-01-04","Wirtschaft, , BIP, Bruttoinlandsprodukt, Eigenheimzulage, Familie, Kindergeld, Rente","http://www.zeit.de/2001/02/Der_Ausbau_des_Sozialstaats"
"Die langen Wellen","2001.2.24713","2001-01-04","Wirtschaft, , Alan Greenspan, Dow Jones, Börse, Deflation, Finanzmarkt, Gold, Inflation, Konjunktur, Nasdaq, Polaroid, Privathaushalt, Rezession, Vermögen, USA, Zürich","http://www.zeit.de/2001/02/Die_langen_Wellen"
"Trügerische Erholung","2001.2.24714","2001-01-04","Wirtschaft, , Europäische Zentralbank, Staatsfinanzen, BIP, Euro, Haushaltspolitik, Hysterie, Inflation, Konjunktur, Staatsverschuldung, Steuerreform, UMTS, Wechselkurs, Währung, Währungsunion, Italien, Niederlande","http://www.zeit.de/2001/02/Truegerische_Erholung"
"Von gestern","2001.2.24715","2001-01-04","Wirtschaft, , Bevölkerung, Alte, Autor, Broadway, Fernsehen, Internet, Wahl, London","http://www.zeit.de/2001/02/Von_gestern"
"Ausgesperrt","2001.2.24716","2001-01-04","Wirtschaft, , Regelwerk, Arbeitnehmer, Arbeitslose, Arbeitslosenquote, Arbeitslosigkeit, Arbeitszeit, Diskriminierung, Einkommen, Horst Siebert, Langzeitarbeitslosigkeit, Rezession, Tarifvertrag","http://www.zeit.de/2001/02/Ausgesperrt"
"Atomare Profite","2001.2.24717","2001-01-04","Wirtschaft, , Siemens AG, Charles de Gaulle, Atomkraftwerk, Entsorgung, Erderwärmung, Müll, Renaissance, Schwellenland, Treibhauseffekt, China, Frankreich, Indien, Indonesien, Philippinen, Rhein, Tschernobyl","http://www.zeit.de/2001/02/Atomare_Profite"
"Wie ansteckend sind Finanzkrisen?","2001.2.24718","2001-01-04","Wirtschaft, , Anleihe, Finanzkrise, Joseph Stiglitz, Mexiko, Pest, Weltbank, Argentinien, Brasilien, Chile, Hongkong, Russland, Asien, Fernost, Osteuropa","http://www.zeit.de/2001/02/Wie_ansteckend_sind_Finanzkrisen_"
"Surfen auf der Dax-Kurve","2001.2.24719","2001-01-04","Wirtschaft, , Dax, Commerzbank, Siemens AG, SAP, ABN Amro, Aktie, Aktienindex, Direktbank, Eigenheim, Gebühr, HypoVereinsbank, Europa","http://www.zeit.de/2001/02/Surfen_auf_der_Dax-Kurve"
