"title","number","date","keywords","link"
"Zwischen Magie und Aufklärung: Der dritte Band von Richard van Dülmens monumentaler Kulturgeschichte der Frühen Neuzeit: Der Prozeß der Säkularisierung |","1994.36.7209","1994-09-02","DIE ZEIT, Zwischen Magie und Aufklärung: Der dritte Band von Richard van Dülmens monumentaler Kulturgeschichte der Frühen Neuzeit","http://www.zeit.de/1994/36/der-prozess-der-saekularisierung"
"Bonner Bühne: Über den Niederungen |","1994.36.7210","1994-09-02","DIE ZEIT, Bonner Bühne, Bühne, Edzard Reuter, Johannes Rau, Greenpeace, SPD, Arbeit, Herz, Kirche, Spiegel, Tempolimit, Wahlkampf, Oder","http://www.zeit.de/1994/36/ueber-den-niederungen"
"Die drei Gebote von Kairo |","1994.36.7211","1994-09-02","DIE ZEIT, , Bill Clinton, Johannes Paul II., Kairo, Abtreibung, Armut, Baby, Entwicklungsland, Fruchtbarkeit, Genesis, Kondom, Planet, Schwangerschaftsabbruch, Vatikan, Verhütung, China, Indien, Afrika, Braunschweig, Bukarest, Nil, Rom, Washington D.C","http://www.zeit.de/1994/36/die-drei-gebote-von-kairo"
"Im Osten blüht der Kanzler auf |","1994.36.7212","1994-09-02","DIE ZEIT, , Rudolf Scharping, SPD, CDU, CSU, FDP, Oskar Lafontaine, Arbeitslosigkeit, Direktwahl, Erdrutsch, Infratest, Ostdeutschland, PDS, Sonntagsfrage, Sachsen-Anhalt","http://www.zeit.de/1994/36/im-osten-blueht-der-kanzler-auf"
"Jifi Gruša, tschechischer Botschafter in Bonn, will mehr Annäherung an Deutschland: Dichter als Diplomat |","1994.36.7213","1994-09-02","DIE ZEIT, Jifi Gruša, tschechischer Botschafter in Bonn, will mehr Annäherung an Deutschland, Diplomat, Bill Clinton, Václav Havel, Klaus Kinkel, Diplomatie, Dissident, Staatsbürgerschaft, Gedichtband, Kanada, Staatsangehörigkeit, Tschechische Republik, Tschechoslowakei, Ungarn, Bonn, Europa, Prag, Afrika, Asien, München, Westeuropa","http://www.zeit.de/1994/36/dichter-als-diplomat"
"Die meisten Kubaner haben kaum noch Hoffnung, daß es wieder aufwärtsgeht: Nacht der Haie |","1994.36.7214","1994-09-02","DIE ZEIT, Die meisten Kubaner haben kaum noch Hoffnung, daß es wieder aufwärtsgeht, Fidel Castro, Bill Clinton, Kuba, Flüchtling, USA, Florida, Havanna, New York, Südamerika","http://www.zeit.de/1994/36/nacht-der-haie"
"Karl-Theodor Paschke wird Kontrolleur der Uno: Ein Knochenjob |","1994.36.7215","1994-09-02","DIE ZEIT, Karl-Theodor Paschke wird Kontrolleur der Uno, Telekommunikation, Auswärtiges Amt, Constanze Stelzenmüller, Personal, tTokyo, UN, US-Kongress, Vereinte Nationen, USA, New York","http://www.zeit.de/1994/36/ein-knochenjob"
"Wolfgang Ebert: Umfallopfer |","1994.36.7216","1994-09-02","DIE ZEIT, Wolfgang Ebert, CDU, FDP, SPD, Wolfgang Schäuble, Arzt, Herz, Pest, Wolfgang Ebert","http://www.zeit.de/1994/36/umfallopfer"
"Kanzlerkandidat Scharping und die neue Trojka der SPD: Einer für alle! Alle für einen?: Drei Musketiere gegen König Kohl |","1994.36.7217","1994-09-02","DIE ZEIT, Kanzlerkandidat Scharping und die neue Trojka der SPD: Einer für alle! Alle für einen?, Gerhard Schröder, Oskar Lafontaine, Rudolf Scharping, Oskar Negt, SPD, Willy Brandt, Grüne, Finanzministerium, Daniel Goeudevert, Jens Reich, Kanzleramt, Superwahljahr, Rudolf Scharping, Bonn, Brüssel, Hannover","http://www.zeit.de/1994/36/drei-musketiere-gegen-koenig-kohl"
"Am 11. September wählen die Sachsen: Die regierende CDU setzt wieder auf eine absolute Mehrheit: Der Landesvater steigt herab |","1994.36.7218","1994-09-02","DIE ZEIT, Am 11. September wählen die Sachsen: Die regierende CDU setzt wieder auf eine absolute Mehrheit, CDU, Kurt Biedenkopf, SPD, FDP, Werner Schulz, Bündnisgrüne, Kommunalpolitik, Ministerpräsident, Wahlkampf, Sachsen, Magdeburg, Chemnitz, Fernost, Leipzig","http://www.zeit.de/1994/36/der-landesvater-steigt-herab"
"Noch wollen die Franzosen nichts davon hören, aber das Rennen um die Präsidentschaft läuft: Pasqua nutzte die Stunde |","1994.36.7219","1994-09-02","DIE ZEIT, Noch wollen die Franzosen nichts davon hören, aber das Rennen um die Präsidentschaft läuft, Jacques Chirac, Charles Pasqua, Edouard Balladur, François Mitterrand, Silvio Berlusconi, Frankreich, Jacques Delors, Ausländerpolitik, EU-Kommissionspräsident, Fernandel, Michel Rocard, Algerien, Italien, Paris, Präsidentschaft, Ruanda, Sudan, Saint-Tropez","http://www.zeit.de/1994/36/pasqua-nutzte-die-stunde"
"Streiks erschüttern die südafrikanische Demokratie: Rollenwechsel |","1994.36.7220","1994-09-02","DIE ZEIT, Streiks erschüttern die südafrikanische Demokratie, Demokratie, Nelson Mandela, VW, ANC, Arbeitskampf, Armutsgrenze, Desmond Tutu, Kommunistische Partei, Südafrika, Afrika, Europa","http://www.zeit.de/1994/36/rollenwechsel"
"IG Chemie: Der künftige Chef wird an der Gewerkschaftspolitik wenig ändern: Der Interessenmanager |","1994.36.7221","1994-09-02","DIE ZEIT, IG Chemie: Der künftige Chef wird an der Gewerkschaftspolitik wenig ändern, Hubertus Schmoldt, SPD, Franz Steinkühler, IG Metall, Aufsteiger, Betriebsrat, Bundestag, Chemie, Fusion, Gewerkschaft, Mitbestimmung, Tarifvertrag, Vorstand, Chef","http://www.zeit.de/1994/36/der-interessenmanager"
"Zinsen: Ausländische Anleihen locken mit hohen Renditen – die Risiken stecken im Wechselkurs: Reine Nervensache |","1994.36.7222","1994-09-02","DIE ZEIT, Zinsen: Ausländische Anleihen locken mit hohen Renditen – die Risiken stecken im Wechselkurs, Anleihe, Bundesanleihe, Dollar, Rendite, Staatsanleihe, Wechselkurs, Wertpapierhandel, Währung, Australien, Großbritannien, Italien, Kanada, MIT, Schweden, Spanien, Zürich","http://www.zeit.de/1994/36/reine-nervensache"
"Markt-Report: Impulse aus New York |","1994.36.7223","1994-09-02","DIE ZEIT, Markt-Report, Dax, Ferdinand Piëch, Aktie, Aktienindex, Anleihe, Börse, Gewinn, Kapitalmarkt, Umsatz, Verband der Automobilindustrie, Wertpapierhandel, USA, Atlantik","http://www.zeit.de/1994/36/impulse-aus-new-york"
"Post: Unfair |","1994.36.7224","1994-09-02","DIE ZEIT, Post, Post, Helmut Kohl, Klaus Zumwinkel, Bundeskanzler, Großunternehmen, Klaus Mangold, Regierungschef","http://www.zeit.de/1994/36/unfair"
"Lotto: Bei der nächsten Ziehung locken 35 Millionen Mark. Zuviel, meinen immer mehr Kritiker: Der Topf ist voll |","1994.36.7225","1994-09-02","DIE ZEIT, Lotto: Bei der nächsten Ziehung locken 35 Millionen Mark. Zuviel, meinen immer mehr Kritiker, Bundesregierung, VW, Greenpeace, Innenministerium, Unicef, Glücksspiel, Lotto, Bayern, Bremen, Hamburg, Schleswig-Holstein","http://www.zeit.de/1994/36/der-topf-ist-voll"
"Streitbare Tochter |","1994.36.7226","1994-09-02","DIE ZEIT, , IG Metall, Arbeitnehmer, Arbeitskampf, Betriebsrat, Hardware, Personalabbau, Rezession, Software, Sozialplan, Streik, Treuhandanstalt, Umstrukturierung, Bayern, München","http://www.zeit.de/1994/36/streitbare-tochter"
"Bonner Kulisse |","1994.36.7227","1994-09-02","DIE ZEIT, , FDP, Klaus Kinkel, Theo Waigel, Manfred Kanther, Veba, Autohändler, Gebrauchtwagen, Helmut Becker, Hochwasser, Kanzleramt, Rhein","http://www.zeit.de/1994/36/bonner-kulisse"
"Herzog: Fair |","1994.36.7228","1994-09-02","DIE ZEIT, Herzog, Roman Herzog, CDU, CSU, FDP, SPD, Recht, Bundespräsident, Bundesverfassungsgericht, Familie, Präsident, Regierung, Staatsoberhaupt, Steuerpolitik, Wahlkampf, Zeitung","http://www.zeit.de/1994/36/fair"
"Börse: Als staatlicher Aufseher deckte August Schäfer Skandale und Mißstände der Frankfurter Wertpapierhändler auf – jetzt will er selbst der Zunft beitreten: Mobbing auf hohem Niveau |","1994.36.7229","1994-09-02","DIE ZEIT, Börse: Als staatlicher Aufseher deckte August Schäfer Skandale und Mißstände der Frankfurter Wertpapierhändler auf – jetzt will er selbst der Zunft beitreten, Bundesfinanzministerium, Bundesbank, CDU, Ernst Welteke, SPD, Wirtschaftsministerium, Bewerbung, Finanzamt, Frankfurter Börse, Landesregierung, Mobbing, Wirtschaftsminister, Bonn","http://www.zeit.de/1994/36/mobbing-auf-hohem-niveau"
"Kuba: Der Handel mit der Bundesrepublik läuft auf Sparflamme. Nun lockt das Regime deutsche Investoren: Zucker, Nickel und reiche Touristen |","1994.36.7230","1994-09-02","DIE ZEIT, Kuba: Der Handel mit der Bundesrepublik läuft auf Sparflamme. Nun lockt das Regime deutsche Investoren, Handel, Kuba, LTU, DDR, Jürgen Warnke, Kanada, MIT, Spanien, Bonn, Havanna","http://www.zeit.de/1994/36/zucker-nickel-und-reiche-touristen"
"Mercedes: Transfer |","1994.36.7231","1994-09-02","DIE ZEIT, Mercedes, Mercedes, Opel, VW, Rover, Band, DHL, Geld, Motor, Qualität, Stern, USA, Schwaben","http://www.zeit.de/1994/36/transfer"
"Digital Equipment: Die Zukunft des angeschlagenen Computerherstellers hängt an einem winzigen Stück Silizium: Hoffen auf Alpha |","1994.36.7232","1994-09-02","DIE ZEIT, Digital Equipment: Die Zukunft des angeschlagenen Computerherstellers hängt an einem winzigen Stück Silizium, Microsoft, Bill Gates, Hewlett-Packard, Aufsichtsrat, Dollar, Europa","http://www.zeit.de/1994/36/hoffen-auf-alpha"
