"title","number","date","keywords","link"
"Edward Snowden: Sein geheimes Leben","2013.27.55655","2013-06-26","Politik, Edward Snowden, Julian Assange, CIA, Google, Hongkong, USA, Anschlag, Geheimdienst, Pakistan, Prism, Russland, USA, Ecuador, Genf, North Carolina","http://www.zeit.de/2013/27/edward-snowden-leben"
"Edward Snowden: Achse des Ärgers","2013.27.55656","2013-06-27","Politik, Edward Snowden, Edward Snowden, Hugo Chávez, Rafael Correa, China, Russland, USA, Allianz, Lateinamerika, USA, Hongkong, Syrien, Ecuador, Moskau, Peking, Washington D.C","http://www.zeit.de/2013/27/snowden-aussenpolitik-china-russland"
"Zeitgeist: Schlechte Dogmatiker","2013.27.55657","2013-06-26","Politik, Zeitgeist, FDP, Katholische Kirche, Bibel, Ehe, Ethik, Gleichstellung, Homosexualität, Liebe, Norm, Papst, Protestantismus, Qualität, Wunder","http://www.zeit.de/2013/27/kirche-homo-ehe"
"türkische Proteste: Wir sind so stolz auf euch","2013.27.55658","2013-06-28","Politik, türkische Proteste, Türkei, Recep Tayyip Erdogan, AKP, Protest, Angela Merkel, Istanbul, UN, Aleviten, Eltern, Facebook, Niederlande, Ägypten, Bahrain, Berlin, Europa, Köln, London","http://www.zeit.de/2013/27/tuerkei-deutschtuerken"
"Erweiterung: Wo endet Europa?","2013.27.55659","2013-06-29","Politik, Erweiterung, Europäische Union, Europäische Gemeinschaft, Kroatien, EU-Beitritt, Estland, Euro-Zone, Feinstaub, Charles de Gaulle, Frankreich, Friedensnobelpreis, Griechenland, Großbritannien, Polen, Portugal, Spanien, Türkei, Finnland, Ungarn, Österreich, Europa, Brüssel","http://www.zeit.de/2013/27/kroatien-eu-erweiterung"
"Eveline Widmer-Schlumpf: Alle gegen eine","2013.27.55660","2013-06-27","Politik, Eveline Widmer-Schlumpf, Eveline Widmer-Schlumpf, Schweiz","http://www.zeit.de/2013/27/schweiz-widmer-schlumpf"
"Nord-Süd-Achse: Die Schweizer Atombombe","2013.27.55661","2013-06-27","Politik, Nord-Süd-Achse","http://www.zeit.de/2013/27/schweiz-nord-sued-achse"
"Reden mit den Taliban?: In Teufels Küche","2013.27.55662","2013-06-27","Politik, Reden mit den Taliban?, Hamid Karsai, Nato, Afghanistan, Asyl, Attentat, Bürgerkrieg, Chaos, Drogenanbau, Katar, Präsident, Schicksal, Soldat, Taliban, USA, MIT, Kabul","http://www.zeit.de/2013/27/01-taliban"
"Türkei: Die Verhafteten: Erdogans zweite Rache","2013.27.55663","2013-06-27","Politik, Türkei: Die Verhafteten, Europäische Union, Recep Tayyip Erdogan, Türkei, Polizei, Protest, Istanbul, Ankara","http://www.zeit.de/2013/27/tuerkei-justiz-gefangene"
"Dausend: Stoppt Peer!","2013.27.55664","2013-06-27","Politik, Dausend, Auto, Herz, Cottbus","http://www.zeit.de/2013/27/steinbrueck-klassentreffen-wahlkampf"
"Arab Idol: Gaza hat den Superstar","2013.27.55665","2013-06-27","Politik, Arab Idol, Gaza, Hamas, Elvis Presley, Allah, Diaspora, Flüchtlingslager, Idol, Moschee, Palästinenser, Schizophrenie, Show, Zirkus, Libanon, Syrien, Ägypten, Aleppo, Alexandria, Beirut, Damaskus, Kairo, Westjordanland","http://www.zeit.de/2013/27/gaza-hamas-arab-idol"
"Atommüll: Klingt verrückt? Ist verrückt!","2013.27.55666","2013-06-27","Politik, Atommüll, Anschlag, Atomindustrie, Atomkraftwerk, Atommüll, Bioprodukt, Brennelement, Debatte, Eiszeit, Endlager, Gletscher, Grundstück, Kraftwerk, Müll, Rakete, Torsten Albig, Vertrieb, Zwischenlager, Brokdorf, Brunsbüttel, Gorleben, Wendland","http://www.zeit.de/2013/27/atommuell-endlager-suche"
"Demografie: Von wegen Kinder","2013.27.55667","2013-06-27","Politik, Demografie, CDU, Kristina Schröder, SPD, Hartz IV, Heiner Geißler, Arbeitszeit, Ehegattensplitting, Einkommen, Eltern, Elterngeld, Familie, Familienpolitik, Jobcenter, Kinderarmut, Kinderbetreuung, Kindergeld, Kindertagesstätte, Mittelschicht, Demografie, Kinder, Berlin","http://www.zeit.de/2013/27/01-familienpolitik"
"Zeitspiegel: Der Fall Magomadow","2013.27.55668","2013-06-27","Politik, Zeitspiegel, Ansbach, Asyl, Behörde, Familie, Glück, Krankenhaus, Polen, Psyche, Psychiatrie, Russland, Tschetschenien","http://www.zeit.de/2013/27/zeitspiegel-magomadow"
"Wahlkampf: Es bewegt sich was","2013.27.55669","2013-06-27","Politik, Wahlkampf, Angela Merkel, Hubertus Heil, Gerhard Schröder, SPD, Grüne, Peer Steinbrück, Jürgen Trittin, Feridun Zaimoglu, Heinrich-Böll-Stiftung, Kanzleramt, Twitter, Nordrhein-Westfalen","http://www.zeit.de/2013/27/rot-gruen-merkel-wahlkampf"
"Justiz: Berufsbedingt überheblich","2013.27.55670","2013-07-06","Politik, Justiz, Manfred Götzl, Josef Ackermann, Recht, Orkan, Richter, Scheidung, Sorgerecht, Bayern","http://www.zeit.de/2013/27/richter-kritik-justiz"
"Hongkong: Hilfe, die Gucci-Shopper!","2013.27.55671","2013-07-07","Politik, Hongkong, Hongkong, Gucci, Dolce &amp; Gabbana, China, Louis Vuitton, Prada, U-Bahn, Peking","http://www.zeit.de/2013/27/hongkong-luxustouristen"
"Bundestag: Raus und vorbei","2013.27.55672","2013-07-07","Politik, Bundestag, Angela Merkel, CDU, FDP, Grüne, Norbert Geis, SPD, CSU, Ulrich Maurer, Willy Brandt, Wirtschaftsministerium, Hartz IV, Betreuungsgeld, Bundestagskandidatur, Christian Lindner, Feminismus, Kanzleramt, Mindestlohn, Volker Beck","http://www.zeit.de/2013/27/ausscheider-bundestag"
"Amerika: Da seid ihr die Größten","2013.27.55673","2013-06-27","Politik, Amerika, Angela Merkel, Barack Obama, USA, Adolf Hitler, Helmut Schmidt, Karl May, USA, DDR, Mauerfall, Müll, US-Geheimdienst, Leipzig, Bayern, Dresden, Quedlinburg","http://www.zeit.de/2013/27/us-botschafter-berlin-philip-murphy"
"Donnerstalk: Dr. Seltsam","2013.27.55674","2013-06-27","Politik, Donnerstalk, Hochschule, Philosophie, Arbeitsrecht, Bundesheer, Euro, Heer, Indianer, Psychologie, Universität","http://www.zeit.de/2013/27/donnerstalk"
"Politologe C. Lehnguth: Wien war wie eine Zeitreise","2013.27.55675","2013-06-27","Politik, Politologe C. Lehnguth, FPÖ, Österreich, Heinz Fischer, Nationalsozialismus, Politikwissenschaft, Sozialdemokratie, Wien","http://www.zeit.de/2013/27/oesterreich-naziaufarbeitung-interview-lehnguth"
"Carolina Müller-Möhl: Aus Opas Zeiten","2013.27.55676","2013-06-27","Wirtschaft, Carolina Müller-Möhl","http://www.zeit.de/2013/27/kolumne-mueller-moehl"
"Quengelzone: Ohne Zusätze","2013.27.55677","2013-06-27","Wirtschaft, Quengelzone","http://www.zeit.de/2013/27/quengelzone"
"Geld und Leben: Falle in der Bankfiliale","2013.27.55678","2013-06-27","Wirtschaft, Geld und Leben","http://www.zeit.de/2013/27/baukredite"
"Telekommunikationsunternehmen: Unter Druck","2013.27.55679","2013-06-27","Wirtschaft, Telekommunikationsunternehmen","http://www.zeit.de/2013/27/analyse-vodafone-kabel-deutschland"
"Aktienmarkt: Gewöhnen Sie sich besser daran!","2013.27.55680","2013-06-27","Wirtschaft, Aktienmarkt","http://www.zeit.de/2013/27/aktienmarkt-kursausschlaege"
"Jugendarbeitslosigkeit: Gipfel der Zumutung","2013.27.55681","2013-06-27","Wirtschaft, Jugendarbeitslosigkeit","http://www.zeit.de/2013/27/jugend-arbeitslosigkeit-europa"
"Hartmut Mehdorn: Der Luftikus","2013.27.55682","2013-06-27","Wirtschaft, Hartmut Mehdorn, Hartmut Mehdorn, Berlin, Billigflieger, Brandschutz, Brandenburg","http://www.zeit.de/2013/27/flughafen-berlin-mehdorn"
"Banken: Sanieren oder abwickeln","2013.27.55683","2013-06-27","Wirtschaft, Banken","http://www.zeit.de/2013/27/kolumne-banken-euro-krise"
"Buchmarkt: Leben in der Löwengrube","2013.27.55684","2013-06-28","Wirtschaft, Buchmarkt, Verlag, USA, Amazon, Bestseller, Buch, E-Book","http://www.zeit.de/2013/27/buchmarkt-usa-e-books"
"Staatsverschuldung: Verrechnet!","2013.27.55685","2013-07-04","Wirtschaft, Staatsverschuldung","http://www.zeit.de/2013/27/staatsverschuldung-rechenfehler-thomas-herndon"
"China: Dunkle Blase","2013.27.55686","2013-06-27","Wirtschaft, China, China, Bank, Darlehen, Finanzmarkt, Geld, Kredit","http://www.zeit.de/2013/27/china-kredite-schattenbanken"
"Europäische Investitionsbank: Ein Riese erwacht","2013.27.55687","2013-06-27","Wirtschaft, Europäische Investitionsbank, Werner Hoyer, Europäische Union, Europäische Investitionsbank, Jugendarbeitslosigkeit, Kredit","http://www.zeit.de/2013/27/europaeische-investitionsbank"
"EZB: Fakten für Karlsruhe","2013.27.55688","2013-06-27","Wirtschaft, EZB, Europäische Zentralbank, Bank, Geldpolitik, Staatsanleihe","http://www.zeit.de/2013/27/forum-geldpolitik-ezb-inflation"
"Random House-Chef Markus Dohle: Umarmen, fertig, los!","2013.27.55689","2013-06-27","Wirtschaft, Random House-Chef Markus Dohle, Random House, Amazon","http://www.zeit.de/2013/27/markus-dohle-random-house"
"Aserbaidschan: Angriff auf Gasprom","2013.27.55690","2013-07-07","Wirtschaft, Aserbaidschan, Europäische Union, Aserbaidschan, Gas, Pipeline, Rohstoff, Europa","http://www.zeit.de/2013/27/aserbaidschan-gasvorkommen-gasprom-europa"
"Elmar Degenhart: Auffallend unauffällig","2013.27.55691","2013-07-10","Wirtschaft, Elmar Degenhart, Automobilindustrie, Continental, Aufsichtsrat","http://www.zeit.de/2013/27/elmar-degenhart"
"Arbeitslosigkeit: Spaniens Jugend stürzt ab","2013.27.55692","2013-06-27","Wirtschaft, Arbeitslosigkeit, Arbeitslosigkeit, Spanien, Spanien","http://www.zeit.de/2013/27/spanien-jugendliche-arbeitslosigkeit"
